UF,MUNICIPIO,ESTABELECIMENTO,LOGRADOURO,NUMERO,BAIRRO,ENDERECO_COMPLETO,latitude,longitude,address,point
BA,CATURAMA,UBSF FEIRA NOVA,POVOADO DE FEIRA NOVA,S/N,ZONA RURAL,"POVOADO DE FEIRA NOVA, ZONA RURAL, CATURAMA, BA, BRASIL",,,,
BA,CATURAMA,UBSF CATURAMA,BA 156 KM 76,S/N,CENTRO,"BA 156 KM 76, CENTRO, CATURAMA, BA, BRASIL",,,,
BA,CATURAMA,UBSF LAGOA DA CRUZ,POVOADO DE LAGOA DA CRUZ,S/N,ZONA RURAL,"POVOADO DE LAGOA DA CRUZ, ZONA RURAL, CATURAMA, BA, BRASIL",,,,
BA,CENTRAL,UNIDADE DE SAUDE DA FAMILIA ZONA OESTE,PRACA GETULIO VARGAS,S/N,URBANO,"PRACA GETULIO VARGAS, URBANO, CENTRAL, BA, BRASIL",,,,
BA,CENTRAL,UNIDADE DE SAUDE DA FAMILIA ZONA LESTE,AV JOAO DURVAL CARNEIRO,S/N,CENTRO,"AV JOAO DURVAL CARNEIRO, CENTRO, CENTRAL, BA, BRASIL",-12.2639206,-38.9530006,"Avenida João Durval Carneiro, Ponto Central, Santana, Feira de Santana, Região Geográfica Imediata de Feira de Santana, Região Metropolitana de Feira de Santana, Região Geográfica Intermediária de Feira de Santana, Bahia, Região Nordeste, 44076-000, Brasil","12 15m 50.1142s S, 38 57m 10.8022s W"
BA,CENTRAL,UNIDADE DE SAUDE DA FAMILIA DE NOVA VISTA I,NOVA VISTA I,S/N,POVOADO,"NOVA VISTA I, POVOADO, CENTRAL, BA, BRASIL",,,,
BA,CENTRAL,CENTRO DE SAUDE DE CENTRAL,LARGO PRESIDENTE VARGAS,S/N,CENTRO,"LARGO PRESIDENTE VARGAS, CENTRO, CENTRAL, BA, BRASIL",,,,
BA,CENTRAL,UNIDADE DE SAUDE DA FAMILIA DE PALMEIRAS,PALMEIRAS,S/N,ZONA RURAL,"PALMEIRAS, ZONA RURAL, CENTRAL, BA, BRASIL",,,,
BA,CENTRAL,UNIDADE DE SAUDE DA FAMILIA ZONA SUL,SEDE DE CENTRAL,S/N,SEDE,"SEDE DE CENTRAL, SEDE, CENTRAL, BA, BRASIL",-15.1668521,-48.2835465,"Brasil Central Comunicação, Rua Getúlio Vargas, Centro, Sede Municipal de Padre Bernardo / GO, Padre Bernardo, Região Geográfica Imediata de Águas Lindas de Goiás, Região Integrada de Desenvolvimento do Distrito Federal e Entorno, Região Geográfica Intermediária de Luziânia-Águas Lindas de Goiás, Goiás, Região Centro-Oeste, Brasil","15 10m 0.66756s S, 48 17m 0.7674s W"
BA,CENTRAL,UNIDADE DE SAUDE DA FAMILIA DE VEREDA,POVOADO DE VEREDA,S/N,POVOADO,"POVOADO DE VEREDA, POVOADO, CENTRAL, BA, BRASIL",,,,
BA,CHORROCHO,USF DONA LIDU,RUA MAL CASTELO BRANCO,1,CENTRO,"RUA MAL CASTELO BRANCO, CENTRO, CHORROCHO, BA, BRASIL",,,,
BA,CHORROCHO,UNIDADE DE SAUDE DA FAMILIA MAE TECA,POVOADO DE BARRA DO TARRACHIL,20,ZONA RURAL,"POVOADO DE BARRA DO TARRACHIL, ZONA RURAL, CHORROCHO, BA, BRASIL",,,,
BA,CHORROCHO,POSTO SATELITE DE CINCO BOIS,FAZENDA CINCO BOIS,S/N,ZONA RURAL,"FAZENDA CINCO BOIS, ZONA RURAL, CHORROCHO, BA, BRASIL",,,,
BA,CHORROCHO,POSTO SATELITE UMBELINA MIRANDA DE ARAUJO,POVOADO DE CARAIBAS,S/N,CENTRO,"POVOADO DE CARAIBAS, CENTRO, CHORROCHO, BA, BRASIL",,,,
BA,CHORROCHO,USF PROCOPIO FERREIRA BARBALHO,POVOADO DE SAO JOSE,S/N,ZONA RURAL,"POVOADO DE SAO JOSE, ZONA RURAL, CHORROCHO, BA, BRASIL",,,,
BA,CHORROCHO,USF EMILIO JOSE DE OLIVEIRA,POVOADO DE VARZEA DA EMA,25,ZONA RURAL,"POVOADO DE VARZEA DA EMA, ZONA RURAL, CHORROCHO, BA, BRASIL",,,,
BA,CICERO DANTAS,USF VILA SAO PEDRO,VILA SAO PEDRO,S/N,ZONA RURAL,"VILA SAO PEDRO, ZONA RURAL, CICERO DANTAS, BA, BRASIL",,,,
BA,CICERO DANTAS,USF SEDE,AVENIDA NOSSA SENHORA DO BOM CONSELHO,S/N,CENTRO,"AVENIDA NOSSA SENHORA DO BOM CONSELHO, CENTRO, CICERO DANTAS, BA, BRASIL",,,,
BA,CICERO DANTAS,USF CAMPINAS DE CASTRO,POVOADO CAMPINAS DE CASTRO,S/N,ZONA RURAL,"POVOADO CAMPINAS DE CASTRO, ZONA RURAL, CICERO DANTAS, BA, BRASIL",,,,
BA,CICERO DANTAS,USF SERRA GRANDE,POVOADO SERRA GRANDE,S/N,CENTRO,"POVOADO SERRA GRANDE, CENTRO, CICERO DANTAS, BA, BRASIL",,,,
BA,CICERO DANTAS,USF BENICIO TOMAZ,RUA DO GOUVEIAO,S/N,CENTRO,"RUA DO GOUVEIAO, CENTRO, CICERO DANTAS, BA, BRASIL",,,,
BA,CICERO DANTAS,USF CAXIAS,POVOADO CAXIAS,S/N,CENTRO,"POVOADO CAXIAS, CENTRO, CICERO DANTAS, BA, BRASIL",,,,
BA,CICERO DANTAS,POSTO DE SAUDE DE BETANIA,POVOADO BETANIA,S/N,BETANIA,"POVOADO BETANIA, BETANIA, CICERO DANTAS, BA, BRASIL",,,,
BA,CICERO DANTAS,USF TRINDADE,POVOADO TRINDADE,S/N,CENTRO,"POVOADO TRINDADE, CENTRO, CICERO DANTAS, BA, BRASIL",,,,
BA,CICERO DANTAS,USF URBIS,RUA DO EXPEDICIONARIO,S/N,CENTRO,"RUA DO EXPEDICIONARIO, CENTRO, CICERO DANTAS, BA, BRASIL",,,,
BA,CICERO DANTAS,USF JOVINO PEREIRA,LOT BOM CONSELHO,S/N,CENTRO,"LOT BOM CONSELHO, CENTRO, CICERO DANTAS, BA, BRASIL",,,,
BA,CICERO DANTAS,USF SAO JOAO DA FORTALEZA,DIST DE SAO JOAO DA FORTALEZA,S/N,ZONA RURAL,"DIST DE SAO JOAO DA FORTALEZA, ZONA RURAL, CICERO DANTAS, BA, BRASIL",,,,
BA,CIPO,UNIDADE BASICA DE SAUDE DA FAMILIA NOVA CIPO,RUA MANAUS,S/N,NOVA CIPO,"RUA MANAUS, NOVA CIPO, CIPO, BA, BRASIL",,,,
BA,CIPO,UNIDADE BASICA DE SAUDE DA FAMILIA BURI,POVOADO BURI,S/N,ZONA RURAL,"POVOADO BURI, ZONA RURAL, CIPO, BA, BRASIL",,,,
BA,CIPO,UNIDADE BASICA DE SAUDE DA FAMILIA ITAPICURU,FAZENDA ITAPICURU,S/N,ZONA RURAL,"FAZENDA ITAPICURU, ZONA RURAL, CIPO, BA, BRASIL",,,,
BA,CIPO,UNIDADE BASICA DE SAUDE DA FAMILIA JORRO,RUA DO JORRO,S/N,PETROLANDIA,"RUA DO JORRO, PETROLANDIA, CIPO, BA, BRASIL",,,,
BA,CIPO,UNIDADE BASICA DE SAUDE VITORIA,RUA CARAMBOLA,S/N,VITORIA,"RUA CARAMBOLA, VITORIA, CIPO, BA, BRASIL",,,,
BA,CIPO,UNIDADE BASICA DE SAUDE DA FAMILIA TREZE DE MAIO,RUA TREZE DE MAIO,S/N,SANTA CRUZ,"RUA TREZE DE MAIO, SANTA CRUZ, CIPO, BA, BRASIL",,,,
BA,CIPO,UNIDADE BASICA DE SAUDE DA FAMILIA JUREMA AMARI,FAZENDA JUREMA,S/N,ZONA RURAL,"FAZENDA JUREMA, ZONA RURAL, CIPO, BA, BRASIL",,,,
BA,COARACI,UNIDADE DE SAUDE DA FAMILIA DA FEIRINHA,RUA ANTONIO TEIXEIRA,17,CENTRO,"RUA ANTONIO TEIXEIRA, CENTRO, COARACI, BA, BRASIL",,,,
BA,COARACI,UNIDADE DE SAUDE DA FAMILIA GIMA REVISON ALBANO GALVAO,RUA ELIAS LEAL,S/N,JARDIM CAJUEIRO,"RUA ELIAS LEAL, JARDIM CAJUEIRO, COARACI, BA, BRASIL",,,,
BA,COARACI,UNIDADE DE SAUDE DA FAMILIA CELSINA CASTRO DOS SANTOS,RUA SAO VICENTE,S/N,MARIA GABRIELA,"RUA SAO VICENTE, MARIA GABRIELA, COARACI, BA, BRASIL",,,,
BA,COARACI,USF ADAUTO RIBEIRO SACRAMENTO,RUA SAO PAULO,381,CEMITERIO,"RUA SAO PAULO, CEMITERIO, COARACI, BA, BRASIL",,,,
BA,COARACI,UNIDADE DE SAUDE DA FAMILIA JAMILLY ALBANO GALVAO,RUA SAO LAZARO,1107,JOIA DO ALMADA,"RUA SAO LAZARO, JOIA DO ALMADA, COARACI, BA, BRASIL",,,,
BA,COARACI,UNIDADE DE SAUDE DA FAMILIA GILBERTO LYRIO,RUA ANTONIO VICENTE MAIA,S/N,DISTR DE ITAMOTINGA,"RUA ANTONIO VICENTE MAIA, DISTR DE ITAMOTINGA, COARACI, BA, BRASIL",,,,
BA,COARACI,CENTRO DE SAUDE DR ANGELO BRITTO,RUA ANTONIO TEIXEIRA,17,CENTRO,"RUA ANTONIO TEIXEIRA, CENTRO, COARACI, BA, BRASIL",,,,
BA,COCOS,UNIDADE DE SAUDE DA FAMILIA ARNULFO LACERDA DE MOURA,RUA MARCELINO PEREIRA DOS SANTOS,S/N,VILA SORRISO,"RUA MARCELINO PEREIRA DOS SANTOS, VILA SORRISO, COCOS, BA, BRASIL",,,,
BA,COCOS,UNIDADE DE SAUDE DA FAMILIA LUIS CARDOSO BOMFIM,POVOADO DO SANTO ANTONIO,S/N,RURAL,"POVOADO DO SANTO ANTONIO, RURAL, COCOS, BA, BRASIL",,,,
BA,COCOS,UNIDADE DE SAUDE DA FAMILIA MANOEL MESSIAS,POVOADO DE AGUA DO CARMO,S/N,ZONA RURAL,"POVOADO DE AGUA DO CARMO, ZONA RURAL, COCOS, BA, BRASIL",,,,
BA,COCOS,UNIDADE DE SAUDE DA FAMILIA FELICIANA SOUZA DOS REIS,PRACA DA MATRIZ,S/N,CENTRO,"PRACA DA MATRIZ, CENTRO, COCOS, BA, BRASIL",,,,
BA,COCOS,UNIDADE DE SAUDE DA FAMILIA DONA LIO,RUA ATILIO LOPES DA SILVA,26,CENTRO,"RUA ATILIO LOPES DA SILVA, CENTRO, COCOS, BA, BRASIL",,,,
BA,COCOS,UBS,RUA ATILIO LOPES DA SILVA,26,CENTRO,"RUA ATILIO LOPES DA SILVA, CENTRO, COCOS, BA, BRASIL",,,,
BA,COCOS,UNIDADE DE SAUDE DA FAMILIA DE SAO JOAO DO PORTO ALEGRE,POVOADO DE SAO JOAO DO PORTO ALEGRE,S/N,RURAL,"POVOADO DE SAO JOAO DO PORTO ALEGRE, RURAL, COCOS, BA, BRASIL",,,,
BA,COCOS,UNIDADE DE SAUDE DA FAMILIA MARIO SOUZA BARROS,RUA TEOLINDA CLARA DA COSTA,S/N,CENTRO,"RUA TEOLINDA CLARA DA COSTA, CENTRO, COCOS, BA, BRASIL",,,,
BA,CONCEICAO DA FEIRA,UNIDADE SAUDE DA FAMILIA RENATO MARQUES DE OLIVEIRA,POVOADO DO CANDEAL,S/N,ZONA RURAL,"POVOADO DO CANDEAL, ZONA RURAL, CONCEICAO DA FEIRA, BA, BRASIL",,,,
BA,CONCEICAO DA FEIRA,UNIDADE DE SAUDE DA FAMILIA SANTA LUZIA,RUA MIGUEL CALMON,S/N,SANTA LUZIA,"RUA MIGUEL CALMON, SANTA LUZIA, CONCEICAO DA FEIRA, BA, BRASIL",,,,
BA,CONCEICAO DA FEIRA,UNIDADE SAUDE DA FAMILIA VIVALDO BITTENCOURT,RUA CASTRO ALVES,303,CENTRO,"RUA CASTRO ALVES, CENTRO, CONCEICAO DA FEIRA, BA, BRASIL",,,,
BA,CONCEICAO DA FEIRA,POSTO DE SAUDE DO CRUZEIRO,POVOADO DO CRUZEIRO,S/N,ZONA RURAL,"POVOADO DO CRUZEIRO, ZONA RURAL, CONCEICAO DA FEIRA, BA, BRASIL",,,,
BA,CONCEICAO DA FEIRA,POSTO DE SAUDE ONZE MIL VIRGENS,POVOADO ONZE MIL VIRGENS,26,ZONA RURAL,"POVOADO ONZE MIL VIRGENS, ZONA RURAL, CONCEICAO DA FEIRA, BA, BRASIL",,,,
BA,CONCEICAO DA FEIRA,UNIDADE DE SAUDE DA FAMILIA ANTONIO LEONCIO DA SILVA,RUA DIRETA,100,POVOADO PINHEIRO,"RUA DIRETA, POVOADO PINHEIRO, CONCEICAO DA FEIRA, BA, BRASIL",,,,
BA,CONCEICAO DA FEIRA,USF DA CINCO PORTAS,CINCO PORTAS,S/N,CENTRO,"CINCO PORTAS, CENTRO, CONCEICAO DA FEIRA, BA, BRASIL",,,,
BA,CONCEICAO DA FEIRA,POSTO DE SAUDE DA FAMILIA DO SERRA,SERRA,S/N,ZONA RURAL,"SERRA, ZONA RURAL, CONCEICAO DA FEIRA, BA, BRASIL",,,,
BA,CONCEICAO DA FEIRA,UNIDADE SAUDE DA FAMILIA MOACYR OZORIO PASCOAL,POVOADO DA BAIXINHA DA PINDOBEIRA,S/N,ZONA RURAL,"POVOADO DA BAIXINHA DA PINDOBEIRA, ZONA RURAL, CONCEICAO DA FEIRA, BA, BRASIL",,,,
BA,CONCEICAO DO ALMEIDA,USF JOSE MARIA DE MAGALHAES NETO 03,POVOADO SAO FRANCISCO DA MOMBACA,S/N,ZONA RURAL,"POVOADO SAO FRANCISCO DA MOMBACA, ZONA RURAL, CONCEICAO DO ALMEIDA, BA, BRASIL",,,,
BA,CONCEICAO DO ALMEIDA,PS DE GRAMPARA,POVOADO DE GRAMPARA,S/N,ZONA RURAL,"POVOADO DE GRAMPARA, ZONA RURAL, CONCEICAO DO ALMEIDA, BA, BRASIL",,,,
BA,CONCEICAO DO ALMEIDA,PS BAIXA DE AREIA,BAIXA DE AREIA,S/N,ZONA RURAL,"BAIXA DE AREIA, ZONA RURAL, CONCEICAO DO ALMEIDA, BA, BRASIL",,,,
BA,CONCEICAO DO ALMEIDA,PS DE BEBEDOURO,POVOADO DE BEBEDOURO,S/N,ZONA RURAL,"POVOADO DE BEBEDOURO, ZONA RURAL, CONCEICAO DO ALMEIDA, BA, BRASIL",,,,
BA,CONCEICAO DO ALMEIDA,PS DE SAO SALVADOR,SAO SALVADOR,S/N,ZONA RURAL,"SAO SALVADOR, ZONA RURAL, CONCEICAO DO ALMEIDA, BA, BRASIL",,,,
BA,CONCEICAO DO ALMEIDA,PS DE SAPATUI,POVOADO DE SAPATUI,S/N,ZONA RURAL,"POVOADO DE SAPATUI, ZONA RURAL, CONCEICAO DO ALMEIDA, BA, BRASIL",,,,
BA,CONCEICAO DO ALMEIDA,USF PARTEIRA SOFIA 01,RUA ULISSES CALDAS PINTO,S/N,BRASILIA,"RUA ULISSES CALDAS PINTO, BRASILIA, CONCEICAO DO ALMEIDA, BA, BRASIL",,,,
BA,CONCEICAO DO ALMEIDA,USF COMERCIO DE JAGUARIPE 04,COMERCIO DE JAGUARIPE,S/N,ZONA RURAL,"COMERCIO DE JAGUARIPE, ZONA RURAL, CONCEICAO DO ALMEIDA, BA, BRASIL",,,,
BA,CONCEICAO DO ALMEIDA,USF DR DJALMA ROCHA GALVAO 06,POVOADO PAU CEDRO,S/N,ZONA RURAL,"POVOADO PAU CEDRO, ZONA RURAL, CONCEICAO DO ALMEIDA, BA, BRASIL",,,,
BA,CONCEICAO DO ALMEIDA,PS DE SAO JOAO,SAO JOAO,S/N,ZONA RURAL,"SAO JOAO, ZONA RURAL, CONCEICAO DO ALMEIDA, BA, BRASIL",,,,
BA,CONCEICAO DO ALMEIDA,USF TABULEIRO DE MENESES 05,POVOADO DE TABULEIRO,S/N,ZONA RURAL,"POVOADO DE TABULEIRO, ZONA RURAL, CONCEICAO DO ALMEIDA, BA, BRASIL",,,,
BA,CONCEICAO DO ALMEIDA,USF DR GUILHERME TRINDADE 02,LOTEAMENTO MARIA PASSOS CONI,S/N,BRASILIA,"LOTEAMENTO MARIA PASSOS CONI, BRASILIA, CONCEICAO DO ALMEIDA, BA, BRASIL",,,,
BA,CONCEICAO DO ALMEIDA,PS PONTO DE SAO JOSE,POVOADO DE SAO JOSE,S/N,ZONA RURAL,"POVOADO DE SAO JOSE, ZONA RURAL, CONCEICAO DO ALMEIDA, BA, BRASIL",,,,
BA,CONCEICAO DO ALMEIDA,PS DE MURITIBINHA,POVOADO MURITIBINHA,S/N,ZONA RURAL,"POVOADO MURITIBINHA, ZONA RURAL, CONCEICAO DO ALMEIDA, BA, BRASIL",,,,
BA,CONCEICAO DO ALMEIDA,PS DE SANTANA DO RIO DA DONA,POVOADO DE SANTANA DO RIO DA DONA,S/N,ZONA RURAL,"POVOADO DE SANTANA DO RIO DA DONA, ZONA RURAL, CONCEICAO DO ALMEIDA, BA, BRASIL",,,,
BA,CONCEICAO DO COITE,UNIDADE BASICA DE SAUDE DA FAMILIA DE SAO JOAO,RUA HAMILTON RIOS DE ARAUJO,S/N,DISTRITO SAO JOAO,"RUA HAMILTON RIOS DE ARAUJO, DISTRITO SAO JOAO, CONCEICAO DO COITE, BA, BRASIL",,,,
BA,CONCEICAO DO COITE,UNIDADE BASICA DE SAUDE DA FAMILIA DE CONCEICAO DO COITE,RUA JOAO MATEUS DE SOUZA,S/N,ACUDINHO,"RUA JOAO MATEUS DE SOUZA, ACUDINHO, CONCEICAO DO COITE, BA, BRASIL",,,,
BA,CONCEICAO DO COITE,UNIDADE DE SAUDE DA FAMILIA BARREIRO,RUA LEOPOLDINO RAMOS,S/N,BARREIROS,"RUA LEOPOLDINO RAMOS, BARREIROS, CONCEICAO DO COITE, BA, BRASIL",,,,
BA,CONCEICAO DO COITE,UNIDADE BASICA DE SAUDE DA FAMILIA DO CRUZEIRO,RUA DO CRUZEIRO,S/N,CRUZEIRO,"RUA DO CRUZEIRO, CRUZEIRO, CONCEICAO DO COITE, BA, BRASIL",,,,
BA,CONCEICAO DO COITE,UNIDADE BASICA DE SAUDE DA FAMILIA DA CARAIBA,RUA DO CEMITERIO,S/N,DISTRITO DE SALGADAL,"RUA DO CEMITERIO, DISTRITO DE SALGADAL, CONCEICAO DO COITE, BA, BRASIL",,,,
BA,CONCEICAO DO COITE,UNIDADE DE SAUDE DA FAMILIA DO FLUMINENSE TERRA NOVA,LOTEAMENTO CAMPO LIMPO,S/N,TERRA NOVA,"LOTEAMENTO CAMPO LIMPO, TERRA NOVA, CONCEICAO DO COITE, BA, BRASIL",,,,
BA,CONCEICAO DO COITE,POSTO DE SAUDE DE IPOEIRINHA,RUA SABINO FERREIRA DA SILVA,S/N,ZONA RURAL,"RUA SABINO FERREIRA DA SILVA, ZONA RURAL, CONCEICAO DO COITE, BA, BRASIL",,,,
BA,CONCEICAO DO COITE,POSTO DE SAUDE DE BOA VISTA,RUA DO CENTRO,S/N,ZONA RURAL,"RUA DO CENTRO, ZONA RURAL, CONCEICAO DO COITE, BA, BRASIL",,,,
BA,CONCEICAO DO COITE,UNIDADE BASICA DE SAUDE DA FAMILIA DE AROEIRA,AVENIDA AGEMIRO RAMOS,S/N,DISTRITO AROEIRA,"AVENIDA AGEMIRO RAMOS, DISTRITO AROEIRA, CONCEICAO DO COITE, BA, BRASIL",,,,
BA,CONCEICAO DO COITE,UNIDADE BASICA DE SAUDE DA FAMILIA DE SALGADALIA,RUA DO CEMITERIO,S/N,DISTRITO SALGADALIA,"RUA DO CEMITERIO, DISTRITO SALGADALIA, CONCEICAO DO COITE, BA, BRASIL",,,,
BA,CONCEICAO DO COITE,UNIDADE BASICA DE SAUDE DA FAMILIA CASAS POPULARES,POVOADO CASAS POPULARES,S/N,ZONA RURAL,"POVOADO CASAS POPULARES, ZONA RURAL, CONCEICAO DO COITE, BA, BRASIL",,,,
BA,CONCEICAO DO COITE,POSTO DE SAUDE SANTA CRUZ,POVOADO DE SANTA CRUZ,S/N,ZONA RURAL,"POVOADO DE SANTA CRUZ, ZONA RURAL, CONCEICAO DO COITE, BA, BRASIL",,,,
BA,CONCEICAO DO COITE,UNIDADE BASICA DE SAUDE DA FAMILIA DA RODOVIARIA,AVENIDA LUIZ EDUARDO MAGALHAES,S/N,VILA TOIDE,"AVENIDA LUIZ EDUARDO MAGALHAES, VILA TOIDE, CONCEICAO DO COITE, BA, BRASIL",,,,
BA,CONCEICAO DO COITE,UNIDADE BASICA DE SAUDE DA FAMILIA DE BANDIACU,RUA JOSE GREGORIO SIMOES,S/N,DISTRITO BANDIACU,"RUA JOSE GREGORIO SIMOES, DISTRITO BANDIACU, CONCEICAO DO COITE, BA, BRASIL",,,,
BA,CONCEICAO DO COITE,UNIDADE BASICA DE SAUDE DE ITALMAR,POVOADO DE ITALMAR,S/N,ZONA RURAL,"POVOADO DE ITALMAR, ZONA RURAL, CONCEICAO DO COITE, BA, BRASIL",,,,
BA,CONCEICAO DO COITE,UNIDADE BASICA DE SAUDE DA FAMILIA DE SANTA ROSA,PRACA JOAQUIM RODRIGUES,S/N,POV SANTA ROSA,"PRACA JOAQUIM RODRIGUES, POV SANTA ROSA, CONCEICAO DO COITE, BA, BRASIL",,,,
BA,CONCEICAO DO COITE,UNIDADE BASICA DE SAUDE DA FAMILIA WALDEMAR CARNEIRO,RUA DO CRUZEIRO,S/N,POV JUAZEIRO,"RUA DO CRUZEIRO, POV JUAZEIRO, CONCEICAO DO COITE, BA, BRASIL",,,,
BA,CONCEICAO DO COITE,POSTO DE SAUDE DE VILA CARNEIRO,POVOADO DE VILA CARNEIRO,S/N,ZONA RURAL,"POVOADO DE VILA CARNEIRO, ZONA RURAL, CONCEICAO DO COITE, BA, BRASIL",,,,
BA,CONCEICAO DO COITE,POSTO DE SAUDE LAGOA DO MEIO,RUA JOAQUIM MAIA,31,ZONA RURAL,"RUA JOAQUIM MAIA, ZONA RURAL, CONCEICAO DO COITE, BA, BRASIL",,,,
BA,CONCEICAO DO COITE,UNIDADE BASICA DE SAUDE DA FAMILIA DR MANOEL A PINHEIRO,JUVENCIO MENDES,S/N,CENTRO,"JUVENCIO MENDES, CENTRO, CONCEICAO DO COITE, BA, BRASIL",,,,
BA,CONCEICAO DO JACUIPE,UNIDADE DE SAUDE DA FAMILIA MARLENE DOS SANTOS PAIXAO,RUA NOVA BRASILIA,S/N,NOVA BRASILIA,"RUA NOVA BRASILIA, NOVA BRASILIA, CONCEICAO DO JACUIPE, BA, BRASIL",,,,
BA,CONCEICAO DO JACUIPE,PSF POVOADO DO PICADO,PRACA DA MATRIZ,S/N,PICADO,"PRACA DA MATRIZ, PICADO, CONCEICAO DO JACUIPE, BA, BRASIL",,,,
BA,CONCEICAO DO JACUIPE,PSF POVOADO DO BESSA,RUA PRINCIPAL DO BESSA,S/N,BESSA,"RUA PRINCIPAL DO BESSA, BESSA, CONCEICAO DO JACUIPE, BA, BRASIL",,,,
BA,CONCEICAO DO JACUIPE,UNIDADE DE SAUDE DA FAMILIA ZULMIRA RIBEIRO DE LIMA,LOTEAMENTO JOAO PAULO II,S/N,ZONA RURAL,"LOTEAMENTO JOAO PAULO II, ZONA RURAL, CONCEICAO DO JACUIPE, BA, BRASIL",,,,
BA,CONCEICAO DO JACUIPE,UNIDADE DE SAUDE DA FAMILIA CAMILLA SANTIAGO RIBEIRO,FAZENDA BOM SUCESSO,S/N,BOM SUCESSO,"FAZENDA BOM SUCESSO, BOM SUCESSO, CONCEICAO DO JACUIPE, BA, BRASIL",,,,
BA,CONCEICAO DO JACUIPE,PSF DO BALDEZ,RUA JOAO DOS SANTOS MARINHO,172,BALDEZ,"RUA JOAO DOS SANTOS MARINHO, BALDEZ, CONCEICAO DO JACUIPE, BA, BRASIL",,,,
BA,CONCEICAO DO JACUIPE,PSF PARQUE OURO VERDE,RUA JOSE ANTONIO OLIVEIRA DE ALMEIDA,347,PARQUE OURO VERDE,"RUA JOSE ANTONIO OLIVEIRA DE ALMEIDA, PARQUE OURO VERDE, CONCEICAO DO JACUIPE, BA, BRASIL",,,,
BA,CONCEICAO DO JACUIPE,PSF DA GAMELEIRA,POVOADO DA GAMELEIRA,S/N,GAMELEIRA,"POVOADO DA GAMELEIRA, GAMELEIRA, CONCEICAO DO JACUIPE, BA, BRASIL",,,,
BA,CONCEICAO DO JACUIPE,UNIDADE DE SAUDE DA FAMILIA WALTER DE JESUS MORAIS,LOTEAMENTO BELO HORIZONTE,S/N,CENTRO,"LOTEAMENTO BELO HORIZONTE, CENTRO, CONCEICAO DO JACUIPE, BA, BRASIL",,,,
BA,CONCEICAO DO JACUIPE,UNIDADE DE SAUDE DA FAMILIA DR PAULO ROBERTO DA SILVA MORAIS,RUA PEDRO DA SILVA CASTRO,S/N,ILICURITIBA,"RUA PEDRO DA SILVA CASTRO, ILICURITIBA, CONCEICAO DO JACUIPE, BA, BRASIL",,,,
BA,CONCEICAO DO JACUIPE,UNIDADE DE SAUDE DA FAMILIA GRACILIANO PEREIRA COELHO,LOTEAMENTO FRANCISCO AUGUSTO COSTA,S/N,GUEDES,"LOTEAMENTO FRANCISCO AUGUSTO COSTA, GUEDES, CONCEICAO DO JACUIPE, BA, BRASIL",,,,
BA,CONDE,UNIDADE DE SAUDE DA FAMILIA DE COBO,POVOADO DO COBO,S/N,CENTRO,"POVOADO DO COBO, CENTRO, CONDE, BA, BRASIL",,,,
BA,CONDE,UNIDADE DE SAUDE DA FAMILIA DE BARRA DO ITARIRI,RUA LINO GOMES,S/N,CENTRO,"RUA LINO GOMES, CENTRO, CONDE, BA, BRASIL",,,,
BA,CONDE,UNIDADE DE SAUDE DA FAMILIA DE SITIO DO CONDE,AVENIDA BEIRA MAR,S/N,SITIO DO CONDE,"AVENIDA BEIRA MAR, SITIO DO CONDE, CONDE, BA, BRASIL",,,,
BA,CONDE,UNIDADE DE SAUDE DA FAMILIA DO LOTEAMENTO ARACY MENDES LINS,LOTEAMENTO ARACY MENDES LINS,S/N,CENTRO,"LOTEAMENTO ARACY MENDES LINS, CENTRO, CONDE, BA, BRASIL",,,,
BA,CONDE,POSTO DE SAUDE JOS VANRESPAILLE,POCAS,S/N,POCAS,"POCAS, POCAS, CONDE, BA, BRASIL",,,,
BA,CONDE,POSTO DE SAUDE DO ASSENTAMENTO NOVA ESPERANCA,ASSENTAMENTO NOVA ESPERANCA,S/N,ALTAMIRA,"ASSENTAMENTO NOVA ESPERANCA, ALTAMIRA, CONDE, BA, BRASIL",,,,
BA,CONDE,UNIDADE BASICA CENTRO,AVENIDA JOAO IZIDORO LINS,S/N,CENTRO,"AVENIDA JOAO IZIDORO LINS, CENTRO, CONDE, BA, BRASIL",,,,
BA,CONDE,POSTO DE SAUDE SANTA CRUZ,ILHA DAS OSTRAS,S/N,ILHA DAS OSTRAS,"ILHA DAS OSTRAS, ILHA DAS OSTRAS, CONDE, BA, BRASIL",,,,
BA,CONDE,UNIDADE DE SAUDE DA FAMILIA DE VILA DO CONDE,RUA DO ITORORO,S/N,CENTRO,"RUA DO ITORORO, CENTRO, CONDE, BA, BRASIL",,,,
BA,CONDE,UNIDADE DE SAUDE DA FAMILIA DE CONDE,AVENIDA JOAO IZIDORO LINS,S/N,CENTRO,"AVENIDA JOAO IZIDORO LINS, CENTRO, CONDE, BA, BRASIL",,,,
BA,CONDE,UNIDADE DE SAUDE DA FAMILIA DE VILA DO CONDE 02,RUA BAIXA DA AREIA,S/N,VILA DO CONDE,"RUA BAIXA DA AREIA, VILA DO CONDE, CONDE, BA, BRASIL",,,,
BA,CONDE,UNIDADE DE SAUDE DA FAMILIA DE ALTAMIRA,PRACA EDUARDO CAVALCANTE LINS,S/N,ALTAMIRA,"PRACA EDUARDO CAVALCANTE LINS, ALTAMIRA, CONDE, BA, BRASIL",,,,
BA,CONDE,POSTO DE SAUDE DE SIRIBINHA,POVOADO DA SIRIBINHA,S/N,CENTRO,"POVOADO DA SIRIBINHA, CENTRO, CONDE, BA, BRASIL",,,,
BA,CONDE,UNIDADE DE SAUDE DA FAMILIA DE CANGURITO,FAZENDA CANGURITO,S/N,ZONA RURAL,"FAZENDA CANGURITO, ZONA RURAL, CONDE, BA, BRASIL",,,,
BA,CONDEUBA,UNIDADE DE SAUDE DA FAMILIA CENTRO,PRACA RUI BARBOSA,S/N,CENTRO,"PRACA RUI BARBOSA, CENTRO, CONDEUBA, BA, BRASIL",,,,
BA,CONDEUBA,UNIDADE DE SAUDE DA FAMILIA MANOEL BATISTA,POVOADO DA FEIRINHA,S/N,ZONA RURAL,"POVOADO DA FEIRINHA, ZONA RURAL, CONDEUBA, BA, BRASIL",,,,
BA,CONDEUBA,UNIDADE DE SAUDE DA FAMILIA JOSE MARTINS DE CARVALHO,POVOADO DO ALEGRE,S/N,ZONA RURAL,"POVOADO DO ALEGRE, ZONA RURAL, CONDEUBA, BA, BRASIL",,,,
BA,CONDEUBA,UNIDADE DE SAUDE DA FAMILIA DE LAGOINHA,POVOADO DA LAGOINHA,S/N,ZONA RURAL,"POVOADO DA LAGOINHA, ZONA RURAL, CONDEUBA, BA, BRASIL",,,,
BA,CONDEUBA,U S F FLORISVALDO BATISTA DE OLIVEIRA,RUA 21 DE ABRIL,S/N,DIVINO ESPIRITO SANT,"RUA 21 DE ABRIL, DIVINO ESPIRITO SANT, CONDEUBA, BA, BRASIL",,,,
BA,CONDEUBA,U S F RITA MARIA DA TRINDADE,PRACA BOM JESUS,1,BOM JESUS,"PRACA BOM JESUS, BOM JESUS, CONDEUBA, BA, BRASIL",,,,
BA,CONDEUBA,U S F DORISVALDO DE SOUSA OLIVEIRA,POVOADO DA MANDASSAIA,S/N,ZONA RURAL,"POVOADO DA MANDASSAIA, ZONA RURAL, CONDEUBA, BA, BRASIL",,,,
BA,CONDEUBA,UNIDADE DE SAUDE DA FAMILIA DO MUCAMBO,FAZENDA MUCAMBO,S/N,ZONA RURAL,"FAZENDA MUCAMBO, ZONA RURAL, CONDEUBA, BA, BRASIL",,,,
BA,CONTENDAS DO SINCORA,PS CASA DE PEDRA,VILA CASA DE PEDRA,S/N,ZONA RURAL,"VILA CASA DE PEDRA, ZONA RURAL, CONTENDAS DO SINCORA, BA, BRASIL",,,,
BA,CONTENDAS DO SINCORA,USF VALDIR NERYS DE OLIVEIRA,RUA 13 DE MAIO,0,CENTRO,"RUA 13 DE MAIO, CENTRO, CONTENDAS DO SINCORA, BA, BRASIL",,,,
BA,CONTENDAS DO SINCORA,USF DR RODRIGO DE CASTRO BURGOS,RUA DR PAULO DIAMANTINO,62,CENTRO,"RUA DR PAULO DIAMANTINO, CENTRO, CONTENDAS DO SINCORA, BA, BRASIL",,,,
BA,CONTENDAS DO SINCORA,PS DE CARAIBUNA,POVOADO DE CARAIBUNA,S/N,ZONA RURAL,"POVOADO DE CARAIBUNA, ZONA RURAL, CONTENDAS DO SINCORA, BA, BRASIL",,,,
BA,CONTENDAS DO SINCORA,PS DE PALMEIRAS,POVOADO DE PALMEIRAS,S/N,ZONA RURAL,"POVOADO DE PALMEIRAS, ZONA RURAL, CONTENDAS DO SINCORA, BA, BRASIL",,,,
BA,CORACAO DE MARIA,USF CANABRAVA,FAZENDA CANABRAVA,S/N,ZONA RURAL,"FAZENDA CANABRAVA, ZONA RURAL, CORACAO DE MARIA, BA, BRASIL",,,,
BA,CORACAO DE MARIA,USF DE ITACAVA,PRACA DO SAO SIMAO,S/N,ITACAVA,"PRACA DO SAO SIMAO, ITACAVA, CORACAO DE MARIA, BA, BRASIL",,,,
BA,CORACAO DE MARIA,CENTRO DE SAUDE VIEIRA DE MELO,RUA PEDRO CERQUEIRA DALTRO,154,CENTRO,"RUA PEDRO CERQUEIRA DALTRO, CENTRO, CORACAO DE MARIA, BA, BRASIL",,,,
BA,CORACAO DE MARIA,USF SAGRADO CORACAO DE JESUS,RUA PEDRO CERQUEIRA DALTRO,10,CENTRO,"RUA PEDRO CERQUEIRA DALTRO, CENTRO, CORACAO DE MARIA, BA, BRASIL",,,,
BA,CORACAO DE MARIA,USF JOAO PAULO II,POVOADO DO RETIRO,S/N,RETIRO,"POVOADO DO RETIRO, RETIRO, CORACAO DE MARIA, BA, BRASIL",,,,
BA,CORACAO DE MARIA,USF TOMAZIA GOMES DA SILVA,FAZENDA NETO,S/N,ZONA RURAL,"FAZENDA NETO, ZONA RURAL, CORACAO DE MARIA, BA, BRASIL",,,,
BA,CORACAO DE MARIA,USF ISA COELHO MACHADO,RUA PEDRO CERQUEIRA DALTRO,154,CENTRO,"RUA PEDRO CERQUEIRA DALTRO, CENTRO, CORACAO DE MARIA, BA, BRASIL",,,,
BA,CORACAO DE MARIA,USF AGNELO MENDES,PC DO RETIRO,S/N,RETIRO,"PC DO RETIRO, RETIRO, CORACAO DE MARIA, BA, BRASIL",,,,
BA,CORDEIROS,USF LIDUINA VIERA SALOMAO,RUA DA QUADRA,S/N,CENTRO,"RUA DA QUADRA, CENTRO, CORDEIROS, BA, BRASIL",,,,
BA,CORDEIROS,UNIDADE DE SAUDE DA FAMILIA ARACAS II,PRACA CORONEL JOSE MOREIRA CORDEIRO,104,ZONA RURAL,"PRACA CORONEL JOSE MOREIRA CORDEIRO, ZONA RURAL, CORDEIROS, BA, BRASIL",,,,
BA,CORDEIROS,USF DO POVOADO DE ALVORADA,PRACA CORONEL JOSE MOREIRA CORDEIRO,104,CENTRO,"PRACA CORONEL JOSE MOREIRA CORDEIRO, CENTRO, CORDEIROS, BA, BRASIL",,,,
BA,CORDEIROS,USF DR JOSE CARDOSO DOS APOSTOLOS,PRACA CORONEL JOSE MOREIRA CORDEIRO,104,CENTRO,"PRACA CORONEL JOSE MOREIRA CORDEIRO, CENTRO, CORDEIROS, BA, BRASIL",,,,
BA,CORIBE,USF MIGUEL ALVES DAS NEVES,RUA COLONIA,S/N,CENTRO,"RUA COLONIA, CENTRO, CORIBE, BA, BRASIL",,,,
BA,CORIBE,USF FRANCISCO VIGARIO DA ROCHA,RUA RIO ALEGRE,S/N,CENTRO,"RUA RIO ALEGRE, CENTRO, CORIBE, BA, BRASIL",,,,
BA,CORIBE,USF PARTEIRA DONA INES,RUA DOS BANDEIRANTES,S/N,CENTRO,"RUA DOS BANDEIRANTES, CENTRO, CORIBE, BA, BRASIL",,,,
BA,CORIBE,USF FELISMINO BATISTA DA SILVA,RUA PRINCIPAL,S/N,DISTRITO RANCHINHO,"RUA PRINCIPAL, DISTRITO RANCHINHO, CORIBE, BA, BRASIL",,,,
BA,CORIBE,UNIDADE DE SAUDE DA FAMILIA NOVO HORIZONTE,BAIRRO NOVO HORIZONTE,10,CENTRO,"BAIRRO NOVO HORIZONTE, CENTRO, CORIBE, BA, BRASIL",,,,
BA,CORIBE,CENTRO DE SAUDE DE CORIBE,RUA DOS BANDEIRANTES,S/N,CENTRO,"RUA DOS BANDEIRANTES, CENTRO, CORIBE, BA, BRASIL",,,,
BA,CORIBE,USF ANIZIA PEREIRA NASCIMENTO,RUA PRINCIPAL,S/N,CENTRO,"RUA PRINCIPAL, CENTRO, CORIBE, BA, BRASIL",,,,
BA,CORIBE,USF JOSEFINO ARRUDA,PRACA DA MATRIZ,S/N,CENTRO,"PRACA DA MATRIZ, CENTRO, CORIBE, BA, BRASIL",-13.4008642,-44.1941443,"Praça da Matriz, Centro, São Félix do Coribe, Região Geográfica Imediata de Santa Maria da Vitória, Região Geográfica Intermediária de Barreiras, Bahia, Região Nordeste, 47665-000, Brasil","13 24m 3.11112s S, 44 11m 38.9195s W"
BA,CORONEL JOAO SA,UNIDADE DE SAUDE DA FAMILIA PSF SEDE II,RUA DR JOSE MAGALHAES,S/N,CENTRO,"RUA DR JOSE MAGALHAES, CENTRO, CORONEL JOAO SA, BA, BRASIL",,,,
BA,CORONEL JOAO SA,UNIDADE DE SAUDE DA FAMILIA GASPARINO,POVOADO GASPARINO,1,ZONA RURAL,"POVOADO GASPARINO, ZONA RURAL, CORONEL JOAO SA, BA, BRASIL",,,,
BA,CORONEL JOAO SA,UNIDADE DE SAUDE DA FAMILIA BARRA LARGA,POV ALAGOINHAS,S/N,ZONA RURAL,"POV ALAGOINHAS, ZONA RURAL, CORONEL JOAO SA, BA, BRASIL",,,,
BA,CORONEL JOAO SA,UNIDADE DE SAUDE DA FAMILIA CEL JOAO SA,RUA DR CARVALHO SA,S/N,CENTRO,"RUA DR CARVALHO SA, CENTRO, CORONEL JOAO SA, BA, BRASIL",,,,
BA,CORONEL JOAO SA,UNIDADE BASICA DE SAUDE SERROTINHO,POVOADO SERROTINHO,S/N,ZONA RURAL,"POVOADO SERROTINHO, ZONA RURAL, CORONEL JOAO SA, BA, BRASIL",,,,
BA,CORONEL JOAO SA,UNIDADE BASICA DE SAUDE JOSE ABILIO DA COSTA,R JOSE ABILIO DA COSTA,S/N,CENTRO,"R JOSE ABILIO DA COSTA, CENTRO, CORONEL JOAO SA, BA, BRASIL",,,,
BA,CORONEL JOAO SA,UNIDADE DE SAUDE DA FAMILIA RIO DO PEIXE,POVOADO TIMOTEO,1,ZONA RURAL,"POVOADO TIMOTEO, ZONA RURAL, CORONEL JOAO SA, BA, BRASIL",,,,
BA,CORRENTINA,UBS DEOCLECIANO SILVA,RUA F,S/N,DEOCLECIANO,"RUA F, DEOCLECIANO, CORRENTINA, BA, BRASIL",,,,
BA,CORRENTINA,USF DO SETOR DOURADO,RUA RUY BARBOSA,S/N,SETOR DOURADO,"RUA RUY BARBOSA, SETOR DOURADO, CORRENTINA, BA, BRASIL",,,,
BA,CORRENTINA,USF DO ROSARIO,DISTRITO DO ROSARIO,S/N,ZONA RURAL,"DISTRITO DO ROSARIO, ZONA RURAL, CORRENTINA, BA, BRASIL",,,,
BA,CORRENTINA,USF DO SAO JOSE,RUA B,S/N,SAO JOSE,"RUA B, SAO JOSE, CORRENTINA, BA, BRASIL",,,,
BA,CORRENTINA,PSF DE APARECIDA DO OESTE,POVOADO DE APARECIDA DO OESTE,S/N,ZONA RURAL,"POVOADO DE APARECIDA DO OESTE, ZONA RURAL, CORRENTINA, BA, BRASIL",,,,
BA,CORRENTINA,PSF JUVENAL PEREIRA DA SILVA USF DE PRAIA,DISTRITO DE PRAIA,S/N,ZONA RURAL,"DISTRITO DE PRAIA, ZONA RURAL, CORRENTINA, BA, BRASIL",,,,
BA,CORRENTINA,CEO CENTRO DE ESPECIALIDADES ODONTOLOGICAS DE CORRENTINA,RUA DA INDEPENDENCIA,S/N,DEOCLECIANO SILVA,"RUA DA INDEPENDENCIA, DEOCLECIANO SILVA, CORRENTINA, BA, BRASIL",,,,
BA,CORRENTINA,POSTO DE SAUDE DA FAMILIA DA SILVANIA,FAZENDA SILVANIA,S/N,ZONRA RURAL,"FAZENDA SILVANIA, ZONRA RURAL, CORRENTINA, BA, BRASIL",,,,
BA,CORRENTINA,UNIDADE BASICA DE SAUDE CORRENTINA I,RUA DA BARRAGEM,12,CENTRO,"RUA DA BARRAGEM, CENTRO, CORRENTINA, BA, BRASIL",,,,
