UF,MUNICIPIO,ESTABELECIMENTO,LOGRADOURO,NUMERO,BAIRRO,ENDERECO_COMPLETO,latitude,longitude,address,point
BA,QUEIMADAS,CENTRO DE SAUDE SINFOROSA LIRIO,RUA DA MATERNIDADE,S/N,CENTRO,"RUA DA MATERNIDADE, CENTRO, QUEIMADAS, BA, BRASIL",,,,
BA,QUEIMADAS,POSTO DE SAUDE DE FAZENDA DE CIMA,POV FAZENDA DE CIMA,S/N,CENTRO,"POV FAZENDA DE CIMA, CENTRO, QUEIMADAS, BA, BRASIL",,,,
BA,QUEIMADAS,USF DE LAGOINHA,POVOADO LAGOINHA,S/N,ZONA RURAL,"POVOADO LAGOINHA, ZONA RURAL, QUEIMADAS, BA, BRASIL",,,,
BA,QUEIMADAS,USF DE ALECRIM,POVOADO DE ALECRIM,S/N,ZONA RURAL,"POVOADO DE ALECRIM, ZONA RURAL, QUEIMADAS, BA, BRASIL",,,,
BA,QUEIMADAS,USF DE RIACHO DA ONCA,POVOADO DE CEL JOAO BORGES,S/N,CENTRO,"POVOADO DE CEL JOAO BORGES, CENTRO, QUEIMADAS, BA, BRASIL",,,,
BA,QUEIMADAS,POSTO DE SAUDE DE PONTO NOVO,POV DE PONTO NOVO,S/N,ZONA RURAL,"POV DE PONTO NOVO, ZONA RURAL, QUEIMADAS, BA, BRASIL",,,,
BA,QUEIMADAS,USF ALTO DA JACOBINA,RUA ANTNIO ARAUJO,S/N,ALTO DA JACOBINA,"RUA ANTNIO ARAUJO, ALTO DA JACOBINA, QUEIMADAS, BA, BRASIL",,,,
BA,QUEIMADAS,USF DE PEDROLANDIA,POVOADO DE PEDROLANDIA,S/N,POV DE PEDROLANDIA,"POVOADO DE PEDROLANDIA, POV DE PEDROLANDIA, QUEIMADAS, BA, BRASIL",,,,
BA,QUIJINGUE,UNIDADE DE SAUDE DA FAMILIA DO MONTE CRUZEIRO,POVOADO DE MONTE CRUZEIRO,S/N,ZONA RURAL,"POVOADO DE MONTE CRUZEIRO, ZONA RURAL, QUIJINGUE, BA, BRASIL",,,,
BA,QUIJINGUE,UNIDADE DE SAUDE DA FAMILIA SEDE III,TANCREDO NEVES,S/N,CENTRO,"TANCREDO NEVES, CENTRO, QUIJINGUE, BA, BRASIL",,,,
BA,QUIJINGUE,UNIDADE DE SAUDE DA FAMILIA DE SITIO,POVOADO SITIO,S/N,POVOADO SITIO,"POVOADO SITIO, POVOADO SITIO, QUIJINGUE, BA, BRASIL",,,,
BA,QUIJINGUE,UNIDADE DE SAUDE DA FAMILIA TANQUE DO RUMO,POVOADO TANQUE DO RUMO,S/N,ZONA RURAL,"POVOADO TANQUE DO RUMO, ZONA RURAL, QUIJINGUE, BA, BRASIL",,,,
BA,QUIJINGUE,UNIDADE DE SAUDE DA FAMILIA DE LAGOA DO MATO,POVOADO LAGOA DO MATO,S/N,LAGOA DO MATO,"POVOADO LAGOA DO MATO, LAGOA DO MATO, QUIJINGUE, BA, BRASIL",,,,
BA,QUIJINGUE,CENTRO DE SAUDE DE QUIJINGUE USF SEDE I,AVENIDA PRESIDENTE GETULIO VARGAS,S/N,CENTRO,"AVENIDA PRESIDENTE GETULIO VARGAS, CENTRO, QUIJINGUE, BA, BRASIL",,,,
BA,QUIJINGUE,UNIDADE DE SAUDE DA FAMILIA DRA ZILDA ARNS,RUA TANCREDO NEVES,S/N,CENTRO,"RUA TANCREDO NEVES, CENTRO, QUIJINGUE, BA, BRASIL",,,,
BA,QUIJINGUE,CENTRO DE SAUDE DE ALGODOES USF ALGODOES I,AVENIDA EUCLIDES DA CUNHA,S/N,CENTRO,"AVENIDA EUCLIDES DA CUNHA, CENTRO, QUIJINGUE, BA, BRASIL",,,,
BA,QUIJINGUE,UNIDADE DE SAUDE DA FAMILIA DE LAGOA DO JUNCO,POVOADO LAGOA DO JUNCO,S/N,LAGOA DO JUNCO,"POVOADO LAGOA DO JUNCO, LAGOA DO JUNCO, QUIJINGUE, BA, BRASIL",,,,
BA,QUIJINGUE,UNIDADE DE SAUDE DA FAMILIA DE MACETE,POVOADO MACETE,S/N,MECETE,"POVOADO MACETE, MECETE, QUIJINGUE, BA, BRASIL",,,,
BA,QUIJINGUE,UNIDADE DE SAUDE DA FAMILIA DE ALGODOES,DISTRITO DE ALGODOES,S/N,ALGODOES,"DISTRITO DE ALGODOES, ALGODOES, QUIJINGUE, BA, BRASIL",,,,
BA,QUIXABEIRA,UNIDADE DE SAUDE DA FAMILIA DA SEDE,PRACA 21 DE ABRIL,S/N,CENTRO,"PRACA 21 DE ABRIL, CENTRO, QUIXABEIRA, BA, BRASIL",,,,
BA,QUIXABEIRA,CENTRO DE SAUDE DE QUIXABEIRA,PRACA 21 DE ABRIL,S/N,CENTRO,"PRACA 21 DE ABRIL, CENTRO, QUIXABEIRA, BA, BRASIL",,,,
BA,QUIXABEIRA,POSTO DE SAUDE DE CAMPO VERDE,POVOADO DE CAMPO VERDE,6,CAMPO VERDE,"POVOADO DE CAMPO VERDE, CAMPO VERDE, QUIXABEIRA, BA, BRASIL",,,,
BA,QUIXABEIRA,CENTRO TERAPEUTICO E DE REABILITACAO,AV JOVITO SOUZA NOVAES,S/N,CENTRO,"AV JOVITO SOUZA NOVAES, CENTRO, QUIXABEIRA, BA, BRASIL",,,,
BA,QUIXABEIRA,UNIDADE DE SAUDE DA FAMILIA DE LARANJEIRAS,PRACA 21 DE ABRIL,S/N,LARANJEIRAS,"PRACA 21 DE ABRIL, LARANJEIRAS, QUIXABEIRA, BA, BRASIL",,,,
BA,QUIXABEIRA,UNIDADE DE SAUDE DA FAMILIA DE ALTO DO CAPIM,POVOADO DE ALTO DO CAPIM,33,ALTO DO CAPIM,"POVOADO DE ALTO DO CAPIM, ALTO DO CAPIM, QUIXABEIRA, BA, BRASIL",,,,
BA,QUIXABEIRA,UNIDADE DE SAUDE DA FAMILIA DE JABOTICABA,PRACA MARTINIANO GOMES,26,JABOTICABA,"PRACA MARTINIANO GOMES, JABOTICABA, QUIXABEIRA, BA, BRASIL",,,,
BA,QUIXABEIRA,POSTO DE SAUDE DE COVA DO ANJO,POVOADO DE COVA DO ANJO,6,COVA DO ANJO,"POVOADO DE COVA DO ANJO, COVA DO ANJO, QUIXABEIRA, BA, BRASIL",,,,
BA,QUIXABEIRA,POSTO DE SAUDE DE RAMAL,POVOADO DE RAMAL,12,RAMAL,"POVOADO DE RAMAL, RAMAL, QUIXABEIRA, BA, BRASIL",,,,
BA,QUIXABEIRA,POSTO DE SAUDE DE BAIXA GRANDE,POVOADO DE BAIXA GRANDE,25,BAIXA GRANDE,"POVOADO DE BAIXA GRANDE, BAIXA GRANDE, QUIXABEIRA, BA, BRASIL",,,,
BA,QUIXABEIRA,POSTO DE SAUDE DE VARZEA DO CANTO,POVOADO DE VARZEA DO CANTO,4,VARZEA DO CANTO,"POVOADO DE VARZEA DO CANTO, VARZEA DO CANTO, QUIXABEIRA, BA, BRASIL",,,,
BA,RAFAEL JAMBEIRO,USF NOSSA SENHORA DO ROSARIO,POVOADO DO ROSARINHO,S/N,ZONA RURAL,"POVOADO DO ROSARINHO, ZONA RURAL, RAFAEL JAMBEIRO, BA, BRASIL",,,,
BA,RAFAEL JAMBEIRO,USF TOME FERNANDES SERRA,POVOADO DE CALDEIRAO,S/N,ZONA RURAL,"POVOADO DE CALDEIRAO, ZONA RURAL, RAFAEL JAMBEIRO, BA, BRASIL",,,,
BA,RAFAEL JAMBEIRO,POSTO DE SAUDE SERAFIM,FAZENDA SERAFIM,S/N,ZONA RURAL,"FAZENDA SERAFIM, ZONA RURAL, RAFAEL JAMBEIRO, BA, BRASIL",,,,
BA,RAFAEL JAMBEIRO,USF LEONCIO CERQUEIRA GOMES,LARGO ANSELMO DIAS,S/N,CENTRO,"LARGO ANSELMO DIAS, CENTRO, RAFAEL JAMBEIRO, BA, BRASIL",,,,
BA,RAFAEL JAMBEIRO,USF DO PARAGUASSU,RUA CASTRO ALVES,S/N,ZONA RURAL,"RUA CASTRO ALVES, ZONA RURAL, RAFAEL JAMBEIRO, BA, BRASIL",,,,
BA,RAFAEL JAMBEIRO,POSTO DE SAUDE MARACANA,POVOADO DO MARACANA,S/N,ZONA RURAL,"POVOADO DO MARACANA, ZONA RURAL, RAFAEL JAMBEIRO, BA, BRASIL",,,,
BA,RAFAEL JAMBEIRO,POSTO DE SAUDE MANDACARU,FAZENDA MANDACARU,S/N,ZONA RURAL,"FAZENDA MANDACARU, ZONA RURAL, RAFAEL JAMBEIRO, BA, BRASIL",,,,
BA,RAFAEL JAMBEIRO,POSTO DE SAUDE DE PORTO DA PASSAGEM,POV DE PORTO DA PASSAGEM,S/N,ZONA RURAL,"POV DE PORTO DA PASSAGEM, ZONA RURAL, RAFAEL JAMBEIRO, BA, BRASIL",,,,
BA,RAFAEL JAMBEIRO,POSTO DE SAUDE DE PORTEIRAS,POVOADO DE PORTEIRAS,S/N,ZONA RURAL,"POVOADO DE PORTEIRAS, ZONA RURAL, RAFAEL JAMBEIRO, BA, BRASIL",,,,
BA,RAFAEL JAMBEIRO,POSTO DE SAUDE FAZENDA NOVA,FAZENDA NOVA,S/N,ZONA RURAL,"FAZENDA NOVA, ZONA RURAL, RAFAEL JAMBEIRO, BA, BRASIL",,,,
BA,RAFAEL JAMBEIRO,USF FIRMINO CARMO,RUA CAIXA DAGUA,S/N,CENTRO,"RUA CAIXA DAGUA, CENTRO, RAFAEL JAMBEIRO, BA, BRASIL",,,,
BA,RAFAEL JAMBEIRO,USF JUSTINIANO FRANCISCO DA SILVA,POVOADO DE SAO ROQUE DO PARATIGI,S/N,ZONA RURAL,"POVOADO DE SAO ROQUE DO PARATIGI, ZONA RURAL, RAFAEL JAMBEIRO, BA, BRASIL",,,,
BA,RAFAEL JAMBEIRO,POSTO DE SAUDE CABECA DO NEGRO,POVOADO CABECA DO NEGRO,S/N,ZONA RURAL,"POVOADO CABECA DO NEGRO, ZONA RURAL, RAFAEL JAMBEIRO, BA, BRASIL",,,,
BA,RAFAEL JAMBEIRO,POSTO DE SAUDE MOCO,FAZENDA MOCO,S/N,ZONA RURAL,"FAZENDA MOCO, ZONA RURAL, RAFAEL JAMBEIRO, BA, BRASIL",,,,
BA,RAFAEL JAMBEIRO,UNIDADE BASICA DE SAUDE DA FAMILIA SANTA RITA,PRACA LARGO DA LIBERDADE,S/N,CENTRO,"PRACA LARGO DA LIBERDADE, CENTRO, RAFAEL JAMBEIRO, BA, BRASIL",,,,
BA,RAFAEL JAMBEIRO,POSTO DE SAUDE AMARGOSO,FAZENDA AMARGOSO,S/N,ZONA RURAL,"FAZENDA AMARGOSO, ZONA RURAL, RAFAEL JAMBEIRO, BA, BRASIL",,,,
BA,RAFAEL JAMBEIRO,USF FIRMINO CERQUEIRA ARAUJO,POVOADO DO CAJUEIRO,S/N,ZONA RURAL,"POVOADO DO CAJUEIRO, ZONA RURAL, RAFAEL JAMBEIRO, BA, BRASIL",,,,
BA,RAFAEL JAMBEIRO,USF BOM JESUS DA LAPA,POVOADO PARANAGUA,S/N,ZONA RURAL,"POVOADO PARANAGUA, ZONA RURAL, RAFAEL JAMBEIRO, BA, BRASIL",,,,
BA,RAFAEL JAMBEIRO,POSTO DE SAUDE CARNE DANTA,FAZENDA CARNE DANTA,S/N,ZONA RURAL,"FAZENDA CARNE DANTA, ZONA RURAL, RAFAEL JAMBEIRO, BA, BRASIL",,,,
BA,REMANSO,UNIDADE DE SAUDE DA FAMILIA DA MALHADINHA,POVOADO DA MALHADINHA,S/N,ZONA RURAL,"POVOADO DA MALHADINHA, ZONA RURAL, REMANSO, BA, BRASIL",,,,
BA,REMANSO,UNIDADE DE SAUDE DA FAMILIA DA MARAVILHA,POVOADO MARAVILHA,S/N,ZONA RURAL,"POVOADO MARAVILHA, ZONA RURAL, REMANSO, BA, BRASIL",,,,
BA,REMANSO,UNIDADE DE SAUDE DA FAMILIA PADRE JOSE BENEDITO ROSA,RAIMUNDO FERREIRA DE CASTRO,S/N,VILA SANTANA,"RAIMUNDO FERREIRA DE CASTRO, VILA SANTANA, REMANSO, BA, BRASIL",,,,
BA,REMANSO,UNIDADE DE SAUDE DA FAMILIA DO NOVO MARCOS,POVOADO DE NOVO MARCOS,S/N,ZONA RURAL,"POVOADO DE NOVO MARCOS, ZONA RURAL, REMANSO, BA, BRASIL",,,,
BA,REMANSO,UNIDADE DE SAUDE DA FAMILIA DR MARCELINO RIBEIRO,RUA CEL JOSE DO CARMO,S/N,CENTRO,"RUA CEL JOSE DO CARMO, CENTRO, REMANSO, BA, BRASIL",,,,
BA,REMANSO,UNIDADE DE SAUDE DA FAMILIA DO DESTERRO,SITIO DESTERRO,S/N,ZONA RURAL,"SITIO DESTERRO, ZONA RURAL, REMANSO, BA, BRASIL",,,,
BA,REMANSO,UNIDADE BASICA DE SAUDE,RUA CIDADE IPIAU,201,QUADRA 07,"RUA CIDADE IPIAU, QUADRA 07, REMANSO, BA, BRASIL",,,,
BA,REMANSO,UNIDADE DE SAUDE DA FAMILIA DO TAMBURIL,POVOADO DO TAMBURIL,S/N,ZONA RURAL,"POVOADO DO TAMBURIL, ZONA RURAL, REMANSO, BA, BRASIL",,,,
BA,REMANSO,UNIDADE DE SAUDE DA FAMILIA MARIA AMELIA DE ALENCAR CARVALHO,RUA JOSE DIAS RIBEIRO,701,AREA INDUSTRIAL,"RUA JOSE DIAS RIBEIRO, AREA INDUSTRIAL, REMANSO, BA, BRASIL",,,,
BA,REMANSO,UNIDADE DE SAUDE DA FAMILIA DR CARLOS DIAS RIBEIRO,AV VEREADOR PAULO FERREIRA,S/N,QUADRA 14,"AV VEREADOR PAULO FERREIRA, QUADRA 14, REMANSO, BA, BRASIL",,,,
BA,RETIROLANDIA,POSTO DE SAUDE DE MANDAPOLIS,POVOADO DE MANDAPOLIS,S/N,POV MANDAPOLIS,"POVOADO DE MANDAPOLIS, POV MANDAPOLIS, RETIROLANDIA, BA, BRASIL",,,,
BA,RETIROLANDIA,POSTO DE SAUDE DE VISTA BELA,POVOADO DE VISTA BELA,S/N,POV VISTA BELA,"POVOADO DE VISTA BELA, POV VISTA BELA, RETIROLANDIA, BA, BRASIL",,,,
BA,RETIROLANDIA,UNIDADE DE SAUDE DA FAMILIA ROQUE CARNEIRO DE OLIVEIRA,RUA DO PRADO,S/N,POCINHO,"RUA DO PRADO, POCINHO, RETIROLANDIA, BA, BRASIL",,,,
BA,RETIROLANDIA,UNIDADE SAUDE DA FAMILIA ALTO DO CAMILO,RUA DA CAJAZEIRAS,S/N,CENTRO,"RUA DA CAJAZEIRAS, CENTRO, RETIROLANDIA, BA, BRASIL",,,,
BA,RETIROLANDIA,POSTO DE SAUDE DE UBERLANDIA,POVOADO DE UBERLANDIA,S/N,POV UBERLANDIA,"POVOADO DE UBERLANDIA, POV UBERLANDIA, RETIROLANDIA, BA, BRASIL",,,,
BA,RETIROLANDIA,POSTO DE SAUDE DE LAGOA GRANDE,POV DE LAGOA GRANDE,S/N,POV LAGOA GRANDE,"POV DE LAGOA GRANDE, POV LAGOA GRANDE, RETIROLANDIA, BA, BRASIL",,,,
BA,RETIROLANDIA,POSTO DE SAUDE DE VARGEM,POVOADO DE VARGEM,S/N,POVOADO DE VARGEM,"POVOADO DE VARGEM, POVOADO DE VARGEM, RETIROLANDIA, BA, BRASIL",,,,
BA,RETIROLANDIA,POSTO DE SAUDE JITAI,POVOADO JITAI,S/N,ZONA RURAL,"POVOADO JITAI, ZONA RURAL, RETIROLANDIA, BA, BRASIL",,,,
BA,RETIROLANDIA,UNIDADE SAUDE DA FAMILIA LAGINHA,POVOADO DE LAGINHA,S/N,POV LAGINHA,"POVOADO DE LAGINHA, POV LAGINHA, RETIROLANDIA, BA, BRASIL",,,,
BA,RETIROLANDIA,UNIDADE SAUDE DA FAMILIA ALECRIM,POVOADO DE ALECRIM,S/N,ALECRIM,"POVOADO DE ALECRIM, ALECRIM, RETIROLANDIA, BA, BRASIL",,,,
BA,RETIROLANDIA,UNIDADE BASICA DE SAUDE FERNANDO PRESIDIO,RUA JOANA ANGELICA,S/N,CENTRO,"RUA JOANA ANGELICA, CENTRO, RETIROLANDIA, BA, BRASIL",,,,
BA,RETIROLANDIA,UNIDADE SAUDE DA FAMILIA CECILIA SANTIAGO,RETIRO VELHO,S/N,RETIRO VELHO,"RETIRO VELHO, RETIRO VELHO, RETIROLANDIA, BA, BRASIL",,,,
BA,RETIROLANDIA,POSTO DE SAUDE DA GAMELEIRA,POVOADO GAMELEIRA,S/N,ZONA RURAL,"POVOADO GAMELEIRA, ZONA RURAL, RETIROLANDIA, BA, BRASIL",,,,
BA,RETIROLANDIA,POSTO DE SAUDE DE GIBOIA,POVOADO DE GIBOIA,S/N,POV DE GIBOIA,"POVOADO DE GIBOIA, POV DE GIBOIA, RETIROLANDIA, BA, BRASIL",,,,
BA,RIACHAO DAS NEVES,CENTRO DE SAUDE I DE RIACHAO DAS NEVES,RUA LANDULFO ALVES,329,CENTRO,"RUA LANDULFO ALVES, CENTRO, RIACHAO DAS NEVES, BA, BRASIL",,,,
BA,RIACHAO DAS NEVES,POSTO DE SAUDE DO PINTOR,POV DO PINTOR,S/N,ZONA RURAL,"POV DO PINTOR, ZONA RURAL, RIACHAO DAS NEVES, BA, BRASIL",,,,
BA,RIACHAO DAS NEVES,POSTINHO DE CARIPARE,RUA PRINCIPAL,S/N,ZONA RURAL,"RUA PRINCIPAL, ZONA RURAL, RIACHAO DAS NEVES, BA, BRASIL",,,,
BA,RIACHAO DAS NEVES,POSTO DE SAUDE DE ENTRONCAMENTO,DISTRITO DE CRUZEIRO DO OESTE,S/N,ZONA RURAL,"DISTRITO DE CRUZEIRO DO OESTE, ZONA RURAL, RIACHAO DAS NEVES, BA, BRASIL",,,,
BA,RIACHAO DAS NEVES,POSTO DE SAUDE DE CARIPARE,TRAVESSA DO CAMPO,S/N,CENTRO,"TRAVESSA DO CAMPO, CENTRO, RIACHAO DAS NEVES, BA, BRASIL",,,,
BA,RIACHAO DAS NEVES,POSTO DE PAJEU DO GERAIS,POVOADO DE PAJEU,S/N,ZONA RURAL,"POVOADO DE PAJEU, ZONA RURAL, RIACHAO DAS NEVES, BA, BRASIL",,,,
BA,RIACHAO DAS NEVES,POSTO DE SAUDE DA FAMILIA JARDILINO DOS SANTOS BOMFIM,RUA ANTONIO DOS SANTOS,S/N,CENTRO,"RUA ANTONIO DOS SANTOS, CENTRO, RIACHAO DAS NEVES, BA, BRASIL",,,,
BA,RIACHAO DAS NEVES,USF JOSE BERNARDINO DE SOUZA,PRACA CENTRAL,S/N,CENTRO,"PRACA CENTRAL, CENTRO, RIACHAO DAS NEVES, BA, BRASIL",,,,
BA,RIACHAO DAS NEVES,POSTO DE SAUDE DE SAO JOSE DO RIO GRANDE,RUA CASTRO ALVES,S/N,CENTRO,"RUA CASTRO ALVES, CENTRO, RIACHAO DAS NEVES, BA, BRASIL",,,,
BA,RIACHAO DAS NEVES,PSF ASSENTAMENTO RIO BRANCO,RUA PRINCIPAL,S/N,ZONA RURAL,"RUA PRINCIPAL, ZONA RURAL, RIACHAO DAS NEVES, BA, BRASIL",,,,
BA,RIACHAO DAS NEVES,PSF BARRA DO RIACHO,RUA CENTRAL,S/N,ZONA RURAL,"RUA CENTRAL, ZONA RURAL, RIACHAO DAS NEVES, BA, BRASIL",,,,
BA,RIACHAO DAS NEVES,POSTO DE SAUDE DE AREIAS,POVOADO DE AREIAS,S/N,ZONA RURAL,"POVOADO DE AREIAS, ZONA RURAL, RIACHAO DAS NEVES, BA, BRASIL",,,,
BA,RIACHAO DAS NEVES,POSTO DE SAUDE DE CANUDOS,POV CANUDOS,S/N,ZONA RURAL,"POV CANUDOS, ZONA RURAL, RIACHAO DAS NEVES, BA, BRASIL",,,,
BA,RIACHAO DAS NEVES,PSF MAE VENANCIA,RUA TIA GUINA,S/N,CENTRO,"RUA TIA GUINA, CENTRO, RIACHAO DAS NEVES, BA, BRASIL",,,,
BA,RIACHAO DO JACUIPE,UNIDADE DE SAUDE DA FAMILIA DE BELA VISTA,RUA CID PASSOS,S/N,BELA VISTA,"RUA CID PASSOS, BELA VISTA, RIACHAO DO JACUIPE, BA, BRASIL",,,,
BA,RIACHAO DO JACUIPE,UNIDADE DE SAUDE DA FAMILIA DE CHAPADA,PCA SANTA TEREZINHA,S/N,POV CHAPADA,"PCA SANTA TEREZINHA, POV CHAPADA, RIACHAO DO JACUIPE, BA, BRASIL",,,,
BA,RIACHAO DO JACUIPE,UNIDADE DE SAUDE DA FAMILIA DE MANDASSAIA,POV DE MANDASSAIA,S/N,MANDASSAIA,"POV DE MANDASSAIA, MANDASSAIA, RIACHAO DO JACUIPE, BA, BRASIL",,,,
BA,RIACHAO DO JACUIPE,UNIDADE DE SAUDE DA FAMILIA DE RANCHINHO,RUA ANTONIO CORDEIRO DE ALMEIDA,S/N,RANCHINHO,"RUA ANTONIO CORDEIRO DE ALMEIDA, RANCHINHO, RIACHAO DO JACUIPE, BA, BRASIL",,,,
BA,RIACHAO DO JACUIPE,POSTO DE SAUDE DE MALHADOR,PCA DA MATRIZ,1,POV MALHADOR,"PCA DA MATRIZ, POV MALHADOR, RIACHAO DO JACUIPE, BA, BRASIL",,,,
BA,RIACHAO DO JACUIPE,UNIDADE DE SAUDE DA FAMILIA DE VILA APARECIDA,RUA DAS FLORES,1,POV VILA APARECIDA,"RUA DAS FLORES, POV VILA APARECIDA, RIACHAO DO JACUIPE, BA, BRASIL",,,,
BA,RIACHAO DO JACUIPE,UNIDADE DE SAUDE DA FAMILIA DE BARREIROS,RUA MARIO NOU,18,POV BARREIROS,"RUA MARIO NOU, POV BARREIROS, RIACHAO DO JACUIPE, BA, BRASIL",,,,
BA,RIACHAO DO JACUIPE,UNIDADE DE SAUDE DA FAMILIA JATOBA,RUA DR JOAO CAMPOS,176,CENTRO,"RUA DR JOAO CAMPOS, CENTRO, RIACHAO DO JACUIPE, BA, BRASIL",,,,
BA,RIACHAO DO JACUIPE,UNIDADE DE SAUDE DA FAMILIA DE CAMPO ALEGRE,RUA MIZAEL CARNEIRO,S/N,POV CAMPO ALEGRE,"RUA MIZAEL CARNEIRO, POV CAMPO ALEGRE, RIACHAO DO JACUIPE, BA, BRASIL",,,,
BA,RIACHAO DO JACUIPE,CENTRO DE SAUDE DR JOSE MARIA DE MAGALHAES NETO,RUA DR JOAO CAMPOS,176,CENTRO,"RUA DR JOAO CAMPOS, CENTRO, RIACHAO DO JACUIPE, BA, BRASIL",,,,
BA,RIACHAO DO JACUIPE,UNIDADE DE SAUDE DA FAMILIA DE PONTO NOVO,RUA IRMA DULCE,S/N,POV PONTO NOVO,"RUA IRMA DULCE, POV PONTO NOVO, RIACHAO DO JACUIPE, BA, BRASIL",,,,
BA,RIACHAO DO JACUIPE,UNIDADE DE SAUDE DA FAMILIA DE ALTO DO CRUZEIRO,RUA BARAO DO RIO BRANCO,S/N,ALTO DO CRUZEIRO,"RUA BARAO DO RIO BRANCO, ALTO DO CRUZEIRO, RIACHAO DO JACUIPE, BA, BRASIL",,,,
BA,RIACHO DE SANTANA,UNIDADE DA SAUDE DA FAMILIA DO MATO VERDE II,RUA HERMENEGILDO CARDOSO DE CASTRO,S/N,MATO VERDE,"RUA HERMENEGILDO CARDOSO DE CASTRO, MATO VERDE, RIACHO DE SANTANA, BA, BRASIL",,,,
BA,RIACHO DE SANTANA,USF DE BOTUQUARA,POVOADO DE BOTUQUARA,15,ZONA RURAL,"POVOADO DE BOTUQUARA, ZONA RURAL, RIACHO DE SANTANA, BA, BRASIL",,,,
BA,RIACHO DE SANTANA,UNIDADE DE SAUDE DA FAMILIA ALEXANDRINA ALVES DE OLIVEIRA,RUA DR JOAQUIM VENANCIO DE CASTRO,S/N,CENTRO,"RUA DR JOAQUIM VENANCIO DE CASTRO, CENTRO, RIACHO DE SANTANA, BA, BRASIL",,,,
BA,RIACHO DE SANTANA,USF DE SANTA RITA,POVOADO DE SANTA RITA,S/N,ZONA RURAL,"POVOADO DE SANTA RITA, ZONA RURAL, RIACHO DE SANTANA, BA, BRASIL",,,,
BA,RIACHO DE SANTANA,UNIDADE DA SAUDE DA FAMILIA DO MATO VERDE,RUA JOAO EVANGELISTA DE CASTRO,S/N,MATO VERDE,"RUA JOAO EVANGELISTA DE CASTRO, MATO VERDE, RIACHO DE SANTANA, BA, BRASIL",,,,
BA,RIACHO DE SANTANA,UBS DE RIACHO DE SANTANA,RUA GERCINO COELHO,S/N,CENTRO,"RUA GERCINO COELHO, CENTRO, RIACHO DE SANTANA, BA, BRASIL",,,,
BA,RIACHO DE SANTANA,UNIDADE DE SAUDE DA VESPERINA,POVOADO DE VESPERINA,S/N,ZONA RURAL,"POVOADO DE VESPERINA, ZONA RURAL, RIACHO DE SANTANA, BA, BRASIL",,,,
BA,RIACHO DE SANTANA,UNIDADE DE SAUDE DA FAMILIA DO BELEM,RUA ULDORICO CARVALHO GONDIM,S/N,BELEM,"RUA ULDORICO CARVALHO GONDIM, BELEM, RIACHO DE SANTANA, BA, BRASIL",,,,
BA,RIACHO DE SANTANA,UNIDADE DE SAUDE DA FAMILIA DE LAGUNA,POVOADO DE LAGUNA,S/N,ZONA RURAL,"POVOADO DE LAGUNA, ZONA RURAL, RIACHO DE SANTANA, BA, BRASIL",,,,
BA,RIACHO DE SANTANA,USF DO POVOADO DO CAMBAITO,POVOADO DO CAMBAITO,S/N,ZONA RURAL,"POVOADO DO CAMBAITO, ZONA RURAL, RIACHO DE SANTANA, BA, BRASIL",,,,
BA,RIBEIRA DO AMPARO,UNIDADE DE SAUDE DA FAMILIA BARROCAS,POVOADO BARROCAS,S/N,ZONA RURAL,"POVOADO BARROCAS, ZONA RURAL, RIBEIRA DO AMPARO, BA, BRASIL",,,,
BA,RIBEIRA DO AMPARO,UNIDADE DE SAUDE DA FAMILIA PIMENTEL,FAZENDA PIMENTEL,5,ZONA RURAL,"FAZENDA PIMENTEL, ZONA RURAL, RIBEIRA DO AMPARO, BA, BRASIL",,,,
BA,RIBEIRA DO AMPARO,UNIDADE DE SAUDE DA FAMILIA RASPADOR,POVOADO DE RASPADOR,S/N,ZONA RURAL,"POVOADO DE RASPADOR, ZONA RURAL, RIBEIRA DO AMPARO, BA, BRASIL",,,,
BA,RIBEIRA DO AMPARO,UNIDADE DE SAUDE DA FAMILIA PROF NELSON BARROS,AVENIDA GOVERNADOR DR OTTO ALENCAR,426,CENTRO,"AVENIDA GOVERNADOR DR OTTO ALENCAR, CENTRO, RIBEIRA DO AMPARO, BA, BRASIL",,,,
BA,RIBEIRA DO AMPARO,UNIDADE DE SAUDE DA FAMILIA BOA HORA,POVOADO BOA HORA,S/N,ZONA RURAL,"POVOADO BOA HORA, ZONA RURAL, RIBEIRA DO AMPARO, BA, BRASIL",,,,
BA,RIBEIRA DO AMPARO,UNIDADE DE SAUDE DA FAMILIA PATOS,FAZENDA LAGES,6,ZONA RURAL,"FAZENDA LAGES, ZONA RURAL, RIBEIRA DO AMPARO, BA, BRASIL",,,,
BA,RIBEIRA DO POMBAL,UNIDADE SATELITE DO ALTO DO SANTO ANTONIO,BAIRRO POMBALZINHO,S/N,ZONA RURAL,"BAIRRO POMBALZINHO, ZONA RURAL, RIBEIRA DO POMBAL, BA, BRASIL",,,,
BA,RIBEIRA DO POMBAL,UNIDADE DE SAUDE DA FAMILIA DO BAIRRO PESCADOR,BAIRRO PESCADOR,S/N,PESCADOR,"BAIRRO PESCADOR, PESCADOR, RIBEIRA DO POMBAL, BA, BRASIL",,,,
BA,RIBEIRA DO POMBAL,UNIDADE DE SAUDE DA FAMILIA DO POVOADO CURRAL FALSO,POVOADO CURRAL FALSO,S/N,CURRAL FALSO,"POVOADO CURRAL FALSO, CURRAL FALSO, RIBEIRA DO POMBAL, BA, BRASIL",,,,
BA,RIBEIRA DO POMBAL,UNIDADE DE SAUDE FAMILIA DO POVOADO FEIRA DA SERRA,POVOADO FEIRA DA SERRA,S/N,FEIRA DA SERRA,"POVOADO FEIRA DA SERRA, FEIRA DA SERRA, RIBEIRA DO POMBAL, BA, BRASIL",,,,
BA,RIBEIRA DO POMBAL,UNIDADE DE SAUDE DA FAMILIA DA VILA OPERARIA,VILA OPERARIA,S/N,VILA OPERARIA,"VILA OPERARIA, VILA OPERARIA, RIBEIRA DO POMBAL, BA, BRASIL",,,,
BA,RIBEIRA DO POMBAL,UNIDADE SATELITE DO CAJUEIRO,POVOADO MARAVILHA,S/N,ZONA RURAL,"POVOADO MARAVILHA, ZONA RURAL, RIBEIRA DO POMBAL, BA, BRASIL",,,,
BA,RIBEIRA DO POMBAL,UNIDADE SATELITE DA FAZENDA PINTO II,POVOADO TAPERA,S/N,ZONA RURAL,"POVOADO TAPERA, ZONA RURAL, RIBEIRA DO POMBAL, BA, BRASIL",,,,
BA,RIBEIRA DO POMBAL,UNIDADE SATELITE DO POCO DAS VARAS,POVOADO MOCO,S/N,ZONA RURAL,"POVOADO MOCO, ZONA RURAL, RIBEIRA DO POMBAL, BA, BRASIL",,,,
BA,RIBEIRA DO POMBAL,UNIDADE SATELITE DO BARRO VERMELHO,POVOADO POCO,S/N,ZONA RURAL,"POVOADO POCO, ZONA RURAL, RIBEIRA DO POMBAL, BA, BRASIL",,,,
BA,RIBEIRA DO POMBAL,UNIDADE DE SAUDE DA FAMILIA DO POVOADO DE BOCA DA MATA,POVOADO BOCA DA MATA,S/N,BOCA DA MATA,"POVOADO BOCA DA MATA, BOCA DA MATA, RIBEIRA DO POMBAL, BA, BRASIL",,,,
BA,RIBEIRA DO POMBAL,UNIDADE DE SAUDE DA FAMILIA DO BAIRRO PEDRO TIBURCIO,RUA HILARIO DOS SANTOS,S/N,PEDRO TIBURCIO,"RUA HILARIO DOS SANTOS, PEDRO TIBURCIO, RIBEIRA DO POMBAL, BA, BRASIL",,,,
BA,RIBEIRA DO POMBAL,UNIDADE DE SAUDE DA FAMILIA DO POVOADO MARAVILHA,POV MARAVILHA,S/N,ZONA RURAL,"POV MARAVILHA, ZONA RURAL, RIBEIRA DO POMBAL, BA, BRASIL",,,,
BA,RIBEIRA DO POMBAL,UNIDADE SATELITE DO CURRALINHO,POVOADO BOCA DA MATA,S/N,ZONA RURAL,"POVOADO BOCA DA MATA, ZONA RURAL, RIBEIRA DO POMBAL, BA, BRASIL",,,,
BA,RIBEIRA DO POMBAL,UNIDADE DE SAUDE DA FAMILIA DO BAIRRO POMBALZINHO,BAIRRO POMBALZINHO,S/N,POMBALZINHO,"BAIRRO POMBALZINHO, POMBALZINHO, RIBEIRA DO POMBAL, BA, BRASIL",,,,
BA,RIBEIRA DO POMBAL,UNIDADE DE SAUDE DA FAMILIA DO POVOADO TAPERA,POVOADO TAPERA,S/N,POVOADO TAPERA,"POVOADO TAPERA, POVOADO TAPERA, RIBEIRA DO POMBAL, BA, BRASIL",,,,
BA,RIBEIRA DO POMBAL,UNIDADE SATELITE DA FAZENDA MANTEIGA,POVOADO TAPERA,S/N,ZONA RURAL,"POVOADO TAPERA, ZONA RURAL, RIBEIRA DO POMBAL, BA, BRASIL",,,,
BA,RIBEIRA DO POMBAL,UNIDADE DE SAUDE DA FAMILIA DO POVOADO BARROCAO,POVOADO BARROCAO,S/N,BARROCAO,"POVOADO BARROCAO, BARROCAO, RIBEIRA DO POMBAL, BA, BRASIL",,,,
BA,RIBEIRA DO POMBAL,UNIDADE DA SAUDE DA FAMILIA POVOADO DE NOVA ESPERANCA,POVOADO NOVA ESPERANCA,S/N,NOVA ESPERANCA,"POVOADO NOVA ESPERANCA, NOVA ESPERANCA, RIBEIRA DO POMBAL, BA, BRASIL",,,,
BA,RIBEIRA DO POMBAL,UNIDADE SATELITE DA MACAMBIRA,POVOADO MARAVILHA,S/N,ZONA RURAL,"POVOADO MARAVILHA, ZONA RURAL, RIBEIRA DO POMBAL, BA, BRASIL",,,,
BA,RIBEIRA DO POMBAL,UNIDADE DE SAUDE DA FAMILIA DO BAIRRO AGRICOLA,BAIRRO AGRICOLA,S/N,BAIRRO AGRICOLA,"BAIRRO AGRICOLA, BAIRRO AGRICOLA, RIBEIRA DO POMBAL, BA, BRASIL",,,,
BA,RIBEIRA DO POMBAL,UNIDADE SATELITE DO NOVO SEGREDO,POVOADO CURRAL FALSO,S/N,ZONA RURAL,"POVOADO CURRAL FALSO, ZONA RURAL, RIBEIRA DO POMBAL, BA, BRASIL",,,,
BA,RIBEIRA DO POMBAL,UNIDADE DE SAUDE DA FAMILIA DO POVOADO MOCO,POVOADO MOCO,S/N,POVOADO MOCO,"POVOADO MOCO, POVOADO MOCO, RIBEIRA DO POMBAL, BA, BRASIL",,,,
BA,RIBEIRA DO POMBAL,UNIDADE DE SAUDE DA FAMILIA DO POVOADO POCO,POVOADO POCO,S/N,POCO,"POVOADO POCO, POCO, RIBEIRA DO POMBAL, BA, BRASIL",,,,
BA,RIBEIRA DO POMBAL,CENTRO DE SAUDE DE RIBEIRA DO POMBAL,RUA JOAO XXIII,S/N,CENTRO,"RUA JOAO XXIII, CENTRO, RIBEIRA DO POMBAL, BA, BRASIL",,,,
BA,RIBEIRA DO POMBAL,UNIDADE DE SAUDE DA FAMILIA DO POVOADO PEDRA,POVOADO PEDRA,S/N,ZONA RURAL,"POVOADO PEDRA, ZONA RURAL, RIBEIRA DO POMBAL, BA, BRASIL",,,,
BA,RIBEIRAO DO LARGO,ESF ALVARO SIMOES DE OLIVEIRA JUNIOR,FAZ COPACABANA,2,ZONA RURAL,"FAZ COPACABANA, ZONA RURAL, RIBEIRAO DO LARGO, BA, BRASIL",,,,
BA,RIBEIRAO DO LARGO,ESF JOAQUIM CAETANO DOS SANTOS,AVENIDA AQUILINO JOSE DIAS,196,CENTRO,"AVENIDA AQUILINO JOSE DIAS, CENTRO, RIBEIRAO DO LARGO, BA, BRASIL",,,,
BA,RIBEIRAO DO LARGO,ESF RAMIRO POWEIRO DA SILVA,FAZ CACHOEIRA,2,ZONA RURAL,"FAZ CACHOEIRA, ZONA RURAL, RIBEIRAO DO LARGO, BA, BRASIL",,,,
BA,RIBEIRAO DO LARGO,CENTRO DE SAUDE ADELINO FERNANDES DE OLIVEIRA,RUA ANTONIO AQUINO DE CARVALHO,1,CENTRO,"RUA ANTONIO AQUINO DE CARVALHO, CENTRO, RIBEIRAO DO LARGO, BA, BRASIL",,,,
BA,RIBEIRAO DO LARGO,ESF PRUDENCIO SANTOS,RUA ANTONIO AQUINO DE CARVALHO,216,CENTRO,"RUA ANTONIO AQUINO DE CARVALHO, CENTRO, RIBEIRAO DO LARGO, BA, BRASIL",,,,
BA,RIO DE CONTAS,POSTO DE SAUDE DE LAGOA DAS BARAUNAS,POVOADO LAGOA DAS BARAUNAS,S/N,RURAL,"POVOADO LAGOA DAS BARAUNAS, RURAL, RIO DE CONTAS, BA, BRASIL",,,,
BA,RIO DE CONTAS,NASF RIO DE CONTAS,PRACA DA MATRIZ,S/N,CENTRO,"PRACA DA MATRIZ, CENTRO, RIO DE CONTAS, BA, BRASIL",,,,
BA,RIO DE CONTAS,UNIDADE DE SAUDE DA FAMILIA DO VERMELHAO,RUA ALTO DO CRUZEIRO,525,VERMELHAO,"RUA ALTO DO CRUZEIRO, VERMELHAO, RIO DE CONTAS, BA, BRASIL",,,,
BA,RIO DE CONTAS,CENTRO DE SAUDE E PSF DA SEDE,PRACA DA MATRIZ,S/N,CENTRO,"PRACA DA MATRIZ, CENTRO, RIO DE CONTAS, BA, BRASIL",,,,
BA,RIO DE CONTAS,POSTO DE SAUDE DE UMBUZEIRO DOS SANTOS,POVOADO UMBUZEIRO DOS SANTOS,S/N,RURAL,"POVOADO UMBUZEIRO DOS SANTOS, RURAL, RIO DE CONTAS, BA, BRASIL",,,,
BA,RIO DE CONTAS,UNIDADE DE SAUDE DA FAMILIA DE MARCOLINO MOURA,RUA FRANCISCO SANTOS,S/N,RURAL,"RUA FRANCISCO SANTOS, RURAL, RIO DE CONTAS, BA, BRASIL",,,,
BA,RIO DE CONTAS,POSTO DE SAUDE DE ENGENHO VELHO,POVOADO DE ENGENHO VELHO,S/N,ZONA RURAL,"POVOADO DE ENGENHO VELHO, ZONA RURAL, RIO DE CONTAS, BA, BRASIL",,,,
BA,RIO DE CONTAS,UNIDADE DE SAUDE DA FAMILIA DE MATO GROSSO,POVOADO MATO GROSSO,S/N,RURAL,"POVOADO MATO GROSSO, RURAL, RIO DE CONTAS, BA, BRASIL",,,,
BA,RIO DE CONTAS,POSTO DE SAUDE DE TAMANDUA,POVOADO DE TAMANDUA,S/N,RURAL,"POVOADO DE TAMANDUA, RURAL, RIO DE CONTAS, BA, BRASIL",,,,
BA,RIO DE CONTAS,POSTO DE SAUDE DE BOA SENTENCA,POVOADO BOA SENTENCA,S/N,RURAL,"POVOADO BOA SENTENCA, RURAL, RIO DE CONTAS, BA, BRASIL",,,,
BA,RIO DE CONTAS,UNIDADE DE SAUDE DA FAMILIA DE ARAPIRANGA,DISTRITO DE ARAPIRANGA,S/N,RURAL,"DISTRITO DE ARAPIRANGA, RURAL, RIO DE CONTAS, BA, BRASIL",,,,
BA,RIO DE CONTAS,POSTO DE SAUDE DO GILO,POVOADO GILO,S/N,RURAL,"POVOADO GILO, RURAL, RIO DE CONTAS, BA, BRASIL",,,,
BA,RIO DE CONTAS,POSTO DE SAUDE DE CASA DE TELHA,POVOADO CASA DE TELHA,S/N,RURAL,"POVOADO CASA DE TELHA, RURAL, RIO DE CONTAS, BA, BRASIL",,,,
BA,RIO DE CONTAS,POSTO DE SAUDE DA BARRA,POVOADO BARRA,S/N,RURAL,"POVOADO BARRA, RURAL, RIO DE CONTAS, BA, BRASIL",,,,
BA,RIO DE CONTAS,UNIDADE DE SAUDE DA FAMILIA DE JOAO VAZ,RUA JOANA ANGELICA JOAO VAZ,2,ZONA RURAL,"RUA JOANA ANGELICA JOAO VAZ, ZONA RURAL, RIO DE CONTAS, BA, BRASIL",,,,
BA,RIO DO ANTONIO,U S F IBITIRA I,RUA DO CAMPO DISTRITO DE IBITIRA,S/N,ZONA RURAL,"RUA DO CAMPO DISTRITO DE IBITIRA, ZONA RURAL, RIO DO ANTONIO, BA, BRASIL",,,,
BA,RIO DO ANTONIO,U S F ANA ROSA GOMES,AV AULINO SILVA,S/N,CENTRO,"AV AULINO SILVA, CENTRO, RIO DO ANTONIO, BA, BRASIL",,,,
BA,RIO DO ANTONIO,U S F BANDEIRA,POVOADO DE BANDEIRA,S/N,ZONA RURAL,"POVOADO DE BANDEIRA, ZONA RURAL, RIO DO ANTONIO, BA, BRASIL",,,,
BA,RIO DO ANTONIO,U S F SAO JOSE,RUA MANOEL CANDIDO SILVEIRA DISTRITO DE IBITIRA,S/N,ZONA RURAL,"RUA MANOEL CANDIDO SILVEIRA DISTRITO DE IBITIRA, ZONA RURAL, RIO DO ANTONIO, BA, BRASIL",,,,
BA,RIO DO ANTONIO,UBS ALIPIO SERGIO CARLOS GARCIA,RUA NOSSA SENHORA DAS GRACAS,S/N,UMBUZEIRO,"RUA NOSSA SENHORA DAS GRACAS, UMBUZEIRO, RIO DO ANTONIO, BA, BRASIL",,,,
BA,RIO DO ANTONIO,U S F UMBAUBA,POVOADO DE UMBAUBA,S/N,ZONA RURAL,"POVOADO DE UMBAUBA, ZONA RURAL, RIO DO ANTONIO, BA, BRASIL",,,,
BA,RIO DO PIRES,UNIDADE BASICA DE SAUDE DA SEDE 4,RUA TIBERIO NEVES,S/N,CENTRO,"RUA TIBERIO NEVES, CENTRO, RIO DO PIRES, BA, BRASIL",,,,
BA,RIO DO PIRES,POSTO SAUDE DE CACHOEIRA,POV DE CACHOEIRA,S/N,ZONA RURAL,"POV DE CACHOEIRA, ZONA RURAL, RIO DO PIRES, BA, BRASIL",,,,
BA,RIO DO PIRES,UNIDADE DE SAUDE DA FAMILIA DE VARZINHA,POVOADO DE VARZINHA,S/N,ZONA RURAL,"POVOADO DE VARZINHA, ZONA RURAL, RIO DO PIRES, BA, BRASIL",,,,
