UF,MUNICIPIO,ESTABELECIMENTO,LOGRADOURO,NUMERO,BAIRRO,ENDERECO_COMPLETO,latitude,longitude,address,point
BA,ABAIRA,UNIDADE DE SAUDE DA FAMILIA SEDE II,AVENIDA CARLITO COSTA,S/N,CENTRO,"AVENIDA CARLITO COSTA, CENTRO, ABAIRA, BA, BRASIL",-13.251120000000002,-41.66006,"Avenida Carlito Moreira, 46690-000, Abaíra","13 15m 4.032s S, 41 39m 36.216s W"
BA,ABAIRA,UNIDADE DE SAUDE DA FAMILIA DE OURO VERDE,PCA ANTONIO CARLOS MAGALHAES,18,POV OURO VERDE,"PCA ANTONIO CARLOS MAGALHAES, POV OURO VERDE, ABAIRA, BA, BRASIL",-16.575879999999998,-39.56226,"Praça Antônio Carlos Magalhães, Itabela","16 34m 33.168s S, 39 33m 44.136s W"
BA,ABAIRA,CENTRO DE SAUDE DE ABAIRA,PCA JOAO HIPOLITO RODRIGUES,15,MOREIRA,"PCA JOAO HIPOLITO RODRIGUES, MOREIRA, ABAIRA, BA, BRASIL",-13.25143,-41.66515,"Praça João Hipólito Rodrigues, 46690-000, Abaíra","13 15m 5.148s S, 41 39m 54.54s W"
BA,ABAIRA,UNIDADE DE SAUDE DA FAMILIA DE ABAIRA,PRACA JOAO HIPOLITO RODRIGUES,S/N,CENTRO,"PRACA JOAO HIPOLITO RODRIGUES, CENTRO, ABAIRA, BA, BRASIL",-13.25143,-41.66515,"Praça João Hipólito Rodrigues, 46690-000, Abaíra","13 15m 5.148s S, 41 39m 54.54s W"
BA,ABAIRA,UNIDADE DE SAUDE DA FAMILIA DE CATOLES,RUA DO COLEGIO,S/N,DISTRITO DE CATOLES,"RUA DO COLEGIO, DISTRITO DE CATOLES, ABAIRA, BA, BRASIL",-13.25149,-41.66766,"Rua do Colégio, 46690-000, Abaíra","13 15m 5.364s S, 41 40m 3.576s W"
BA,ABARE,UNIDADE DE SAUDE DA FAMILIA SAO FRANCISCO,AGROVILA 16,100,PROJETO PEDRA BRANCA,"AGROVILA 16, PROJETO PEDRA BRANCA, ABARE, BA, BRASIL",-12.90636,-38.4315,"Acesso 2 Projeto Pesquisa Etpiii, 16, 41321, Salvador","12 54m 22.896s S, 38 25m 53.4s W"
BA,ABARE,UNIDADE DE SAUDE INDIGENA TUMBALALA,ALDEIA NOSSA SENHORA DA CONCEICAO DO PAMPU,100,ZONA RURAL,"ALDEIA NOSSA SENHORA DA CONCEICAO DO PAMPU, ZONA RURAL, ABARE, BA, BRASIL",-11.56363,-39.28493,"Rua Nossa Senhora da Conceição, 48730-000, Conceição do Coité","11 33m 49.068s S, 39 17m 5.748s W"
BA,ABARE,UNIDADE DE SAUDE DA FAMILIA IRMA DULCE,DISTRITO DE IBO,100,ZONA RURAL,"DISTRITO DE IBO, ZONA RURAL, ABARE, BA, BRASIL",-12.41631,-41.78971,"Estrada Vicinal Para Tenda Zona Rural, Seabra","12 24m 58.716s S, 41 47m 22.956s W"
BA,ABARE,UNIDADE DE SAUDE DA FAMILIA UMBUZEIRO,POVOADO UMBUZEIRO,100,ZONA RURAL,"POVOADO UMBUZEIRO, ZONA RURAL, ABARE, BA, BRASIL",-12.41631,-41.78971,"Estrada Vicinal Para Tenda Zona Rural, Seabra","12 24m 58.716s S, 41 47m 22.956s W"
BA,ABARE,UNIDADE DE SAUDE DA FAMILIA NOSSA SENHORA APARECIDA,RUA DO ALTO,12,NOSSA SRA APARECIDA,"RUA DO ALTO, NOSSA SRA APARECIDA, ABARE, BA, BRASIL",-29.10029,-53.21447,"Rua Nossa Senhora Aparecida, 99440-000, Salto do Jacuí","29 6m 1.044s S, 53 12m 52.092s W"
BA,ABARE,UNIDADE DE SAUDE DA FAMILIA JOSINO SOARES DA SILVA,POV ICOZEIRA,100,ZONA RURAL,"POV ICOZEIRA, ZONA RURAL, ABARE, BA, BRASIL",-12.41631,-41.78971,"Estrada Vicinal Para Tenda Zona Rural, Seabra","12 24m 58.716s S, 41 47m 22.956s W"
BA,ABARE,UNIDADE DE SAUDE DA FAMILIA SANTO ANTONIO,RUA JOSINA NEUMA PEREIRA DE CERQUEIRA,S/N,CENTRO,"RUA JOSINA NEUMA PEREIRA DE CERQUEIRA, CENTRO, ABARE, BA, BRASIL",-8.72777,-39.11304000000001,"Rua Josina Neuma Pereira de Cerqueira, 48680-000, Abaré","8 43m 39.972s S, 39 6m 46.944s W"
BA,ABARE,UNIDADE DE SAUDE DA FAMILIA SAO JOSE,RUA DA PAZ,0,DISTRITO DE IBO,"RUA DA PAZ, DISTRITO DE IBO, ABARE, BA, BRASIL",-8.63415,-39.25189,"Travessa Rua da Paz D1, 48680, 48685, Abaré","8 38m 2.94s S, 39 15m 6.804s W"
BA,ACAJUTIBA,UNIDADE DE SAUDE DA FAMILIA DO CRUZEIRO,RUA SEVERINO VIEIRA,S/N,CENTRO,"RUA SEVERINO VIEIRA, CENTRO, ACAJUTIBA, BA, BRASIL",-11.66864,-38.02248,"Rua Severino Vieira, 48360-000, Acajutiba","11 40m 7.104s S, 38 1m 20.928s W"
BA,ACAJUTIBA,UNIDADE DE SAUDE DA FAMILIA DA RODAGEM,RUA SATURNINO DE MENEZES,S/N,CENTRO,"RUA SATURNINO DE MENEZES, CENTRO, ACAJUTIBA, BA, BRASIL",-11.66088,-38.01897,"Rua Saturnino de Menezes, 48360, Acajutiba","11 39m 39.168s S, 38 1m 8.292s W"
BA,ACAJUTIBA,CENTRO DE SAUDE DR WALDIR PIRES,PRACA BOSQUE DA SAUDADE,S/N,CENTRO,"PRACA BOSQUE DA SAUDADE, CENTRO, ACAJUTIBA, BA, BRASIL",-11.65892,-38.02147,"Praça Bosque da Saudade, 48360-000, Acajutiba","11 39m 32.112s S, 38 1m 17.292s W"
BA,ACAJUTIBA,UNIDADE DE SAUDE DA FAMILIA DE SACO DO ROCHA,DISTRITO SACO DO ROCHA,0,SACO DO ROCHA,"DISTRITO SACO DO ROCHA, SACO DO ROCHA, ACAJUTIBA, BA, BRASIL",-11.67916,-38.00677,"Rua do Saco do Rocha, 48360-000, Acajutiba","11 40m 44.976s S, 38 0m 24.372s W"
BA,ACAJUTIBA,UNIDADE DE SAUDE DA FAMILIA DE MARAMBAIA,AVENIDA MARAMBAIA,31,CENTRO,"AVENIDA MARAMBAIA, CENTRO, ACAJUTIBA, BA, BRASIL",-11.66019,-38.0647,"Avenida Acajutiba & Rua Marambaia, 48350, Aporá","11 39m 36.684s S, 38 3m 52.92s W"
BA,ACAJUTIBA,UNIDADE DE SAUDE DA FAMILIA DA BEDO FERREIRA BRITO,RUA BEDO FERREIRA BRITO,S/N,BOA VISTA,"RUA BEDO FERREIRA BRITO, BOA VISTA, ACAJUTIBA, BA, BRASIL",-11.65361,-38.00396,"Rua Bedo Ferreira Brito, 48360-000, Acajutiba","11 39m 12.996s S, 38 0m 14.256s W"
BA,ACAJUTIBA,UNIDADE DE SAUDE DA FAMILIA DA SEDE,PRACA BOSQUE DA SAUDADE,S/N,CENTRO,"PRACA BOSQUE DA SAUDADE, CENTRO, ACAJUTIBA, BA, BRASIL",-11.65892,-38.02147,"Praça Bosque da Saudade, 48360-000, Acajutiba","11 39m 32.112s S, 38 1m 17.292s W"
BA,ADUSTINA,U S F SAO FRANCISCO,POVOADO SAO FRANCISCO,S/N,ZONA RURAL,"POVOADO SAO FRANCISCO, ZONA RURAL, ADUSTINA, BA, BRASIL",-12.34402,-38.7912,"Estrada para Povoado de São Francisco, 44245-000, Conceição do Jacuípe","12 20m 38.472s S, 38 47m 28.32s W"
BA,ADUSTINA,SEDE II,JOSE CARLOS ALELUIA,199,CENTRO,"JOSE CARLOS ALELUIA, CENTRO, ADUSTINA, BA, BRASIL",-10.53828,-38.11058,"Rua José Carlos Aleluia, Adustina","10 32m 17.808s S, 38 6m 38.088s W"
BA,ADUSTINA,POSTO DE SAUDE POVOADO JUREMA,POVOADO JUREMA,S/N,ZONA RURAL,"POVOADO JUREMA, ZONA RURAL, ADUSTINA, BA, BRASIL",-12.41631,-41.78971,"Estrada Vicinal Para Tenda Zona Rural, Seabra","12 24m 58.716s S, 41 47m 22.956s W"
BA,ADUSTINA,U S F SEDE I E II,RUA PEDRO LINS BARRETO,S/N,ZONA URBANA,"RUA PEDRO LINS BARRETO, ZONA URBANA, ADUSTINA, BA, BRASIL",-10.53248,-38.11687,"Rua Pedro Lins Barreto, 48435-000, Adustina","10 31m 56.928s S, 38 7m 0.732s W"
BA,ADUSTINA,POSTO DE SAUDE SITIO DA CONCEICAO,POVOADO SITIO DA CONCEICAO,S/N,ZONA RURAL,"POVOADO SITIO DA CONCEICAO, ZONA RURAL, ADUSTINA, BA, BRASIL",-12.50835,-39.00554,"Rua do Sítio Sobrado, 44320-000, Conceição da Feira","12 30m 30.06s S, 39 0m 19.944s W"
BA,ADUSTINA,UNIDADE MISTA HOSPITALAR MARIA DOS SANTOS ALMEIDA,RUA JOAO CORREIA NETO,235,CENTRO,"RUA JOAO CORREIA NETO, CENTRO, ADUSTINA, BA, BRASIL",-10.53553,-38.11692,"Rua João Corrêa Neto, 48435-000, Adustina","10 32m 7.908s S, 38 7m 0.912s W"
BA,ADUSTINA,U S F POVOADO JOAO GRANDE,POVOADO JOAO GRANDE,S/N,ZONA RURAL,"POVOADO JOAO GRANDE, ZONA RURAL, ADUSTINA, BA, BRASIL",-12.41631,-41.78971,"Estrada Vicinal Para Tenda Zona Rural, Seabra","12 24m 58.716s S, 41 47m 22.956s W"
BA,ADUSTINA,U S F BOM JESUS,POVOADO BOM JESUS,S/N,ZONA RURAL,"POVOADO BOM JESUS, ZONA RURAL, ADUSTINA, BA, BRASIL",-13.25549,-43.42055,Bom Jesus da Lapa,"13 15m 19.764s S, 43 25m 13.98s W"
BA,AGUA FRIA,UNIDADE DE SAUDE DA FAMILIA DE MARACAIA,POVOADO MARACAIA,S/N,ZONA RURAL,"POVOADO MARACAIA, ZONA RURAL, AGUA FRIA, BA, BRASIL",-11.86733,-38.7675,Água Fria,"11 52m 2.388s S, 38 46m 3s W"
BA,AGUA FRIA,UNIDADE DE SAUDE DA FAMILIA ASSENTAMENTO MENINO JESUS,ASSENTAMENTO MENINO JESUS,S/N,ZONA RURAL,"ASSENTAMENTO MENINO JESUS, ZONA RURAL, AGUA FRIA, BA, BRASIL",-11.87144,-38.76447,"Rua Damião de Jesus Barreto, 48170-000, Água Fria","11 52m 17.184s S, 38 45m 52.092s W"
BA,AGUA FRIA,UNIDADE DE SAUDE DA FAMILIA DE CATANA,POVOADO DO CATANA,S/N,ZONA RURAL,"POVOADO DO CATANA, ZONA RURAL, AGUA FRIA, BA, BRASIL",-14.86829,-40.57781,"Travessa Água Fria, 45120-000, Barra do Choça","14 52m 5.844s S, 40 34m 40.116s W"
BA,AGUA FRIA,UNIDADE DE SAUDE DA FAMILIA SEDE II,AV ESTELITA FALCAO,S/N,CENTRO,"AV ESTELITA FALCAO, CENTRO, AGUA FRIA, BA, BRASIL",-11.87133,-38.76208,"Avenida Estelita Falcão, 48170-959, Água Fria","11 52m 16.788s S, 38 45m 43.488s W"
BA,AGUA FRIA,UNIDADE DE SAUDE DA FAMILIA DE PATAIBA,POVOADO PATAIBA,S/N,ZONA RURAL,"POVOADO PATAIBA, ZONA RURAL, AGUA FRIA, BA, BRASIL",-11.6962,-38.74203,"Pataíba, Água Fria","11 41m 46.32s S, 38 44m 31.308s W"
BA,AGUA FRIA,USF DAMIAO DE JESUS BARRETO,AV PATAIBA,S/N,CENTRO,"AV PATAIBA, CENTRO, AGUA FRIA, BA, BRASIL",-11.6962,-38.74203,"Pataíba, Água Fria","11 41m 46.32s S, 38 44m 31.308s W"
BA,AGUA FRIA,UNIDADE DE SAUDE DA FAMILIA DE BARRA,RUA OSCAR SANTANA,S/N,ZONA RURAL,"RUA OSCAR SANTANA, ZONA RURAL, AGUA FRIA, BA, BRASIL",-12.22552,-38.99499,"Rua Água Fria, 44090, Feira de Santana","12 13m 31.872s S, 38 59m 41.964s W"
BA,AIQUARA,UNIDADE DE SAUDE DA FAMILIA MARIA CERQUEIRA,RUA ANTONIO PEIXOTO,S/N,CENTRO,"RUA ANTONIO PEIXOTO, CENTRO, AIQUARA, BA, BRASIL",-14.03898,-39.83107,"Rua Antônio Peixoto, 45220-000, Aiquara","14 2m 20.328s S, 39 49m 51.852s W"
BA,AIQUARA,UNIDADE DE SAUDE DA FAMILIA HILDETE E LOMANTO,RUA FRANCISCO MOREIRA RIOS,S/N,CENTRO,"RUA FRANCISCO MOREIRA RIOS, CENTRO, AIQUARA, BA, BRASIL",-14.12936,-39.88853,"Rua Francisco Moreira Rios, 45220-000, Aiquara","14 7m 45.696s S, 39 53m 18.708s W"
BA,AIQUARA,HOSPITAL MUNICIPAL ANTONIO CARLOS MAGALHAES,RUA LOMANTO JUNIOR,50,CENTRO,"RUA LOMANTO JUNIOR, CENTRO, AIQUARA, BA, BRASIL",-14.12941,-39.88815,"Rua Lomanto Júnior, 45220-000, Aiquara","14 7m 45.876s S, 39 53m 17.34s W"
BA,ALAGOINHAS,UNIDADE DE SAUDE DA FAMILIA PETROLAR II,JARDIM PETROLAR,541,PETROLAR,"JARDIM PETROLAR, PETROLAR, ALAGOINHAS, BA, BRASIL",-12.1554145,-38.4177923,"Creche Jardim Petrolar (Não concluída), Avenida Minas Gerais, Jardim Petrolar, Alagoinhas, Região Geográfica Imediata de Alagoinhas, Região Geográfica Intermediária de Salvador, Bahia, Região Nordeste, 48005-444, Brasil","12 9m 19.4922s S, 38 25m 4.05228s W"
BA,ALAGOINHAS,UNIDADE DE SAUDE DA FAMILIA BOA UNIAO,PRACA MANOEL TEIXEIRA LEAL,S/N,BOA UNIAO,"PRACA MANOEL TEIXEIRA LEAL, BOA UNIAO, ALAGOINHAS, BA, BRASIL",-12.32466,-38.76156,"Praça Manoel Teixeira, 44245-000, Conceição do Jacuípe","12 19m 28.776s S, 38 45m 41.616s W"
BA,ALAGOINHAS,UNIDADE DE SAUDE DA FAMILIA 21 DE SETEMBRO,RUA JOAO LUCIO DE JESUS,S/N,21 DE SETEMBRO,"RUA JOAO LUCIO DE JESUS, 21 DE SETEMBRO, ALAGOINHAS, BA, BRASIL",-12.13379,-38.4345,"Rua João Lúcio de Jesus & Rua Vinte e Um de Setembro, 48070, Alagoinhas","12 8m 1.644s S, 38 26m 4.2s W"
BA,ALAGOINHAS,UNIDADE DE SAUDE DA FAMILIA PORTOES,FAZENDA PORTOES,1540,BOA UNIAO,"FAZENDA PORTOES, BOA UNIAO, ALAGOINHAS, BA, BRASIL",-12.84243,-38.28458,"Boa União, Camaçari","12 50m 32.748s S, 38 17m 4.488s W"
BA,ALAGOINHAS,UNIDADE DE SAUDE DA FAMILIA FLAVIO CAVALCANTE,AVENIDA MARECHAL ARISTOTELES DE SOUZA DANTAS,S/N,MANGALO,"AVENIDA MARECHAL ARISTOTELES DE SOUZA DANTAS, MANGALO, ALAGOINHAS, BA, BRASIL",-12.15063,-38.44346,"Rua Marechal Aristóteles Souza Dantas, 44280, Alagoinhas","12 9m 2.268s S, 38 26m 36.456s W"
BA,ALAGOINHAS,UNIDADE DE SAUDE DA FAMILIA RENOVACAO AVENIDA SILVA,RUA AVENIDA SILVA,S/N,SANTA TEREZINHA,"RUA AVENIDA SILVA, SANTA TEREZINHA, ALAGOINHAS, BA, BRASIL",-12.12085,-38.41931,"Rua Santa Terezinha, 48010-580, Alagoinhas","12 7m 15.06s S, 38 25m 9.516s W"
BA,ALAGOINHAS,UNIDADE DE SAUDE DA FAMILIA SANTO ANTONIO,RUA SANTO ANTONIO,99,TEREZOPOLIS,"RUA SANTO ANTONIO, TEREZOPOLIS, ALAGOINHAS, BA, BRASIL",-12.14069,-38.40292,"Rua Santo Antônio, Alagoinhas","12 8m 26.484s S, 38 24m 10.512s W"
BA,ALAGOINHAS,UNIDADE DE SAUDE DA FAMILIA PAU BRASIL,CONJUNTO ALAGOINHAS IV,S/N,ALAGOINHAS IV,"CONJUNTO ALAGOINHAS IV, ALAGOINHAS IV, ALAGOINHAS, BA, BRASIL",-12.13245,-38.40025,"Alameda 25 Conjunto Alagoinhas IV, 44280, Alagoinhas","12 7m 56.82s S, 38 24m 0.9s W"
BA,ALAGOINHAS,UNIDADE DE SAUDE DA FAMILIA MANGALO,RUA,1100,MANGALO,"RUA, MANGALO, ALAGOINHAS, BA, BRASIL",-12.1518006,-38.4445585,"Rua Do Mangalo, Mangalo, Alagoinhas, Região Geográfica Imediata de Alagoinhas, Região Geográfica Intermediária de Salvador, Bahia, Região Nordeste, 48040-320, Brasil","12 9m 6.48216s S, 38 26m 40.4106s W"
BA,ALAGOINHAS,UBS MAIZA TELES,LOTEAMENTO MORADA DO SOL,S/N,RUA DO CATU,"LOTEAMENTO MORADA DO SOL, RUA DO CATU, ALAGOINHAS, BA, BRASIL",-12.78712,-39.16906,"Rua do Loteamento Pôr do Sol, 44540-000, Conceição do Almeida","12 47m 13.632s S, 39 10m 8.616s W"
BA,ALAGOINHAS,UNIDADE DE SAUDE DA FAMILIA SAO JOSE OPERARIO PIRINEL,AVENIDA SILVA,S/N,SANTA TEREZINHA,"AVENIDA SILVA, SANTA TEREZINHA, ALAGOINHAS, BA, BRASIL",-12.1268061,-38.41809779999999,"Avenida Silva, Kennedy, Alagoinhas, Região Geográfica Imediata de Alagoinhas, Região Geográfica Intermediária de Salvador, Bahia, Região Nordeste, 48011-320, Brasil","12 7m 36.502s S, 38 25m 5.15208s W"
BA,ALAGOINHAS,UNIDADE DE SAUDE DA FAMILIA URBIS III,RUA L CONJ FREI LEAO,S/N,RUA DO CATU,"RUA L CONJ FREI LEAO, RUA DO CATU, ALAGOINHAS, BA, BRASIL",-12.11815,-38.42965,"Rua Q Conjunto Frei Leão Maroto, 44280, Alagoinhas","12 7m 5.34s S, 38 25m 46.74s W"
BA,ALAGOINHAS,UNIDADE DE SAUDE DA FAMILIA SAUIPE,BR 101,S/N,DISAI,"BR 101, DISAI, ALAGOINHAS, BA, BRASIL",-12.14821,-38.39563,"Rodovia BR-101, Alagoinhas","12 8m 53.556s S, 38 23m 44.268s W"
BA,ALAGOINHAS,UNIDADE DE SAUDE DA FAMILIA TAIZE,CONJUNTO ROMULO ALMEIDA,S/N,SANTA TEREZINHA,"CONJUNTO ROMULO ALMEIDA, SANTA TEREZINHA, ALAGOINHAS, BA, BRASIL",-12.1255,-38.40712,"Alameda J Conjunto Rômulo Almeida, 44280, Alagoinhas","12 7m 31.8s S, 38 24m 25.632s W"
BA,ALAGOINHAS,UNIDADE DE SAUDE DA FAMILIA SAO CRISTOVAO,RUA CRISTOVAO TEIXEIRA COSTA,154,SILVA JARDIM,"RUA CRISTOVAO TEIXEIRA COSTA, SILVA JARDIM, ALAGOINHAS, BA, BRASIL",-12.1405,-38.43387,"Rua Cristóvão Teixeira da Costa, 44280, Alagoinhas","12 8m 25.8s S, 38 26m 1.932s W"
BA,ALAGOINHAS,UNIDADE DE SAUDE DA FAMILIA SAGRADA FAMILIA MANGALO,RUA SAO LUIZ,647,MANGALO,"RUA SAO LUIZ, MANGALO, ALAGOINHAS, BA, BRASIL",-12.1487,-38.45474,"Rua São Luiz, 44280, Alagoinhas","12 8m 55.32s S, 38 27m 17.064s W"
BA,ALAGOINHAS,UNIDADE DE SAUDE DA FAMILIA PROSAUDE BARREIRO,RUA DO AVIAO,S/N,BARREIRO,"RUA DO AVIAO, BARREIRO, ALAGOINHAS, BA, BRASIL",-12.138080699999998,-38.443902,"Rua Do Avião, Parque Vitoria, Alagoinhas, Região Geográfica Imediata de Alagoinhas, Região Geográfica Intermediária de Salvador, Bahia, Região Nordeste, 48040-320, Brasil","12 8m 17.0905s S, 38 26m 38.0472s W"
BA,ALAGOINHAS,UNIDADE DE SAUDE DA FAMILIA JARDIM PETROLAR,RUA BRASIL QUADRA C,S/N,JARDIM PETROLAR,"RUA BRASIL QUADRA C, JARDIM PETROLAR, ALAGOINHAS, BA, BRASIL",-12.13928,-38.39972,"Rua 6 Conjunto Jardim Imperial II, 48030-280, Alagoinhas","12 8m 21.408s S, 38 23m 58.992s W"
BA,ALAGOINHAS,UNIDADE DE SAUDE DA FAMILIA DISAI,RUA DISAI,15,CENTRO,"RUA DISAI, CENTRO, ALAGOINHAS, BA, BRASIL",-12.70699,-38.31993,"Rua C de Centro Administrativo, 42800, 42801, 42809, Camaçari","12 42m 25.164s S, 38 19m 11.748s W"
BA,ALAGOINHAS,UNIDADE DE SAUDE DA FAMILIA PRACA KENNEDY,CONJUNTO ROMULO ALMEIDA,S/N,PRACA KENNEDY,"CONJUNTO ROMULO ALMEIDA, PRACA KENNEDY, ALAGOINHAS, BA, BRASIL",-12.1255,-38.40712,"Alameda J Conjunto Rômulo Almeida, 44280, Alagoinhas","12 7m 31.8s S, 38 24m 25.632s W"
BA,ALAGOINHAS,UNIDADE DE SAUDE DA FAMILIA ESTEVAO,PRACA BASILINO RUFINO,S/N,ESTEVAO,"PRACA BASILINO RUFINO, ESTEVAO, ALAGOINHAS, BA, BRASIL",-12.18484,-38.36079,"Praça Basílio Rufino dos Santos, 44280, Alagoinhas","12 11m 5.424s S, 38 21m 38.844s W"
BA,ALAGOINHAS,UNIDADE DE SAUDE DA FAMILIA NARANDIBA,RUA DIRETA DISTRITO DE NARANDIBA,S/N,NARANDIBA,"RUA DIRETA DISTRITO DE NARANDIBA, NARANDIBA, ALAGOINHAS, BA, BRASIL",-12.95894,-38.45069,"Travessa São Domingos de Narandiba, 41192, 48107, Salvador","12 57m 32.184s S, 38 27m 2.484s W"
BA,ALAGOINHAS,UNIDADE DE SAUDE DA FAMILIA RIACHO DA GUIA,RUA SAGRADA FAMILIA,S/N,RIACHO DA GUIA,"RUA SAGRADA FAMILIA, RIACHO DA GUIA, ALAGOINHAS, BA, BRASIL",-12.87073,-38.34035,"Rua Riacho da Guia, 42719-870, Lauro de Freitas","12 52m 14.628s S, 38 20m 25.26s W"
BA,ALAGOINHAS,UNIDADE DE SAUDE DA FAMILIA NOSSA SENHORA DE FATIMA,RUA 14 DE JANEIRO,138,PRACA SANTA ISABEL,"RUA 14 DE JANEIRO, PRACA SANTA ISABEL, ALAGOINHAS, BA, BRASIL",-12.14497,-38.43267,"Praça Santa Isabel & Rua Primeiro de Janeiro, 48050, Alagoinhas","12 8m 41.892s S, 38 25m 57.612s W"
BA,ALAGOINHAS,UNIDADE DE SAUDE DA FAMILIA NOVA BRASILIA,RUA 21 DE SETEMBRO,S/N,NOVA BRASILIA,"RUA 21 DE SETEMBRO, NOVA BRASILIA, ALAGOINHAS, BA, BRASIL",-12.12873,-38.44654,"Rua Nova Brasília & Rua Vinte e Um de Setembro, 48071, Alagoinhas","12 7m 43.428s S, 38 26m 47.544s W"
BA,ALAGOINHAS,UNIDADE DE SAUDE DA FAMILIA NOVA REPUBLICA,RUA SAO IZIDORIO,S/N,SANTA TEREZINHA,"RUA SAO IZIDORIO, SANTA TEREZINHA, ALAGOINHAS, BA, BRASIL",-12.12159,-38.41913,"Rua São Bento & Rua Santa Terezinha, 44280, Alagoinhas","12 7m 17.724s S, 38 25m 8.868s W"
BA,ALAGOINHAS,UNIDADE DE SAUDE DA FAMILIA NOVA ESPERANCA,JARDIM PETROLAR,541,JARDIM PETROLAR,"JARDIM PETROLAR, JARDIM PETROLAR, ALAGOINHAS, BA, BRASIL",-12.1554145,-38.4177923,"Creche Jardim Petrolar (Não concluída), Avenida Minas Gerais, Jardim Petrolar, Alagoinhas, Região Geográfica Imediata de Alagoinhas, Região Geográfica Intermediária de Salvador, Bahia, Região Nordeste, 48005-444, Brasil","12 9m 19.4922s S, 38 25m 4.05228s W"
BA,ALAGOINHAS,UNIDADE DE SAUDE DA FAMILIA MIGUEL VELHO,RUA GAUDENCIO DE SOUZA NUNES,10,MIGUEL VELHO,"RUA GAUDENCIO DE SOUZA NUNES, MIGUEL VELHO, ALAGOINHAS, BA, BRASIL",-23.88564,-47.99666,"Rua Benedito Antônio de Souza, 18230-000, São Miguel Arcanjo","23 53m 8.304s S, 47 59m 47.976s W"
BA,ALAGOINHAS,UNIDADE DE SAUDE DA FAMILIA ALAGOINHAS IV,CONJUNTO ALAGOINHAS IV,S/N,ALAGOINHAS IV,"CONJUNTO ALAGOINHAS IV, ALAGOINHAS IV, ALAGOINHAS, BA, BRASIL",-12.13245,-38.40025,"Alameda 25 Conjunto Alagoinhas IV, 44280, Alagoinhas","12 7m 56.82s S, 38 24m 0.9s W"
BA,ALAGOINHAS,UNIDADE DE SAUDE DA FAMILIA BAIXA DA SANTINHA,BAIXA DA SANTINHA,S/N,CENTRO,"BAIXA DA SANTINHA, CENTRO, ALAGOINHAS, BA, BRASIL",-12.12249,-38.4397,"Travessa Baixa da Santinha, 48080-110, Alagoinhas","12 7m 20.964s S, 38 26m 22.92s W"
BA,ALAGOINHAS,UNIDADE DE SAUDE DA FAMILIA ZONA RURAL,TRAVESSA MARECHAL DEODORO,36,CENTRO,"TRAVESSA MARECHAL DEODORO, CENTRO, ALAGOINHAS, BA, BRASIL",-12.1411536,-38.4196495,"Terceira Travessa Marechal Deodoro, Centro, Alagoinhas, Região Geográfica Imediata de Alagoinhas, Região Geográfica Intermediária de Salvador, Bahia, Região Nordeste, 48005-010, Brasil","12 8m 28.153s S, 38 25m 10.7382s W"
BA,ALAGOINHAS,UNIDADE DE SAUDE DA FAMILIA ALAGOINHAS VELHA,RUA DO TERMINAL RODOVIARIO,S/N,CENTRO,"RUA DO TERMINAL RODOVIARIO, CENTRO, ALAGOINHAS, BA, BRASIL",-12.1484,-38.40067,"Rua do Terminal Rodoviário, Alagoinhas","12 8m 54.24s S, 38 24m 2.412s W"
BA,ALAGOINHAS,UNIDADE DE SAUDE DA FAMILIA LIRIO DOS VALES,RUA SAO SEBASTIAO,219,BARREIRO,"RUA SAO SEBASTIAO, BARREIRO, ALAGOINHAS, BA, BRASIL",-12.1321745,-38.4437716,"Rua São Sebastião, Parque Vitoria, Alagoinhas, Região Geográfica Imediata de Alagoinhas, Região Geográfica Intermediária de Salvador, Bahia, Região Nordeste, 48040-320, Brasil","12 7m 55.8282s S, 38 26m 37.5778s W"
BA,ALAGOINHAS,UNIDADE DE SAUDE DA FAMILIA SANTA TEREZINHA,2 TRAVESSA SAO IZIDORIO,S/N,SANTA TEREZINHA,"2 TRAVESSA SAO IZIDORIO, SANTA TEREZINHA, ALAGOINHAS, BA, BRASIL",-12.1205,-38.42249,"Quarta Travessa Santa Terezinha, 2, 44280, Alagoinhas","12 7m 13.8s S, 38 25m 20.964s W"
BA,ALAGOINHAS,UNIDADE DE SAUDE DA FAMILIA ALAGOINHAS VELHA II,RUA DOMINGOS BARBOSA,154,CENTRO,"RUA DOMINGOS BARBOSA, CENTRO, ALAGOINHAS, BA, BRASIL",-12.25281,-38.95864,"Rua Domingos Barbosa de Araújo, 44001, Feira de Santana","12 15m 10.116s S, 38 57m 31.104s W"
BA,ALCOBACA,PSF TAQUARI,TAQUARI,1,TAQUARI,"TAQUARI, TAQUARI, ALCOBACA, BA, BRASIL",-17.655680899999997,-39.4369795,"Praça Taquari, Taquari, Caravelas, Região Geográfica Imediata de Teixeira de Freitas, Região Geográfica Intermediária de Ilhéus-Itabuna, Bahia, Região Nordeste, Brasil","17 39m 20.4512s S, 39 26m 13.1262s W"
BA,ALCOBACA,PSF CANTA GALO,AVENIDA PRINCIPAL,S/N,CANTA GALO,"AVENIDA PRINCIPAL, CANTA GALO, ALCOBACA, BA, BRASIL",-16.366120000000002,-39.57602,"Rua Canta Galo, 45828-189, Eunápolis","16 21m 58.032s S, 39 34m 33.672s W"
BA,ALCOBACA,PSF SEDE 01,RUA PEDRO MUNIZ,81,CENTRO,"RUA PEDRO MUNIZ, CENTRO, ALCOBACA, BA, BRASIL",-17.53956,-39.1927,"Rua Pedro Muniz, 45910-000, Alcobaça","17 32m 22.416s S, 39 11m 33.72s W"
BA,ALCOBACA,PSF CAXANGA,RODOVIA ALCOBACA TEIXEIRA DE FREITAS,S/N,CAXANGA,"RODOVIA ALCOBACA TEIXEIRA DE FREITAS, CAXANGA, ALCOBACA, BA, BRASIL",-17.52215,-39.69887,"Rodovia Teixeira de Freitas Alcobaça, 45998-000, Teixeira de Freitas","17 31m 19.74s S, 39 41m 55.932s W"
BA,ALCOBACA,PSF SEDE 02,RUA DO ROBALO,207,FAROL,"RUA DO ROBALO, FAROL, ALCOBACA, BA, BRASIL",-17.51575,-39.19502,"Rua do Robalo, 45910-000, Alcobaça","17 30m 56.7s S, 39 11m 42.072s W"
BA,ALCOBACA,PSF SAO JOSE,AVENIDA ITANHEM,S/N,SAO JOSE,"AVENIDA ITANHEM, SAO JOSE, ALCOBACA, BA, BRASIL",-17.16674,-40.33118,"Rua Alcobaça & Rua São José, 45970, Itanhém","17 10m 0.264s S, 40 19m 52.248s W"
BA,ALCOBACA,PSF PROJETO 4045,PRACA SETE DE SETEMBRO,S/N,PROJETO 4045,"PRACA SETE DE SETEMBRO, PROJETO 4045, ALCOBACA, BA, BRASIL",-17.536379999999998,-39.72485,"Praça Sete de Setembro, Teixeira de Freitas","17 32m 10.968s S, 39 43m 29.46s W"
BA,ALCOBACA,PSF POUSO ALEGRE,RUA PRINCIPAL,S/N,POUSO ALEGRE,"RUA PRINCIPAL, POUSO ALEGRE, ALCOBACA, BA, BRASIL",-17.4122931,-39.5989105,"Rua Principal, Arraial Pouso Alegre, São José, Alcobaça, Região Geográfica Imediata de Teixeira de Freitas, Região Geográfica Intermediária de Ilhéus-Itabuna, Bahia, Região Nordeste, Brasil","17 24m 44.2552s S, 39 35m 56.0778s W"
BA,ALCOBACA,PSF SEDE 08,RUA MINAS GERAIS,S/N,PALMEIRAS,"RUA MINAS GERAIS, PALMEIRAS, ALCOBACA, BA, BRASIL",-17.52551,-39.19599,"Rua 8 Ltm Palmeiras & Avenida Minas Gerais, 45910, Alcobaça","17 31m 31.836s S, 39 11m 45.564s W"
BA,ALMADINA,USF ANTONIO SOARES LOPES,RUA FERNANDO BARROS,25,CENTRO,"RUA FERNANDO BARROS, CENTRO, ALMADINA, BA, BRASIL",-14.70488,-39.635,"Rua Fernando Barros, 45640-000, Almadina","14 42m 17.568s S, 39 38m 6s W"
BA,ALMADINA,POSTO DE SAUDE MARIA RAIMUNDA LIMA SOUZA,PRACA VEREADOR RAIMUNDO ROCHA,S/N,CENTRO,"PRACA VEREADOR RAIMUNDO ROCHA, CENTRO, ALMADINA, BA, BRASIL",-14.70432,-39.63911,"Praça Vereador Raimundo Rocha, 45640-000, Almadina","14 42m 15.552s S, 39 38m 20.796s W"
BA,ALMADINA,USF DA LIBERDADE,RUA VITORIA ARBAGE,0,CENTRO,"RUA VITORIA ARBAGE, CENTRO, ALMADINA, BA, BRASIL",-14.70502,-39.63595,"Travessa Vitória Arbage & Rua Ulisses Guimarães, 45640, Almadina","14 42m 18.072s S, 39 38m 9.42s W"
BA,AMARGOSA,UNIDADE DE SAUDE DA FAMILIA SUCUPIRA,RUA DO GRAVATA,S/N,SANTA RITA,"RUA DO GRAVATA, SANTA RITA, AMARGOSA, BA, BRASIL",-13.0145,-39.60879,"Rua do Gravata, 45300-000, Amargosa","13 0m 52.2s S, 39 36m 31.644s W"
BA,AMARGOSA,USF CATIARA ESPACO VERDE,LOTEAMENTO CIDADE JARDIM,S/N,CATIARA,"LOTEAMENTO CIDADE JARDIM, CATIARA, AMARGOSA, BA, BRASIL",-12.89402,-38.34518,"Loteamento Jardim Cidade Nova, 42700-000, Lauro de Freitas","12 53m 38.472s S, 38 20m 42.648s W"
BA,AMARGOSA,UNIDADE DE SAUDE DA FAMILIA CENTRAL,RUA OTAVIO MANGABEIRA,S/N,CENTRO,"RUA OTAVIO MANGABEIRA, CENTRO, AMARGOSA, BA, BRASIL",-13.03203,-39.60247,"Rua Otávio Mangabeira, 45300-000, Amargosa","13 1m 55.308s S, 39 36m 8.892s W"
BA,AMARGOSA,UNIDADE DE SAUDE DA FAMILIA CORTA MAO,PRACA DOM JOAO NILTON,S/N,CORTA MAO,"PRACA DOM JOAO NILTON, CORTA MAO, AMARGOSA, BA, BRASIL",-13.75934,-41.77336,"Praça São João, 46165, Dom Basílio","13 45m 33.624s S, 41 46m 24.096s W"
BA,AMARGOSA,UNIDADE DE SAUDE DA FAMILIA JAQUEIRA,COND VIVENDA DAS JAQUEIRAS,S/N,CENTRO,"COND VIVENDA DAS JAQUEIRAS, CENTRO, AMARGOSA, BA, BRASIL",-22.91589,-47.00543,"Alameda das Jaqueiras, 13101-790, Campinas","22 54m 57.204s S, 47 0m 19.548s W"
BA,AMARGOSA,UNIDADE DE SAUDE DA FAMILIA SANTA RITA,RUA MANOEL GUIMARAES PASSOS,50,SANTA RITA,"RUA MANOEL GUIMARAES PASSOS, SANTA RITA, AMARGOSA, BA, BRASIL",-13.02364,-39.60327,"Rua Manoel Passos, 45300-000, Amargosa","13 1m 25.104s S, 39 36m 11.772s W"
BA,AMARGOSA,UNIDADE DE SAUDE DA FAMILIA CATIARA,LOTEAMENTO BOA ESPERANCA RUA PARA,300,CATIARA,"LOTEAMENTO BOA ESPERANCA RUA PARA, CATIARA, AMARGOSA, BA, BRASIL",-14.85627,-40.86557,"Rua B Loteamento Boa Esperança, 45066, Vitória da Conquista","14 51m 22.572s S, 40 51m 56.052s W"
BA,AMARGOSA,UNIDADE DE SAUDE DA FAMILIA SAO ROQUE,AVENIDA ANTONIO CARLOS MAGALHAES,220,SAO ROQUE,"AVENIDA ANTONIO CARLOS MAGALHAES, SAO ROQUE, AMARGOSA, BA, BRASIL",-13.03135,-39.59579,"Avenida Antônio Carlos Magalhães & Travessa São Roque, 45300, Amargosa","13 1m 52.86s S, 39 35m 44.844s W"
BA,AMARGOSA,UNIDADE DE SAUDE DA FAMILIA DIOGENES SAMPAIO,RUA SAO JOSE,40,DIOGENES SAMPAIO,"RUA SAO JOSE, DIOGENES SAMPAIO, AMARGOSA, BA, BRASIL",-12.9571587,-39.5905301,"Rua São José, Diógenes Sampaio, Amargosa, Região Geográfica Imediata de Santo Antônio de Jesus, Região Geográfica Intermediária de Santo Antônio de Jesus, Bahia, Região Nordeste, Brasil","12 57m 25.7713s S, 39 35m 25.9084s W"
BA,AMARGOSA,POSTO DE SAUDE ITACHAMA,PRACA ANTONIO J ALMEIDA,S/N,ITACHAMA,"PRACA ANTONIO J ALMEIDA, ITACHAMA, AMARGOSA, BA, BRASIL",-22.82886,-43.27895,"Praça Antônio José de Almeida, 21011-580, Rio de Janeiro","22 49m 43.896s S, 43 16m 44.22s W"
BA,AMARGOSA,UNIDADE DE SAUDE DA FAMILIA ALTO DA BELA VISTA,RUA ALTO DA BELA VISTA,15,SANTA RITA,"RUA ALTO DA BELA VISTA, SANTA RITA, AMARGOSA, BA, BRASIL",-11.0023,-44.51382,"Rua Alto da Boa Vista, 47150-000, Santa Rita de Cássia","11 0m 8.28s S, 44 30m 49.752s W"
BA,AMARGOSA,UNIDADE DE SAUDE DA FAMILIA JEQUITIBA,RUA OTAVIO MANGABEIRA,20,CENTRO,"RUA OTAVIO MANGABEIRA, CENTRO, AMARGOSA, BA, BRASIL",-13.03203,-39.60247,"Rua Otávio Mangabeira, 45300-000, Amargosa","13 1m 55.308s S, 39 36m 8.892s W"
BA,AMELIA RODRIGUES,USF DOS CAMPOS,FAZENDA CAMPOS,S/N,FAZENDA CAMPOS,"FAZENDA CAMPOS, FAZENDA CAMPOS, AMELIA RODRIGUES, BA, BRASIL",-9.40502,-38.26227,"Estrada para Fazenda Juá Campos Novos, 48605, Paulo Afonso","9 24m 18.072s S, 38 15m 44.172s W"
