UF,MUNICIPIO,NOME,LOGRADOURO,NUMERO,BAIRRO,ENDERECO_COMPLETO,LATITUDE,LONGITUDE,ENDERECO_API,POINT,CEP,CO_CNES
MS,AGUA CLARA,UBSF ELTON ALVES DE OLIVEIRA,PORTE BATISTA SOUZA,27,CENTRO,"PORTE BATISTA SOUZA, CENTRO, AGUA CLARA, MS, BRASIL",-20.4457626,-52.8799225,"Rua Porte Batista de Souza, Jardim Aeroporto, Água Clara, Região Geográfica Imediata de Três Lagoas, Região Geográfica Intermediária de Campo Grande, Mato Grosso do Sul, Região Centro-Oeste, 79680-000, Brasil","20 26m 44.7454s S, 52 52m 47.721s W",79680-000,2558793
MS,AGUA CLARA,UBSF MARIA LUIZA DA SILVA MARINHO,FERNANDO BASTOS JUNIOR,720,JD SANTOS DUMONT,"FERNANDO BASTOS JUNIOR, JD SANTOS DUMONT, AGUA CLARA, MS, BRASIL",-20.44029,-52.87358,"Rua Fernando Bastos Júnior, 79680-000, Água Clara","20 26m 25.044s S, 52 52m 24.888s W",79680-000,2535823
MS,AGUA CLARA,UBSF MARIA DO CARMO DA SILVA MARIA,AVENIDA LUIZ FIUZA LIMA,S/N,JARDIM MORUMBI,"AVENIDA LUIZ FIUZA LIMA, JARDIM MORUMBI, AGUA CLARA, MS, BRASIL",-20.4397995,-52.8861973,"Avenida Luiz Fiuza Lima, Jardim Morumbi, Água Clara, Região Geográfica Imediata de Três Lagoas, Região Geográfica Intermediária de Campo Grande, Mato Grosso do Sul, Região Centro-Oeste, 79680-000, Brasil","20 26m 23.2782s S, 52 53m 10.3103s W",79680-000,3989372
MS,AGUA CLARA,UBSF SEBASTIANA DE BRITO PASCOAL,ALBERTO BATISTA DE SOUZA,180,JARDIM DAS PALMEIRAS,"ALBERTO BATISTA DE SOUZA, JARDIM DAS PALMEIRAS, AGUA CLARA, MS, BRASIL",-20.44576,-52.87992,"Rua Porte Batista de Souza, 79680-000, Água Clara","20 26m 44.736s S, 52 52m 47.712s W",79680-000,9318348
MS,ALCINOPOLIS,HOSPITAL LOCAL AVERALDO F BARBOSA,AV AVERALDO FERNANDES BARBOSA,970,CENTRO,"AV AVERALDO FERNANDES BARBOSA, CENTRO, ALCINOPOLIS, MS, BRASIL",-18.3267682,-53.70439350000001,"Avenida Averaldo Fernandes Barbosa, Alcinópolis, Região Geográfica Imediata de Coxim, Região Geográfica Intermediária de Campo Grande, Mato Grosso do Sul, Região Centro-Oeste, Brasil","18 19m 36.3655s S, 53 42m 15.8166s W",,7173113
MS,ALCINOPOLIS,UNIDADE PSF DE ALCIONOPOLIS,RUA ERASMO FRANCO,635,CENTRO,"RUA ERASMO FRANCO, CENTRO, ALCINOPOLIS, MS, BRASIL",-18.3272227,-53.7014374,"Rua Erasmo Franco, Alcinópolis, Região Geográfica Imediata de Coxim, Região Geográfica Intermediária de Campo Grande, Mato Grosso do Sul, Região Centro-Oeste, Brasil","18 19m 38.0017s S, 53 42m 5.17464s W",,2659638
MS,ALCINOPOLIS,UNIDADE BASICA DE SAUDE DE ALCINOPOLIS,AV DARLINDO JOS CARNEIRO,1211,CENTRO,"AV DARLINDO JOS CARNEIRO, CENTRO, ALCINOPOLIS, MS, BRASIL",-18.32552,-53.70752,"Avenida Darlindo José Carneiro, 79530-000, Alcinópolis","18 19m 31.872s S, 53 42m 27.072s W",79530-000,2659611
MS,AMAMBAI,UNIDADE DE SAUDE DA FAMILIA VILA GLORIA,R JOANA BATISTA,815,VILA GLORIA,"R JOANA BATISTA, VILA GLORIA, AMAMBAI, MS, BRASIL",-23.10761,-55.21871,"Rua Joana Batista, Amambai","23 6m 27.396s S, 55 13m 7.356s W",,2611961
MS,AMAMBAI,UNIDADE DE SAUDE DA FAMILIA VILA GUAPECRISTINA,R DA REPUBLICA,S/N,VILA GUAPE,"R DA REPUBLICA, VILA GUAPE, AMAMBAI, MS, BRASIL",-23.10778,-55.22736,"Rua da República, 79990-000, Amambai","23 6m 28.008s S, 55 13m 38.496s W",79990-000,3280136
MS,AMAMBAI,UNIDADE DE SAUDE CENTRAL,JOSE LUIZ SAMPAIO FERRAZ,1553,VILA VILARINHO,"JOSE LUIZ SAMPAIO FERRAZ, VILA VILARINHO, AMAMBAI, MS, BRASIL",-23.10807,-55.21968,"Rua José Luís sampaio ferraz, 79990-000, Amambai","23 6m 29.052s S, 55 13m 10.848s W",79990-000,18856
MS,AMAMBAI,POSTO DE SAUDE VILA SAO LUIZ ESF,RUA D PEDRO II,3791,VILA SAO LUIZ,"RUA D PEDRO II, VILA SAO LUIZ, AMAMBAI, MS, BRASIL",-2.62624,-44.26874,"Rua Dom Pedro II, 65090-753, São Luís","2 37m 34.464s S, 44 16m 7.464s W",65090-753,6003370
MS,AMAMBAI,POSTO DE SAUDE VILAS JARDIM PANORAMA E ORLANDO VIOL,RUA FRANCISCO SEREJO NETO,1889,VILA JARDIM PANORAMA,"RUA FRANCISCO SEREJO NETO, VILA JARDIM PANORAMA, AMAMBAI, MS, BRASIL",-23.11194,-55.22221999999999,"Rua Francisco Serejo Neto, 79990-000, Amambai","23 6m 42.984s S, 55 13m 19.992s W",79990-000,6967752
MS,AMAMBAI,UNIDADE DE SAUDE DA FAMILIA VILA VILARINHO,RUA JOSE LUIZ SAMPAIO FERRAZ S N VILA VILARINHO,1553,VILA MARINHO,"RUA JOSE LUIZ SAMPAIO FERRAZ S N VILA VILARINHO, VILA MARINHO, AMAMBAI, MS, BRASIL",-23.10807,-55.21968,"Rua José Luís sampaio ferraz, 79990-000, Amambai","23 6m 29.052s S, 55 13m 10.848s W",79990-000,2559455
MS,AMAMBAI,UNIDADE DE SAUDE DA FAMILIA VILAS INTEGRADAS,AV NICOLAU OTANO ESQ C SAO CRISTOVAO,31,VILA VAROCOPA,"AV NICOLAU OTANO ESQ C SAO CRISTOVAO, VILA VAROCOPA, AMAMBAI, MS, BRASIL",-23.1066,-55.22514,"Rua Nicolau Otano, 79990-000, Amambai","23 6m 23.76s S, 55 13m 30.504s W",79990-000,2559463
MS,AMAMBAI,UNIDADE DE SAUDE DA FAMILIA VILA DORIANA,RUA JACINTO BASILIO OLIVEIRA,S/N,VILA DORIANE,"RUA JACINTO BASILIO OLIVEIRA, VILA DORIANE, AMAMBAI, MS, BRASIL",-23.09613,-55.23956,"Rua Jacinto Bazílio de Oliveira, 79990-000, Amambai","23 5m 46.068s S, 55 14m 22.416s W",79990-000,2558432
MS,AMAMBAI,UNIDADE DE SAUDE PENITENCIARIA DE AMAMBAI,RUA WALTER GOMES CAIMAR,1019,CENTRO,"RUA WALTER GOMES CAIMAR, CENTRO, AMAMBAI, MS, BRASIL",-23.0981616,-55.2326984,"Rua Walter Gomes Caimar, Amambai, Região Geográfica Imediata de Amambai, Região Geográfica Intermediária de Dourados, Mato Grosso do Sul, Região Centro-Oeste, 79990-970, Brasil","23 5m 53.3818s S, 55 13m 57.7142s W",79990-970,6285147
MS,AMAMBAI,UNIDADE DE SAUDE DA FAMILIA VILA LIMEIRA,RUA OSCAR TRINDADE,505,VILA LIMEIRA,"RUA OSCAR TRINDADE, VILA LIMEIRA, AMAMBAI, MS, BRASIL",-23.1366,-55.2138,"Rua Oscar Trindade, 79990-000, Amambai","23 8m 11.76s S, 55 12m 49.68s W",79990-000,2558440
MS,AMAMBAI,POSTO DE SAUDE DO ASSENTAMENTO GUANABARA,RODOVIA AMAMBAI JUTY KM 80,100,AREA RURAL,"RODOVIA AMAMBAI JUTY KM 80, AREA RURAL, AMAMBAI, MS, BRASIL",-19.68445,-51.20145,"Rua Amambaí, 80, 79500-000, Paranaíba","19 41m 4.02s S, 51 12m 5.22s W",79500-000,0
MS,ANASTACIO,POSTO DE SAUDE PULADOR,COLONIA PULADOR,S/N,CENTRO,"COLONIA PULADOR, CENTRO, ANASTACIO, MS, BRASIL",-22.79245,-43.35182,"Rua Maria Soares Sendas & Rua Anastácio Correia, 25581, São João de Meriti","22 47m 32.82s S, 43 21m 6.552s W",25581,0
MS,ANASTACIO,ESF MARIA FRANCISCA DE LIMA,RUA CAMPO GRANDE,S/N,JARDIM INDEPENDENCIA,"RUA CAMPO GRANDE, JARDIM INDEPENDENCIA, ANASTACIO, MS, BRASIL",-20.5038439,-55.8004438,"Rua Campo Grande, Jardim Independência, Anastácio, Região Geográfica Imediata de Aquidauana - Anastácio, Região Geográfica Intermediária de Corumbá, Mato Grosso do Sul, Região Centro-Oeste, 79200-970, Brasil","20 30m 13.838s S, 55 48m 1.59768s W",79200-970,0
MS,ANASTACIO,ESF BENTA VIEIRA DE ARRUDA,RUA BAHIA,S/N,VILA MAIOR,"RUA BAHIA, VILA MAIOR, ANASTACIO, MS, BRASIL",-20.4815644,-55.8169551,"Rua Bahia, Vila Maior, Anastácio, Região Geográfica Imediata de Aquidauana - Anastácio, Região Geográfica Intermediária de Corumbá, Mato Grosso do Sul, Região Centro-Oeste, 79200-970, Brasil","20 28m 53.6318s S, 55 49m 1.03836s W",79200-970,0
MS,ANASTACIO,CEM CENTRO DE ESPECIALIDADES MEDICAS,RUA CORONEL PONCE ESQUINA RUA DOM AQUINO,S/N,CENTRO,"RUA CORONEL PONCE ESQUINA RUA DOM AQUINO, CENTRO, ANASTACIO, MS, BRASIL",-20.48072,-55.8063,"Rua Coronel Ponce & Rua Dom Aquino, 79210, Anastácio","20 28m 50.592s S, 55 48m 22.68s W",79210,2376040
MS,ANASTACIO,PSF VILA UMBELINA,RUA CORONEL PONCE ADEMAR DOS SANTOS,S/N,VILA UMBELINA,"RUA CORONEL PONCE ADEMAR DOS SANTOS, VILA UMBELINA, ANASTACIO, MS, BRASIL",-20.48893,-55.79719,"Rua Coronel Ponce & Rua Ademar dos Santos, 79210, Anastácio","20 29m 20.148s S, 55 47m 49.884s W",79210,0
MS,ANASTACIO,POSTO DE SAUDE MONJOLINHO,ASSENTAMENTO MONJOLINHO,S/N,CENTRO,"ASSENTAMENTO MONJOLINHO, CENTRO, ANASTACIO, MS, BRASIL",-22.79245,-43.35182,"Rua Maria Soares Sendas & Rua Anastácio Correia, 25581, São João de Meriti","22 47m 32.82s S, 43 21m 6.552s W",25581,0
MS,ANASTACIO,ESF ALTOS DA CIDADE,RUA PROFESSORA ESMERALDINA MALHADO,S/N,ALTOS DA CIDADE,"RUA PROFESSORA ESMERALDINA MALHADO, ALTOS DA CIDADE, ANASTACIO, MS, BRASIL",-20.49756,-55.82049,"Rua Professora Esmeraldina Malhado, 79210-000, Anastácio","20 29m 51.216s S, 55 49m 13.764s W",79210-000,0
MS,ANASTACIO,UNIDADE BASICA DE SAUDE ALFREDO GARCIA,RUA SAO PAULO,120,BEMTEVI,"RUA SAO PAULO, BEMTEVI, ANASTACIO, MS, BRASIL",-20.48896,-55.81461,"Rua São Paulo, 79210-000, Anastácio","20 29m 20.256s S, 55 48m 52.596s W",79210-000,0
MS,ANASTACIO,ESF ESTRATEGIA DE SAUDE DA FAMILIA ARAPONGAS,RUA ADAIR GOULART MARTINS,S/N,ARAPONGAS,"RUA ADAIR GOULART MARTINS, ARAPONGAS, ANASTACIO, MS, BRASIL",-20.49332,-55.79668,"Rua Adair Goulart Martins, 79210-000, Anastácio","20 29m 35.952s S, 55 47m 48.048s W",79210-000,0
MS,ANASTACIO,ESF ESTRATEGIA DE SAUDE DA FAMILIA ANASTACIO,DOM AQUINO,S/N,CENTRO,"DOM AQUINO, CENTRO, ANASTACIO, MS, BRASIL",-20.4862515,-55.8117744,"Rua Dom Aquino, Vila Flor, Anastácio, Região Geográfica Imediata de Aquidauana - Anastácio, Região Geográfica Intermediária de Corumbá, Mato Grosso do Sul, Região Centro-Oeste, 79200-970, Brasil","20 29m 10.5054s S, 55 48m 42.3878s W",79200-970,0
MS,ANASTACIO,POSTO DE SAUDE VEREDAO,COLONIA VEREDAO,S/N,CENTRO,"COLONIA VEREDAO, CENTRO, ANASTACIO, MS, BRASIL",-22.79245,-43.35182,"Rua Maria Soares Sendas & Rua Anastácio Correia, 25581, São João de Meriti","22 47m 32.82s S, 43 21m 6.552s W",25581,0
MS,ANASTACIO,POSTO DE SAUDE COLONIA PAULISTA,COLONIA PAULISTA,S/N,CENTRO,"COLONIA PAULISTA, CENTRO, ANASTACIO, MS, BRASIL",-23.78945,-54.28242,"Rua Paulista, 79970-000, Eldorado","23 47m 22.02s S, 54 16m 56.712s W",79970-000,0
MS,ANAURILANDIA,UNIDADE BASICA SAUDE EDUARDO F SANTOS,RUA DUQUE DE CAXIAS,1115,CENTRO,"RUA DUQUE DE CAXIAS, CENTRO, ANAURILANDIA, MS, BRASIL",-22.1868991,-52.71920649999999,"Rua Duque de Caxias, Anaurilândia, Região Geográfica Imediata de Nova Andradina, Região Geográfica Intermediária de Dourados, Mato Grosso do Sul, Região Centro-Oeste, Brasil","22 11m 12.8368s S, 52 43m 9.1434s W",,2376687
MS,ANAURILANDIA,UNIDADE BASICA DE SAUDE KASUSIQUE UMADA,KASUSIQUE UMADA,1,JARDIM ESPERANCA,"KASUSIQUE UMADA, JARDIM ESPERANCA, ANAURILANDIA, MS, BRASIL",-22.51715,-55.7076,"Jardim Esperança, Ponta Porã","22 31m 1.74s S, 55 42m 27.36s W",,0
MS,ANAURILANDIA,UNIDADE DE SAUDE DA FAMILIA DR HULDA STABILE CRUZ GONZALES,RUA FLORIANO PEIXOTO,S/N,CENTRO,"RUA FLORIANO PEIXOTO, CENTRO, ANAURILANDIA, MS, BRASIL",-22.1842831,-52.7178661,"Rua Floriano Peixoto, Anaurilândia, Região Geográfica Imediata de Nova Andradina, Região Geográfica Intermediária de Dourados, Mato Grosso do Sul, Região Centro-Oeste, Brasil","22 11m 3.41916s S, 52 43m 4.31796s W",,6259111
MS,ANAURILANDIA,ESTRATEGIA SAUDE DA FAMILIA 1 LUIZ RAMIRO DA SILVA,RUA MARANHAO,350,V QUEBRACHO,"RUA MARANHAO, V QUEBRACHO, ANAURILANDIA, MS, BRASIL",-22.01024,-52.51284,"Rua Maranhão, 79770-000, Anaurilândia","22 0m 36.864s S, 52 30m 46.224s W",79770-000,2376679
MS,ANGELICA,ESF DR MARCIO ROGERIO CAMARGO,RUA BENEDITO FRANCISCO DE AZEVEDO,S/N,DISTRITO DE IPEZAL,"RUA BENEDITO FRANCISCO DE AZEVEDO, DISTRITO DE IPEZAL, ANGELICA, MS, BRASIL",-22.05208,-54.07006,"Rua Benedito Francisco de Azevedo, 79787-000, Angélica","22 3m 7.488s S, 54 4m 12.216s W",79787-000,2376601
MS,ANGELICA,ESF LAURO DOMINGOS DE SOUZA,RUA GAIVOTA LOTE 5 QUADRA 6,S/N,MUTUM,"RUA GAIVOTA LOTE 5 QUADRA 6, MUTUM, ANGELICA, MS, BRASIL",-15.93796,-47.94515,"SMPW Quadra 17 Conjunto 5 Lote 5, 5, 71741-700, Brasília","15 56m 16.656s S, 47 56m 42.54s W",71741-700,6958451
MS,ANGELICA,ESF VILA ESPERANCA,AVENIDA PE AQUILINO FRANCISCHET,420,ESPERANCA,"AVENIDA PE AQUILINO FRANCISCHET, ESPERANCA, ANGELICA, MS, BRASIL",-22.15549,-53.76614,"Avenida Padre Aquilino Francischet, Angélica","22 9m 19.764s S, 53 45m 58.104s W",,2376628
MS,ANGELICA,ESF CENTRAL,AVENIDA RACHID NEDER,98,CENTRO CIVICO,"AVENIDA RACHID NEDER, CENTRO CIVICO, ANGELICA, MS, BRASIL",-22.15975,-53.77186999999999,"Avenida Rachid Neder, Angélica","22 9m 35.1s S, 53 46m 18.732s W",,2299941
MS,ANTONIO JOAO,ESF BRUM DE OLIVEIRA,RUA VALDOMIRO FIGUEIRA,S/N,CENTRO,"RUA VALDOMIRO FIGUEIRA, CENTRO, ANTONIO JOAO, MS, BRASIL",-22.19654,-55.94266,"Rua Waldomiro F. Silva, 79910-000, Antônio João","22 11m 47.544s S, 55 56m 33.576s W",79910-000,2710617
MS,ANTONIO JOAO,UNIDADE BASICA DE SAUDE DE ANTONIO JOAO,RUA WILMAR MARTINEZ MARQUES,S/N,CENTRO,"RUA WILMAR MARTINEZ MARQUES, CENTRO, ANTONIO JOAO, MS, BRASIL",-22.1914996,-55.9460927,"Rua Doutor Wilmar Martinez Marques, Centro, Antônio João, Região Geográfica Imediata de Ponta Porã, Região Geográfica Intermediária de Dourados, Mato Grosso do Sul, Região Centro-Oeste, Brasil","22 11m 29.3986s S, 55 56m 45.9337s W",,0
MS,ANTONIO JOAO,ESF TEOFILO TEIXEIRA DA ROSA,RUA FERNANDO SALDANHA,S/N,VILA NOVA,"RUA FERNANDO SALDANHA, VILA NOVA, ANTONIO JOAO, MS, BRASIL",-22.1860961,-55.9518235,"Rua Fernando Saldanha, Vila Nova, Antônio João, Região Geográfica Imediata de Ponta Porã, Região Geográfica Intermediária de Dourados, Mato Grosso do Sul, Região Centro-Oeste, Brasil","22 11m 9.94596s S, 55 57m 6.5646s W",,3553280
MS,ANTONIO JOAO,ESF SALVANI SIMPLICIO FREITAS,RUA FERNANDO SALDANHA,240,VILA PENZO,"RUA FERNANDO SALDANHA, VILA PENZO, ANTONIO JOAO, MS, BRASIL",-22.1860961,-55.9518235,"Rua Fernando Saldanha, Vila Nova, Antônio João, Região Geográfica Imediata de Ponta Porã, Região Geográfica Intermediária de Dourados, Mato Grosso do Sul, Região Centro-Oeste, Brasil","22 11m 9.94596s S, 55 57m 6.5646s W",,2710625
MS,APARECIDA DO TABOADO,ESF VILA BARBOSA,RUA DOIS DE JANEIRO,3030,CHACARA BOA VISTA,"RUA DOIS DE JANEIRO, CHACARA BOA VISTA, APARECIDA DO TABOADO, MS, BRASIL",-20.08268,-51.10481,"Rua Boa Vista, 79570-000, Aparecida do Taboado","20 4m 57.648s S, 51 6m 17.316s W",79570-000,2558912
MS,APARECIDA DO TABOADO,ESF JARDIM DAS FLORES,RUA CONFINS,2941,JARDIM AEROPORTO,"RUA CONFINS, JARDIM AEROPORTO, APARECIDA DO TABOADO, MS, BRASIL",-20.07251,-51.09251,"Rua Confins, 79570-000, Aparecida do Taboado","20 4m 21.036s S, 51 5m 33.036s W",79570-000,5884179
MS,APARECIDA DO TABOADO,ESF VILA PEREIRA,RUA CURITIBA,2658,JARDIM MORUMBI,"RUA CURITIBA, JARDIM MORUMBI, APARECIDA DO TABOADO, MS, BRASIL",-20.0922,-51.1094,"Rua Curitiba, 79570-000, Aparecida do Taboado","20 5m 31.92s S, 51 6m 33.84s W",79570-000,3569578
MS,APARECIDA DO TABOADO,ESF VILA SAO JERONIMO,RUA SAO PAULO,4822,VILA RODRIGUES,"RUA SAO PAULO, VILA RODRIGUES, APARECIDA DO TABOADO, MS, BRASIL",-20.09282,-51.10729,"Rua São Paulo, 79570-000, Aparecida do Taboado","20 5m 34.152s S, 51 6m 26.244s W",79570-000,2676699
MS,APARECIDA DO TABOADO,UNIDADE BASICA DE SAUDE MANOEL RODRIGUES DA SILVA,DULQUE DE CAXIAS,3422,CENTRO,"DULQUE DE CAXIAS, CENTRO, APARECIDA DO TABOADO, MS, BRASIL",-20.08212,-51.09663,"Rua Duque de Caxias, Aparecida do Taboado","20 4m 55.632s S, 51 5m 47.868s W",,2558769
MS,APARECIDA DO TABOADO,ESF JARDIM DO LAGO,AVENIDA PRESIDENTE VARGAS,4888,JARDIM DO LAGO,"AVENIDA PRESIDENTE VARGAS, JARDIM DO LAGO, APARECIDA DO TABOADO, MS, BRASIL",-20.08771,-51.07137,"Avenida Presidente Vargas, 79570-000, Aparecida do Taboado","20 5m 15.756s S, 51 4m 16.932s W",79570-000,3684539
MS,AQUIDAUANA,ESTRATEGIA DE SAUDE DA FAMILIA CIPOLANDIA,RUA JOAO V DO NASCIMENTO,S/N,CIPOLANDIA CENTRO,"RUA JOAO V DO NASCIMENTO, CIPOLANDIA CENTRO, AQUIDAUANA, MS, BRASIL",-20.12801,-55.39598,"Rua João Vitor do Nascimento, 79208-000, Aquidauana","20 7m 40.836s S, 55 23m 45.528s W",79208-000,6310834
MS,AQUIDAUANA,ESTRATEGIA DE SAUDE DA FAMILIA GUANANDY,RUA QUINTINO BOCAIUVA,400,GUANANDY,"RUA QUINTINO BOCAIUVA, GUANANDY, AQUIDAUANA, MS, BRASIL",-20.4801964,-55.7831363,"Rua Quintino Bocaiuva, Bairro Guanandy, Aquidauana, Região Geográfica Imediata de Aquidauana - Anastácio, Região Geográfica Intermediária de Corumbá, Mato Grosso do Sul, Região Centro-Oeste, 79200-970, Brasil","20 28m 48.707s S, 55 46m 59.2907s W",79200-970,3240061
MS,AQUIDAUANA,UNIDADE DE SAUDE DA FAMILIA BAIRRO ALTO,RUA DUQUE DE CAXIAS,2061,ALTO,"RUA DUQUE DE CAXIAS, ALTO, AQUIDAUANA, MS, BRASIL",-20.4712044,-55.7841412,"Rua Duque de Caxias, Bairro Alto, Aquidauana, Região Geográfica Imediata de Aquidauana - Anastácio, Região Geográfica Intermediária de Corumbá, Mato Grosso do Sul, Região Centro-Oeste, 79200-970, Brasil","20 28m 16.3358s S, 55 47m 2.90832s W",79200-970,5601010
MS,AQUIDAUANA,ESTRATEGIA DE SAUDE DA FAMILIA SAO PEDRO,RUA PROJETADA 01,1,VILA SAO PEDRO,"RUA PROJETADA 01, VILA SAO PEDRO, AQUIDAUANA, MS, BRASIL",-22.24357,-54.7402,"Rua Projetada Três, 79843-251, Dourados","22 14m 36.852s S, 54 44m 24.72s W",79843-251,6315356
MS,AQUIDAUANA,UNIDADE DE SAUDE DA FAMILIA ELCIRIA RITA BRANDES GARCIA,RUA VALDOMIRO CORTADO,1,SAO FRANCISCO,"RUA VALDOMIRO CORTADO, SAO FRANCISCO, AQUIDAUANA, MS, BRASIL",-20.47003,-55.75252,"Rua São Francisco de Assis, 79200-000, Aquidauana","20 28m 12.108s S, 55 45m 9.072s W",79200-000,2360209
MS,AQUIDAUANA,ESTRATEGIA DE SAUDE DA FAMILIA VILA TRINDADE,RUA FRANCISCO VIEIRA COUTINHO,36,VILA TRINDADE,"RUA FRANCISCO VIEIRA COUTINHO, VILA TRINDADE, AQUIDAUANA, MS, BRASIL",-20.46164,-55.79686,"Rua Francisco Vieira Coutinho, 79200-000, Aquidauana","20 27m 41.904s S, 55 47m 48.696s W",79200-000,3240053
MS,AQUIDAUANA,ESTABELECIMENTO PENAL DE AQUIDAUANA,RUA DUQUE DE CAXIAS,0,ALTO,"RUA DUQUE DE CAXIAS, ALTO, AQUIDAUANA, MS, BRASIL",-20.4712044,-55.7841412,"Rua Duque de Caxias, Bairro Alto, Aquidauana, Região Geográfica Imediata de Aquidauana - Anastácio, Região Geográfica Intermediária de Corumbá, Mato Grosso do Sul, Região Centro-Oeste, 79200-970, Brasil","20 28m 16.3358s S, 55 47m 2.90832s W",79200-970,6471307
MS,AQUIDAUANA,UNIDADE DE SAUDE DA FAMILIA CIDADE NOVA,RUA ESTEVAO ALVES CORREA,2834,ALTO,"RUA ESTEVAO ALVES CORREA, ALTO, AQUIDAUANA, MS, BRASIL",-20.4739707,-55.7937942,"Rua Estevão Alves Correa, Bairro Alto, Aquidauana, Região Geográfica Imediata de Aquidauana - Anastácio, Região Geográfica Intermediária de Corumbá, Mato Grosso do Sul, Região Centro-Oeste, 79200-970, Brasil","20 28m 26.2945s S, 55 47m 37.6591s W",79200-970,2120011
MS,AQUIDAUANA,UNIDADE DE SAUDE DA FAMILIA SANTA TEREZINHA,RUA CARLOS FERREIRA BANDEIRA,S/N,SANTA TEREZINHA,"RUA CARLOS FERREIRA BANDEIRA, SANTA TEREZINHA, AQUIDAUANA, MS, BRASIL",-20.4671,-55.76728000000001,"Rua Carlos Ferreira Bandeira, 79200-000, Aquidauana","20 28m 1.56s S, 55 46m 2.208s W",79200-000,2411520
MS,AQUIDAUANA,UNIDADE DE SAUDE DA FAMILIA CAMISAO,RUA 01,1,CAMISAO,"RUA 01, CAMISAO, AQUIDAUANA, MS, BRASIL",-20.46303,-55.76643000000001,"Rua Carlos Camisão, 79200-000, Aquidauana","20 27m 46.908s S, 55 45m 59.148s W",79200-000,2360225
MS,AQUIDAUANA,UNIDADE DE SAUDE DA FAMILIA MODESTO PEREIRA,RUA ESTEVAO ALVES CORREA,1,TAUNAY,"RUA ESTEVAO ALVES CORREA, TAUNAY, AQUIDAUANA, MS, BRASIL",-20.2912364,-56.0762903,"Rua Estevão alves corrêa, Taunay, Aquidauana, Região Geográfica Imediata de Aquidauana - Anastácio, Região Geográfica Intermediária de Corumbá, Mato Grosso do Sul, Região Centro-Oeste, Brasil","20 17m 28.451s S, 56 4m 34.6451s W",,7525877
MS,AQUIDAUANA,UNIDADE DE SAUDE DA FAMILIA VILA PINHEIRO,OVIDIO COSTA,S/N,VILA PINHEIRO,"OVIDIO COSTA, VILA PINHEIRO, AQUIDAUANA, MS, BRASIL",-20.45284,-55.76996,"Rua Ovídio Costa, 79200-000, Aquidauana","20 27m 10.224s S, 55 46m 11.856s W",79200-000,2360217
MS,AQUIDAUANA,ESTRATEGIA DE SAUDE DA FAMILIA IZAURA BAES,RUA 10 QD 059 LT 09,9,NOVA AQUIDAUANA,"RUA 10 QD 059 LT 09, NOVA AQUIDAUANA, AQUIDAUANA, MS, BRASIL",-20.4519,-55.7973,"Rua Dez, 10, 79200-000, Aquidauana","20 27m 6.84s S, 55 47m 50.28s W",79200-000,7065817
MS,AQUIDAUANA,ESTRATEGIA DE SAUDE DA FAMILIA NOVA AQUIDAUANA,AVENIDA VICE PREFEITO TIMOTEO PROENCA,S/N,BAIRRO NOVA AQUIDAUA,"AVENIDA VICE PREFEITO TIMOTEO PROENCA, BAIRRO NOVA AQUIDAUA, AQUIDAUANA, MS, BRASIL",-20.44766,-55.79585,"Rua Prefeito Timióteo Proença, 79200-000, Aquidauana","20 26m 51.576s S, 55 47m 45.06s W",79200-000,2659689
MS,ARAL MOREIRA,UNIDADE BASICA DE SAUDE CIRILLO ROSSATI,TREZE DE MAIO,30,CENTRO,"TREZE DE MAIO, CENTRO, ARAL MOREIRA, MS, BRASIL",-22.94694,-55.62819,"Rua 13 de Maio, 79930-000, Aral Moreira","22 56m 48.984s S, 55 37m 41.484s W",79930-000,2591383
MS,ARAL MOREIRA,POSTO DE SAUDE VISTA ALEGRE,ASSENTAMENTO SANTA CATARINA,S/N,ZONA RURAL,"ASSENTAMENTO SANTA CATARINA, ZONA RURAL, ARAL MOREIRA, MS, BRASIL",-32.04335,-52.1178,"Rua Santa Catarina, 96211-600, Rio Grande","32 2m 36.06s S, 52 7m 4.08s W",96211-600,2199645
MS,ARAL MOREIRA,UNIDADE BASICA DE SAUDE UNIAO GUARANI,RUA PRIMEIRO DE MAIO,S/N,VILA UNIAO,"RUA PRIMEIRO DE MAIO, VILA UNIAO, ARAL MOREIRA, MS, BRASIL",39.47121,-8.68267,"Rua Primeiro de Maio, 2380 Alcanena","39 28m 16.356s N, 8 40m 57.612s W",,0
MS,ARAL MOREIRA,POSTO DE SAUDE NASCIMENTO MIRANDA,ZONA RURAL RIO VERDE,1,ZONA RURAL,"ZONA RURAL RIO VERDE, ZONA RURAL, ARAL MOREIRA, MS, BRASIL",-12.41631,-41.78971,"Estrada Vicinal Para Tenda Zona Rural, Seabra","12 24m 58.716s S, 41 47m 22.956s W",,0
MS,ARAL MOREIRA,POSTO DE SAUDE GUASSUTY,ALDEIA INDIGENA GUSSUTY,0,ZONA RURAL,"ALDEIA INDIGENA GUSSUTY, ZONA RURAL, ARAL MOREIRA, MS, BRASIL",-22.94624,-55.63238000000001,"Aral Moreira, MS, Brasil","22 56m 46.464s S, 55 37m 56.568s W",,0
MS,ARAL MOREIRA,POSTO DE SAUDE GENI GUINZANI,VILA SAO LUIS,1,ZONA RURAL,"VILA SAO LUIS, ZONA RURAL, ARAL MOREIRA, MS, BRASIL",-22.55717000000001,-55.69301,"Rua São Pedro, 79906-532, Ponta Porã","22 33m 25.812s S, 55 41m 34.836s W",79906-532,0
MS,ARAL MOREIRA,POSTO DE SAUDE ELIANA FERREIRA MACHADO,JOSE LUIZ MATOSO,S/N,VILA MARQUES,"JOSE LUIZ MATOSO, VILA MARQUES, ARAL MOREIRA, MS, BRASIL",-23.025309,-55.5879632,"Rua José Luiz Matoso, Aral Moreira, Região Geográfica Imediata de Ponta Porã, Região Geográfica Intermediária de Dourados, Mato Grosso do Sul, Região Centro-Oeste, Brasil","23 1m 31.1124s S, 55 35m 16.6675s W",,2591391
MS,BANDEIRANTES,POSTO DE SAUDE CONGONHAS,RUA JOAO BATISTA RODRIGUES,S/N,CONGONHAS,"RUA JOAO BATISTA RODRIGUES, CONGONHAS, BANDEIRANTES, MS, BRASIL",-19.68129,-54.35178000000001,"Rua João Batista Rodrigues, 79432-000, Bandeirantes","19 40m 52.644s S, 54 21m 6.408s W",79432-000,0
MS,BANDEIRANTES,UNIDADE BASICA DE SAUDE DE BANDEIRANTES,RUA ARTUR BERNANDES,2336,CENTRO,"RUA ARTUR BERNANDES, CENTRO, BANDEIRANTES, MS, BRASIL",-19.91981,-54.36296,"Rua Arthur Bernardes, 79430-000, Bandeirantes","19 55m 11.316s S, 54 21m 46.656s W",79430-000,2371626
MS,BANDEIRANTES,UNIDADE DE SAUDE DA FAMILIA II,RUA PRESIDENTE DUTRA,S/N,CENTRO,"RUA PRESIDENTE DUTRA, CENTRO, BANDEIRANTES, MS, BRASIL",-19.9229602,-54.36198879999999,"Rua Presidente Dutra, Bandeirantes, Região Geográfica Imediata de Campo Grande, Região Geográfica Intermediária de Campo Grande, Mato Grosso do Sul, Região Centro-Oeste, Brasil","19 55m 22.6567s S, 54 21m 43.1597s W",,2316625
MS,BANDEIRANTES,UNIDADE MISTA JOAO CARNEIRO MENDONCA,RUA AFONSO PENA,S/N,CENTRO,"RUA AFONSO PENA, CENTRO, BANDEIRANTES, MS, BRASIL",-19.9255198,-54.35885379999999,"Rua Afonso Pena, Bandeirantes, Região Geográfica Imediata de Campo Grande, Região Geográfica Intermediária de Campo Grande, Mato Grosso do Sul, Região Centro-Oeste, Brasil","19 55m 31.8713s S, 54 21m 31.8737s W",,0
MS,BANDEIRANTES,UNIDADE DE SAUDE DA FAMILIA I,PEDRO CELESTINO,S/N,CENTRO,"PEDRO CELESTINO, CENTRO, BANDEIRANTES, MS, BRASIL",-19.9191242,-54.3686304,"Rua Pedro Celestino, Bandeirantes, Região Geográfica Imediata de Campo Grande, Região Geográfica Intermediária de Campo Grande, Mato Grosso do Sul, Região Centro-Oeste, Brasil","19 55m 8.84712s S, 54 22m 7.06944s W",,2341891
MS,BATAGUASSU,AMBULATORIO MEDICO MUNICIPAL SAE DE BATAGUASSU,RUA TREZE DE OUTUBRO,450,JARDIM SANTA MARIA,"RUA TREZE DE OUTUBRO, JARDIM SANTA MARIA, BATAGUASSU, MS, BRASIL",-6.37557,-37.34229000000001,"Rua Martins Soares Dutra, 59324-000, Jardim de Piranhas","6 22m 32.052s S, 37 20m 32.244s W",59324-000,9915982
MS,BATAGUASSU,CENTRO DE ESPECIALIDADE DE BATAGUASSU,RUA 13 DE OUTUBRO,407,CENTRO,"RUA 13 DE OUTUBRO, CENTRO, BATAGUASSU, MS, BRASIL",-21.7118472,-52.4221251,"Rua 13 de Outubro, Bataguassu, Região Geográfica Imediata de Três Lagoas, Região Geográfica Intermediária de Campo Grande, Mato Grosso do Sul, Região Centro-Oeste, Brasil","21 42m 42.6499s S, 52 25m 19.6504s W",,2371022
MS,BATAGUASSU,ESF LUCIO FERREIRA ROSA,RUA JOSE ALVES BARROSO,S/N,JARDIM CAMPO GRANDE,"RUA JOSE ALVES BARROSO, JARDIM CAMPO GRANDE, BATAGUASSU, MS, BRASIL",-21.72336,-52.4094,"Rua José Alves Barroso, 79780-000, Bataguassu","21 43m 24.096s S, 52 24m 33.84s W",79780-000,9060588
MS,BATAGUASSU,UNIDADE DE SAUDE XV DE NOVEMBRO,AV MANOEL DA COSTA LIMA,111,NOVA P XV NOVEMBRO,"AV MANOEL DA COSTA LIMA, NOVA P XV NOVEMBRO, BATAGUASSU, MS, BRASIL",-21.7216684,-52.2593666,"Avenida Manoel da Costa Lima, Bairro São Sebastião da Reta A-1, Bataguassu, Região Geográfica Imediata de Três Lagoas, Região Geográfica Intermediária de Campo Grande, Mato Grosso do Sul, Região Centro-Oeste, Brasil","21 43m 18.0062s S, 52 15m 33.7198s W",,2371030
MS,BATAGUASSU,ESF RITA GUARDINI PACHECO,RUA BRASILANDIA ESQUINA 13 DE OUTUBRO,570,CENTRO,"RUA BRASILANDIA ESQUINA 13 DE OUTUBRO, CENTRO, BATAGUASSU, MS, BRASIL",-21.7162,-52.41651,"Rua 13 de Outubro, 13, 79780-000, Bataguassu","21 42m 58.32s S, 52 24m 59.436s W",79780-000,5777321
MS,BATAGUASSU,UNIDADE DE SAUDE JD SAO FRANCISCO,AV SAO FRANCISCO DE ASSIS,813,JD SAO FRANCISCO,"AV SAO FRANCISCO DE ASSIS, JD SAO FRANCISCO, BATAGUASSU, MS, BRASIL",-21.72272,-52.42626,"Rua São Francisco de Assis, 79780-000, Bataguassu","21 43m 21.792s S, 52 25m 34.536s W",79780-000,2371014
MS,BATAGUASSU,UNIDADE PRISIONAL MASCULINA DE BATAGUASSU,RUA ANAURILANDIA,208,CENTRO,"RUA ANAURILANDIA, CENTRO, BATAGUASSU, MS, BRASIL",-21.7139553,-52.4224125,"Rua Anaurilândia, Bataguassu, Região Geográfica Imediata de Três Lagoas, Região Geográfica Intermediária de Campo Grande, Mato Grosso do Sul, Região Centro-Oeste, Brasil","21 42m 50.2391s S, 52 25m 20.685s W",,6325637
