UF,MUNICIPIO,ESTABELECIMENTO,LOGRADOURO,NUMERO,BAIRRO,ENDERECO_COMPLETO,latitude,longitude,address,point
AP,AMAPA,PM APA UBS NOVA BRASILIA,RUA CONEGO DOMINGO MALTEZ,S/N,NOVA BRASILIA,"RUA CONEGO DOMINGO MALTEZ, NOVA BRASILIA, AMAPA, AP, BRASIL",0.70234,-51.39726,"Rua Nova Brasília, 68997-000, Porto Grande","0 42m 8.424s N, 51 23m 50.136s W"
AP,AMAPA,PM APA P S VISTA ALEGRE,COMUNIDADE DO VISTA ALEGRE,S/N,ZONA RURAL,"COMUNIDADE DO VISTA ALEGRE, ZONA RURAL, AMAPA, AP, BRASIL",-21.1723,-48.62502,"Rua Amapá, 15920-000, Vista Alegre do Alto","21 10m 20.28s S, 48 37m 30.072s W"
AP,AMAPA,PM APA P S CRUZEIRO,COMUNIDADE DO CRUZEIRO,S/N,ZONA RURAL,"COMUNIDADE DO CRUZEIRO, ZONA RURAL, AMAPA, AP, BRASIL",-0.04957,-51.11967,"Travessa São José Comunidade do Coração, 68903, Macapá","0 2m 58.452s S, 51 7m 10.812s W"
AP,AMAPA,PM APA P S AMAPA GRANDE,COMUNIDADE DO AMAPA GRANDE,S/N,ZONA RURAL,"COMUNIDADE DO AMAPA GRANDE, ZONA RURAL, AMAPA, AP, BRASIL",-0.04957,-51.11967,"Travessa São José Comunidade do Coração, 68903, Macapá","0 2m 58.452s S, 51 7m 10.812s W"
AP,AMAPA,PM APA UBS PIQUIA,COMUNIDADE DO PIQUIA,S/N,COMUNIDADE DO PIQUIA,"COMUNIDADE DO PIQUIA, COMUNIDADE DO PIQUIA, AMAPA, AP, BRASIL",-0.04957,-51.11967,"Travessa São José Comunidade do Coração, 68903, Macapá","0 2m 58.452s S, 51 7m 10.812s W"
AP,AMAPA,PM APA P S BASE AEREA,COMUNIDADE DA BASE AEREA,S/N,ZONA RURAL,"COMUNIDADE DA BASE AEREA, ZONA RURAL, AMAPA, AP, BRASIL",0.89551,-51.99809000000001,"Estrada Area Industrial & Rodovia Ayrton Senna da Silva, 68948, Serra do Navio","0 53m 43.836s N, 51 59m 53.124s W"
AP,AMAPA,PM APA PS DO SUCURIJU,COMUNIDADE DE SUCURIJU,S/N,C SUCURIJU,"COMUNIDADE DE SUCURIJU, C SUCURIJU, AMAPA, AP, BRASIL",2.04713,-50.79229,"Rua Desidério Antônio Coelho de Carvalho, 68950-000, Amapá","2 2m 49.668s N, 50 47m 32.244s W"
AP,AMAPA,SES AP UNID MISTA DE SAUDE DE AMAPA,AVN GUARANI,742,NOVA ESPERANCA,"AVN GUARANI, NOVA ESPERANCA, AMAPA, AP, BRASIL",0.03121,-51.08131,"Nova Esperança, Macapá","0 1m 52.356s N, 51 4m 52.716s W"
AP,AMAPA,PM APA PS CALAFATE,COMUNIDADE DO CALAFATE,S/N,CALAFATE,"COMUNIDADE DO CALAFATE, CALAFATE, AMAPA, AP, BRASIL",-0.04957,-51.11967,"Travessa São José Comunidade do Coração, 68903, Macapá","0 2m 58.452s S, 51 7m 10.812s W"
AP,CALCOENE,PMC UBS DR JOSE RIBAMAR CAVALCANTE,AV ANTONIO TEODORO LEAL,227,CENTRO,"AV ANTONIO TEODORO LEAL, CENTRO, CALCOENE, AP, BRASIL",2.49241,-50.94948,"Rua Teodoro Antônio Leal, 68960-000, Calçoene","2 29m 32.676s N, 50 56m 58.128s W"
AP,CALCOENE,PMC POSTO MUNICIPAL DE SAUDE DO CUNANI,VILA DO CUNANI,S/N,V CUNANI,"VILA DO CUNANI, V CUNANI, CALCOENE, AP, BRASIL",-15.79331,-47.85062,"Estrada Acampamento Pacheco Fernandes, 70802, 70803, 70804, 73340, Brasília","15 47m 35.916s S, 47 51m 2.232s W"
AP,CALCOENE,PMC UBS DO CARNOT,COMUNIDADE DO CARNOT,S/N,C CARNOT,"COMUNIDADE DO CARNOT, C CARNOT, CALCOENE, AP, BRASIL",-0.04957,-51.11967,"Travessa São José Comunidade do Coração, 68903, Macapá","0 2m 58.452s S, 51 7m 10.812s W"
AP,CALCOENE,PMC UBS GILMAR RAMOS VIEIRA,AV MANOEL SARMENTO,100,CEA,"AV MANOEL SARMENTO, CEA, CALCOENE, AP, BRASIL",2.49764,-50.95724000000001,"Rua Manoel Sarmento, 68960-000, Calçoene","2 29m 51.504s N, 50 57m 26.064s W"
AP,CALCOENE,UNIDADE BASICA DE SAUDE DO LORENCO,VILA DO LOURENCO,S/N,LOURENCO,"VILA DO LOURENCO, LOURENCO, CALCOENE, AP, BRASIL",-21.5622,-48.54817,"Estrada Municipal São Lourenço do Turvo-Vila do Quadro, 15991, Matão","21 33m 43.92s S, 48 32m 53.412s W"
AP,CALCOENE,SES AP UNID MISTA DE SAUDE DE CALCOENE,ANTONIO TEODORO LEAL,S/N,CENTRO,"ANTONIO TEODORO LEAL, CENTRO, CALCOENE, AP, BRASIL",2.49241,-50.94948,"Rua Teodoro Antônio Leal, 68960-000, Calçoene","2 29m 32.676s N, 50 56m 58.128s W"
AP,CUTIAS,PM CUT UBS AMERICO COELHO PEREIRA,RUA LEUVENCIO DA SILVA,S/N,CENTRO,"RUA LEUVENCIO DA SILVA, CENTRO, CUTIAS, AP, BRASIL",-21.04956,-50.05551,"Rua Carlos Ap. da Silva, 15265-000, Zacarias","21 2m 58.416s S, 50 3m 19.836s W"
AP,CUTIAS,PM CUT PS GURUPORA,RUA GURUPORA,S/N,CENTRO,"RUA GURUPORA, CENTRO, CUTIAS, AP, BRASIL",0.8981899999999999,-50.78417,"Avenida Gurupora, 68973-000, Cutias","0 53m 53.484s N, 50 47m 3.012s W"
AP,CUTIAS,PM CUT PS LIVRAMENTO DO PACUI,RUA LIVRAMENTO,S/N,CENTRO,"RUA LIVRAMENTO, CENTRO, CUTIAS, AP, BRASIL",-28.26899,-52.42552,"Avenida Brasil Centro & Rua Livramento, 99034, Passo Fundo","28 16m 8.364s S, 52 25m 31.872s W"
AP,CUTIAS,PM CUT PS SAO PAULO DO B ARAGUARI,BAIXO ARAGUARI,S/N,RIBEIRNHO,"BAIXO ARAGUARI, RIBEIRNHO, CUTIAS, AP, BRASIL",0.96667,-50.79767,Cutias,"0 58m 0.012s N, 50 47m 51.612s W"
AP,CUTIAS,PM CUT PS DE PRACUUBA DO ARAGUARI,RIO ARAGUARI,S/N,RIO ARAGUARI,"RIO ARAGUARI, RIO ARAGUARI, CUTIAS, AP, BRASIL",0.973862,-50.8076528,"Rua Rio Araguari, Beira Rio, Cutias, Região Geográfica Imediata de Oiapoque, Região Geográfica Intermediária de Oiapoque-Porto Grande, Amapá, Região Norte, Brasil","0 58m 25.9032s N, 50 48m 27.5501s W"
AP,FERREIRA GOMES,PMFG UBS MARIA JOANA MOREIRA DOS SANTOS,RUA MANOEL LINO LEAL,S/N,MONTANHA,"RUA MANOEL LINO LEAL, MONTANHA, FERREIRA GOMES, AP, BRASIL",0.85104,-51.17496,"Avenida Manoel Lino Leal, 68915-000, Ferreira Gomes","0 51m 3.744s N, 51 10m 29.856s W"
AP,FERREIRA GOMES,PMFG UBS MARIA EMILIA BATISTA FERREIRA,DISTRITO DO PAREDAO,S/N,ZONA RURAL,"DISTRITO DO PAREDAO, ZONA RURAL, FERREIRA GOMES, AP, BRASIL",-0.8341799999999999,-52.51662,"Rua Ferreira Gomes, 68924-000, Laranjal do Jari","0 50m 3.048s S, 52 30m 59.832s W"
AP,FERREIRA GOMES,PMFG UBS MARIA LEONICE TAVARES MOREIRA,RUA CASTELO BRANCO,S/N,CENTRO,"RUA CASTELO BRANCO, CENTRO, FERREIRA GOMES, AP, BRASIL",0.85731,-51.18161,"Rua Castelo Branco, 68915-000, Ferreira Gomes","0 51m 26.316s N, 51 10m 53.796s W"
AP,FERREIRA GOMES,PMFG UBS JOAO DE SOUZA MOREIRA,COMUNIDADE DO FERREIRINHA,S/N,ZONA RURAL,"COMUNIDADE DO FERREIRINHA, ZONA RURAL, FERREIRA GOMES, AP, BRASIL",-0.8341799999999999,-52.51662,"Rua Ferreira Gomes, 68924-000, Laranjal do Jari","0 50m 3.048s S, 52 30m 59.832s W"
AP,FERREIRA GOMES,PMFG UBS TRIUNFO DO ARAGUARI,TRIUNFO DO ARAGUARI,S/N,ZONA RURAL,"TRIUNFO DO ARAGUARI, ZONA RURAL, FERREIRA GOMES, AP, BRASIL",-0.8341799999999999,-52.51662,"Rua Ferreira Gomes, 68924-000, Laranjal do Jari","0 50m 3.048s S, 52 30m 59.832s W"
AP,FERREIRA GOMES,SES AP UNID MISTA DE SAUDE DE FERREIRA GOMES,AV LUZIA SERRA CAVALCANTE,774,CENTRO,"AV LUZIA SERRA CAVALCANTE, CENTRO, FERREIRA GOMES, AP, BRASIL",0.85683,-51.1824,"Avenida Luzia São Cavalcante, 68915-000, Ferreira Gomes","0 51m 24.588s N, 51 10m 56.64s W"
AP,ITAUBAL,PM ITA UBS CARMO DO MACACOARI,COMUNIDADE CARMO DO MACACOARI,1,VILA CDO MACACOARI,"COMUNIDADE CARMO DO MACACOARI, VILA CDO MACACOARI, ITAUBAL, AP, BRASIL",,,,
AP,ITAUBAL,PM ITA PS DO URUA,COMUNIDADE DO URUA,S/N,VILA DO URUA,"COMUNIDADE DO URUA, VILA DO URUA, ITAUBAL, AP, BRASIL",-22.73269,-47.3584,"Rua Juruá, 13469-430, Santa Bárbara d'Oeste","22 43m 57.684s S, 47 21m 30.24s W"
AP,ITAUBAL,PM ITA PS IGARAPE NOVO,LOCALIDADE DO IGARAPE NOVO,1,MARG DRIO AMAZONAS,"LOCALIDADE DO IGARAPE NOVO, MARG DRIO AMAZONAS, ITAUBAL, AP, BRASIL",-15.79276,-47.84874,"Via Acampamento Pacheco Fernandes, 70802, 70803, 70804, 73340, Brasília","15 47m 33.936s S, 47 50m 55.464s W"
AP,ITAUBAL,PM ITA UBS DE ITAUBAL,RUA JOAO PALHA DOS REIS,1,CENTRO,"RUA JOAO PALHA DOS REIS, CENTRO, ITAUBAL, AP, BRASIL",0.6030399999999999,-50.69868,"Rua João Palha dos Reis, 68976-000, Itaubal","0 36m 10.944s N, 50 41m 55.248s W"
AP,ITAUBAL,PM ITA PS IPIXUNA GRANDE,IGARAPE IPIXUNA GRANDE,1,MARGD RIO AMAZONAS,"IGARAPE IPIXUNA GRANDE, MARGD RIO AMAZONAS, ITAUBAL, AP, BRASIL",,,,
AP,ITAUBAL,PM ITA PS FOZ DO MACACOARI,VILA,1,CENTRO,"VILA, CENTRO, ITAUBAL, AP, BRASIL",0.60226,-50.69758,"Rua Gila Nobre, 68976-000, Itaubal","0 36m 8.136s N, 50 41m 51.288s W"
AP,ITAUBAL,PM ITA PS SAO TOME,COMUNIDADE SAO TOME,1,VILA,"COMUNIDADE SAO TOME, VILA, ITAUBAL, AP, BRASIL",-20.34766,-40.31436,"Rua São Tomé, 29108-150, Vila Velha","20 20m 51.576s S, 40 18m 51.696s W"
AP,ITAUBAL,PM ITA PS DO INAJA,VILA,1,CENTRO,"VILA, CENTRO, ITAUBAL, AP, BRASIL",0.60226,-50.69758,"Rua Gila Nobre, 68976-000, Itaubal","0 36m 8.136s N, 50 41m 51.288s W"
AP,ITAUBAL,PM ITA UBS SANTA MARIA DO CURICACA,COMUNIDADE SANTA MARIA DO CURICACA,1,CURICACA,"COMUNIDADE SANTA MARIA DO CURICACA, CURICACA, ITAUBAL, AP, BRASIL",-18.1856,-42.42144,"Rua Aílton Pedro de Barros, 39780-000, Santa Maria do Suaçuí","18 11m 8.16s S, 42 25m 17.184s W"
AP,LARANJAL DO JARI,PMLAJ UBS SILVINO MELO,RUA RIO BRANCO,1471,SAGRADO CORACAO DE J,"RUA RIO BRANCO, SAGRADO CORACAO DE J, LARANJAL DO JARI, AP, BRASIL",-0.85596,-52.53211999999999,"Rua Rio Branco, 68924-000, Laranjal do Jari","0 51m 21.456s S, 52 31m 55.632s W"
AP,LARANJAL DO JARI,PMLAJ UBS MARIA DE NAZARE SOUZA MINEIRO,ASSENTAMENTO NAZARE MINEIRO,325,NAZARE MINEIRO,"ASSENTAMENTO NAZARE MINEIRO, NAZARE MINEIRO, LARANJAL DO JARI, AP, BRASIL",-0.8518,-52.53654,"Passagem Nossa Senhora de Nazaré, 68924-000, Laranjal do Jari","0 51m 6.48s S, 52 32m 11.544s W"
AP,LARANJAL DO JARI,PMLAJ UBS CENTRO VANEA SILVA,RUA DA USINA,S/N,CENTRO,"RUA DA USINA, CENTRO, LARANJAL DO JARI, AP, BRASIL",-0.8489966999999998,-52.54084690000001,"Rua da Usina, Vila Malvina, Laranjal do Jari, Região Geográfica Imediata de Laranjal do Jari, Região Geográfica Intermediária de Macapá, Amapá, Região Norte, Brasil","0 50m 56.3881s S, 52 32m 27.0488s W"
AP,LARANJAL DO JARI,PMLAJ UBS CONCEICAO DO MURIACA,COMUNIDADE CONCEICAO DO MURIACA,S/N,ZONA RURAL,"COMUNIDADE CONCEICAO DO MURIACA, ZONA RURAL, LARANJAL DO JARI, AP, BRASIL",-0.8403,-52.52015,Laranjal do Jari,"0 50m 25.08s S, 52 31m 12.54s W"
AP,LARANJAL DO JARI,PMLAJ PS SAO FRANCISCO DO IRATAPURU,COMUNIDADE SAO FRANCISCO DO IRATAPURU,S/N,SAO FRANCISCO DO IRA,"COMUNIDADE SAO FRANCISCO DO IRATAPURU, SAO FRANCISCO DO IRA, LARANJAL DO JARI, AP, BRASIL",-0.85,-52.53028000000001,"Passagem São Francisco, 68924-000, Laranjal do Jari","0 51m 0s S, 52 31m 49.008s W"
AP,LARANJAL DO JARI,PMLAJ UBS DR LELIO SILVA,AV EMILIO MEDICE,2278,AGRESTE,"AV EMILIO MEDICE, AGRESTE, LARANJAL DO JARI, AP, BRASIL",-0.8408899999999999,-52.52129,"Rua Emílio Medice, 68924-000, Laranjal do Jari","0 50m 27.204s S, 52 31m 16.644s W"
AP,LARANJAL DO JARI,PMLAJ UBS NOVA ESPERANCA,RUA ESPLANADA,666,NOVA ESPERANCA,"RUA ESPLANADA, NOVA ESPERANCA, LARANJAL DO JARI, AP, BRASIL",-0.84734,-52.52005,"Rua Esplanada, 68924-000, Laranjal do Jari","0 50m 50.424s S, 52 31m 12.18s W"
AP,LARANJAL DO JARI,PMLAJ UBS AGUA BRANCA,AGUA BRANCA,S/N,COMUNIDADE DE AGUA B,"AGUA BRANCA, COMUNIDADE DE AGUA B, LARANJAL DO JARI, AP, BRASIL",-0.83093,-52.51574,"Avenida Água Branca, 68924-000, Laranjal do Jari","0 49m 51.348s S, 52 30m 56.664s W"
AP,LARANJAL DO JARI,PMLAJ UBS BURITIZAL,RUA PIQUIA,313,BURITIZAL,"RUA PIQUIA, BURITIZAL, LARANJAL DO JARI, AP, BRASIL",-0.8310700000000001,-52.50684,"Rua Piquia, 68924-000, Laranjal do Jari","0 49m 51.852s S, 52 30m 24.624s W"
AP,LARANJAL DO JARI,PMLAJ UBS ENF RUINALDO NASCIMENTO,RUA FERREIRA GOMES,S/N,CASTANHEIRA,"RUA FERREIRA GOMES, CASTANHEIRA, LARANJAL DO JARI, AP, BRASIL",-0.8341799999999999,-52.51662,"Rua Ferreira Gomes, 68924-000, Laranjal do Jari","0 50m 3.048s S, 52 30m 59.832s W"
AP,LARANJAL DO JARI,PMLAJ UBS PADARIA,LARANJAL DO JARI,S/N,COMUNIDADE PADARIA,"LARANJAL DO JARI, COMUNIDADE PADARIA, LARANJAL DO JARI, AP, BRASIL",-0.8403,-52.52015,Laranjal do Jari,"0 50m 25.08s S, 52 31m 12.54s W"
AP,LARANJAL DO JARI,PMLAJ PS SANTO ANTONIO DA CACHOEIRA,COMUNIDADE SANTO ANTONIO DA CACHOEIRA,S/N,SANTO ANTONIO DA CAC,"COMUNIDADE SANTO ANTONIO DA CACHOEIRA, SANTO ANTONIO DA CAC, LARANJAL DO JARI, AP, BRASIL",-29.83835,-50.51619,Santo Antônio da Patrulha,"29 50m 18.06s S, 50 30m 58.284s W"
AP,MACAPA,PMM P S IPIXUNA MIRANDA,IPIXUNA MIRANDA,56,IPIXUNA,"IPIXUNA MIRANDA, IPIXUNA, MACAPA, AP, BRASIL",0.07134,-51.08947,"Avenida Francisco Felipe de Miranda, 68908-805, Macapá","0 4m 16.824s N, 51 5m 22.092s W"
AP,MACAPA,PMM U B S SAO JOAQUIM DO PACUI,DISTRITO DE PACUI,1,DISTRITO DO PACUI,"DISTRITO DE PACUI, DISTRITO DO PACUI, MACAPA, AP, BRASIL",-15.79331,-47.85062,"Estrada Acampamento Pacheco Fernandes, 70802, 70803, 70804, 73340, Brasília","15 47m 35.916s S, 47 51m 2.232s W"
AP,MACAPA,PMM U B S SANTA LUZIA DO PACUI,SANTA LUZIA DO PACUI,1,DISTRITO DE PACUI,"SANTA LUZIA DO PACUI, DISTRITO DE PACUI, MACAPA, AP, BRASIL",-5.19985,-37.33764,"Ilha de Santa Luzia, Mossoró","5 11m 59.46s S, 37 20m 15.504s W"
AP,MACAPA,PMM P S SAO BENEDITO DO PACUI,REGIAO DO PACUI,1,PACUI,"REGIAO DO PACUI, PACUI, MACAPA, AP, BRASIL",-16.5375,-44.53358,"Rua Antônio Paulo Leocádio, 39365-000, São João do Pacuí","16 32m 15s S, 44 32m 0.888s W"
AP,MACAPA,UBS PERPETUO SOCORRO,RUA RIO XINGU,1,PERPETUO SOCORRO,"RUA RIO XINGU, PERPETUO SOCORRO, MACAPA, AP, BRASIL",0.0448956,-51.0487568,"Rua Rio Xingu, Perpétuo Socorro, Macapá, Região Geográfica Imediata de Macapá, Região Geográfica Intermediária de Macapá, Amapá, Região Norte, 68900-911, Brasil","0 2m 41.6242s N, 51 2m 55.5245s W"
AP,MACAPA,PMM U B S CORACAO,AV PROFESSORA NEUZA AMARAL,1163,CORACAO,"AV PROFESSORA NEUZA AMARAL, CORACAO, MACAPA, AP, BRASIL",0.03626,-51.06835,"Avenida Professora Cora de Carvalho, Macapá","0 2m 10.536s N, 51 4m 6.06s W"
AP,MACAPA,PMM P S BACABA,DISTRITO CARAPANATUBA,1,BAILIQUE,"DISTRITO CARAPANATUBA, BAILIQUE, MACAPA, AP, BRASIL",0.03585,-51.06221,Macapá,"0 2m 9.06s N, 51 3m 43.956s W"
AP,MACAPA,PMM P S CORRE AGUA DO PIRIRIM,SAO JOAQUIM DO PACUI,1,PACUI,"SAO JOAQUIM DO PACUI, PACUI, MACAPA, AP, BRASIL",0.8054576999999999,-50.75290089999999,"São Joaquim do Pacui, Rua Marcos Botta, São Joaquim do Pacuí, Macapá, Região Geográfica Imediata de Macapá, Região Geográfica Intermediária de Macapá, Amapá, Região Norte, Brasil","0 48m 19.6477s N, 50 45m 10.4432s W"
AP,MACAPA,PMM UBS MARABAIXO,RUA QUATRO,S/N,MARABAIXO II,"RUA QUATRO, MARABAIXO II, MACAPA, AP, BRASIL",0.0385077,-51.1301615,"Rua Quarta do Marabaixo II, Marabaixo II, Macapá, Região Geográfica Imediata de Macapá, Região Geográfica Intermediária de Macapá, Amapá, Região Norte, 68906-120, Brasil","0 2m 18.6277s N, 51 7m 48.5814s W"
AP,MACAPA,PMM U B S CARMO DO MARUANUM,MARUANUM,1,MARUANUM,"MARUANUM, MARUANUM, MACAPA, AP, BRASIL",0.03585,-51.06221,Macapá,"0 2m 9.06s N, 51 3m 43.956s W"
AP,MACAPA,PMM USB PACOVAL,RUA GENERAL RONDON,1,JULIAO RAMOS,"RUA GENERAL RONDON, JULIAO RAMOS, MACAPA, AP, BRASIL",0.03881,-51.05492,"Rua General Rondon, Macapá","0 2m 19.716s N, 51 3m 17.712s W"
AP,MACAPA,PMM U B S BRASIL NOVO,AVENIDA ABACATAL,177,BRASIL NOVO,"AVENIDA ABACATAL, BRASIL NOVO, MACAPA, AP, BRASIL",0.093137,-51.0859993,"Avenida Abacatal, Brasil Novo, Macapá, Região Geográfica Imediata de Macapá, Região Geográfica Intermediária de Macapá, Amapá, Região Norte, 68909-173, Brasil","0 5m 35.2932s N, 51 5m 9.59748s W"
AP,MACAPA,PMM U B S RD HOZANAN DE SOUZA,RUA HILDEMAR MAIA,3710,MUCA,"RUA HILDEMAR MAIA, MUCA, MACAPA, AP, BRASIL",0.0075128999999999,-51.0723442,"Rua Hildemar Maia, Ressaca do Muca, Muca, Macapá, Região Geográfica Imediata de Macapá, Região Geográfica Intermediária de Macapá, Amapá, Região Norte, 68903-197, Brasil","0 0m 27.0464s N, 51 4m 20.4391s W"
AP,MACAPA,PMM UBS CARAPANATUBA,CARAPANATUBA,2,CARAPANATUBA,"CARAPANATUBA, CARAPANATUBA, MACAPA, AP, BRASIL",-0.8401200000000001,-52.51206,"Avenida Carapanaúba, 68924-000, Laranjal do Jari","0 50m 24.432s S, 52 30m 43.416s W"
AP,MACAPA,PMM U B S DR MARCELO CANDIA,RUA VEREADOR JULIO MARIA P PEREIRA,1329,JARDIM FELICIDADE I,"RUA VEREADOR JULIO MARIA P PEREIRA, JARDIM FELICIDADE I, MACAPA, AP, BRASIL",0.08561,-51.06432,"Rua Vereador Júlio Maria Pinto Pereira, 68909-000, Macapá","0 5m 8.196s N, 51 3m 51.552s W"
AP,MACAPA,PMM UBS ILHA REDONDA,COMUNIDADE DE ILHA REDONDA,S/N,CENTRO,"COMUNIDADE DE ILHA REDONDA, CENTRO, MACAPA, AP, BRASIL",0.06025,-51.1001,"Rua Jesus de Nazaré Lot Ilha Mirim, 68903, Macapá","0 3m 36.9s N, 51 6m 0.36s W"
AP,MACAPA,PMM P S LIBERDADE DO PACUI,LIBERDADE DO PACUI,1,PACUI,"LIBERDADE DO PACUI, PACUI, MACAPA, AP, BRASIL",0.8150895,-50.7192793,"Liberdade, São Joaquim do Pacuí, Macapá, Região Geográfica Imediata de Macapá, Região Geográfica Intermediária de Macapá, Amapá, Região Norte, Brasil","0 48m 54.3222s N, 50 43m 9.40548s W"
AP,MACAPA,UNIDADE BASICA DE SAUDE DA UNIFAP,RUA AMADEU GAMA,1373,JARDIM MARCO ZERO,"RUA AMADEU GAMA, JARDIM MARCO ZERO, MACAPA, AP, BRASIL",-0.00353,-51.089,"Rua Amadeu Gama, 68903-230, Macapá","0 0m 12.708s S, 51 5m 20.4s W"
AP,MACAPA,PMM U B S VILA PROGR DO BAILIQUE,DISTRITO DO BAILIQUE,1,BAILIQUE,"DISTRITO DO BAILIQUE, BAILIQUE, MACAPA, AP, BRASIL",-15.79331,-47.85062,"Estrada Acampamento Pacheco Fernandes, 70802, 70803, 70804, 73340, Brasília","15 47m 35.916s S, 47 51m 2.232s W"
AP,MACAPA,PMM P S TORRAO DO MATAPI,MATAPI,1,MATAPI,"MATAPI, MATAPI, MACAPA, AP, BRASIL",0.02856,-51.05236,"Rua Rio Matapi, 68900-093, Macapá","0 1m 42.816s N, 51 3m 8.496s W"
AP,MACAPA,PMM U B S DR ALVARO P CORREA,AVENIDA ARMANDO TUPA DE ABREU,110,SAO LAZARO,"AVENIDA ARMANDO TUPA DE ABREU, SAO LAZARO, MACAPA, AP, BRASIL",0.0750611,-51.0574876,"Avenida Armando Tupã de Abreu, São Lázaro, Macapá, Região Geográfica Imediata de Macapá, Região Geográfica Intermediária de Macapá, Amapá, Região Norte, 68908-910, Brasil","0 4m 30.22s N, 51 3m 26.9554s W"
AP,MACAPA,PMM P S SAO FRANC DO ALTO,SAO FRANCISCO DO ALTO DO PACUI,1,PACUI,"SAO FRANCISCO DO ALTO DO PACUI, PACUI, MACAPA, AP, BRASIL",-29.09767,-53.21425,"Rua São Francisco, 99440-000, Salto do Jacuí","29 5m 51.612s S, 53 12m 51.3s W"
AP,MACAPA,PMM U B S SANTO ANT DA PEDREIRA,SANTO ANTONIO DA PEDREIRA,1,SANTANTPEDREIRA,"SANTO ANTONIO DA PEDREIRA, SANTANTPEDREIRA, MACAPA, AP, BRASIL",0.04673,-51.04862,"Rua Antônio Pereira da Costa de Sousa, 68905, Macapá","0 2m 48.228s N, 51 2m 55.032s W"
AP,MACAPA,PMM U B S TESSALONICA,DISTRITO DO MARUANUM,1,DISTRITO DO MARUANUM,"DISTRITO DO MARUANUM, DISTRITO DO MARUANUM, MACAPA, AP, BRASIL",-15.79331,-47.85062,"Estrada Acampamento Pacheco Fernandes, 70802, 70803, 70804, 73340, Brasília","15 47m 35.916s S, 47 51m 2.232s W"
AP,MACAPA,PMM U B S DOS CONGOS,AVN CLAUDOMIRO DE MORAES,340,CONGOS,"AVN CLAUDOMIRO DE MORAES, CONGOS, MACAPA, AP, BRASIL",0.01116,-51.08713,"Rua Claudomiro de Moraes, 68904, Macapá","0 0m 40.176s N, 51 5m 13.668s W"
AP,MACAPA,PMM P S FOZ DO MACACOARI II,MACACOARIBAILIQUE,S/N,AREA RURAL,"MACACOARIBAILIQUE, AREA RURAL, MACAPA, AP, BRASIL",0.03585,-51.06221,Macapá,"0 2m 9.06s N, 51 3m 43.956s W"
AP,MACAPA,PMM P S DO MARUANUM II,DISTRITO DE MACAPA,1,MARUANUM,"DISTRITO DE MACAPA, MARUANUM, MACAPA, AP, BRASIL",0.05224,-51.07349,"Jesus de Nazaré, Macapá","0 3m 8.064s N, 51 4m 24.564s W"
AP,MACAPA,PMM U B S DO CURIAU,CURIAU,1,CURIAU,"CURIAU, CURIAU, MACAPA, AP, BRASIL",0.1269596,-51.0574271,"Rodovia Antônio Gomes Picanço, Curiaú, Macapá, Região Geográfica Imediata de Macapá, Região Geográfica Intermediária de Macapá, Amapá, Região Norte, 68909-173, Brasil","0 7m 37.0546s N, 51 3m 26.7376s W"
AP,MACAPA,PMM UBS CIDADE NOVA,RUA BEIRA RIO,518,CIDADE NOVA I,"RUA BEIRA RIO, CIDADE NOVA I, MACAPA, AP, BRASIL",0.0518554,-51.0419163,"Rua Beira Rio, Cidade Nova, Macapá, Região Geográfica Imediata de Macapá, Região Geográfica Intermediária de Macapá, Amapá, Região Norte, 68900-098, Brasil","0 3m 6.67944s N, 51 2m 30.8987s W"
AP,MACAPA,PMM P S ARRAIOL DO BAILIQUE,BAILIQUE,1,BAILIQUE,"BAILIQUE, BAILIQUE, MACAPA, AP, BRASIL",0.9835531,-50.0745281,"Bailique, Macapá, Região Geográfica Imediata de Macapá, Região Geográfica Intermediária de Macapá, Amapá, Região Norte, Brasil","0 59m 0.79116s N, 50 4m 28.3012s W"
AP,MACAPA,PMM P S LIMAO DO CURUA,LIMAO DO CURUA BAILIQUE,1,LIMAO DO CURUA,"LIMAO DO CURUA BAILIQUE, LIMAO DO CURUA, MACAPA, AP, BRASIL",0.7625697499999999,-50.16833258898854,"Igarapé do Limão, Braço dos Pretos, Bailique, Macapá, Região Geográfica Imediata de Macapá, Região Geográfica Intermediária de Macapá, Amapá, Região Norte, Brasil","0 45m 45.2511s N, 50 10m 5.99732s W"
AP,MACAPA,PMM U B S DR LELIO SILVA,RUA JOSE VALENTE DOS SANTOS,126,NOVO BURITIZAL,"RUA JOSE VALENTE DOS SANTOS, NOVO BURITIZAL, MACAPA, AP, BRASIL",0.0213359,-51.079325,"Rua José Valente dos Santos, Novo Buritizal, Macapá, Região Geográfica Imediata de Macapá, Região Geográfica Intermediária de Macapá, Amapá, Região Norte, 68904-250, Brasil","0 1m 16.8092s N, 51 4m 45.57s W"
AP,MACAPA,PMM U B S PEDRO BARROS MONTEIRO,PASSAGEM DONA MARCIA,445,DISTRITO DE FAZENDIN,"PASSAGEM DONA MARCIA, DISTRITO DE FAZENDIN, MACAPA, AP, BRASIL",-0.05264,-51.11421,"Passagem Dona Marcia, 68911-155, Macapá","0 3m 9.504s S, 51 6m 51.156s W"
AP,MACAPA,PMM U B S DR RUBIM B ARONOVITCH,AVENIDA SEIS DE SETEMBRO,212,SANTA INES,"AVENIDA SEIS DE SETEMBRO, SANTA INES, MACAPA, AP, BRASIL",0.0228279,-51.0590905,"Avenida 6 de Setembro, Santa Inês, Macapá, Região Geográfica Imediata de Macapá, Região Geográfica Intermediária de Macapá, Amapá, Região Norte, 68902-080, Brasil","0 1m 22.1804s N, 51 3m 32.7258s W"
AP,MACAPA,PMM UBS ABACATE DA PEDREIRA,PEDREIRA,1,PEDREIRA,"PEDREIRA, PEDREIRA, MACAPA, AP, BRASIL",0.3455675,-50.8719005,"Pedreira do Abacate, Macapá, Região Geográfica Imediata de Macapá, Região Geográfica Intermediária de Macapá, Amapá, Região Norte, Brasil","0 20m 44.043s N, 50 52m 18.8418s W"
AP,MACAPA,PMM P S FREGUESIA DO BAILIQUE,BAILIQUE,1,BAILIQUE,"BAILIQUE, BAILIQUE, MACAPA, AP, BRASIL",0.9835531,-50.0745281,"Bailique, Macapá, Região Geográfica Imediata de Macapá, Região Geográfica Intermediária de Macapá, Amapá, Região Norte, Brasil","0 59m 0.79116s N, 50 4m 28.3012s W"
AP,MACAPA,PMM U B S L B FONTOURA,RUA INSPETOR AIMORES,191,JARDIM MARCO ZERO,"RUA INSPETOR AIMORES, JARDIM MARCO ZERO, MACAPA, AP, BRASIL",-0.00278,-51.0968,"Rua Inspetor Antônio Oliveira, 68903, Macapá","0 0m 10.008s S, 51 5m 48.48s W"
AP,MACAPA,UBS MARIANA SOUZA PEREIRA DE BARROS,PEDREIRA,1,DISTRITO DA PEDREIRA,"PEDREIRA, DISTRITO DA PEDREIRA, MACAPA, AP, BRASIL",0.07212,-51.04611,"Avenida Marlon da Silva Pereira, 68907-313, Macapá","0 4m 19.632s N, 51 2m 45.996s W"
AP,MACAPA,PMM P S SAO TOME,DISTRITO DO PACUI,1,PACUI,"DISTRITO DO PACUI, PACUI, MACAPA, AP, BRASIL",-16.5375,-44.53358,"Rua Antônio Paulo Leocádio, 39365-000, São João do Pacuí","16 32m 15s S, 44 32m 0.888s W"
AP,MACAPA,PMM U B S DAS PEDRINHAS,RUA JOAO CASTRO SUSSUARANA,1,JARDIM EQUATORIAL,"RUA JOAO CASTRO SUSSUARANA, JARDIM EQUATORIAL, MACAPA, AP, BRASIL",0.00732,-51.0691,"Avenida João de Castro Sussuarana, 68903-006, Macapá","0 0m 26.352s N, 51 4m 8.76s W"
AP,MACAPA,PMM UBS TRACAJATUBA I,TRACAJATUBA I PACUI,1,PACUI,"TRACAJATUBA I PACUI, PACUI, MACAPA, AP, BRASIL",0.6438216999999999,-50.6701917,"Tracajatuba 3, São Joaquim do Pacuí, Macapá, Região Geográfica Imediata de Macapá, Região Geográfica Intermediária de Macapá, Amapá, Região Norte, Brasil","0 38m 37.7581s N, 50 40m 12.6901s W"
AP,MACAPA,PMM P S DO CANTAZAL,CANTAZAL DO PACUI,1,CANTAZAL DO PACUI,"CANTAZAL DO PACUI, CANTAZAL DO PACUI, MACAPA, AP, BRASIL",-16.53471,-44.52896,São João do Pacuí,"16 32m 4.956s S, 44 31m 44.256s W"
AP,MACAPA,PMM U B S INFRAERO II,AVENIDA CARLOS LINS CORTES,161,INFRAERO II,"AVENIDA CARLOS LINS CORTES, INFRAERO II, MACAPA, AP, BRASIL",0.0707808,-51.0834365,"Avenida Carlos Lins Cortês, Infraero II, Macapá, Região Geográfica Imediata de Macapá, Região Geográfica Intermediária de Macapá, Amapá, Região Norte, 68908-074, Brasil","0 4m 14.8109s N, 51 5m 0.3714s W"
AP,MACAPA,PMM U B S SAO PEDRO DOS BOIS,COMUNIDADE SAO PEDRO DOS BOIS,1,DISTRITO DA PEDREIRA,"COMUNIDADE SAO PEDRO DOS BOIS, DISTRITO DA PEDREIRA, MACAPA, AP, BRASIL",-29.09126,-53.83649000000001,"Rua São Pedro, 98170-000, Tupanciretã","29 5m 28.536s S, 53 50m 11.364s W"
AP,MACAPA,PMM U B S CONCEICAO R MOITA,AVENIDA RAIMUNDO PEQUILO GOES DE ALMEIDA,294,NOVA ESPERANCA,"AVENIDA RAIMUNDO PEQUILO GOES DE ALMEIDA, NOVA ESPERANCA, MACAPA, AP, BRASIL",0.031587,-51.08224420000001,"Avenida Raimundo Almeida, Nova Esperança, Macapá, Região Geográfica Imediata de Macapá, Região Geográfica Intermediária de Macapá, Amapá, Região Norte, 68900-000, Brasil","0 1m 53.7132s N, 51 4m 56.0791s W"
AP,MACAPA,PMM P S ARIRI,MARUANUM,1,DISTRITO DO MARUANUM,"MARUANUM, DISTRITO DO MARUANUM, MACAPA, AP, BRASIL",-15.79331,-47.85062,"Estrada Acampamento Pacheco Fernandes, 70802, 70803, 70804, 73340, Brasília","15 47m 35.916s S, 47 51m 2.232s W"
AP,MACAPA,PMM U B S NOVO HORIZONTE,AV ALVARO CARVALHO BARBOSA,2246,NOVO HORIZONTE I,"AV ALVARO CARVALHO BARBOSA, NOVO HORIZONTE I, MACAPA, AP, BRASIL",0.0895704,-51.0550726,"Avenida Álvaro Carvalho Barbosa, Novo Horizonte, Macapá, Região Geográfica Imediata de Macapá, Região Geográfica Intermediária de Macapá, Amapá, Região Norte, 68908-910, Brasil","0 5m 22.4534s N, 51 3m 18.2614s W"
AP,MAZAGAO,PM MZG POSTO DE SAUDE PANCADA DO CAMAIPI,COMUNIDADE PANCADA DO CAMAIPI,1,CPDO CAMAIPI,"COMUNIDADE PANCADA DO CAMAIPI, CPDO CAMAIPI, MAZAGAO, AP, BRASIL",,,,
AP,MAZAGAO,PM MZG UBS MARIA HELENA COSTA DE SOUZA,LOCALIDADE VILA DO MARACA,1,C V DO MARACA,"LOCALIDADE VILA DO MARACA, C V DO MARACA, MAZAGAO, AP, BRASIL",-22.87096,-43.23422,"Rua C Vila do João, Rio de Janeiro","22 52m 15.456s S, 43 14m 3.192s W"
AP,MAZAGAO,PM MZG UBS DR SILAS SALGADO,VILA DO CARVAO,1,VILA DO CARVAO,"VILA DO CARVAO, VILA DO CARVAO, MAZAGAO, AP, BRASIL",-12.99379,-38.51092,"Vila do Carvão, 40100-015, Salvador","12 59m 37.644s S, 38 30m 39.312s W"
AP,MAZAGAO,PM MZG POSTO DE SAUDE FOZ DO MAZAGAO VELHO,VILA FOZ DO MAZAGAO VELHO,1,V F DO M VELHO,"VILA FOZ DO MAZAGAO VELHO, V F DO M VELHO, MAZAGAO, AP, BRASIL",-15.79331,-47.85062,"Estrada Acampamento Pacheco Fernandes, 70802, 70803, 70804, 73340, Brasília","15 47m 35.916s S, 47 51m 2.232s W"
