UF,MUNICIPIO,ESTABELECIMENTO,LOGRADOURO,NUMERO,BAIRRO,ENDERECO_COMPLETO,latitude,longitude,address,point
PE,QUIXABA,PSF MARIA DAS DORES PEREIRA DE CARVALHO,RUA BENEDITO PEREIRA DE CARVALHO,S/N,CENTRO,"RUA BENEDITO PEREIRA DE CARVALHO, CENTRO, QUIXABA, PE, BRASIL",,,,
PE,QUIXABA,PSF ANTONIA RAINHA DE FRANCA,SITIO SANTA CRUZ,100,ZONA RURAL,"SITIO SANTA CRUZ, ZONA RURAL, QUIXABA, PE, BRASIL",,,,
PE,QUIXABA,PSF JOSE JACINTO FERREIRA,SITIO RIACHO DO MEIO,100,SITIO RICHO DO MEIO,"SITIO RIACHO DO MEIO, SITIO RICHO DO MEIO, QUIXABA, PE, BRASIL",,,,
PE,RECIFE,US 378 USF JARDIM TERESOPOLIS,RUA EXPEDICIONARIO ANTONIO ROMANO,180,VARZEA,"RUA EXPEDICIONARIO ANTONIO ROMANO, VARZEA, RECIFE, PE, BRASIL",,,,
PE,RECIFE,US 403 USF UPINHA DIA CHIE,AV AGAMENON MAGALHAES,S/N,CAMPO GRANDE,"AV AGAMENON MAGALHAES, CAMPO GRANDE, RECIFE, PE, BRASIL",,,,
PE,RECIFE,US 241 USF COELHOS II,DR JOSE MARIANO,699,COELHOS,"DR JOSE MARIANO, COELHOS, RECIFE, PE, BRASIL",,,,
PE,RECIFE,US 339 USF ALTO DO CAPITAO,TUPIRACABA,S/N,DOIS UNIDOS,"TUPIRACABA, DOIS UNIDOS, RECIFE, PE, BRASIL",,,,
PE,RECIFE,US 183 USF SITIO DOS MACACOS,ESTRADA DOS MACACOS,47,GUABIRABA,"ESTRADA DOS MACACOS, GUABIRABA, RECIFE, PE, BRASIL",,,,
PE,RECIFE,US 324 USF ALTO JOSE BONIFACIO,RUA VISC DE SA BANDEIRA,S/N,ALTO JOSE BONIFACIO,"RUA VISC DE SA BANDEIRA, ALTO JOSE BONIFACIO, RECIFE, PE, BRASIL",,,,
PE,RECIFE,US 270 USF MONTE VERDE,AV CHAPADA DO ARARIPE,116,COHAB,"AV CHAPADA DO ARARIPE, COHAB, RECIFE, PE, BRASIL",,,,
PE,RECIFE,US 266 USF MANGUEIRA II,RUA FELICIANO CASTILHO,64,MANGUEIRA,"RUA FELICIANO CASTILHO, MANGUEIRA, RECIFE, PE, BRASIL",,,,
PE,RECIFE,US 216 USF APIPUCOS,RUA CORONEL JOAO BATISTA DO REGO BARROS,56,APIPUCOS,"RUA CORONEL JOAO BATISTA DO REGO BARROS, APIPUCOS, RECIFE, PE, BRASIL",,,,
PE,RECIFE,US 232 USF ILHA SANTA TEREZINHA,RUA ARTEMIS,9,SANTO AMARO,"RUA ARTEMIS, SANTO AMARO, RECIFE, PE, BRASIL",,,,
PE,RECIFE,US 346 USF ALTO DA JAQUEIRA,RUA 22 DE AGOSTO,S/N,JORDAO,"RUA 22 DE AGOSTO, JORDAO, RECIFE, PE, BRASIL",,,,
PE,RECIFE,US 314 USF RIO DA PRATA,RUA RIO DA PRATA,455,IBURA,"RUA RIO DA PRATA, IBURA, RECIFE, PE, BRASIL",,,,
PE,RECIFE,US 287 USF ALTO JOSE DO PINHO,RUA MARAGOGI,5,ALTO JOSE DO PINHO,"RUA MARAGOGI, ALTO JOSE DO PINHO, RECIFE, PE, BRASIL",,,,
PE,RECIFE,US 397 USF UPINHA DIA CORREGO DO EUCLIDES,RUA CORREGO DO EUCLIDES,309,ALTO JOSE BONIFACIO,"RUA CORREGO DO EUCLIDES, ALTO JOSE BONIFACIO, RECIFE, PE, BRASIL",,,,
PE,RECIFE,US 291 USF ALTO DOS COQUEIROS CORREGO DA JAQUEIRA,RUA CORREGO DA JAQUEIRA,160,LINHA DO TIRO,"RUA CORREGO DA JAQUEIRA, LINHA DO TIRO, RECIFE, PE, BRASIL",,,,
PE,RECIFE,US 120 CS MARIO MONTEIRO MELO,RUA NOVA DESCOBERTA,99,NOVA DESCOBERTA,"RUA NOVA DESCOBERTA, NOVA DESCOBERTA, RECIFE, PE, BRASIL",,,,
PE,RECIFE,US 292 USF VILA DO IPSEP,RUA VIRGINIA HERACLIO,S/N,IPSEP,"RUA VIRGINIA HERACLIO, IPSEP, RECIFE, PE, BRASIL",,,,
PE,RECIFE,US 322 UNIDADE DE CUIDADOS INTEGRAIS GUILHERME ABATH,RUA CARLOS FERNANDES,73,HIPODROMO,"RUA CARLOS FERNANDES, HIPODROMO, RECIFE, PE, BRASIL",,,,
PE,RECIFE,US 331 USF PROF AMAURY DE MEDEIROS,RUA RORAIMA,102,UR 07 VARZEA,"RUA RORAIMA, UR 07 VARZEA, RECIFE, PE, BRASIL",,,,
PE,RECIFE,US 298 USF JORDAO ALTO,AV DONA CARENTINA,S/N,JORDAO,"AV DONA CARENTINA, JORDAO, RECIFE, PE, BRASIL",,,,
PE,RECIFE,PRESIDIO ASP MARCELO FRANCISCO ARAUJO,LIBERDADE,S/N,SANCHO,"LIBERDADE, SANCHO, RECIFE, PE, BRASIL",,,,
PE,RECIFE,US 126 CS VER ROMILDO GOMES,RUA JALISCO,S/N,IMBIRIBEIRA,"RUA JALISCO, IMBIRIBEIRA, RECIFE, PE, BRASIL",,,,
PE,RECIFE,US 300 USF DR GERALDO BARRETO CAMPELO SAN MARTIN,RUA COMENDADOR FRANCO FERREIRA,S/N,SAN MARTIN,"RUA COMENDADOR FRANCO FERREIRA, SAN MARTIN, RECIFE, PE, BRASIL",,,,
PE,RECIFE,US 106 CS PROF JOAQUIM CAVALCANTE,ESTRADA DO FORTE DO ARRAIAL NOVO DO BOM JESUS,1350,TORROES,"ESTRADA DO FORTE DO ARRAIAL NOVO DO BOM JESUS, TORROES, RECIFE, PE, BRASIL",,,,
PE,RECIFE,US 278 USF NOSSA SRA DO PILAR BAIRRO DO RECIFE,RUA DO BRUM BR UM,339,RECIFE,"RUA DO BRUM BR UM, RECIFE, RECIFE, PE, BRASIL",,,,
PE,RECIFE,US 280 USF SITIO CARDOSO,RUA PADRE LANDIM,342,MADALENA,"RUA PADRE LANDIM, MADALENA, RECIFE, PE, BRASIL",,,,
PE,RECIFE,US 297 USF DO PINA,RUA BARREIROS,120,PINA,"RUA BARREIROS, PINA, RECIFE, PE, BRASIL",,,,
PE,RECIFE,US 338 USF UPINHA DIA JARDIM SAO PAULO,PRACA JARDIM SAO PAULO,S/N,JARDIM SAO PAULO,"PRACA JARDIM SAO PAULO, JARDIM SAO PAULO, RECIFE, PE, BRASIL",,,,
PE,RECIFE,US 152 CS INA ROSA BORGES,RUA SENADOR MILTON CAMPOS,S/N,VASCO DA GAMA,"RUA SENADOR MILTON CAMPOS, VASCO DA GAMA, RECIFE, PE, BRASIL",,,,
PE,RECIFE,US 351 USF PAZ E AMOR,RUA SENADOR POMPEU,40,IBURA DE BAIXO,"RUA SENADOR POMPEU, IBURA DE BAIXO, RECIFE, PE, BRASIL",,,,
PE,RECIFE,US 302 USF BYRON SARINHO,RUA NAZARE,293,AGUA FRIA,"RUA NAZARE, AGUA FRIA, RECIFE, PE, BRASIL",,,,
PE,RECIFE,COLONIA PENAL FEMININA DO RECIFE,BOM PASTOR,1407,ENGENHO DO MEIO,"BOM PASTOR, ENGENHO DO MEIO, RECIFE, PE, BRASIL",,,,
PE,RECIFE,US 342 USF DJALMA HOLANDA CAVALCANTE,RUA DELFIN,87,BRASILIA TEIMOSA,"RUA DELFIN, BRASILIA TEIMOSA, RECIFE, PE, BRASIL",,,,
PE,RECIFE,US 226 USF CHAO DE ESTRELAS,RUA DR ELIAS GOMES,65,CAMPINA DO BARRETO,"RUA DR ELIAS GOMES, CAMPINA DO BARRETO, RECIFE, PE, BRASIL",,,,
PE,RECIFE,US 251 USF DA GUABIRABA,AV VER OTACILIO AZEVEDO,115,ALTO JOSE BONIFACIO,"AV VER OTACILIO AZEVEDO, ALTO JOSE BONIFACIO, RECIFE, PE, BRASIL",,,,
PE,RECIFE,US 224 USF CARANGUEIJO,RUA CAMPOS TABAIARES,297,ILHA DO RETIRO,"RUA CAMPOS TABAIARES, ILHA DO RETIRO, RECIFE, PE, BRASIL",,,,
PE,RECIFE,US 345 USF PLANETA DOS MACACOS I,RUA 04 DE SETEMBRO,145,CURADO,"RUA 04 DE SETEMBRO, CURADO, RECIFE, PE, BRASIL",,,,
PE,RECIFE,US 168 CTA CENTRO DE TESTAGEM E ACONSELHAMENTO,LARGO DA SANTA CRUZ,S/N,BOA VISTA,"LARGO DA SANTA CRUZ, BOA VISTA, RECIFE, PE, BRASIL",,,,
PE,RECIFE,US 234 USF RODA DE FOGO COSIROF,RUA EDVALDO MARANHAO FERREIRA,135,TORROES,"RUA EDVALDO MARANHAO FERREIRA, TORROES, RECIFE, PE, BRASIL",,,,
PE,RECIFE,US 248 USF BARREIRAS,RUA AGUA CLARA,145,VARZEA,"RUA AGUA CLARA, VARZEA, RECIFE, PE, BRASIL",,,,
PE,RECIFE,US 395 USF UPINHA 24H DR FERNANDA WANDERLEY,AV URIEL DE HOLANDA,S/N,LINHA DO TIRO,"AV URIEL DE HOLANDA, LINHA DO TIRO, RECIFE, PE, BRASIL",,,,
PE,RECIFE,US 233 USF VIETNA,RUA VINTE E UM DE ABRIL,3677,TORROES,"RUA VINTE E UM DE ABRIL, TORROES, RECIFE, PE, BRASIL",,,,
PE,RECIFE,US 249 USF SANTANA,RUA DONA OLEGARINA DA CUNHA,333,POCO,"RUA DONA OLEGARINA DA CUNHA, POCO, RECIFE, PE, BRASIL",,,,
PE,RECIFE,US 237 USF SITIO DAS PALMEIRAS,RUA FELIXLANDIA,176,CORDEIRO,"RUA FELIXLANDIA, CORDEIRO, RECIFE, PE, BRASIL",,,,
PE,RECIFE,US 344 USF JIQUIA I E II,RUA PADRE ROQUE,33,JIQUIA,"RUA PADRE ROQUE, JIQUIA, RECIFE, PE, BRASIL",,,,
PE,RECIFE,US 247 USF ROSA SELVAGEM,RUA PRF OTAVIO TAVARES,30,VARZEA,"RUA PRF OTAVIO TAVARES, VARZEA, RECIFE, PE, BRASIL",,,,
PE,RECIFE,US 239 USF COQUEIRAL I E II,RUA MARIA TERESA,174,COQUEIRAL,"RUA MARIA TERESA, COQUEIRAL, RECIFE, PE, BRASIL",,,,
PE,RECIFE,US 350 USF CORREGO DO EUCALIPTO,RUA TEREZA CARNEIRO,26,MACAXEIRA,"RUA TEREZA CARNEIRO, MACAXEIRA, RECIFE, PE, BRASIL",,,,
PE,RECIFE,US 113 CS DR ARISTARCO AZEVEDO,RUA BAHIA,29,JORDAO,"RUA BAHIA, JORDAO, RECIFE, PE, BRASIL",,,,
PE,RECIFE,US 312 USF VILA DO SESI,RUA PROF FERNANDO MOTA,217,IBURA,"RUA PROF FERNANDO MOTA, IBURA, RECIFE, PE, BRASIL",,,,
PE,RECIFE,US 326 USF JADER DE ANDRADE COMUNIDADE ENTRA APULSO,RUA CEL ANIZIO RODRIGUES COELHO,8,BOA VIAGEM,"RUA CEL ANIZIO RODRIGUES COELHO, BOA VIAGEM, RECIFE, PE, BRASIL",,,,
PE,RECIFE,US 243 USF SANTO AMARO II,RUA BUARQUE DE MACEDO,65,SANTO AMARO,"RUA BUARQUE DE MACEDO, SANTO AMARO, RECIFE, PE, BRASIL",,,,
PE,RECIFE,US 317 USF ALTO DA BELA VISTA,RUA DERMEVAL LOBAO,672,IBURA,"RUA DERMEVAL LOBAO, IBURA, RECIFE, PE, BRASIL",,,,
PE,RECIFE,US 242 USF SANTO AMARO I SITIO DO CEU,RUA ANCHIETA,520,SANTO AMARO,"RUA ANCHIETA, SANTO AMARO, RECIFE, PE, BRASIL",,,,
PE,RECIFE,US 281 USF VILA DOS MILAGRES,RUA DAS FLORES,60,IBURA,"RUA DAS FLORES, IBURA, RECIFE, PE, BRASIL",,,,
PE,RECIFE,PRESIDIO FREI DAMIAO DE BOZZANO,ORFEU DO CARNAVAL,S/N,SANCHO,"ORFEU DO CARNAVAL, SANCHO, RECIFE, PE, BRASIL",,,,
PE,RECIFE,US 218 USF COQUE,RUA GUAPIRAMA,65,ILHA JOANA BEZERRA,"RUA GUAPIRAMA, ILHA JOANA BEZERRA, RECIFE, PE, BRASIL",,,,
PE,RECIFE,US 117 CS GASPAR REGUEIRA COSTA,RUA PADRE DIOGO RODRIGUES,144,BARRO,"RUA PADRE DIOGO RODRIGUES, BARRO, RECIFE, PE, BRASIL",,,,
PE,RECIFE,US 119 CS PROF JOSE CARNEIRO LEAO,RUA MARQUES DE ALEGRETE,S/N,PINA,"RUA MARQUES DE ALEGRETE, PINA, RECIFE, PE, BRASIL",,,,
PE,RECIFE,US 148 CS DOM MIGUEL DE LIMA VALVERDE,RUA FELICIANO JOSE DE FARIAS,195,BOA VIAGEM,"RUA FELICIANO JOSE DE FARIAS, BOA VIAGEM, RECIFE, PE, BRASIL",,,,
PE,RECIFE,US 187 USF ILHA DE DEUS,RUA SAO JOSE,S/N,IMBIRIBEIRA,"RUA SAO JOSE, IMBIRIBEIRA, RECIFE, PE, BRASIL",,,,
PE,RECIFE,US 184 USF VILA UNIAO,RUA NOVA ALIANCA,S/N,IPUTINGA,"RUA NOVA ALIANCA, IPUTINGA, RECIFE, PE, BRASIL",,,,
PE,RECIFE,US 309 USF PONTO DE PARADA,AV BEBERIBE,419,ENCRUZILHADA,"AV BEBERIBE, ENCRUZILHADA, RECIFE, PE, BRASIL",,,,
PE,RECIFE,US 305 USF DA MACAXEIRA,RUA MARIA CANDIDA,87,MACAXEIRA,"RUA MARIA CANDIDA, MACAXEIRA, RECIFE, PE, BRASIL",,,,
PE,RECIFE,US 269 USF BEIRA DO RIO COMUNIDADE BOA VIAGEM,RUA RIBEIRO DE BRITO,1361,BOA VIAGEM,"RUA RIBEIRO DE BRITO, BOA VIAGEM, RECIFE, PE, BRASIL",,,,
PE,RECIFE,US 103 CS PROF MARIO RAMOS,RUA OSCAR DE BARROS,S/N,CASA AMARELA,"RUA OSCAR DE BARROS, CASA AMARELA, RECIFE, PE, BRASIL",,,,
PE,RECIFE,US 123 CS PROF CESAR MONTEZUMA,CAIS DO APOLO,925,RECIFE,"CAIS DO APOLO, RECIFE, RECIFE, PE, BRASIL",,,,
PE,RECIFE,US 240 USF COELHOS I,RUA BITURUNA,110,COELHOS,"RUA BITURUNA, COELHOS, RECIFE, PE, BRASIL",,,,
PE,RECIFE,US 273 USF BIANOR TEODOSIO,AV HILDEBRANDO DE VASCONCELOS,S/N,DOIS UNIDOS,"AV HILDEBRANDO DE VASCONCELOS, DOIS UNIDOS, RECIFE, PE, BRASIL",,,,
PE,RECIFE,US 279 USF PASSARINHO ALTO,RUA DAS ROSAS,120,PASSARINHO,"RUA DAS ROSAS, PASSARINHO, RECIFE, PE, BRASIL",,,,
PE,RECIFE,US 274 USF TIA REGINA,RUA CORREGO DO DEODATO,315,AGUA FRIA,"RUA CORREGO DO DEODATO, AGUA FRIA, RECIFE, PE, BRASIL",,,,
PE,RECIFE,US 171 CS JOAQUIM COSTA CARVALHO,RUA SIRIJI,S/N,ALTO DO MANDU,"RUA SIRIJI, ALTO DO MANDU, RECIFE, PE, BRASIL",,,,
PE,RECIFE,US 154 USF UPINHA DIA RIO DA PRATA,RUA RIO PAJEU,S/N,IBURA,"RUA RIO PAJEU, IBURA, RECIFE, PE, BRASIL",,,,
PE,RECIFE,US 276 USF UPINHA DIA ALTO DO PASCOAL,AV ANIBAL BENEVOLO,S/N,LINHA DO TIRO,"AV ANIBAL BENEVOLO, LINHA DO TIRO, RECIFE, PE, BRASIL",,,,
PE,RECIFE,US 327 USF CLUBE DOS DELEGADOS,RUA JOAO CAVALCANTI PETRIBU,S/N,DOIS UNIDOS,"RUA JOAO CAVALCANTI PETRIBU, DOIS UNIDOS, RECIFE, PE, BRASIL",,,,
PE,RECIFE,US 261 USF ALTO DO EUCALIPTO,RUA CAMBORIU,S/N,VASCO DA GAMA,"RUA CAMBORIU, VASCO DA GAMA, RECIFE, PE, BRASIL",,,,
PE,RECIFE,US 221 USF ILHA DE JOANEIRO,RUA MARECHAL DEODORO,688,CAMPO GRANDE,"RUA MARECHAL DEODORO, CAMPO GRANDE, RECIFE, PE, BRASIL",,,,
PE,RECIFE,US 400 USF UPINHA DIA DOM HELDER,RUA GRIJALVA COSTA,S/N,BREJO DE BEBERIBE,"RUA GRIJALVA COSTA, BREJO DE BEBERIBE, RECIFE, PE, BRASIL",,,,
PE,RECIFE,US 173 USF DANCING DAYS,RUA DANCING DAYS,109,IMBIRIBEIRA,"RUA DANCING DAYS, IMBIRIBEIRA, RECIFE, PE, BRASIL",,,,
PE,RECIFE,US 236 USF RODA DE FOGO MACAE,RUA MACAE,S/N,TORROES,"RUA MACAE, TORROES, RECIFE, PE, BRASIL",,,,
PE,RECIFE,US 225 USF SKYLAB II,RUA ITAPIRANGA,791,IPUTINGA,"RUA ITAPIRANGA, IPUTINGA, RECIFE, PE, BRASIL",,,,
PE,RECIFE,US 229 USF UR 10,AV MONTE ALEGRE,132,COHAB,"AV MONTE ALEGRE, COHAB, RECIFE, PE, BRASIL",,,,
PE,RECIFE,US 252 USF ENGENHO DO MEIO,RUA JOSE DOS SANTOS,312,ENGENHO DO MEIO,"RUA JOSE DOS SANTOS, ENGENHO DO MEIO, RECIFE, PE, BRASIL",,,,
PE,RECIFE,US 256 USF PASSARINHO BAIXO,RUA CANARIO,200,PASSARINHO,"RUA CANARIO, PASSARINHO, RECIFE, PE, BRASIL",,,,
PE,RECIFE,US 254 USF BRASILIT,RUA EMILIANO BRAGA,S/N,VARZEA,"RUA EMILIANO BRAGA, VARZEA, RECIFE, PE, BRASIL",,,,
PE,RECIFE,US 341 USF PROF FERNANDO FIGUEIRA,RUA BANDEIRANTE RAPOSO TAVARES,S/N,IBURA,"RUA BANDEIRANTE RAPOSO TAVARES, IBURA, RECIFE, PE, BRASIL",,,,
PE,RECIFE,US 393 USF UPINHA DIA BONGI NOVO PRADO,RUA ISAAC MARKMAN,100,BONGI,"RUA ISAAC MARKMAN, BONGI, RECIFE, PE, BRASIL",,,,
PE,RECIFE,US 182 USF POCO DA PANELA,RUA REAL DO POCO,S/N,POCO,"RUA REAL DO POCO, POCO, RECIFE, PE, BRASIL",,,,
PE,RECIFE,US 228 USF UPINHA DIA DES JOSE MANOEL DE FREITAS UR 4UR 5,RUA CAPITAO VICENTE CURADO,33,COHAB,"RUA CAPITAO VICENTE CURADO, COHAB, RECIFE, PE, BRASIL",,,,
PE,RECIFE,US 286 USF IRMA TEREZINHA,RUA DA CONSOLACAO,9,PEIXINHOS,"RUA DA CONSOLACAO, PEIXINHOS, RECIFE, PE, BRASIL",,,,
PE,RECIFE,US 399 USF UPINHA DIA NOVO JIQUIA,RUA BIGUACU,10,JIQUIA,"RUA BIGUACU, JIQUIA, RECIFE, PE, BRASIL",,,,
PE,RECIFE,US 336 USF UNIAO DAS VILAS,AV AGAMENON MAGALHAES,2901,ESPINHEIRO,"AV AGAMENON MAGALHAES, ESPINHEIRO, RECIFE, PE, BRASIL",,,,
PE,RECIFE,US 262 USF JOSE SEVERIANO DA SILVA,AV JERONIMO VILELA,794,CAMPO GRANDE,"AV JERONIMO VILELA, CAMPO GRANDE, RECIFE, PE, BRASIL",,,,
PE,RECIFE,US 149 CS OLINTO OLIVEIRA,RUA FRANCISCO DE PAULA,47,CAXANGA,"RUA FRANCISCO DE PAULA, CAXANGA, RECIFE, PE, BRASIL",,,,
PE,RECIFE,US 137 CS PROF DJAIR BRINDEIRO,RUA COSMORAMA,S/N,BOA VIAGEM,"RUA COSMORAMA, BOA VIAGEM, RECIFE, PE, BRASIL",,,,
PE,RECIFE,US 259 USF SITIO SAO BRAZ,RUA DO SITIO SAO BRAS,60,SITIO DOS PINTOS,"RUA DO SITIO SAO BRAS, SITIO DOS PINTOS, RECIFE, PE, BRASIL",,,,
PE,RECIFE,US 230 USF LAGOA ENCANTADA,AV BENIGNO JORDAO DE VASCONCELOS,S/N,COHAB,"AV BENIGNO JORDAO DE VASCONCELOS, COHAB, RECIFE, PE, BRASIL",,,,
PE,RECIFE,US 158 CS PAM CEASA,RODOVIA BR 101SUL,11606,CURADO,"RODOVIA BR 101SUL, CURADO, RECIFE, PE, BRASIL",,,,
PE,RECIFE,US 295 USF COSME E DAMIAO,RUA TOMAZ FERREIRA,93,VARZEA,"RUA TOMAZ FERREIRA, VARZEA, RECIFE, PE, BRASIL",,,,
PE,RECIFE,US 231 USF CORREGO DA BICA,RUA SANTA TEREZA,S/N,GUABIRABA,"RUA SANTA TEREZA, GUABIRABA, RECIFE, PE, BRASIL",,,,
PE,RECIFE,US 245 USF PLANETA DOS MACACOS II,AV PIRACICABA,929,JARDIM SAO PAULO,"AV PIRACICABA, JARDIM SAO PAULO, RECIFE, PE, BRASIL",,,,
PE,RECIFE,US 404 USF SANTO AMARO III,AV NORTE MIGUEL ARRAES DE ALENCAR,1271,SANTO AMARO,"AV NORTE MIGUEL ARRAES DE ALENCAR, SANTO AMARO, RECIFE, PE, BRASIL",,,,
PE,RECIFE,US 373 USF CIDADE OPERARIA,RUA EMILIO MONTEIRO DA FONSECA,1688,IBURA DE BAIXO,"RUA EMILIO MONTEIRO DA FONSECA, IBURA DE BAIXO, RECIFE, PE, BRASIL",,,,
PE,RECIFE,US 142 CS BIDU KRAUSE,AV ONZE DE AGOSTO,S/N,CURADO,"AV ONZE DE AGOSTO, CURADO, RECIFE, PE, BRASIL",,,,
PE,RECIFE,US 250 USF UR12 UR5 3 ETAPA,RUA FRANCISCO MIRANDA,16,COHAB,"RUA FRANCISCO MIRANDA, COHAB, RECIFE, PE, BRASIL",,,,
PE,RECIFE,AMBULATORIO PRESIDIO ANIBAL BRUNO,AVENIDA LIBERDADE,S/N,TEJIPIO,"AVENIDA LIBERDADE, TEJIPIO, RECIFE, PE, BRASIL",,,,
PE,RECIFE,US 174 USF SITIO GRANDE,AV LUXEMBURGO,254,IMBIRIBEIRA,"AV LUXEMBURGO, IMBIRIBEIRA, RECIFE, PE, BRASIL",,,,
PE,RECIFE,US 255 USF CAMPO DO BANCO,RUA GEN ADAUTO GOMES BARBOSA,13,VARZEA,"RUA GEN ADAUTO GOMES BARBOSA, VARZEA, RECIFE, PE, BRASIL",,,,
PE,RECIFE,US 316 USF BERNARD VAN LEER,RUA FRANCISCO VALPASSOS,S/N,BRASILIA TEIMOSA,"RUA FRANCISCO VALPASSOS, BRASILIA TEIMOSA, RECIFE, PE, BRASIL",,,,
PE,RECIFE,US 311 USF AGUA VIVA,RUA TANABI,S/N,IBURA,"RUA TANABI, IBURA, RECIFE, PE, BRASIL",,,,
PE,RECIFE,US 315 USF UR 3,AV ENGENHO BABILONIA,168,COHAB,"AV ENGENHO BABILONIA, COHAB, RECIFE, PE, BRASIL",,,,
PE,RECIFE,US 349 USF CASARAO DO CORDEIRO,RUA ODETE MONTEIRO,450,CORDEIRO,"RUA ODETE MONTEIRO, CORDEIRO, RECIFE, PE, BRASIL",,,,
PE,RECIFE,US 177 USF CHICO MENDES,RUA DO CAMPO,29,AREIAS,"RUA DO CAMPO, AREIAS, RECIFE, PE, BRASIL",,,,
PE,RECIFE,US 352 USF UPINHA 24H DR HELIO MENDONCA COR DO JENIPAPO,RUA DA RECUPERACAO,6429,CORREGO DO JENIPAPO,"RUA DA RECUPERACAO, CORREGO DO JENIPAPO, RECIFE, PE, BRASIL",,,,
PE,RECIFE,US 296 USF COQUEIRAL IMBIRIBEIRA,RUA SARGENTO SILVINO MACEDO,129,IMBIRIBEIRA,"RUA SARGENTO SILVINO MACEDO, IMBIRIBEIRA, RECIFE, PE, BRASIL",,,,
PE,RECIFE,US 138 USF DR LUIZ WILSOM,RUA CHA DE ALEGRIA,S/N,BOMBA DO HEMETERIO,"RUA CHA DE ALEGRIA, BOMBA DO HEMETERIO, RECIFE, PE, BRASIL",,,,
PE,RECIFE,US 337 USF SITIO WANDERLEY,RUA HEMETRIO MACIEL,311,VARZEA,"RUA HEMETRIO MACIEL, VARZEA, RECIFE, PE, BRASIL",,,,
PE,RECIFE,US 258 USF SITIO DOS PINTOS,RUA PREF AGOSTINHO NUNES MACHADO,S/N,SITIO DOS PINTOS,"RUA PREF AGOSTINHO NUNES MACHADO, SITIO DOS PINTOS, RECIFE, PE, BRASIL",,,,
PE,RECIFE,US 272 USF SANTA TEREZA,ALTO SANTA TEREZA,S/N,PASSARINHO,"ALTO SANTA TEREZA, PASSARINHO, RECIFE, PE, BRASIL",,,,
PE,RECIFE,US 109 CS FRANCISCO PIGNATARI,ESTRADA DO ARRAIAL,S/N,CASA AMARELA,"ESTRADA DO ARRAIAL, CASA AMARELA, RECIFE, PE, BRASIL",,,,
PE,RECIFE,US 285 USF SAO JOSE DO COQUE,AV CENTRAL,S/N,ILHA JOANA BEZERRA,"AV CENTRAL, ILHA JOANA BEZERRA, RECIFE, PE, BRASIL",,,,
PE,RECIFE,US 267 USF UR 2,AV SANTA FE,240,COHAB,"AV SANTA FE, COHAB, RECIFE, PE, BRASIL",,,,
PE,RECIFE,US 186 USF JARDIM UCHOA,RUA JUPIRACY,S/N,AREIAS,"RUA JUPIRACY, AREIAS, RECIFE, PE, BRASIL",,,,
PE,RECIFE,US 401 USF UPINHA 24H GOVERNADOR EDUARDO CAMPOS,RUA ITABIRA,S/N,BOMBA DO HEMETERIO,"RUA ITABIRA, BOMBA DO HEMETERIO, RECIFE, PE, BRASIL",,,,
PE,RECIFE,US 104 CS SEBASTIAO IVO RABELO,AV CAMPINA GRANDE,S/N,COHAB,"AV CAMPINA GRANDE, COHAB, RECIFE, PE, BRASIL",,,,
PE,RECIFE,US 121 CS PROF BRUNO MAIA,RUA ALTO DO REFUGIO,S/N,NOVA DESCOBERTA,"RUA ALTO DO REFUGIO, NOVA DESCOBERTA, RECIFE, PE, BRASIL",,,,
PE,RECIFE,US 301 USF BONGI BOA IDEIA,RUA ARAGUAIA,83,SAN MARTIN,"RUA ARAGUAIA, SAN MARTIN, RECIFE, PE, BRASIL",,,,
PE,RECIFE,US 179 USF ALTO DO CEU,RUA CAPITAO SALGUEIRO,267,PORTO DA MADEIRA,"RUA CAPITAO SALGUEIRO, PORTO DA MADEIRA, RECIFE, PE, BRASIL",,,,
PE,RECIFE,US 150 CS PROFESSOR FERNANDES FIGUEIRAS,AV SAO PAULO,605,JARDIM SAO PAULO,"AV SAO PAULO, JARDIM SAO PAULO, RECIFE, PE, BRASIL",,,,
PE,RECIFE,US 323 USF MUSTARDINHA,RUA MAJOR MARIO PORTELA,472,MUSTARDINHA,"RUA MAJOR MARIO PORTELA, MUSTARDINHA, RECIFE, PE, BRASIL",,,,
PE,RECIFE,US 155 CS PROF MONTEIRO DE MORAIS,AV BEBERIBE,4510,BEBERIBE,"AV BEBERIBE, BEBERIBE, RECIFE, PE, BRASIL",,,,
PE,RECIFE,US 394 USF UPINHA 24H DR MOACYR ANDRE GOMES,AV NORTE MIGUEL ARRAES DE ALENCAR,5400,CASA AMARELA,"AV NORTE MIGUEL ARRAES DE ALENCAR, CASA AMARELA, RECIFE, PE, BRASIL",,,,
PE,RECIFE,US 289 USF JOSUE DE CASTRO,AV CORACAO DE JESUS,S/N,COHAB,"AV CORACAO DE JESUS, COHAB, RECIFE, PE, BRASIL",,,,
PE,RECIFE,US 244 USF PROF ANTONIO FRANCISCO AREIAS,AV JARDIM BRASILIA,S/N,ENCRUZILHADA,"AV JARDIM BRASILIA, ENCRUZILHADA, RECIFE, PE, BRASIL",,,,
PE,RECIFE,PRESIDIO JUIZ ANTONIO LUIZ LINS DE BARROS,AV LIBERDADE,S/N,SANCHO,"AV LIBERDADE, SANCHO, RECIFE, PE, BRASIL",,,,
PE,RECIFE,US 161 CS PROF ROMERO MARQUES,RUA CARLOS GOMES,932,BONGI,"RUA CARLOS GOMES, BONGI, RECIFE, PE, BRASIL",,,,
PE,RECIFE,US 334 USF CABANGA,RUA ESCRITOR SOUZA BARROS,S/N,CABANGA,"RUA ESCRITOR SOUZA BARROS, CABANGA, RECIFE, PE, BRASIL",,,,
PE,RECIFE,US 222 USF CORREGO DO CURIO,RUA CORREGO DO CURIO,43,DOIS UNIDOS,"RUA CORREGO DO CURIO, DOIS UNIDOS, RECIFE, PE, BRASIL",,,,
PE,RECIFE,US 112 CS DR JOSE DUSTAN CARVALHO SOARES,AV MAURICIO DE NASSAU,S/N,IPUTINGA,"AV MAURICIO DE NASSAU, IPUTINGA, RECIFE, PE, BRASIL",,,,
PE,RECIFE,US 257 PSF GILBERTO FREIRE,AV PADRE MOSCA DE CARVALHO,S/N,GUABIRABA,"AV PADRE MOSCA DE CARVALHO, GUABIRABA, RECIFE, PE, BRASIL",,,,
PE,RECIFE,US 283 USF VILA BOA VISTA,RUA VER OTACILIO DE AZEVEDO,S/N,BREJO DE BEBERIBE,"RUA VER OTACILIO DE AZEVEDO, BREJO DE BEBERIBE, RECIFE, PE, BRASIL",,,,
PE,RECIFE,US 238 USF IRAQUE,RUA MEARIM,55,ESTANCIA,"RUA MEARIM, ESTANCIA, RECIFE, PE, BRASIL",,,,
PE,RECIFE,US 299 USF JORDAO BAIXO,RUA JOSE MARTORANO,100,JORDAO,"RUA JOSE MARTORANO, JORDAO, RECIFE, PE, BRASIL",,,,
PE,RECIFE,US 282 USF VILA DAS AEROMOCAS,RUA AIQUARA,25,COHAB,"RUA AIQUARA, COHAB, RECIFE, PE, BRASIL",,,,
PE,RECIFE,US 172 USF TRES CARNEIROS,RUA IBITIARA,154,COHAB,"RUA IBITIARA, COHAB, RECIFE, PE, BRASIL",,,,
PE,RECIFE,US 265 USF MANGUEIRA I,RUA JUPIACARA,70,SAN MARTIN,"RUA JUPIACARA, SAN MARTIN, RECIFE, PE, BRASIL",,,,
PE,RECIFE,US 175 USF DR DIOGENES CAVALCANTI,RUA ALTO DA BRASILEIRA,1002,NOVA DESCOBERTA,"RUA ALTO DA BRASILEIRA, NOVA DESCOBERTA, RECIFE, PE, BRASIL",,,,
PE,RECIFE,US 442 USF UPINHA DIA SANTA LUZIA EMOCY KRAUSE,RUA LAGOA DO RANCHO,S/N,TORRE,"RUA LAGOA DO RANCHO, TORRE, RECIFE, PE, BRASIL",,,,
PE,RECIFE,US 268 USF CAFESOPOLIS,RUA CAFEZOPOLIS,1920,IMBIRIBEIRA,"RUA CAFEZOPOLIS, IMBIRIBEIRA, RECIFE, PE, BRASIL",,,,
PE,RECIFE,US 313 USF TRES CARNEIROS DE BAIXO ZUMBI DO PACHECO,AV CAMPO VERDE,S/N,IBURA,"AV CAMPO VERDE, IBURA, RECIFE, PE, BRASIL",,,,
PE,RECIFE,US 328 USF ALTO DO MARACANA,SUBIDA DA MEDALHA MILAGROSA,153,DOIS UNIDOS,"SUBIDA DA MEDALHA MILAGROSA, DOIS UNIDOS, RECIFE, PE, BRASIL",,,,
PE,RECIFE,US 290 USF DA MANGABEIRA,RUA DA MANGABEIRA,364,MANGABEIRA,"RUA DA MANGABEIRA, MANGABEIRA, RECIFE, PE, BRASIL",,,,
PE,RECIFE,US 284 USF VILA SAO MIGUEL MARROM GLACE,RUA MARIAPOLIS,132,AFOGADOS,"RUA MARIAPOLIS, AFOGADOS, RECIFE, PE, BRASIL",,,,
PE,RECIFE,US 288 USF MORRO DA CONCEICAO,RUA DA CONCEICAO,589,MORRO DA CONCEICAO,"RUA DA CONCEICAO, MORRO DA CONCEICAO, RECIFE, PE, BRASIL",,,,
PE,RECIFE,US 347 USF PARQUE DO MILAGRE,RUA CANTORA DE ELISETE CARDOSO,S/N,BARRO,"RUA CANTORA DE ELISETE CARDOSO, BARRO, RECIFE, PE, BRASIL",,,,
PE,RECIFE,US 260 USF CORREGO DA FORTUNA,AV PRF CLAUDIO SELVA,1030,DOIS IRMAOS,"AV PRF CLAUDIO SELVA, DOIS IRMAOS, RECIFE, PE, BRASIL",,,,
PE,RECIFE,US 235 USF RODA DE FOGO SINOS,RUA DOS SINOS,35,TORROES,"RUA DOS SINOS, TORROES, RECIFE, PE, BRASIL",,,,
PE,RECIFE,US 294 USF VILA TAMANDARE BEIRINHA,RUA DIAS CARDOSO,11,AREIAS,"RUA DIAS CARDOSO, AREIAS, RECIFE, PE, BRASIL",,,,
PE,RIACHO DAS ALMAS,POSTO DE SAUDE DE PINHOES PSF II,VILA PINHOES,S/N,VILA,"VILA PINHOES, VILA, RIACHO DAS ALMAS, PE, BRASIL",,,,
PE,RIACHO DAS ALMAS,POSTO DE SAUDE DO POVOADO DO RANGEL,POVOADO DO RANGEL,S/N,POVOADO,"POVOADO DO RANGEL, POVOADO, RIACHO DAS ALMAS, PE, BRASIL",,,,
PE,RIACHO DAS ALMAS,POSTO DE SAUDE DE COURO DANTAS,VILA COURO DANTAS,S/N,III DISTRITO,"VILA COURO DANTAS, III DISTRITO, RIACHO DAS ALMAS, PE, BRASIL",,,,
PE,RIACHO DAS ALMAS,PAM POSTO DE ASSISTENCIA MEDICA DE RIACHO DAS ALMAS,RUA JANIN MOTA,S/N,BRASILIA TEIMOSA,"RUA JANIN MOTA, BRASILIA TEIMOSA, RIACHO DAS ALMAS, PE, BRASIL",,,,
PE,RIACHO DAS ALMAS,POSTO DE SAUDE CHICAO PSF IV,SITIO CHICAO,S/N,POVOADO,"SITIO CHICAO, POVOADO, RIACHO DAS ALMAS, PE, BRASIL",,,,
PE,RIACHO DAS ALMAS,UNIDADE MISTA JOAO SOARES DA FONSECA,RUA JUSTO FERNANDES DA MOTA,68,CENTRO,"RUA JUSTO FERNANDES DA MOTA, CENTRO, RIACHO DAS ALMAS, PE, BRASIL",,,,
PE,RIACHO DAS ALMAS,ESF VI ALTO DO JIQUIRI,RUA MANOEL FERREIRA,S/N,AUTO DO JIQUIRI,"RUA MANOEL FERREIRA, AUTO DO JIQUIRI, RIACHO DAS ALMAS, PE, BRASIL",,,,
PE,RIACHO DAS ALMAS,POSTO DE SAUDE DE TRAPIA PSF I,VILA TRAPIA,S/N,II DISTRITO,"VILA TRAPIA, II DISTRITO, RIACHO DAS ALMAS, PE, BRASIL",,,,
PE,RIACHO DAS ALMAS,POSTO DE SAUDE ALTO DO BANDEIRA,SITIO ALTO DO BANDEIRA,S/N,POVOADO,"SITIO ALTO DO BANDEIRA, POVOADO, RIACHO DAS ALMAS, PE, BRASIL",,,,
PE,RIACHO DAS ALMAS,POSTO DE SAUDE DE VITURINO PSF III,VILA VITURINO,S/N,POVOADO,"VILA VITURINO, POVOADO, RIACHO DAS ALMAS, PE, BRASIL",,,,
PE,RIACHO DAS ALMAS,NUCLEO DE ASSISTENCIA A MULHER,RUA JOAQUIM BEZERRA,5,CENTRO,"RUA JOAQUIM BEZERRA, CENTRO, RIACHO DAS ALMAS, PE, BRASIL",,,,
PE,RIBEIRAO,PSF IX JOSE COSTA CAVALCANTE JUNIOR,RUA CARLOS GOMES,401,BAIRRO NOVO,"RUA CARLOS GOMES, BAIRRO NOVO, RIBEIRAO, PE, BRASIL",,,,
PE,RIBEIRAO,PSF VI JOSE LOPES DE SIQUEIRA SANTOS,ENGENHO AGROVILA,S/N,AGROVILA,"ENGENHO AGROVILA, AGROVILA, RIBEIRAO, PE, BRASIL",,,,
PE,RIBEIRAO,PSF V LINO PAZ DE CARVALHO,FAZENDA CAPRI,S/N,FAZENDA CAPRI,"FAZENDA CAPRI, FAZENDA CAPRI, RIBEIRAO, PE, BRASIL",,,,
PE,RIBEIRAO,POSTO DE SAUDE TANCREDO NEVES PSF II,RUA ACRE,S/N,ELDORADO,"RUA ACRE, ELDORADO, RIBEIRAO, PE, BRASIL",,,,
PE,RIBEIRAO,PSF VII FERNANDO JULIO DE ALBUQUERQUE MARANHAO,ENGENHO VICENTE CAMPELO,S/N,VICENTE CAMPELO,"ENGENHO VICENTE CAMPELO, VICENTE CAMPELO, RIBEIRAO, PE, BRASIL",,,,
PE,RIBEIRAO,POSTO DO PSF JOSE REGIS DE MOURA,RUA DO CAMPO,S/N,ALTO DA FE,"RUA DO CAMPO, ALTO DA FE, RIBEIRAO, PE, BRASIL",,,,
PE,RIBEIRAO,PSF VIII NANIE DE SIQUEIRA SANTOS,AV MARIO DOMINGUES,1010,CENTRO,"AV MARIO DOMINGUES, CENTRO, RIBEIRAO, PE, BRASIL",,,,
PE,RIBEIRAO,POSTO DE SAUDE HUMBERTO DE BARROS E SILVA,RUA 05,S/N,BANDEIRANTE,"RUA 05, BANDEIRANTE, RIBEIRAO, PE, BRASIL",,,,
PE,RIBEIRAO,PSF XI FRANCISCO ALFREDO CORREA DE OLIVEIRA,RUA PROCURADOR PEDRO JORGE,S/N,VILA RICA,"RUA PROCURADOR PEDRO JORGE, VILA RICA, RIBEIRAO, PE, BRASIL",,,,
PE,RIBEIRAO,POSTO DO PSF IV MARIA ANUNCIADA DA SILVA,VILA JOSE MARIANO,S/N,ZONA RURAL,"VILA JOSE MARIANO, ZONA RURAL, RIBEIRAO, PE, BRASIL",,,,
PE,RIBEIRAO,PSF X NELSON DE BRITO,RUA SAO PAULO,163,ELDORADO,"RUA SAO PAULO, ELDORADO, RIBEIRAO, PE, BRASIL",,,,
PE,RIBEIRAO,ESF XII FIRMINO SOUZA BARROSO,TRAV NOVA YORK,S/N,CANAVIAL,"TRAV NOVA YORK, CANAVIAL, RIBEIRAO, PE, BRASIL",,,,
PE,RIO FORMOSO,POSTO DE SAUDE DA FAMILIA PAQUEVIRA,ENGENHO,S/N,ZONA RURAL,"ENGENHO, ZONA RURAL, RIO FORMOSO, PE, BRASIL",,,,
PE,RIO FORMOSO,POSTO DE SAUDE DA FAMILIA OLHO DAGUA I,LOT OLHO DAGUA I,S/N,CENTRO,"LOT OLHO DAGUA I, CENTRO, RIO FORMOSO, PE, BRASIL",,,,
PE,RIO FORMOSO,POSTO DE SAUDE DA FAMILIA DE PEDRA DE AMOLAR,ENGENHO PEDRA DE AMOLAR,S/N,ZONA RURAL,"ENGENHO PEDRA DE AMOLAR, ZONA RURAL, RIO FORMOSO, PE, BRASIL",,,,
PE,RIO FORMOSO,POSTO DE SAUDE DA FAMILIA DOS LOTES,TRAVESSA DO JANGADEIRO,S/N,LOTES,"TRAVESSA DO JANGADEIRO, LOTES, RIO FORMOSO, PE, BRASIL",,,,
PE,RIO FORMOSO,PSF RUA DA LAMA,LAMA,S/N,CENTRO,"LAMA, CENTRO, RIO FORMOSO, PE, BRASIL",,,,
PE,RIO FORMOSO,POSTO DE SAUDE DA FAMILIA ELDORADO,RUA AMELIA MONTEIRO,10,CUCAU,"RUA AMELIA MONTEIRO, CUCAU, RIO FORMOSO, PE, BRASIL",,,,
PE,RIO FORMOSO,PSF ARMANDO MONTEIRO QUEIROZ,AMELIA MONTEIRO,10,COCAU,"AMELIA MONTEIRO, COCAU, RIO FORMOSO, PE, BRASIL",,,,
PE,RIO FORMOSO,PSF AGROVILA CONCEICAO,AGROVILA CONCEICAO,10,ZONA RURAL,"AGROVILA CONCEICAO, ZONA RURAL, RIO FORMOSO, PE, BRASIL",,,,
PE,RIO FORMOSO,PSF DA COHAB,RUA 5 A,S/N,COHAB,"RUA 5 A, COHAB, RIO FORMOSO, PE, BRASIL",,,,
PE,SAIRE,UNIDADE DE SAUDE DA FAMILIA SEVERINO PESSOA PONTES PSF,SITIO CACHOEIRA NOVA,S/N,ZONA RURAL,"SITIO CACHOEIRA NOVA, ZONA RURAL, SAIRE, PE, BRASIL",,,,
PE,SAIRE,PSF CUNHA,SITIO CUNHA,1,ZONA RURAL,"SITIO CUNHA, ZONA RURAL, SAIRE, PE, BRASIL",,,,
