UF,MUNICIPIO,NOME,LOGRADOURO,NUMERO,BAIRRO,ENDERECO_COMPLETO,LATITUDE,LONGITUDE,ENDERECO_API,POINT,CEP,CO_CNES
RR,ALTO ALEGRE,POSTO DE SAUDE PAREDAO NOVO,VILA PAREDAO,S/N,CENTRO,"VILA PAREDAO, CENTRO, ALTO ALEGRE, RR, BRASIL",2.98802,-61.3078,"Rua Paredão, 69350-000, Alto Alegre","2 59m 16.872s N, 61 18m 28.08s W",69350-000,0
RR,ALTO ALEGRE,CENTRO DE REFERENCIA SAUDE DA MULHER DE ALTO ALEGRE,AVENIDA 1 DE JULHO,S/N,CENTRO,"AVENIDA 1 DE JULHO, CENTRO, ALTO ALEGRE, RR, BRASIL",2.992,-61.31248000000001,"Avenida Primeiro de Julho, 69350-000, Alto Alegre","2 59m 31.2s N, 61 18m 44.928s W",69350-000,0
RR,ALTO ALEGRE,POSTO DE SAUDE DO TAIANO,RUA A,S/N,ZONA RURAL,"RUA A, ZONA RURAL, ALTO ALEGRE, RR, BRASIL",2.98307,-61.30488,"Rua A, 69350-000, Alto Alegre","2 58m 59.052s N, 61 18m 17.568s W",69350-000,0
RR,ALTO ALEGRE,UNIDADE MISTA BOM SAMARITANO,RUA PRINCIPAL,S/N,CENTRO,"RUA PRINCIPAL, CENTRO, ALTO ALEGRE, RR, BRASIL",-2.45796,-46.04078,"Rua Alto Alegre, 65288-000, Centro do Guilherme","2 27m 28.656s S, 46 2m 26.808s W",65288-000,0
RR,ALTO ALEGRE,POSTO DE SAUDE VILA SAO SILVESTRE,RUA PRINCIPAL,S/N,CENTRO,"RUA PRINCIPAL, CENTRO, ALTO ALEGRE, RR, BRASIL",-2.45796,-46.04078,"Rua Alto Alegre, 65288-000, Centro do Guilherme","2 27m 28.656s S, 46 2m 26.808s W",65288-000,0
RR,ALTO ALEGRE,CENTRO DE SAUDE ANA PEREIRA,RUA JOAO 23,S/N,CENTRO,"RUA JOAO 23, CENTRO, ALTO ALEGRE, RR, BRASIL",-21.58024,-50.16662,"Rua João Evangelista, 23, 16310-000, Alto Alegre","21 34m 48.864s S, 50 9m 59.832s W",16310-000,2319969
RR,ALTO ALEGRE,UBS ALONSO DEMETRIO DOS SANTOS,COMUNIDADE RAIMUNDAO I,S/N,ZONA RURAL,"COMUNIDADE RAIMUNDAO I, ZONA RURAL, ALTO ALEGRE, RR, BRASIL",2.98794,-61.30641,"Rua Dom Pedro I, 69350-000, Alto Alegre","2 59m 16.584s N, 61 18m 23.076s W",69350-000,9512829
RR,ALTO ALEGRE,POSTO DE SAUDE RECREAR,RR205,S/N,ZONA RUARAL,"RR205, ZONA RUARAL, ALTO ALEGRE, RR, BRASIL",2.99461,-61.12739000000001,"RR-205, 69350-000, Alto Alegre","2 59m 40.596s N, 61 7m 38.604s W",69350-000,0
RR,ALTO ALEGRE,CENTRO DE SAUDE JOAO MARIANO,AVENIDA GETULIO VARGAS,S/N,MUTIRAO,"AVENIDA GETULIO VARGAS, MUTIRAO, ALTO ALEGRE, RR, BRASIL",2.9902900000000003,-61.30972,"Avenida Getúlio Vargas, 69350-000, Alto Alegre","2 59m 25.044s N, 61 18m 34.992s W",69350-000,7317972
RR,AMAJARI,POSTO DE SAUDE DO TEPEQUEM,RUA PRINCIPAL,S/N,ZONA RURAL,"RUA PRINCIPAL, ZONA RURAL, AMAJARI, RR, BRASIL",-12.41631,-41.78971,"Estrada Vicinal Para Tenda Zona Rural & Rua Principal Caixa Dagua, 46900, Seabra","12 24m 58.716s S, 41 47m 22.956s W",46900,0
RR,AMAJARI,POSTO DE SAUDE DO PESQUEIRO,RUA EREU RR,S/N,CENTRO,"RUA EREU RR, CENTRO, AMAJARI, RR, BRASIL",-26.39187,-53.08051,"Rua Rio de Janeiro, 89980-000, Campo Erê","26 23m 30.732s S, 53 4m 49.836s W",89980-000,0
RR,AMAJARI,CENTRO DE SAUDE JAIR DA SILVA MOTA,RUA JOSE PEREIRA DA SILVA,S/N,CENTRO,"RUA JOSE PEREIRA DA SILVA, CENTRO, AMAJARI, RR, BRASIL",3.65295,-61.41947,"Rua José Pereira da Silva, 69343-000, Amajari","3 39m 10.62s N, 61 25m 10.092s W",69343-000,2319667
RR,AMAJARI,POSTO DE SAUDE BOM JESUS,PROJETO DE ASSENTAMENTO BOM JESUS,S/N,CENTRO,"PROJETO DE ASSENTAMENTO BOM JESUS, CENTRO, AMAJARI, RR, BRASIL",-21.13759,-41.67935,"Centro, Bom Jesus do Itabapoana","21 8m 15.324s S, 41 40m 45.66s W",,2604736
RR,AMAJARI,UNIDADE BASICA DOS TRES CORACOES,COMUNIDADE INDIGENA DOS TRES CORACOES,S/N,ZONA RURAL,"COMUNIDADE INDIGENA DOS TRES CORACOES, ZONA RURAL, AMAJARI, RR, BRASIL",-21.69279,-45.24104000000001,"Rua Rio Grande do Sul, 37413-806, Três Corações","21 41m 34.044s S, 45 14m 27.744s W",37413-806,7293852
RR,AMAJARI,POSTO DE SAUDE TRAIRAO I,RUA AFONSO PENA,S/N,ZONA RURAL,"RUA AFONSO PENA, ZONA RURAL, AMAJARI, RR, BRASIL",-23.664,-52.62298000000001,"Rua Afonso Pena, 87200-027, Cianorte","23 39m 50.4s S, 52 37m 22.728s W",87200-027,0
RR,AMAJARI,UNIDADE BASICA DE VILA BRASIL,RUA RAUL LIMA,S/N,CENTRO,"RUA RAUL LIMA, CENTRO, AMAJARI, RR, BRASIL",3.65495,-61.41919,"Rua Raul Lima, 69343-000, Amajari","3 39m 17.82s N, 61 25m 9.084s W",69343-000,7024282
RR,BOA VISTA,UNIDADE BASICA DE SAUDE LUPERCIO LIMA FERREIRA,RUA NAZARE FIGUEIRA C LAURA PINHEIRO MAIA,S/N,PINTOLANDIA,"RUA NAZARE FIGUEIRA C LAURA PINHEIRO MAIA, PINTOLANDIA, BOA VISTA, RR, BRASIL",2.80463,-60.75236,"Rua Laura Pinheiro Maia, 69317-540, Boa Vista","2 48m 16.668s N, 60 45m 8.496s W",69317-540,5446627
RR,BOA VISTA,UNIDADE BASICA DE SAUDE ARMINDA GOMES,RUA JOSE AIRTON DE ALMEIDA,422,JOQUEI CLUBE,"RUA JOSE AIRTON DE ALMEIDA, JOQUEI CLUBE, BOA VISTA, RR, BRASIL",2.7986414,-60.72459250000001,"Rua José Airton de Almeida, Loteamento Cidade Jardim II, Jóquei Clube, Boa Vista, Região Geográfica Imediata de Boa Vista, Região Geográfica Intermediária de Boa Vista, Roraima, Região Norte, 69313-068, Brasil","2 47m 55.109s N, 60 43m 28.533s W",69313-068,9362649
RR,BOA VISTA,COORDENACAO MUNICIPAL DE IMUNIZACAO,EURIDES VASCONCELOS RODRIGUES,562,JARDIM FLORESTA,"EURIDES VASCONCELOS RODRIGUES, JARDIM FLORESTA, BOA VISTA, RR, BRASIL",2.830048,-60.7048329,"Rua Eurídes Vasconcelos Rodrigues, Jardim Floresta, Boa Vista, Região Geográfica Imediata de Boa Vista, Região Geográfica Intermediária de Boa Vista, Roraima, Região Norte, 69316-025, Brasil","2 49m 48.1728s N, 60 42m 17.3984s W",69316-025,0
RR,BOA VISTA,UNIDADE BASICA DE SAUDE SENADOR HELIO CAMPOS,RUA PEDRO ALDEMAR BANTI,28,SENADOR HELIO CAMPOS,"RUA PEDRO ALDEMAR BANTI, SENADOR HELIO CAMPOS, BOA VISTA, RR, BRASIL",2.78857,-60.75239000000001,"Rua Maisa Campos de Melo, 69316, Boa Vista","2 47m 18.852s N, 60 45m 8.604s W",69316,2566605
RR,BOA VISTA,UNIDADE BASICA DE SAUDE PASTOR LUCIANO GALDINO RABELO,RUA BRESCIA C BOLONIA,S/N,CENTENARIO,"RUA BRESCIA C BOLONIA, CENTENARIO, BOA VISTA, RR, BRASIL",2.7957,-60.71865,"Rua Brescia & Rua Bolônia, 69312, Boa Vista","2 47m 44.52s N, 60 43m 7.14s W",69312,6006396
RR,BOA VISTA,CENTRO DE SAUDE PRISIONAL RR,BR 174,S/N,MONTE CRISTO,"BR 174, MONTE CRISTO, BOA VISTA, RR, BRASIL",2.79253,-60.69869,"Avenida Brasil, 69308, 69309, 69310, Boa Vista","2 47m 33.108s N, 60 41m 55.284s W",69308,6758444
RR,BOA VISTA,UNIDADE BASICA DE SAUDE 31 DE MARCO,RUA MAJOR CARLOS MARDEL,466,31 DE MARCO,"RUA MAJOR CARLOS MARDEL, 31 DE MARCO, BOA VISTA, RR, BRASIL",2.8386657000000004,-60.6712098,"Rua Major Carlos Mardel, 31 de março, Boa Vista, Região Geográfica Imediata de Boa Vista, Região Geográfica Intermediária de Boa Vista, Roraima, Região Norte, 69305-410, Brasil","2 50m 19.1965s N, 60 40m 16.3553s W",69305-410,2744457
RR,BOA VISTA,UNIDADE BASICA DE SAUDE LIBERDADE,RUA GUILHERME BRITO,214,LIBERDADE,"RUA GUILHERME BRITO, LIBERDADE, BOA VISTA, RR, BRASIL",2.8210963,-60.7002272,"Rua Guilherme de Brito, Liberdade, Boa Vista, Região Geográfica Imediata de Boa Vista, Região Geográfica Intermediária de Boa Vista, Roraima, Região Norte, 69309-075, Brasil","2 49m 15.9467s N, 60 42m 0.81792s W",69309-075,2591219
RR,BOA VISTA,UNIDADE BASICA DE SAUDE DELIO TUPINAMBA,AVENIDA BELO HORIZONTE,178,NOVA CIDADE,"AVENIDA BELO HORIZONTE, NOVA CIDADE, BOA VISTA, RR, BRASIL",2.7679400000000003,-60.74038,"Rua Belo Horizonte, 69316-266, Boa Vista","2 46m 4.584s N, 60 44m 25.368s W",69316-266,2744481
RR,BOA VISTA,UNIDADE BASICA DE SAUDE BURITIS,RUA RAIMUNDO FIGUEIRAS,661,BURITIS,"RUA RAIMUNDO FIGUEIRAS, BURITIS, BOA VISTA, RR, BRASIL",2.8177,-60.71018,"Rua Raimundo Filgueiras, Boa Vista","2 49m 3.72s N, 60 42m 36.648s W",,2744473
RR,BOA VISTA,UNIDADE BASICA DE SAUDE 13 DE SETEMBRO,AV ELDORADO,19,13 DE SETEMBRO,"AV ELDORADO, 13 DE SETEMBRO, BOA VISTA, RR, BRASIL",2.7978803,-60.682874,"Avenida Eldorado, 13 de Setembro, Boa Vista, Região Geográfica Imediata de Boa Vista, Região Geográfica Intermediária de Boa Vista, Roraima, Região Norte, 69308-450, Brasil","2 47m 52.3691s N, 60 40m 58.3464s W",69308-450,0
RR,BOA VISTA,UNIDADE BASICA DE SAUDE DR SILVIO LOFEGO BOTELHO,AV MINAS GERAIS,512,DOS ESTADOS,"AV MINAS GERAIS, DOS ESTADOS, BOA VISTA, RR, BRASIL",2.8485353,-60.6641601,"Avenida Minas Gerais, Estados, Boa Vista, Região Geográfica Imediata de Boa Vista, Região Geográfica Intermediária de Boa Vista, Roraima, Região Norte, 69305-420, Brasil","2 50m 54.7271s N, 60 39m 50.9764s W",69305-420,2744570
RR,BOA VISTA,UNIDADE BASICA DE SAUDE TANCREDO NEVES,AV SAO SEBASTIAO COM RUT PINHEIRO,S/N,JARDIM TANCREDO NEVE,"AV SAO SEBASTIAO COM RUT PINHEIRO, JARDIM TANCREDO NEVE, BOA VISTA, RR, BRASIL",2.826,-60.72798,"Avenida São Sebastião, 69311, 69313, Boa Vista","2 49m 33.6s N, 60 43m 40.728s W",69311,2308037
RR,BOA VISTA,UNIDADE BASICA DE SAUDE DR SILVIO LEITE,RUA VICENTETAVARES DE MELO,600,SILVIO LEITE,"RUA VICENTETAVARES DE MELO, SILVIO LEITE, BOA VISTA, RR, BRASIL",2.82534,-60.7419,"Avenida Mário Homem de Melo, 69317-184, Boa Vista","2 49m 31.224s N, 60 44m 30.84s W",69317-184,2566508
RR,BOA VISTA,UNIDADE BASICA DE SAUDE CINTURAO VERDE,RUA SANTA CLARA,1081,CINTURAO VERDE,"RUA SANTA CLARA, CINTURAO VERDE, BOA VISTA, RR, BRASIL",2.8036102,-60.7093561,"Rua Santa Clara, Loteamento Cinturão Verde, Cinturão Verde, Boa Vista, Região Geográfica Imediata de Boa Vista, Região Geográfica Intermediária de Boa Vista, Roraima, Região Norte, 69312-349, Brasil","2 48m 12.9967s N, 60 42m 33.682s W",69312-349,2566648
RR,BOA VISTA,UNIDADE BASICA DE SAUDE DALMO SILVA FEITOSA,RUA AUSTRALIA,700,CAUAME,"RUA AUSTRALIA, CAUAME, BOA VISTA, RR, BRASIL",2.8447265,-60.71046310000001,"Rua Austrália, Loteamento Bom Futuro 2, Cauamé, Boa Vista, Região Geográfica Imediata de Boa Vista, Região Geográfica Intermediária de Boa Vista, Roraima, Região Norte, 69313-632, Brasil","2 50m 41.0154s N, 60 42m 37.6672s W",69313-632,0
RR,BOA VISTA,UNIDADE BASICA DE SAUDE CAMBARA,RUA RAIMUNDO MENDES DE OLIVEIRA,16,CAMBARA,"RUA RAIMUNDO MENDES DE OLIVEIRA, CAMBARA, BOA VISTA, RR, BRASIL",2.82921,-60.70445,"Rua Raimundo Mendes de Souza Júnior, 69312-032, Boa Vista","2 49m 45.156s N, 60 42m 16.02s W",69312-032,2566540
RR,BOA VISTA,UNIDADE BASICA DE SAUDE DR DIMITRI RAMOS GRANDEZ DE ARAUJO,AV DOS CORRETORE DE IMOVEIS,764,ALVORADA,"AV DOS CORRETORE DE IMOVEIS, ALVORADA, BOA VISTA, RR, BRASIL",2.8195900000000003,-60.75374,"Avenida dos Corretores de Imóveis, 69317-180, Boa Vista","2 49m 10.524s N, 60 45m 13.464s W",69317-180,2566524
RR,BOA VISTA,UNIDADE BASICA DE SAUDE DR RUBELDIMAR MAIA DE AZEVEDO CRUZ,RUA GOV FELIX VALOIS DE ARAUJO,S/N,SAO BENTO,"RUA GOV FELIX VALOIS DE ARAUJO, SAO BENTO, BOA VISTA, RR, BRASIL",2.78207,-60.70407,"Rua Governador Felix Valois de Araújo, 69316, Boa Vista","2 46m 55.452s N, 60 42m 14.652s W",69316,9430016
RR,BOA VISTA,SAUDE ITINERANTE,RUA MADRI,180,AEROPORTO,"RUA MADRI, AEROPORTO, BOA VISTA, RR, BRASIL",2.8310516,-60.6906735,"Rua Madri, Aeroporto, Boa Vista, Região Geográfica Imediata de Boa Vista, Região Geográfica Intermediária de Boa Vista, Roraima, Região Norte, 69310-000, Brasil","2 49m 51.7858s N, 60 41m 26.4246s W",69310-000,6235476
RR,BOA VISTA,REDE CIDADANIA MELHOR IDADE,RUA CABO PM LAURENCE DE MELO,259,CARANA,"RUA CABO PM LAURENCE DE MELO, CARANA, BOA VISTA, RR, BRASIL",2.85228,-60.72241999999999,"Rua Altair Pereira de Melo, 69316, Boa Vista","2 51m 8.208s N, 60 43m 20.712s W",69316,7819110
RR,BOA VISTA,UNIDADE BASICA DE SAUDE SANTA LUZIA,RUA JOSE CASIMIRO DA SILVA,676,SANTA LUZIA,"RUA JOSE CASIMIRO DA SILVA, SANTA LUZIA, BOA VISTA, RR, BRASIL",2.80639,-60.77126,"Rua José Cassimiro da Silva, Boa Vista","2 48m 23.004s N, 60 46m 16.536s W",,2307847
RR,BOA VISTA,CENTRO DE SAUDE DO CORPO DE BOMBEIROS M DE RORAIMA CBMRR,AV VENEZUELA,1271,PRICUMA,"AV VENEZUELA, PRICUMA, BOA VISTA, RR, BRASIL",2.808729,-60.69130229999999,"Avenida Venezuela, Conjunto AECO, Pricumã, Boa Vista, Região Geográfica Imediata de Boa Vista, Região Geográfica Intermediária de Boa Vista, Roraima, Região Norte, 69303-340, Brasil","2 48m 31.4244s N, 60 41m 28.6883s W",69303-340,7728646
RR,BOA VISTA,UNIDADE BASICA DE SAUDE SAYONARA MARIA DANTAS LICARIAO MATOS,AVENIDA RAIMUNDO RODRIGUES COELHO,2280,SENADOR HELIO CAMPOS,"AVENIDA RAIMUNDO RODRIGUES COELHO, SENADOR HELIO CAMPOS, BOA VISTA, RR, BRASIL",2.7991651,-60.770927,"Avenida Raimundo Rodrigues Coelho, Senador Hélio Campos, Boa Vista, Região Geográfica Imediata de Boa Vista, Região Geográfica Intermediária de Boa Vista, Roraima, Região Norte, 69317-382, Brasil","2 47m 56.9944s N, 60 46m 15.3372s W",69317-382,2566591
RR,BOA VISTA,UNIDADE BASICA DE SAUDE IONE SANTIAGO,RUA PRESIDENTE COSTA E SILVA,356,SAO PEDRO,"RUA PRESIDENTE COSTA E SILVA, SAO PEDRO, BOA VISTA, RR, BRASIL",2.825782,-60.6636078,"Rua Presidente Costa e Silva, Conjunto dos Desembargadores e Conselheiros, São Pedro, Boa Vista, Região Geográfica Imediata de Boa Vista, Região Geográfica Intermediária de Boa Vista, Roraima, Região Norte, 69306-680, Brasil","2 49m 32.8152s N, 60 39m 48.9881s W",69306-680,2744554
RR,BOA VISTA,UNIDADE BASICA DE SAUDE DR HELIO MACEDO,RUA JOCA FARIAS,2199,JARDIM CARANA,"RUA JOCA FARIAS, JARDIM CARANA, BOA VISTA, RR, BRASIL",2.8515038,-60.7219454,"Rua Joca Farias, Jardim Caranã, Boa Vista, Região Geográfica Imediata de Boa Vista, Região Geográfica Intermediária de Boa Vista, Roraima, Região Norte, 69313-620, Brasil","2 51m 5.41368s N, 60 43m 19.0034s W",69313-620,2550261
RR,BOA VISTA,UNIDADE BASICA DE SAUDE ASA BRANCA,RUA FRANCISCO CUSTODIO DE ANDRADE,505,ASA BRANCA,"RUA FRANCISCO CUSTODIO DE ANDRADE, ASA BRANCA, BOA VISTA, RR, BRASIL",2.8128427000000005,-60.72185279999999,"Rua Francisco Custódio de Andrade, Loteamento Vila Rorenge, Asa Branca, Boa Vista, Região Geográfica Imediata de Boa Vista, Região Geográfica Intermediária de Boa Vista, Roraima, Região Norte, 69312-493, Brasil","2 48m 46.2337s N, 60 43m 18.6701s W",69312-493,2744465
RR,BOA VISTA,CENT DE REF E ESPEC MEDICAS ANDREIA PATRICIA MADRUGA SARAIVA,RUA PAVAO,S/N,MECEJANA,"RUA PAVAO, MECEJANA, BOA VISTA, RR, BRASIL",2.8228916,-60.6931211,"Rua do Pavão, Mecejana, Boa Vista, Região Geográfica Imediata de Boa Vista, Região Geográfica Intermediária de Boa Vista, Roraima, Região Norte, 69304-360, Brasil","2 49m 22.4098s N, 60 41m 35.236s W",69304-360,2744503
RR,BOA VISTA,POSTO AEROPORTUARIO DE BOA VISTA RR ANVISA,PRACA SANTOS DUMONT,3110,AEROPORTO,"PRACA SANTOS DUMONT, AEROPORTO, BOA VISTA, RR, BRASIL",2.8409521,-60.691313,"Praça Santos Dumont, Aeroporto, Boa Vista, Região Geográfica Imediata de Boa Vista, Região Geográfica Intermediária de Boa Vista, Roraima, Região Norte, 69310-000, Brasil","2 50m 27.4276s N, 60 41m 28.7268s W",69310-000,0
RR,BOA VISTA,UNIDADE BASICA DE SAUDE EDNA BEZERRA DINIZ,RUA FRANCISCO CANDIDO,177,AEROPORTO,"RUA FRANCISCO CANDIDO, AEROPORTO, BOA VISTA, RR, BRASIL",2.8363652000000004,-60.70799279999999,"Rua Francisco Cândido, Loteamento Bom Futuro I - Etapa A, Aeroporto, Boa Vista, Região Geográfica Imediata de Boa Vista, Região Geográfica Intermediária de Boa Vista, Roraima, Região Norte, 69310-078, Brasil","2 50m 10.9147s N, 60 42m 28.7741s W",69310-078,9430032
RR,BOA VISTA,UNIDADE BASICA DE SAUDE JORGE ANDRE GURJAO VIEIRA,RUA CC 24,S/N,CONJUNTO CIDADAO,"RUA CC 24, CONJUNTO CIDADAO, BOA VISTA, RR, BRASIL",2.7989299,-60.7769169,"Rua CC-24, Conjunto Cidadão, Laura Moreira, Boa Vista, Região Geográfica Imediata de Boa Vista, Região Geográfica Intermediária de Boa Vista, Roraima, Região Norte, 69317-382, Brasil","2 47m 56.1476s N, 60 46m 36.9008s W",69317-382,7013337
RR,BOA VISTA,UNIDADE BASICA DE SAUDE OLENKA MACELLARO THOME VIEIRA,AV MARIO HOMEM DE MELO,5075,CAIMBE,"AV MARIO HOMEM DE MELO, CAIMBE, BOA VISTA, RR, BRASIL",2.8238962000000005,-60.718948,"Avenida Mário Homem de Melo, Conjunto Caimbé II, Caimbé, Boa Vista, Região Geográfica Imediata de Boa Vista, Região Geográfica Intermediária de Boa Vista, Roraima, Região Norte, 69312-244, Brasil","2 49m 26.0263s N, 60 43m 8.2128s W",69312-244,2744511
RR,BOA VISTA,UNIDADE BASICA DE SAUDE RAIAR DO SOL,RUA DAS ESTRELAS,672,RAIR DO SOL,"RUA DAS ESTRELAS, RAIR DO SOL, BOA VISTA, RR, BRASIL",2.7746,-60.72002,"Rua das Estrelas, Boa Vista","2 46m 28.56s N, 60 43m 12.072s W",,2566729
RR,BOA VISTA,UNIDADE BASICA DE SAUDE MECEJANA,RUA PAVAO,932,MECEANA,"RUA PAVAO, MECEANA, BOA VISTA, RR, BRASIL",2.82294,-60.69323000000001,"Rua do Pavão, 69304-451, Boa Vista","2 49m 22.584s N, 60 41m 35.628s W",69304-451,2566400
RR,BOA VISTA,UNIDADE BASICA DE SAUDE EQUATORIAL,RUA FRANCISCO REGIA DE MELO,1362,EQUATORIAL,"RUA FRANCISCO REGIA DE MELO, EQUATORIAL, BOA VISTA, RR, BRASIL",2.82449,-60.76504,"Rua Francisco Regis Maciel de Melo, 69317-328, Boa Vista","2 49m 28.164s N, 60 45m 54.144s W",69317-328,2566737
RR,BOA VISTA,UNIDADE BASICA DE SAUDE JARDIM FLORESTA,RUA ANA CECILIA MOTA DA SILVA,S/N,JARDIM FLORESTA,"RUA ANA CECILIA MOTA DA SILVA, JARDIM FLORESTA, BOA VISTA, RR, BRASIL",2.8249927,-60.69885479999999,"Rua Ana Cecilia Mota da Silva, Jardim Floresta, Boa Vista, Região Geográfica Imediata de Boa Vista, Região Geográfica Intermediária de Boa Vista, Roraima, Região Norte, 69312-012, Brasil","2 49m 29.9737s N, 60 41m 55.8773s W",69312-012,2566265
RR,BOA VISTA,UNIDADE BASICA DE SAUDE SAO VICENTE,AV PRESIDENTE CASTELO BRANCO,1875,SAO VICENTE,"AV PRESIDENTE CASTELO BRANCO, SAO VICENTE, BOA VISTA, RR, BRASIL",2.815316,-60.6833079,"Avenida Presidente Castelo Branco, Loteamento São Vicente Industrial, São Vicente, Boa Vista, Região Geográfica Imediata de Boa Vista, Região Geográfica Intermediária de Boa Vista, Roraima, Região Norte, 69303-472, Brasil","2 48m 55.1376s N, 60 40m 59.9084s W",69303-472,2514028
RR,BOA VISTA,UNIDADE BASICA DE SAUDE PROF MARIANO DE ANDRADE,AVENIDA DECO FONTELIS,264,CARANA,"AVENIDA DECO FONTELIS, CARANA, BOA VISTA, RR, BRASIL",2.85087,-60.72281,"Rua R, 69317-579, Boa Vista","2 51m 3.132s N, 60 43m 22.116s W",69317-579,2744546
RR,BOA VISTA,UNIDADE BASICA DE SAUDE PRICUMA,AV VIA DAS FLORES,2347,PRICUMA,"AV VIA DAS FLORES, PRICUMA, BOA VISTA, RR, BRASIL",2.80548,-60.69464,"Rua das Mil Flores, 69309-560, Boa Vista","2 48m 19.728s N, 60 41m 40.704s W",69309-560,2744538
RR,BOA VISTA,UNIDADE BASICA DE SAUDE AYGARA MOTTA PEREIRA,RUA J,256,CIDADE SATELITE,"RUA J, CIDADE SATELITE, BOA VISTA, RR, BRASIL",2.8491473,-60.7482015,"Rua José Lacerda, Conjunto Residencial Belvedere, Boa Vista, Região Geográfica Imediata de Boa Vista, Região Geográfica Intermediária de Boa Vista, Roraima, Região Norte, 69317-544, Brasil","2 50m 56.9303s N, 60 44m 53.5254s W",69317-544,6571999
RR,BOA VISTA,AGENCIA DEFESA AGROPECUARIA DO ESTADO DE RORAIMA ADERR,RUA CORONEL MOTA,1142,CENTRO,"RUA CORONEL MOTA, CENTRO, BOA VISTA, RR, BRASIL",2.8260127,-60.6764268,"Rua Coronel Mota, Centro, Boa Vista, Região Geográfica Imediata de Boa Vista, Região Geográfica Intermediária de Boa Vista, Roraima, Região Norte, 69301-110, Brasil","2 49m 33.6457s N, 60 40m 35.1365s W",69301-110,7769350
RR,BOA VISTA,UNIDADE BASICA DE SAUDE SANTA TEREZA,RUA ARUANA,355,SANTA TEREZA,"RUA ARUANA, SANTA TEREZA, BOA VISTA, RR, BRASIL",2.832503,-60.7336182,"Rua Aruanã, Santa Tereza, Boa Vista, Região Geográfica Imediata de Boa Vista, Região Geográfica Intermediária de Boa Vista, Roraima, Região Norte, 69317-803, Brasil","2 49m 57.0108s N, 60 44m 1.02552s W",69317-803,2566451
RR,BOA VISTA,UNIDADE DE SAUDE DE REFERENCIA DO PFQA,RUA SOLON RODRIGUES PESSOA,615,PINTOLANDIA,"RUA SOLON RODRIGUES PESSOA, PINTOLANDIA, BOA VISTA, RR, BRASIL",2.8104255,-60.7484414,"Rua Solón Rodrigues Pessoa, Pintolândia, Boa Vista, Região Geográfica Imediata de Boa Vista, Região Geográfica Intermediária de Boa Vista, Roraima, Região Norte, 69317-382, Brasil","2 48m 37.5318s N, 60 44m 54.389s W",69317-382,9513973
RR,BONFIM,UBS VILENA,AV BRASIL,S/N,VILA VILENA,"AV BRASIL, VILA VILENA, BONFIM, RR, BRASIL",-10.0174,-51.10386,"Rua R, 78645-000, Vila Rica","10 1m 2.64s S, 51 6m 13.896s W",78645-000,2589966
RR,BONFIM,UBS SAO FRANCISCO,RUA PRINCIPAL,S/N,VILA SAO FRANCISCO,"RUA PRINCIPAL, VILA SAO FRANCISCO, BONFIM, RR, BRASIL",-10.28636,-36.57153,"Rua Alto da Vila São Francisco, 57200-000, Penedo","10 17m 10.896s S, 36 34m 17.508s W",57200-000,2096978
RR,BONFIM,CENTRO DE SAUDE CRISTINO JOSE DA SILVA,RUA JOAO LOPES DE MAGALHAES,S/N,CENTRO,"RUA JOAO LOPES DE MAGALHAES, CENTRO, BONFIM, RR, BRASIL",3.36126,-59.83346,"Rua João Lopes Magalhães, 69380-000, Bonfim","3 21m 40.536s N, 59 50m 0.456s W",69380-000,2320053
RR,BONFIM,UBS NOVA ESPERANCA,RUA PRINCIPAL,S/N,VILA NOVA ESPERANCA,"RUA PRINCIPAL, VILA NOVA ESPERANCA, BONFIM, RR, BRASIL",-2.54294,-44.33134,"Rua Principal & Rua Nova Esperança, 65095, São Luís","2 32m 34.584s S, 44 19m 52.824s W",65095,2367793
RR,BONFIM,UBS DIMINIZ DINIZ DA SILVA,RUA SAO FRANCISCO,S/N,SAO FRANCISCO,"RUA SAO FRANCISCO, SAO FRANCISCO, BONFIM, RR, BRASIL",3.3779800000000004,-59.816,"Rua São Francisco, 69380-000, Bonfim","3 22m 40.728s N, 59 48m 57.6s W",69380-000,3068927
RR,BONFIM,UBS TUCANO,BR 401,S/N,TUCANO,"BR 401, TUCANO, BONFIM, RR, BRASIL",3.1489069,-60.26353,"Rodovia Brasil - Guiana, São Sebastião, Bonfim, Região Geográfica Imediata de Boa Vista, Região Geográfica Intermediária de Boa Vista, Roraima, Região Norte, Brasil","3 8m 56.0648s N, 60 15m 48.708s W",,0
RR,CANTA,POSTO DE SAUDE VILA SAO JOSE KM 20,VILA SAO JOSE,S/N,VILA SAO JOSE,"VILA SAO JOSE, VILA SAO JOSE, CANTA, RR, BRASIL",-28.92544,-49.48144,"Vila São José, Araranguá","28 55m 31.584s S, 49 28m 53.184s W",,0
RR,CANTA,POSTO DE SAUDE SAO RAIMUNDO,RUA PRINCIPAL,S/N,CENTRO,"RUA PRINCIPAL, CENTRO, CANTA, RR, BRASIL",-22.45891,-47.5265,"Rua Principal, 13510-000, Santa Gertrudes","22 27m 32.076s S, 47 31m 35.4s W",13510-000,7175310
RR,CANTA,POSTO DE SAUDE FELIX PINTO,RUA PRINCIPAL,S/N,CENTRO,"RUA PRINCIPAL, CENTRO, CANTA, RR, BRASIL",-22.45891,-47.5265,"Rua Principal, 13510-000, Santa Gertrudes","22 27m 32.076s S, 47 31m 35.4s W",13510-000,0
RR,CANTA,CENTRO DE SAUDE JOSE EUCIO RODRIGUES,RUA VINICIUS DE MORAES,122,SANTA CECILIA,"RUA VINICIUS DE MORAES, SANTA CECILIA, CANTA, RR, BRASIL",-22.72476,-47.62204000000001,"Rua Vinícius de Moraes, 13420-056, Piracicaba","22 43m 29.136s S, 47 37m 19.344s W",13420-056,7271603
RR,CANTA,CENTRO DE SAUDE 13 DE MAIO,TABOCA,S/N,CENTRO,"TABOCA, CENTRO, CANTA, RR, BRASIL",-27.86711,-54.47296,"Rua Rio Grande, 98780-334, Santa Rosa","27 52m 1.596s S, 54 28m 22.656s W",98780-334,0
RR,CANTA,POSTO DE COMBATE A ENDEMIAS DE CANTA,FRANCISCO ALVES GONDIM,S/N,CENTRO,"FRANCISCO ALVES GONDIM, CENTRO, CANTA, RR, BRASIL",2.61156,-60.6031,"Rua Francisco Alves Gondim, 69390-000, Cantá","2 36m 41.616s N, 60 36m 11.16s W",69390-000,0
RR,CANTA,CENTRO DE SAUDE SEBASTIAO RODRIGUES SILVA,LUCIA EDUARDO QUEIROZ,S/N,CENTRO,"LUCIA EDUARDO QUEIROZ, CENTRO, CANTA, RR, BRASIL",2.61143,-60.60109,"Rua Lúcia Eduarda de Queiroz, 69390-000, Cantá","2 36m 41.148s N, 60 36m 3.924s W",69390-000,2320207
RR,CANTA,POSTO DE SAUDE DO CANTA,RENATO COSTA DE ALMEIDA,S/N,CENTRO,"RENATO COSTA DE ALMEIDA, CENTRO, CANTA, RR, BRASIL",2.61026,-60.60326,"Rua Renato Costa de Almeida, 69390-000, Cantá","2 36m 36.936s N, 60 36m 11.736s W",69390-000,0
RR,CANTA,POSTO DE SAUDE BORGES LEAL,VICINAL II,S/N,CENTRO,"VICINAL II, CENTRO, CANTA, RR, BRASIL",-26.124,-49.81357,"Centro II Alto de Mafra, Mafra","26 7m 26.4s S, 49 48m 48.852s W",,0
RR,CANTA,POSTO DE SAUDE DA MALACACHETA,RUA PRINCIPAL,S/N,CENTRO,"RUA PRINCIPAL, CENTRO, CANTA, RR, BRASIL",-22.45891,-47.5265,"Rua Principal, 13510-000, Santa Gertrudes","22 27m 32.076s S, 47 31m 35.4s W",13510-000,0
RR,CANTA,POSTO MUNICIPAL FONTE NOVA,FONTE NOVA,S/N,FONTE NOVA,"FONTE NOVA, FONTE NOVA, CANTA, RR, BRASIL",2.4776006,-60.7029805,"Vicinal Fonte Nova, Cantá, Região Geográfica Imediata de Boa Vista, Região Geográfica Intermediária de Boa Vista, Roraima, Região Norte, Brasil","2 28m 39.3622s N, 60 42m 10.7298s W",,0
RR,CANTA,POSTO DE SAUDE SERRA GRANDE I,RUA PRINCIPAL,S/N,CENTRO,"RUA PRINCIPAL, CENTRO, CANTA, RR, BRASIL",-22.45891,-47.5265,"Rua Principal, 13510-000, Santa Gertrudes","22 27m 32.076s S, 47 31m 35.4s W",13510-000,0
RR,CANTA,POSTO DE SAUDE SERRA GRANDE II,RUA PRINCIPAL,S/N,CENTRO,"RUA PRINCIPAL, CENTRO, CANTA, RR, BRASIL",-22.45891,-47.5265,"Rua Principal, 13510-000, Santa Gertrudes","22 27m 32.076s S, 47 31m 35.4s W",13510-000,0
RR,CANTA,POSTO DE SAUDE CANAUANI,AV PRINCIPAL,S/N,CENTRO,"AV PRINCIPAL, CENTRO, CANTA, RR, BRASIL",-22.45891,-47.5265,"Rua Principal, 13510-000, Santa Gertrudes","22 27m 32.076s S, 47 31m 35.4s W",13510-000,0
RR,CANTA,POSTO DE SAUDE CONFIANCA III VILA CENTRAL,BR,S/N,CENTRO,"BR, CENTRO, CANTA, RR, BRASIL",-27.86711,-54.47296,"Rua Rio Grande, 98780-334, Santa Rosa","27 52m 1.596s S, 54 28m 22.656s W",98780-334,0
RR,CANTA,POSTO DE SAUDE VILA CAXIAS,VILA CAXIAS,S/N,VILA CAXIAS,"VILA CAXIAS, VILA CAXIAS, CANTA, RR, BRASIL",-22.64348,-43.2859,"Rua Rio de Janeiro, 25221-080, Duque de Caxias","22 38m 36.528s S, 43 17m 9.24s W",25221-080,0
RR,CANTA,CENTRO DE FISIOTERAPIA MANOEL PACHECO MENEZES NUNES,RUA GALDINO VIEIRA DO NASCIMENTO,S/N,CENTRO,"RUA GALDINO VIEIRA DO NASCIMENTO, CENTRO, CANTA, RR, BRASIL",2.61173,-60.60519,"Rua Galdino Vieira do Nascimento, 69390-000, Cantá","2 36m 42.228s N, 60 36m 18.684s W",69390-000,0
RR,CARACARAI,CENTRO DE SAUDE DE VISTA ALEGRE,BR174,S/N,VILA VISTA ALEGRE,"BR174, VILA VISTA ALEGRE, CARACARAI, RR, BRASIL",-22.01073,-47.87323,"Vila Vista Alegre, São Carlos","22 0m 38.628s S, 47 52m 23.628s W",,2320746
RR,CARACARAI,CENTRO DE SAUDE BARAUANA KM 55 BR 170,VILA BARUANA,S/N,VILA BARAUANA,"VILA BARUANA, VILA BARAUANA, CARACARAI, RR, BRASIL",1.82156,-61.13853,"Vila de Drenagem, 69360-000, Caracaraí","1 49m 17.616s N, 61 8m 18.708s W",69360-000,2657406
RR,CARACARAI,CENTRO DE SAUDE MANOEL LUIZ RODRIGUES,PRACA PE CALLERI,S/N,CENTRO,"PRACA PE CALLERI, CENTRO, CARACARAI, RR, BRASIL",2.82873,-60.67348000000001,"Rua Padre Caleri, 69305-250, Boa Vista","2 49m 43.428s N, 60 40m 24.528s W",69305-250,2476657
RR,CARACARAI,POSTO DE SAUDE RIO DIAS,VILA RIO DIAS,1,INTERIOR,"VILA RIO DIAS, INTERIOR, CARACARAI, RR, BRASIL",-5.17999,-48.13557,"Rua Rio Branco & Rua Ângelo Dias, 65924, Vila Nova dos Martírios","5 10m 47.964s S, 48 8m 8.052s W",65924,0
