UF,MUNICIPIO,ESTABELECIMENTO,LOGRADOURO,NUMERO,BAIRRO,ENDERECO_COMPLETO,latitude,longitude,address,point,cep
PB,PRATA,UNIDADE ANCORA LAURA CECILE DE SOUSA,SITIO BOA SORTE,S/N,ZONA RURAL,"SITIO BOA SORTE, ZONA RURAL, PRATA, PB, BRASIL",-23.66081,-52.58845,"Praça da Boa Morte, 87203, Cianorte","23 39m 38.916s S, 52 35m 18.42s W",87203
PB,PRATA,UBSF SONIA MARIA CLEMENTE FIRMINO ESF II,AMARO JOSE DE MELO,92,CENTRO,"AMARO JOSE DE MELO, CENTRO, PRATA, PB, BRASIL",-7.70404,-37.08402,"Rua Amaro José de Melo, 58550-000, Prata","7 42m 14.544s S, 37 5m 2.472s W",58550-000
PB,PRINCESA ISABEL,UBS PSF CACHOEIRA DE MINAS,POVOADO CACHOEIRA DE MINAS,S/N,POVOADO,"POVOADO CACHOEIRA DE MINAS, POVOADO, PRINCESA ISABEL, PB, BRASIL",-20.71047,-45.00064,"Estrada para Cachoeira, 35543-000, São Francisco de Paula","20 42m 37.692s S, 45 0m 2.304s W",35543-000
PB,PRINCESA ISABEL,UBS PSF PADRE IBIAPINA,RUA FRANCISCO SALES MAIA,S/N,CENTRO,"RUA FRANCISCO SALES MAIA, CENTRO, PRINCESA ISABEL, PB, BRASIL",-7.73652,-37.98831,"Rua Francisco Pedro da Silva, 58755-000, Princesa Isabel","7 44m 11.472s S, 37 59m 17.916s W",58755-000
PB,PRINCESA ISABEL,UBS PSF SAUDADE,RUA AUGUSTA HOLANDA CAVALCANTE,S/N,SAUDADE,"RUA AUGUSTA HOLANDA CAVALCANTE, SAUDADE, PRINCESA ISABEL, PB, BRASIL",-7.73505,-37.9902,"Rua Augusto Holanda Cavalcante, 58755-000, Princesa Isabel","7 44m 6.18s S, 37 59m 24.72s W",58755-000
PB,PRINCESA ISABEL,UBS PSF BAIRRO JARDIM KARLOTA,RUA DRADILVA CARLOS DINIZ,S/N,JARDIM KARLOTA,"RUA DRADILVA CARLOS DINIZ, JARDIM KARLOTA, PRINCESA ISABEL, PB, BRASIL",-7.7304,-37.9967,"Rua Doutora Dilva Carlos Diniz, 58755-000, Princesa Isabel","7 43m 49.44s S, 37 59m 48.12s W",58755-000
PB,PRINCESA ISABEL,ESF BAIRRO CASUSA,RUA VIGARIO ELISEU DUARTE DINIZ,S/N,CASUSA,"RUA VIGARIO ELISEU DUARTE DINIZ, CASUSA, PRINCESA ISABEL, PB, BRASIL",-7.73405,-38.00008,"Rua Manoel Lopes Diniz, 58755-000, Princesa Isabel","7 44m 2.58s S, 38 0m 0.288s W",58755-000
PB,PRINCESA ISABEL,CTA CENTRO DE TESTAGEM E ACONSELHAMENTO,RUA SAO VICENTE DE PAULA,S/N,CENTRO,"RUA SAO VICENTE DE PAULA, CENTRO, PRINCESA ISABEL, PB, BRASIL",-7.74067,-37.99252,"Rua São Vicente de Paula, 58755-000, Princesa Isabel","7 44m 26.412s S, 37 59m 33.072s W",58755-000
PB,PRINCESA ISABEL,UBS PSF VARZEA,POVOADO DA VARZEA,S/N,VARZEA,"POVOADO DA VARZEA, VARZEA, PRINCESA ISABEL, PB, BRASIL",-17.59169,-44.73844,"Rua Princesa Isabel, 39260-000, Várzea da Palma","17 35m 30.084s S, 44 44m 18.384s W",39260-000
PB,PRINCESA ISABEL,UBS PSF LAGOA DA CRUZ,POVOADO LAGOA DA CRUZ,S/N,ZONA RURAL,"POVOADO LAGOA DA CRUZ, ZONA RURAL, PRINCESA ISABEL, PB, BRASIL",-20.01096,-45.53633,"Rua Princesa Isabel, 35590-000, Lagoa da Prata","20 0m 39.456s S, 45 32m 10.788s W",35590-000
PB,PRINCESA ISABEL,UBS PSF CRUZEIRO,RUA MAESTRO JOAQUIM DE CARVALHO,S/N,CRUZEIRO,"RUA MAESTRO JOAQUIM DE CARVALHO, CRUZEIRO, PRINCESA ISABEL, PB, BRASIL",-7.74222,-37.99264,"Rua Expedito Leandro de Carvalho, 58755-000, Princesa Isabel","7 44m 31.992s S, 37 59m 33.504s W",58755-000
PB,PRINCESA ISABEL,UBS PSF BAIRRO SAO FRANCISCO,RUA MANOEL HONORATO,S/N,SAO FRANCISCO,"RUA MANOEL HONORATO, SAO FRANCISCO, PRINCESA ISABEL, PB, BRASIL",-27.60058,-48.6459,"Rua Princesa Isabel & Rua Manoel Francisco de Souza, 88106, São José","27 36m 2.088s S, 48 38m 45.24s W",88106
PB,PRINCESA ISABEL,UBS PSF LAGOA DE SAO JOAO,POVOADO LAGOA DE SAO JOAO,0,ZONA RURAL,"POVOADO LAGOA DE SAO JOAO, ZONA RURAL, PRINCESA ISABEL, PB, BRASIL",-22.77528,-43.36791,"Rua Princesa Isabel, 25561-110, São João de Meriti","22 46m 31.008s S, 43 22m 4.476s W",25561-110
PB,PRINCESA ISABEL,UBS PSF CENTRO I,RUA ABRAAO BARROS DINIZ,S/N,CENTRO,"RUA ABRAAO BARROS DINIZ, CENTRO, PRINCESA ISABEL, PB, BRASIL",-7.7367,-37.99553,"Rua Abraão de Barros Diniz, 58755-000, Princesa Isabel","7 44m 12.12s S, 37 59m 43.908s W",58755-000
PB,PRINCESA ISABEL,UBS PSF MAIA,RUA ANTONIA DINIZ MAIA,S/N,MAIA,"RUA ANTONIA DINIZ MAIA, MAIA, PRINCESA ISABEL, PB, BRASIL",-7.73889,-37.99503,"Rua Belarmino Maia, Princesa Isabel","7 44m 20.004s S, 37 59m 42.108s W",
PB,PRINCESA ISABEL,HOSPITAL REGIONAL DE PRINCESA ISABEL,RUA ALAMEDA DAS ACACIAS,1444,BAIRRO CASCAVEL,"RUA ALAMEDA DAS ACACIAS, BAIRRO CASCAVEL, PRINCESA ISABEL, PB, BRASIL",-7.73579,-37.9778,"Rua Alameda das Acácias, 58755-000, Princesa Isabel","7 44m 8.844s S, 37 58m 40.08s W",58755-000
PB,PUXINANA,UNIDADE DE SAUDE DA FAMILIA BEIJA FLOR,LOTEAMENTO BEIJA FLOR,10,CENTRO,"LOTEAMENTO BEIJA FLOR, CENTRO, PUXINANA, PB, BRASIL",-14.22566,-42.75257,"Rua 15 Loteamento Beija Flor, 46430-000, Guanambi","14 13m 32.376s S, 42 45m 9.252s W",46430-000
PB,PUXINANA,UNIDADE DE SAUDE DA FAMILIA MATERNO INFANTIL,AV 28 DE JANEIRO,S/N,CENTRO,"AV 28 DE JANEIRO, CENTRO, PUXINANA, PB, BRASIL",-7.1472,-35.96352,"Avenida Vinte e Oito de Janeiro, 28, 58115-000, Puxinanã","7 8m 49.92s S, 35 57m 48.672s W",58115-000
PB,PUXINANA,UNIDADE DE SAUDE DA FAMILIA CAMPO D ANGOLA,SITIO CAMPO DANGOLA,S/N,ZONA RURAL,"SITIO CAMPO DANGOLA, ZONA RURAL, PUXINANA, PB, BRASIL",-7.15125,-35.96162,"Estrada para Sítio Catirina, 58115-000, Puxinanã","7 9m 4.5s S, 35 57m 41.832s W",58115-000
PB,PUXINANA,UNIDADE DE SAUDE DA FAMILIA ANTAS,SITIO ANTAS,S/N,ZONA RURAL,"SITIO ANTAS, ZONA RURAL, PUXINANA, PB, BRASIL",-7.15125,-35.96162,"Estrada para Sítio Catirina, 58115-000, Puxinanã","7 9m 4.5s S, 35 57m 41.832s W",58115-000
PB,PUXINANA,UNIDADE DE SAUDE DA FAMILIA MARACAJA,SITIO MARACAJA,S/N,ZONA RURAL,"SITIO MARACAJA, ZONA RURAL, PUXINANA, PB, BRASIL",-7.15125,-35.96162,"Estrada para Sítio Catirina, 58115-000, Puxinanã","7 9m 4.5s S, 35 57m 41.832s W",58115-000
PB,PUXINANA,UNIDADE DE SAUDE DA FAMILIA JENIPAPO,POVOADO DE JENIPAPO,S/N,ZONA RURAL,"POVOADO DE JENIPAPO, ZONA RURAL, PUXINANA, PB, BRASIL",-6.60197,-35.63193,"Povoado de Cozinha, 58228-000, Dona Inês","6 36m 7.092s S, 35 37m 54.948s W",58228-000
PB,QUEIMADAS,UBSF ZUMBI,RUA JOAO MIRANDA,345,CASTANHO,"RUA JOAO MIRANDA, CASTANHO, QUEIMADAS, PB, BRASIL",-7.3604791,-35.889757700000004,"Rua João Miranda, Castanho, Queimadas, Região Geográfica Imediata de Campina Grande, Região Metropolitana de Campina Grande, Região Geográfica Intermediária de Campina Grande, Paraíba, Região Nordeste, 58475-000, Brasil","7 21m 37.7248s S, 35 53m 23.1277s W",58475-000
PB,QUEIMADAS,UBSF BAIXA VERDE,SITIO BAIXA VERDE,S/N,ZONA RURAL,"SITIO BAIXA VERDE, ZONA RURAL, QUEIMADAS, PB, BRASIL",-7.82319,-38.16509,"Estrada para Sítio Conceição, 56895-000, Santa Cruz da Baixa Verde","7 49m 23.484s S, 38 9m 54.324s W",56895-000
PB,QUEIMADAS,UBSF ANIBAL TEIXEIRA,AV SEVERINO BEZERRA CABRAL,61,ANIBAL TEIXEIRA,"AV SEVERINO BEZERRA CABRAL, ANIBAL TEIXEIRA, QUEIMADAS, PB, BRASIL",-7.363778599999999,-35.9023323,"Rua Severino Bezerra Cabral, Centro, Queimadas, Região Geográfica Imediata de Campina Grande, Região Metropolitana de Campina Grande, Região Geográfica Intermediária de Campina Grande, Paraíba, Região Nordeste, 58475-000, Brasil","7 21m 49.603s S, 35 54m 8.39628s W",58475-000
PB,QUEIMADAS,UBSF CAIXA DAGUA,SITIO CAIXA DAGUA,S/N,ZONA RURAL,"SITIO CAIXA DAGUA, ZONA RURAL, QUEIMADAS, PB, BRASIL",-7.36454,-35.90502,"Rua da Caixa d'Água, 58475-000, Queimadas","7 21m 52.344s S, 35 54m 18.072s W",58475-000
PB,QUEIMADAS,UBSF CENTRAL,RUA CESAR RIBEIRO,372,CENTRO,"RUA CESAR RIBEIRO, CENTRO, QUEIMADAS, PB, BRASIL",-7.364349799999999,-35.9004096,"Rua César Ribeiro, Centro, Queimadas, Região Geográfica Imediata de Campina Grande, Região Metropolitana de Campina Grande, Região Geográfica Intermediária de Campina Grande, Paraíba, Região Nordeste, 58475-000, Brasil","7 21m 51.6593s S, 35 54m 1.47456s W",58475-000
PB,QUEIMADAS,UBSF GURITIBA,SITIO GURITIBA,S/N,ZONA RURAL,"SITIO GURITIBA, ZONA RURAL, QUEIMADAS, PB, BRASIL",-7.15017,-35.6354,"Rua Central do Sítio Queimadas, 58385-000, Serra Redonda","7 9m 0.612s S, 35 38m 7.44s W",58385-000
PB,QUEIMADAS,NASF TATAGUASSU,AV SEVERINO BEZERRA CABRAL,S/N,CENTRO,"AV SEVERINO BEZERRA CABRAL, CENTRO, QUEIMADAS, PB, BRASIL",-7.363778599999999,-35.9023323,"Rua Severino Bezerra Cabral, Centro, Queimadas, Região Geográfica Imediata de Campina Grande, Região Metropolitana de Campina Grande, Região Geográfica Intermediária de Campina Grande, Paraíba, Região Nordeste, 58475-000, Brasil","7 21m 49.603s S, 35 54m 8.39628s W",58475-000
PB,QUEIMADAS,UBSF CIDADE TIAO DO REGO,RUA CIDADE SEBASTIAO DE PAULA REGO,S/N,CIDADE TIAO DO REGO,"RUA CIDADE SEBASTIAO DE PAULA REGO, CIDADE TIAO DO REGO, QUEIMADAS, PB, BRASIL",-16.76538,-49.28064,"Rua José Lins do Rego, 74920-350, Aparecida de Goiânia","16 45m 55.368s S, 49 16m 50.304s W",74920-350
PB,QUEIMADAS,UBSF ZE VELHO,SITIO ZE VELHO,S/N,ZONA RURAL,"SITIO ZE VELHO, ZONA RURAL, QUEIMADAS, PB, BRASIL",-7.15017,-35.6354,"Rua Central do Sítio Queimadas, 58385-000, Serra Redonda","7 9m 0.612s S, 35 38m 7.44s W",58385-000
PB,QUEIMADAS,UBSF VILA,RUA JOAO PESSOA,47,CENTRO,"RUA JOAO PESSOA, CENTRO, QUEIMADAS, PB, BRASIL",-7.367779700000001,-35.9034594,"Rua João Pessoa, Vila, Queimadas, Região Geográfica Imediata de Campina Grande, Região Metropolitana de Campina Grande, Região Geográfica Intermediária de Campina Grande, Paraíba, Região Nordeste, 58475-000, Brasil","7 22m 4.00692s S, 35 54m 12.4538s W",58475-000
PB,QUEIMADAS,UBSF RIACHO DO MEIO,SITIO RIACHO DO MEIO,S/N,ZONA RURAL,"SITIO RIACHO DO MEIO, ZONA RURAL, QUEIMADAS, PB, BRASIL",-7.15017,-35.6354,"Rua Central do Sítio Queimadas, 58385-000, Serra Redonda","7 9m 0.612s S, 35 38m 7.44s W",58385-000
PB,QUEIMADAS,UBSF SAULO LEAL ERNESTO DE MELO,RUA ODILON ALMEIDA BARRETO,20,CENTRO,"RUA ODILON ALMEIDA BARRETO, CENTRO, QUEIMADAS, PB, BRASIL",-7.3640064,-35.9027141,"Rua Odilon Almeida Barreto, Centro, Queimadas, Região Geográfica Imediata de Campina Grande, Região Metropolitana de Campina Grande, Região Geográfica Intermediária de Campina Grande, Paraíba, Região Nordeste, 58475-000, Brasil","7 21m 50.423s S, 35 54m 9.77076s W",58475-000
PB,QUEIMADAS,UBSF BOA VISTA,SITIO BOA VISTA,S/N,ZONA RURAL,"SITIO BOA VISTA, ZONA RURAL, QUEIMADAS, PB, BRASIL",-7.26303,-36.24103,Boa Vista,"7 15m 46.908s S, 36 14m 27.708s W",
PB,QUEIMADAS,UBSF LIGEIRO I,SITIO LIGEIRO I,S/N,ZONA RURAL,"SITIO LIGEIRO I, ZONA RURAL, QUEIMADAS, PB, BRASIL",-7.30329,-35.89462,"Rua Iracema Pereira, 58475-000, Queimadas","7 18m 11.844s S, 35 53m 40.632s W",58475-000
PB,QUEIMADAS,SERVICO DE ATENCAO DOMICILIAR JOSE FERREIRA CALAFANGE,AV ASSIS CHATEAUBRIAND,S/N,VILA,"AV ASSIS CHATEAUBRIAND, VILA, QUEIMADAS, PB, BRASIL",-7.29099,-35.8908,"Avenida Assis Chateaubriand, 58475-000, Queimadas","7 17m 27.564s S, 35 53m 26.88s W",58475-000
PB,QUEIMADAS,UBSF MALHADA GRANDE,SITIO MALHADA GRANDE,S/N,ZONA RURAL,"SITIO MALHADA GRANDE, ZONA RURAL, QUEIMADAS, PB, BRASIL",-7.15017,-35.6354,"Rua Central do Sítio Queimadas, 58385-000, Serra Redonda","7 9m 0.612s S, 35 38m 7.44s W",58385-000
PB,QUEIMADAS,UBSF LIGEIRO II,SITIO LIGEIRO,S/N,ZONA RURAL,"SITIO LIGEIRO, ZONA RURAL, QUEIMADAS, PB, BRASIL",-7.28801,-35.89345,"Ligeiro, Queimadas","7 17m 16.836s S, 35 53m 36.42s W",
PB,QUEIMADAS,UBSF CASTANHO,RUA DURVAL GOMES DA MOTA,56,CASSTANHO,"RUA DURVAL GOMES DA MOTA, CASSTANHO, QUEIMADAS, PB, BRASIL",-7.29068,-35.89397,"Rua Inácio Gomes da Silva, 58475-000, Queimadas","7 17m 26.448s S, 35 53m 38.292s W",58475-000
PB,QUEIMADAS,UBSF LUTADOR,SITIO LUTADOR,S/N,ZONA RURAL,"SITIO LUTADOR, ZONA RURAL, QUEIMADAS, PB, BRASIL",-7.15017,-35.6354,"Rua Central do Sítio Queimadas, 58385-000, Serra Redonda","7 9m 0.612s S, 35 38m 7.44s W",58385-000
PB,QUEIMADAS,UBSF OLHO DAGUA SALGADO,SITIO OLHO DAGUA SALGADO,S/N,ZONA RURAL,"SITIO OLHO DAGUA SALGADO, ZONA RURAL, QUEIMADAS, PB, BRASIL",,,,,
PB,QUIXABA,USF ROBSON CARNEIRO PEREIRA,RUA DO ALTO,S/N,CENTRO,"RUA DO ALTO, CENTRO, QUIXABA, PB, BRASIL",-7.03004,-37.14858,"Rua do Alto, 58733-000, Quixabá","7 1m 48.144s S, 37 8m 54.888s W",58733-000
PB,REMIGIO,UBSF VII IRIS DE FATIMA S GONCALVES,RUA SEMEAO CANANEA,S/N,BELA VISTA,"RUA SEMEAO CANANEA, BELA VISTA, REMIGIO, PB, BRASIL",-6.97584,-35.81902,"Rua Bela Vista, 58398-000, Remígio","6 58m 33.024s S, 35 49m 8.472s W",58398-000
PB,REMIGIO,UBSF IV CICERO LUIZ DA SILVA,SITIO CONSTANTINO,S/N,ZONA RURAL,"SITIO CONSTANTINO, ZONA RURAL, REMIGIO, PB, BRASIL",-6.97208,-35.80874,"Estrada Sítio Jacaré, 58398-000, Remígio","6 58m 19.488s S, 35 48m 31.464s W",58398-000
PB,REMIGIO,UBSF II MARIA AUGUSTA LAUREANO,AV MONS RUI BARREIRA VIEIRA,52,LAGOA DO MATO,"AV MONS RUI BARREIRA VIEIRA, LAGOA DO MATO, REMIGIO, PB, BRASIL",-6.97356,-35.81054,"Rua Lagoa do Mato, 58398-000, Remígio","6 58m 24.816s S, 35 48m 37.944s W",58398-000
PB,REMIGIO,UBSF VIII LETICIA DE SOUZA SILVA,SITIO QUEIMADAS,S/N,ZONA RURAL,"SITIO QUEIMADAS, ZONA RURAL, REMIGIO, PB, BRASIL",-7.15017,-35.6354,"Rua Central do Sítio Queimadas, 58385-000, Serra Redonda","7 9m 0.612s S, 35 38m 7.44s W",58385-000
PB,REMIGIO,UBSF III MANOEL DIAS DE LUNA,SITIO GRAVATA ASSU,S/N,ZONA RURAL,"SITIO GRAVATA ASSU, ZONA RURAL, REMIGIO, PB, BRASIL",-6.97208,-35.80874,"Estrada Sítio Jacaré, 58398-000, Remígio","6 58m 19.488s S, 35 48m 31.464s W",58398-000
PB,REMIGIO,UBSF V JAILZA MOREIRA GONCALVES,CONJUNTO MONSENHOR FIDELIS,S/N,PADRE CICERO,"CONJUNTO MONSENHOR FIDELIS, PADRE CICERO, REMIGIO, PB, BRASIL",-6.97057,-35.80532,"Rua Padre Cícero, 58398-000, Remígio","6 58m 14.052s S, 35 48m 19.152s W",58398-000
PB,REMIGIO,ESF IX SEBASTIANA BATISTA DO NASCIMENTO,RUA MANOEL CORDEIRO,21,FREITAS,"RUA MANOEL CORDEIRO, FREITAS, REMIGIO, PB, BRASIL",-6.96088,-35.79766,"Rua Manoel Cordeiro Cavalcante, 58398-000, Remígio","6 57m 39.168s S, 35 47m 51.576s W",58398-000
PB,REMIGIO,UBSF VI JOAO FERNANDES BATISTA,RUA ROBELIA DINIZ,S/N,BAIXA VERDE,"RUA ROBELIA DINIZ, BAIXA VERDE, REMIGIO, PB, BRASIL",-6.9714,-35.79355,"Rua Robelia Diniz Barreto, 58398-000, Remígio","6 58m 17.04s S, 35 47m 36.78s W",58398-000
PB,REMIGIO,UBSF I PAULO CABRAL VIITORIO,RUA RANIERI VITORIO,S/N,CENTRO,"RUA RANIERI VITORIO, CENTRO, REMIGIO, PB, BRASIL",-6.96303,-35.79749,"Rua Ranieri Rodrigues Vitório, 58398-000, Remígio","6 57m 46.908s S, 35 47m 50.964s W",58398-000
PB,RIACHAO,UNIDADE DE SAUDE DA FAMILIA PSF II QUIXABA,QUIXABA,S/N,QUIXABA,"QUIXABA, QUIXABA, RIACHAO, PB, BRASIL",-7.03091,-37.14949,Quixabá,"7 1m 51.276s S, 37 8m 58.164s W",
PB,RIACHAO,POSTO ANCORA DO SEIXOS,SITIO SEIXOS,S/N,ZONA RURAL,"SITIO SEIXOS, ZONA RURAL, RIACHAO, PB, BRASIL",-7.24833,-35.65501,"Rua do Sítio Bacamarte, 58380-000, Riachão do Bacamarte","7 14m 53.988s S, 35 39m 18.036s W",58380-000
PB,RIACHAO,POSTO DE SAUDE DO BAIXIO ANCORA,SITIO BAIXIO,S/N,ZONA RURAL,"SITIO BAIXIO, ZONA RURAL, RIACHAO, PB, BRASIL",-7.24833,-35.65501,"Rua do Sítio Bacamarte, 58380-000, Riachão do Bacamarte","7 14m 53.988s S, 35 39m 18.036s W",58380-000
PB,RIACHAO,UNIDADE DE SAUDE DA FAMILIA PSF,RUA ERNESTO VIANA,S/N,CENTRO,"RUA ERNESTO VIANA, CENTRO, RIACHAO, PB, BRASIL",-6.97305,-34.83066,"Rua Ernesto Vital, 58100, Cabedelo","6 58m 22.98s S, 34 49m 50.376s W",58100
PB,RIACHAO DO BACAMARTE,CENTRO DE SAUDE DE RIACHAO DO BACAMARTE,RUA CENTRAL,17,CENTRO,"RUA CENTRAL, CENTRO, RIACHAO DO BACAMARTE, PB, BRASIL",-7.24775,-35.66717,"Rua Central, 58382-000, Riachão do Bacamarte","7 14m 51.9s S, 35 40m 1.812s W",58382-000
PB,RIACHAO DO BACAMARTE,USF I RIACHAO DO BACAMARTE,CONJUNTO FREI GALVAO,23,CENTRO,"CONJUNTO FREI GALVAO, CENTRO, RIACHAO DO BACAMARTE, PB, BRASIL",-7.24995,-35.66528,"Rua Frei Galvão, 58382-000, Riachão do Bacamarte","7 14m 59.82s S, 35 39m 55.008s W",58382-000
PB,RIACHAO DO BACAMARTE,USF II DE SERRA RAJADA,SITIO SERRA RAJADA,S/N,ZORA RURAL,"SITIO SERRA RAJADA, ZORA RURAL, RIACHAO DO BACAMARTE, PB, BRASIL",-7.24833,-35.65501,"Rua do Sítio Bacamarte, 58380-000, Riachão do Bacamarte","7 14m 53.988s S, 35 39m 18.036s W",58380-000
PB,RIACHAO DO BACAMARTE,POSTO DE SAUDE DA TORRE,SITIO TORRE,3,ZONA RURAL,"SITIO TORRE, ZONA RURAL, RIACHAO DO BACAMARTE, PB, BRASIL",-7.24833,-35.65501,"Rua do Sítio Bacamarte, 58380-000, Riachão do Bacamarte","7 14m 53.988s S, 35 39m 18.036s W",58380-000
PB,RIACHAO DO BACAMARTE,POSTO DE SAUDE DO CUITES,SITIO CUITES,12,SITIO,"SITIO CUITES, SITIO, RIACHAO DO BACAMARTE, PB, BRASIL",-7.24833,-35.65501,"Rua do Sítio Bacamarte, 58380-000, Riachão do Bacamarte","7 14m 53.988s S, 35 39m 18.036s W",58380-000
PB,RIACHAO DO POCO,USF FREI DAMIAO,RUA JOAO FERREIRA ALVES,S/N,CENTRO,"RUA JOAO FERREIRA ALVES, CENTRO, RIACHAO DO POCO, PB, BRASIL",-7.14705,-35.26044,"Rua João Ferreira Alves, 58348-000, Riachão do Poço","7 8m 49.38s S, 35 15m 37.584s W",58348-000
PB,RIACHAO DO POCO,POSTO ANCORA RAFAEL DOMINGOS DOS SANTOS,RUA,S/N,ZONA RURAL,"RUA, ZONA RURAL, RIACHAO DO POCO, PB, BRASIL",-7.14644,-35.26377,Riachão do Poço,"7 8m 47.184s S, 35 15m 49.572s W",
PB,RIACHAO DO POCO,USF LAGOA DO PADRE,SITIO LAGOA DO PADRE,S/N,ZONA RURAL,"SITIO LAGOA DO PADRE, ZONA RURAL, RIACHAO DO POCO, PB, BRASIL",-7.14644,-35.26377,Riachão do Poço,"7 8m 47.184s S, 35 15m 49.572s W",
PB,RIACHO DE SANTO ANTONIO,UNIDADE DE SAUDE DA FAMILIA SEVERINO MINEIRO DA COSTA,SITIO RIACHO DO MEIO II,S/N,ZONA RURAL,"SITIO RIACHO DO MEIO II, ZONA RURAL, RIACHO DE SANTO ANTONIO, PB, BRASIL",-7.69075,-36.15852,Riacho de Santo Antônio,"7 41m 26.7s S, 36 9m 30.672s W",
PB,RIACHO DE SANTO ANTONIO,UBSF MAURICIO TRAVASSOS MOURA,RUA CEL DEMOSTENES BARBOSA,407,CENTRO,"RUA CEL DEMOSTENES BARBOSA, CENTRO, RIACHO DE SANTO ANTONIO, PB, BRASIL",-7.69313,-36.15563,"Rua Coronel Demóstenes Barbosa, Riacho de Santo Antônio","7 41m 35.268s S, 36 9m 20.268s W",
PB,RIACHO DOS CAVALOS,USF III,RUA BENEDITO JOSE DE AQUINO,S/N,CENTRO,"RUA BENEDITO JOSE DE AQUINO, CENTRO, RIACHO DOS CAVALOS, PB, BRASIL",-6.43574,-37.66056,"Rua José Ferreira de Araújo, 58870-000, Riacho dos Cavalos","6 26m 8.664s S, 37 39m 38.016s W",58870-000
PB,RIACHO DOS CAVALOS,USF I,RUA JOAO AGRIPINO FILHO,S/N,JOSE AMERICO DE ALME,"RUA JOAO AGRIPINO FILHO, JOSE AMERICO DE ALME, RIACHO DOS CAVALOS, PB, BRASIL",-6.43574,-37.66056,"Rua João Agripino Filho & Rua José Ferreira de Araújo, 58870, Riacho dos Cavalos","6 26m 8.664s S, 37 39m 38.016s W",58870
PB,RIACHO DOS CAVALOS,USF II,RUA JOSE CANDIDO DE LIMA,S/N,JOSE AMERICO DE ALME,"RUA JOSE CANDIDO DE LIMA, JOSE AMERICO DE ALME, RIACHO DOS CAVALOS, PB, BRASIL",-6.43783,-37.65479,"Rua José Cândido de Lima, 58870-000, Riacho dos Cavalos","6 26m 16.188s S, 37 39m 17.244s W",58870-000
PB,RIACHO DOS CAVALOS,UNIDADE MISTA DE RIACHO DOS CAVALOS,RUA ANTONIO VIEIRA,87,CENTRO,"RUA ANTONIO VIEIRA, CENTRO, RIACHO DOS CAVALOS, PB, BRASIL",-6.43539,-37.66295,"Rua Antônio Carneiro Cavalcante, 58870-000, Riacho dos Cavalos","6 26m 7.404s S, 37 39m 46.62s W",58870-000
PB,RIO TINTO,UNIDADE DE SAUDE DA FAMILIA DE RIO BANCO,SITIO RIO BRANCO,S/N,ZONA RURAL,"SITIO RIO BRANCO, ZONA RURAL, RIO TINTO, PB, BRASIL",-6.78751,-35.0662,"Avenida Rio Branco, 58297-000, Rio Tinto","6 47m 15.036s S, 35 3m 58.32s W",58297-000
PB,RIO TINTO,UNIDADE DE SAUDE DA FAMILIA DE PIABUCU,SITIO PIABUCU,S/N,ZONA RURAL,"SITIO PIABUCU, ZONA RURAL, RIO TINTO, PB, BRASIL",-6.8069,-35.07776,Rio Tinto,"6 48m 24.84s S, 35 4m 39.936s W",
PB,RIO TINTO,UNIDADE DE SAUDE DA FAMILIA DO CONJUNTO NOVO,RUA ANTONIO ALVES DE MIRANDA,S/N,CENTRO,"RUA ANTONIO ALVES DE MIRANDA, CENTRO, RIO TINTO, PB, BRASIL",-6.80428,-35.08249,"Rua Antônio A. de Miranda, 58297-000, Rio Tinto","6 48m 15.408s S, 35 4m 56.964s W",58297-000
PB,RIO TINTO,UNIDADE DE SAUDE DA FAMILIA 5 RUAS,RUA SAOPEDRO,2198,CENTRO,"RUA SAOPEDRO, CENTRO, RIO TINTO, PB, BRASIL",-6.80027,-35.07185,"Rua São Pedro, 58297-000, Rio Tinto","6 48m 0.972s S, 35 4m 18.66s W",58297-000
PB,RIO TINTO,UNIDADE DE SAUDE DA FAMILIA DE CRAVACU,SITIO CRAVACU,S/N,ZONA RURAL,"SITIO CRAVACU, ZONA RURAL, RIO TINTO, PB, BRASIL",-6.8069,-35.07776,Rio Tinto,"6 48m 24.84s S, 35 4m 39.936s W",
PB,RIO TINTO,UNIDADE DE SAUDE DA FAMILIA DE SALEMA,RUA SALEMA,S/N,CENTRO,"RUA SALEMA, CENTRO, RIO TINTO, PB, BRASIL",-7.15223,-34.96779,"Rua Rio Tinto, 58302-305, Santa Rita","7 9m 8.028s S, 34 58m 4.044s W",58302-305
PB,RIO TINTO,UNIDADE DE SAUDE DA FAMILIA DA VILA REGINA,ASPIRANTE MENAS BARRETO,S/N,VILA REGINA,"ASPIRANTE MENAS BARRETO, VILA REGINA, RIO TINTO, PB, BRASIL",-6.79352,-35.06491,"Rua Aspirante Nena Barreto, 58297-000, Rio Tinto","6 47m 36.672s S, 35 3m 53.676s W",58297-000
PB,RIO TINTO,UNIDADE DE SAUDE DA FAMILIA DAS PALMEIRAS,RUA DO PATRICIO,S/N,CENTRO,"RUA DO PATRICIO, CENTRO, RIO TINTO, PB, BRASIL",-6.80754,-35.0823,"Rua do Bomfin, 58297-000, Rio Tinto","6 48m 27.144s S, 35 4m 56.28s W",58297-000
PB,RIO TINTO,UNIDADE DE SAUDE DA FAMILIA DE TANQUES,SITIO TANQUES,S/N,ZONA RURAL,"SITIO TANQUES, ZONA RURAL, RIO TINTO, PB, BRASIL",-6.8069,-35.07776,Rio Tinto,"6 48m 24.84s S, 35 4m 39.936s W",
PB,SALGADINHO,UNIDADE DE SAUDE DE SERRARIA,SITIO SERRARIA,S/N,ZONA RURAL,"SITIO SERRARIA, ZONA RURAL, SALGADINHO, PB, BRASIL",-7.31301,-35.46816,"Rua do Sítio Salgadinho, 58375-000, Mogeiro","7 18m 46.836s S, 35 28m 5.376s W",58375-000
PB,SALGADINHO,UBSF ABSOLON LEITE DA NOBREGA,RUA JOSE MACIEL DE SOUZA,351,CENTRO,"RUA JOSE MACIEL DE SOUZA, CENTRO, SALGADINHO, PB, BRASIL",-7.1031,-36.84624,"Rua José Maciel de Souza, 58650-000, Salgadinho","7 6m 11.16s S, 36 50m 46.464s W",58650-000
PB,SALGADINHO,UBSF DE SAO JOSE DA BATALHA,DISTRITO SAO JOSE DA BATALHA,S/N,ZONA RURAL,"DISTRITO SAO JOSE DA BATALHA, ZONA RURAL, SALGADINHO, PB, BRASIL",-6.94048,-38.16468,São José da Lagoa Tapada,"6 56m 25.728s S, 38 9m 52.848s W",
PB,SALGADO DE SAO FELIX,PSF SALGADO DE SAO FELIX,RUA JOSE SILVEIRA,13,CENTRO,"RUA JOSE SILVEIRA, CENTRO, SALGADO DE SAO FELIX, PB, BRASIL",-7.35152,-35.42318,"Rua Prefeito José Silveira, 58360, 58370, Salgado de São Félix","7 21m 5.472s S, 35 25m 23.448s W",58360
PB,SALGADO DE SAO FELIX,POSTO DE SAUDE DE ALAGAMAR,FAZENDA ALAGAMAR,S/N,ZONA RURAL,"FAZENDA ALAGAMAR, ZONA RURAL, SALGADO DE SAO FELIX, PB, BRASIL",-7.3557,-35.44577,Salgado de São Félix,"7 21m 20.52s S, 35 26m 44.772s W",
PB,SALGADO DE SAO FELIX,PSF DE DOIS RIACHOS,DISTRITO DE DOIS RIACHOS,S/N,ZONA RURAL,"DISTRITO DE DOIS RIACHOS, ZONA RURAL, SALGADO DE SAO FELIX, PB, BRASIL",-7.36721,-35.48727,"Dois Riachos, Salgado de São Félix","7 22m 1.956s S, 35 29m 14.172s W",
PB,SALGADO DE SAO FELIX,POSTO DE SAUDE DA PREGUICA,SITIO PREGUICA,S/N,SITIO,"SITIO PREGUICA, SITIO, SALGADO DE SAO FELIX, PB, BRASIL",-7.3557,-35.44577,Salgado de São Félix,"7 21m 20.52s S, 35 26m 44.772s W",
PB,SALGADO DE SAO FELIX,UNIDADE DE SAUDE DA FAMILIA DE MARIA DE MELO,SITIO MARIA DE MELO,S/N,ZONA RURAL,"SITIO MARIA DE MELO, ZONA RURAL, SALGADO DE SAO FELIX, PB, BRASIL",-7.3557,-35.44577,Salgado de São Félix,"7 21m 20.52s S, 35 26m 44.772s W",
PB,SALGADO DE SAO FELIX,UNIDADE DE SAUDE DA FAMILIA NAUM BARBOSA,DISTRITO FEIRA NOVA,S/N,ZONA RURAL,"DISTRITO FEIRA NOVA, ZONA RURAL, SALGADO DE SAO FELIX, PB, BRASIL",-7.3557,-35.44577,Salgado de São Félix,"7 21m 20.52s S, 35 26m 44.772s W",
PB,SALGADO DE SAO FELIX,POSTO DE SAUDE DE PIACAS,SITIO PIACAS,S/N,ZONA RURAL,"SITIO PIACAS, ZONA RURAL, SALGADO DE SAO FELIX, PB, BRASIL",-7.3557,-35.44577,Salgado de São Félix,"7 21m 20.52s S, 35 26m 44.772s W",
PB,SALGADO DE SAO FELIX,POSTO DE SAUDE DA BOA VISTA,SITIO BOA VISTA,11,ZONA RURAL,"SITIO BOA VISTA, ZONA RURAL, SALGADO DE SAO FELIX, PB, BRASIL",-7.3557,-35.44577,Salgado de São Félix,"7 21m 20.52s S, 35 26m 44.772s W",
PB,SALGADO DE SAO FELIX,PSF CENTRO II,SALGADO DE SAO FELIX,1,CENTRO,"SALGADO DE SAO FELIX, CENTRO, SALGADO DE SAO FELIX, PB, BRASIL",-7.3557,-35.44577,Salgado de São Félix,"7 21m 20.52s S, 35 26m 44.772s W",
PB,SALGADO DE SAO FELIX,POSTO DE SAUDE SITIO SOUZA,SITIO SOUZA,22,ZONA RURAL,"SITIO SOUZA, ZONA RURAL, SALGADO DE SAO FELIX, PB, BRASIL",-7.3557,-35.44577,Salgado de São Félix,"7 21m 20.52s S, 35 26m 44.772s W",
PB,SANTA CECILIA,PSF II SAMAMBAIA,SAMAMBAIA,S/N,ZONA RURAL,"SAMAMBAIA, ZONA RURAL, SANTA CECILIA, PB, BRASIL",-7.74299,-35.87906,Santa Cecília,"7 44m 34.764s S, 35 52m 44.616s W",
PB,SANTA CECILIA,PSF III POROROCA,CECILIA DE CIMA,S/N,CENTRO,"CECILIA DE CIMA, CENTRO, SANTA CECILIA, PB, BRASIL",-7.17234,-34.93031,"Rua Cidade de Santa Cecília, 58083-586, João Pessoa","7 10m 20.424s S, 34 55m 49.116s W",58083-586
PB,SANTA CECILIA,PSF I SANTA CECILIA,AVENIDA SANTA CECILIA,S/N,CENTRO,"AVENIDA SANTA CECILIA, CENTRO, SANTA CECILIA, PB, BRASIL",-23.8128859,-47.7196418,"Avenida Papa João Paulo XXIII, Portal do Lago, Centro, Pilar do Sul, Região Imediata de Sorocaba, Região Metropolitana de Sorocaba, Região Geográfica Intermediária de Sorocaba, São Paulo, Região Sudeste, 18185-000, Brasil","23 48m 46.3892s S, 47 43m 10.7105s W",18185-000
PB,SANTA CECILIA,UNID AMBULATORIAL SANTA CECILIA,AV SANTA CECILIA,S/N,CENTRO,"AV SANTA CECILIA, CENTRO, SANTA CECILIA, PB, BRASIL",-23.36233,-46.73923,"Rua Santa Cecília, 07700-080, Caieiras","23 21m 44.388s S, 46 44m 21.228s W",07700-080
PB,SANTA CRUZ,ESF CASINHA DO HOMEM EQUIPE II,DISTRITO CASINHA DO HOMEM,S/N,ZONA RURAL,"DISTRITO CASINHA DO HOMEM, ZONA RURAL, SANTA CRUZ, PB, BRASIL",-29.75719,-52.42767,"Distrito Industrial, Santa Cruz do Sul","29 45m 25.884s S, 52 25m 39.612s W",
PB,SANTA CRUZ,ESF SAO PEDRO EQUIPE III,DISTRITO SAO PEDRO,S/N,ZONA RURAL,"DISTRITO SAO PEDRO, ZONA RURAL, SANTA CRUZ, PB, BRASIL",-6.59381,-38.12159,"Rua São Pedro, 58824-000, Santa Cruz","6 35m 37.716s S, 38 7m 17.724s W",58824-000
PB,SANTA CRUZ,ESF SANTA CRUZ EQUIPE I,RUA POLIDORIO SEIXAS,24,CENTRO,"RUA POLIDORIO SEIXAS, CENTRO, SANTA CRUZ, PB, BRASIL",-6.53309,-38.05822,"Rua Professor Polidório Seixas, 58824-000, Santa Cruz","6 31m 59.124s S, 38 3m 29.592s W",58824-000
PB,SANTA HELENA,ESTRATEGIA DE SAUDE DA FAMILIA OTAVIO FELIX DE MOURA,DISTRITO MELANCIA,1,CENTRO,"DISTRITO MELANCIA, CENTRO, SANTA HELENA, PB, BRASIL",-6.72189,-38.64036,Santa Helena,"6 43m 18.804s S, 38 38m 25.296s W",
PB,SANTA HELENA,ESTRATEGIA DE SAUDE DA FAMILIA JAIRTON RIBEIRO DA SILVA,RUA GONCALO JOSE VITURIANO,1,CENTRO,"RUA GONCALO JOSE VITURIANO, CENTRO, SANTA HELENA, PB, BRASIL",-6.72318,-38.64141,"Rua Gonçalo José Vitoriano Um, Santa Helena","6 43m 23.448s S, 38 38m 29.076s W",
