UF,MUNICIPIO,ESTABELECIMENTO,LOGRADOURO,NUMERO,BAIRRO,ENDERECO_COMPLETO,latitude,longitude,address,point
SP,ESPIRITO SANTO DO PINHAL,UBS IRACEMA PINTO RICCI NINA B JARDIM BRASIL ESPINHAL SP,RUA LUIZ ROMAO,S/N,JARDIM BRASIL,"RUA LUIZ ROMAO, JARDIM BRASIL, ESPIRITO SANTO DO PINHAL, SP, BRASIL",,,,
SP,ESPIRITO SANTO DO TURVO,UBS ESPIRITO SANTO DO TURVO,RUA MARIA PERPETUA PIEDADE GONCALVES,112,CENTRO,"RUA MARIA PERPETUA PIEDADE GONCALVES, CENTRO, ESPIRITO SANTO DO TURVO, SP, BRASIL",,,,
SP,ESPIRITO SANTO DO TURVO,PREFEITURA MUNICIPAL PACS ESPIRITO SANTO DO TURVO,RUA MARIA PERPETUA PIEDADE GONCALVES,114,CENTRO,"RUA MARIA PERPETUA PIEDADE GONCALVES, CENTRO, ESPIRITO SANTO DO TURVO, SP, BRASIL",,,,
SP,ESTIVA GERBI,UNIDADE SAUDE DA FAMILIA ANTONIO RODRIGUES PSF 2,AVENIDA MARIO ZARA,S/N,ESTIVA VELHA,"AVENIDA MARIO ZARA, ESTIVA VELHA, ESTIVA GERBI, SP, BRASIL",,,,
SP,ESTIVA GERBI,UNIDADE SAUDE DA FAMILIA SEBASTIAO RODRIGUES BARBOSA,JOAQUIM AUGUSTO DA SILVA,249,TAGUA,"JOAQUIM AUGUSTO DA SILVA, TAGUA, ESTIVA GERBI, SP, BRASIL",,,,
SP,ESTIVA GERBI,UNIDADE SAUDE DA FAMILIA ANTONIO OIR DO PRADO,RUA CUBANO GERBI,80,CENTRO,"RUA CUBANO GERBI, CENTRO, ESTIVA GERBI, SP, BRASIL",,,,
SP,ESTRELA D'OESTE,UBS JOAO ALVES PEREIRA,RUA AGUAS DE PRATA,255,DR GILMAR ALVES FERR,"RUA AGUAS DE PRATA, DR GILMAR ALVES FERR, ESTRELA D'OESTE, SP, BRASIL",,,,
SP,ESTRELA D'OESTE,UBS III VICTOR ZIVIERI,RUA PARANA,1141,CENTRO,"RUA PARANA, CENTRO, ESTRELA D'OESTE, SP, BRASIL",,,,
SP,ESTRELA D'OESTE,UBS SEBASTIAO JOSE DA SILVA,RUA SOROCABA,25,JARDIM SAO LUIS,"RUA SOROCABA, JARDIM SAO LUIS, ESTRELA D'OESTE, SP, BRASIL",,,,
SP,ESTRELA DO NORTE,UNIDADE BASICA DE SAUDE II ESTRELA DO NORTE,RUA JOAO MARINHO,72,CENTRO,"RUA JOAO MARINHO, CENTRO, ESTRELA DO NORTE, SP, BRASIL",,,,
SP,EUCLIDES DA CUNHA PAULISTA,ESF II DA VILA DM,ANTONIO JOAQUIM MANO,304,CENTRO,"ANTONIO JOAQUIM MANO, CENTRO, EUCLIDES DA CUNHA PAULISTA, SP, BRASIL",,,,
SP,EUCLIDES DA CUNHA PAULISTA,UNIDADE I PROGRAMA DE SAUDE DA FAMILIA,RUA ADRIANE CRISTINA VENANCIO DA SILVA,506,CENTRO,"RUA ADRIANE CRISTINA VENANCIO DA SILVA, CENTRO, EUCLIDES DA CUNHA PAULISTA, SP, BRASIL",,,,
SP,EUCLIDES DA CUNHA PAULISTA,PAS AGROVILA ROSANELA DA PREFEUCLIDES DA CUNHA PAULISTA,AGROVILA ROSANELA,S/N,ZONA RURAL,"AGROVILA ROSANELA, ZONA RURAL, EUCLIDES DA CUNHA PAULISTA, SP, BRASIL",,,,
SP,EUCLIDES DA CUNHA PAULISTA,UBS III DE EUCLIDES DA CUNHA PAULISTA,RUA HELENA KILL DINIZ,1621,CENTRO,"RUA HELENA KILL DINIZ, CENTRO, EUCLIDES DA CUNHA PAULISTA, SP, BRASIL",,,,
SP,EUCLIDES DA CUNHA PAULISTA,ESF IV DO BAIRRO SANTA RITA DO PONTAL,BAIRRO SANTA RITA DO PONTAL,S/N,ZONA RURAL,"BAIRRO SANTA RITA DO PONTAL, ZONA RURAL, EUCLIDES DA CUNHA PAULISTA, SP, BRASIL",,,,
SP,EUCLIDES DA CUNHA PAULISTA,ESF V DA GLEBA XV DE NOVEMBRO,GLEBA XV DE NOVEMBRO SETOR 5,S/N,ZONA RURAL,"GLEBA XV DE NOVEMBRO SETOR 5, ZONA RURAL, EUCLIDES DA CUNHA PAULISTA, SP, BRASIL",,,,
SP,FARTURA,PSF VILA NOSSA SENHORA DE FATIMA FARTURA,RUA SAO CAETANO,145,VILA NSRAFATIMA,"RUA SAO CAETANO, VILA NSRAFATIMA, FARTURA, SP, BRASIL",,,,
SP,FARTURA,ESF BELA VISTA,JURACI CLAUDINO,80,JARDIM BELA VISTA,"JURACI CLAUDINO, JARDIM BELA VISTA, FARTURA, SP, BRASIL",,,,
SP,FARTURA,ESF VILA SAO CAETANO,RUA CHICA VAZ,190,VILA SAO CAETANO,"RUA CHICA VAZ, VILA SAO CAETANO, FARTURA, SP, BRASIL",,,,
SP,FARTURA,CENTRO DE SAUDE II FARTURA,RUA ARTHUR DE ANDRADE,41,CENTRO,"RUA ARTHUR DE ANDRADE, CENTRO, FARTURA, SP, BRASIL",,,,
SP,FERNANDOPOLIS,UBS DIONISIO PEREIRA MARQUES SANTA BARBARA FERNANDOPOLIS,RUA MOACYR FERRARI,199,JARDIM SANTA BARBARA,"RUA MOACYR FERRARI, JARDIM SANTA BARBARA, FERNANDOPOLIS, SP, BRASIL",,,,
SP,FERNANDOPOLIS,UBS ANTONIO MODESTO DA SILVA UIRAPURU FERNANDOPOLIS,AVENIDA ANHANGUERA,577,JARDIM UIRAPURU,"AVENIDA ANHANGUERA, JARDIM UIRAPURU, FERNANDOPOLIS, SP, BRASIL",,,,
SP,FERNANDOPOLIS,UBS DR ANTONIO MILTON ZAMBOM CAIC FERNANDOPOLIS,RUA BENEDITA CRUZ,747,BERNARDO PESSUTO,"RUA BENEDITA CRUZ, BERNARDO PESSUTO, FERNANDOPOLIS, SP, BRASIL",,,,
SP,FERNANDOPOLIS,UBS JOAO GARCIA PELAYO BRASITANIA FERNANDOPOLIS,RUA DAS AMERICAS,765,DISTRITO BRASITANIA,"RUA DAS AMERICAS, DISTRITO BRASITANIA, FERNANDOPOLIS, SP, BRASIL",,,,
SP,FERNANDOPOLIS,UBS ANDRE MALAVAZZI CECAP FERNANDOPOLIS,RUA LUIS GIACHETTO,125,CECAP,"RUA LUIS GIACHETTO, CECAP, FERNANDOPOLIS, SP, BRASIL",,,,
SP,FERNANDOPOLIS,UBS DR ADHEMAR MONTEIRO PACHECO UNIVERSITARIO,RUA EURIPEDES TEIXEIRA DE REZENDE,131,PARQUE UNIVERSITARIO,"RUA EURIPEDES TEIXEIRA DE REZENDE, PARQUE UNIVERSITARIO, FERNANDOPOLIS, SP, BRASIL",,,,
SP,FERNANDOPOLIS,UBS AMERICO POSSARI JARDIM PARAISO FERNANDOPOLIS,AVENIDA RUBENS PADILHA MEATO,923,JARDIM PARAISO,"AVENIDA RUBENS PADILHA MEATO, JARDIM PARAISO, FERNANDOPOLIS, SP, BRASIL",,,,
SP,FERNANDOPOLIS,UBS DR JOSE FERREIRA MAIA ROSA AMARELA,TRAVESSA MARIA LUIZA,187,RESIDENCIAL POR DO S,"TRAVESSA MARIA LUIZA, RESIDENCIAL POR DO S, FERNANDOPOLIS, SP, BRASIL",,,,
SP,FERNANDOPOLIS,UBS DR ALEXANDRE ZILENOVSKI BRASILANDIA FERNANDOPOLIS,AVENIDA CARLOS BAROZZI,520,BRASILANDIA,"AVENIDA CARLOS BAROZZI, BRASILANDIA, FERNANDOPOLIS, SP, BRASIL",,,,
SP,FERNANDOPOLIS,UBS CARLOS GANDOLFI IPANEMA FERNANDOPOLIS,RUA AIRTON MARQUES DE SOUZA,269,JARDIM IPANEMA,"RUA AIRTON MARQUES DE SOUZA, JARDIM IPANEMA, FERNANDOPOLIS, SP, BRASIL",,,,
SP,FERNANDOPOLIS,UBS DR PAULO SANO ALBINO MININELLI FERNANDOPOLIS,RUA PASTOR ALCIDES PEREIRA DE SOUZA,174,ALBINO MININELLI,"RUA PASTOR ALCIDES PEREIRA DE SOUZA, ALBINO MININELLI, FERNANDOPOLIS, SP, BRASIL",,,,
SP,FERNANDOPOLIS,UBS DR ECIO VIDOTTI VILA REGINA FERNANDOPOLIS,AVENIDA BRASILIA,704,VILA NOVA,"AVENIDA BRASILIA, VILA NOVA, FERNANDOPOLIS, SP, BRASIL",,,,
SP,FERNANDOPOLIS,UBS PASTOR MARCELINO DEUNGARO RIO GRANDE,RUA KAZUYOSHI BEPPU,355,RIO GRANDE,"RUA KAZUYOSHI BEPPU, RIO GRANDE, FERNANDOPOLIS, SP, BRASIL",,,,
SP,FERNANDOPOLIS,UBS DR WALTRUDES BARALDI PLANALTO FERNANDOPOLIS,AVENIDA DA SAUDADE,1011,JARDIM PLANALTO,"AVENIDA DA SAUDADE, JARDIM PLANALTO, FERNANDOPOLIS, SP, BRASIL",,,,
SP,FERNANDOPOLIS,UBS JOSE V MENDONCA FILHO GUANABARA FERNANDOPOLIS,RUA PERNAMBUCO,3728,JARDIM GUANABARA,"RUA PERNAMBUCO, JARDIM GUANABARA, FERNANDOPOLIS, SP, BRASIL",,,,
SP,FERNANDOPOLIS,UBS ANTONIO SANTILIO COHAB FERNANDOPOLIS,AVENIDA PAULINO MAXIMIANO DURAN,319,SANTA CECILIA,"AVENIDA PAULINO MAXIMIANO DURAN, SANTA CECILIA, FERNANDOPOLIS, SP, BRASIL",,,,
SP,FERNANDOPOLIS,UBS HEITOR MALDONADO ARAGUAIA FERNANDOPOLIS,AVENIDAS DAS PATATIVAS,381,JARDIM ARAGUAIA,"AVENIDAS DAS PATATIVAS, JARDIM ARAGUAIA, FERNANDOPOLIS, SP, BRASIL",,,,
SP,FERNANDOPOLIS,UBS ANTONIO PIVATO JARDIM PAULISTA FERNANDOPOLIS,AVENIDA BELO HORIZONTE,629,JARDIM ELDORADO,"AVENIDA BELO HORIZONTE, JARDIM ELDORADO, FERNANDOPOLIS, SP, BRASIL",,,,
SP,FERNANDO PRESTES,CS DE FERNANDO PRESTES,RUA CLELIA M DE FREITAS,320,JARDIM SANTO ANTONIO,"RUA CLELIA M DE FREITAS, JARDIM SANTO ANTONIO, FERNANDO PRESTES, SP, BRASIL",,,,
SP,FERNANDO PRESTES,UBS JOSE DOCE FILHO,RUA ERNESTO BAPTISTA DE AGUIAR,260,CENTRO,"RUA ERNESTO BAPTISTA DE AGUIAR, CENTRO, FERNANDO PRESTES, SP, BRASIL",,,,
SP,FERNAO,UNIDADE DE SAUDE DA FAMILIA DE FERNAO,RUA JOSE BONIFACIO,174,CENTRO,"RUA JOSE BONIFACIO, CENTRO, FERNAO, SP, BRASIL",,,,
SP,FERRAZ DE VASCONCELOS,UBS MARIO SQUIZATO,RUA RAIMUNDO MAGRINI,240,VILA DAS NACOES,"RUA RAIMUNDO MAGRINI, VILA DAS NACOES, FERRAZ DE VASCONCELOS, SP, BRASIL",,,,
SP,FERRAZ DE VASCONCELOS,UBS JARDIM CASTELO,TRAVESSA DO CASTELO,78,JARDIM CASTELO,"TRAVESSA DO CASTELO, JARDIM CASTELO, FERRAZ DE VASCONCELOS, SP, BRASIL",,,,
SP,FERRAZ DE VASCONCELOS,UBS VILA SANTA MARGARIDA,RUA JASMIM,31,VILA SANTA MARGARIDA,"RUA JASMIM, VILA SANTA MARGARIDA, FERRAZ DE VASCONCELOS, SP, BRASIL",,,,
SP,FERRAZ DE VASCONCELOS,UBS CDHU,RUA AMERICO TUFELLI,261,PRQ S FRANCISCO,"RUA AMERICO TUFELLI, PRQ S FRANCISCO, FERRAZ DE VASCONCELOS, SP, BRASIL",,,,
SP,FERRAZ DE VASCONCELOS,UBS BELA VISTA,RUA BENEDITO SECUNDINO LEITE,350,JAD BELA VISTA,"RUA BENEDITO SECUNDINO LEITE, JAD BELA VISTA, FERRAZ DE VASCONCELOS, SP, BRASIL",,,,
SP,FERRAZ DE VASCONCELOS,CENTRO DE SAUDE II UBS MARIO M SILVA F VASCONCELOS,RUA JAPAO,120,CENTRO,"RUA JAPAO, CENTRO, FERRAZ DE VASCONCELOS, SP, BRASIL",,,,
SP,FERRAZ DE VASCONCELOS,UBS LUCAS SIMPLICIO DELIESPOSTI,RUA JOSE BREVES BRETAS,10,JAD ROSANA,"RUA JOSE BREVES BRETAS, JAD ROSANA, FERRAZ DE VASCONCELOS, SP, BRASIL",,,,
SP,FERRAZ DE VASCONCELOS,UBS JD SAO LAZARO,RUA JOSE MILITAO SOARES,141,JD SAO FERNANDO,"RUA JOSE MILITAO SOARES, JD SAO FERNANDO, FERRAZ DE VASCONCELOS, SP, BRASIL",,,,
SP,FERRAZ DE VASCONCELOS,UBS SANTO ANTONIO,RUA GUARANI,581,VIL STO ANTONIO,"RUA GUARANI, VIL STO ANTONIO, FERRAZ DE VASCONCELOS, SP, BRASIL",,,,
SP,FERRAZ DE VASCONCELOS,UBS VILA SAO PAULO,RUA VINICIUS DE MORAES,386,VIL SAO PAULO,"RUA VINICIUS DE MORAES, VIL SAO PAULO, FERRAZ DE VASCONCELOS, SP, BRASIL",,,,
SP,FERRAZ DE VASCONCELOS,UBS VILA JAMIL,RUA MOREIRA NETO,114,VILA JAMIL,"RUA MOREIRA NETO, VILA JAMIL, FERRAZ DE VASCONCELOS, SP, BRASIL",,,,
SP,FERRAZ DE VASCONCELOS,UBS DR GERALDO JOSE RODRIGUES ALCKMIN JARDIM YONE,RUA XV DE NOVEMBRO,2300,JARDIM YONE,"RUA XV DE NOVEMBRO, JARDIM YONE, FERRAZ DE VASCONCELOS, SP, BRASIL",,,,
SP,FERRAZ DE VASCONCELOS,UBS ANTONIO NHAN,RUA LUIZ ZANDRINI,10,JAD LUIZ MAURO,"RUA LUIZ ZANDRINI, JAD LUIZ MAURO, FERRAZ DE VASCONCELOS, SP, BRASIL",,,,
SP,FLORA RICA,UBS III DE FLORA RICA,PREFEITO OCTACIANO PEREIRA DE ANDRADE,66,CENTRO,"PREFEITO OCTACIANO PEREIRA DE ANDRADE, CENTRO, FLORA RICA, SP, BRASIL",,,,
SP,FLOREAL,CS DE FLOREAL,RUA FERRUCIO ZANOVELLO,436,CENTRO,"RUA FERRUCIO ZANOVELLO, CENTRO, FLOREAL, SP, BRASIL",,,,
SP,FLORIDA PAULISTA,CENTRO DE SAUDE DE FLORIDA PAULISTA,AVN JOSE FROIO,482,CENTRO,"AVN JOSE FROIO, CENTRO, FLORIDA PAULISTA, SP, BRASIL",,,,
SP,FLORIDA PAULISTA,UNIDADE DE SAUDE DA FAMILIA DE FLORIDA PAULISTA II,RUA CEARA,99,VILA MONTEIRO,"RUA CEARA, VILA MONTEIRO, FLORIDA PAULISTA, SP, BRASIL",,,,
SP,FLORIDA PAULISTA,UNIDADE DE SAUDE DA FAMILIA DE FLORIDA PAULISTA,RUA JOSE DE OLIVEIRA PINTO,200,CENTRO,"RUA JOSE DE OLIVEIRA PINTO, CENTRO, FLORIDA PAULISTA, SP, BRASIL",,,,
SP,FLORIDA PAULISTA,CENTRO DE SAUDE DO INDAIA DO AGUAPEI FLORIDA PAULISTA,RUA TANCREDO DE ALMEIDA NEVES,357,INDAIA DO AGUAPEI,"RUA TANCREDO DE ALMEIDA NEVES, INDAIA DO AGUAPEI, FLORIDA PAULISTA, SP, BRASIL",,,,
SP,FLORIDA PAULISTA,PENITENCIARIA DE FLORIDA PAULISTA,VICINAL KIICHIRO HATTORI,6,AGRELO,"VICINAL KIICHIRO HATTORI, AGRELO, FLORIDA PAULISTA, SP, BRASIL",,,,
SP,FLORIDA PAULISTA,UNIDADE DE SAUDE DA FAMILIA DE FLORIDA PAULISTA III,AVENIDA XV DE NOVEMBRO,945,CENTRO,"AVENIDA XV DE NOVEMBRO, CENTRO, FLORIDA PAULISTA, SP, BRASIL",,,,
SP,FLORINIA,CENTRO DE SAUDE DE FLORINEA,RUA VITALINA MARIA DE JESUS,728,CENTRO,"RUA VITALINA MARIA DE JESUS, CENTRO, FLORINIA, SP, BRASIL",,,,
SP,FLORINIA,PSF FLORINEA,RUA VITALINA MARIA DE JESUS,S/N,CENTRO,"RUA VITALINA MARIA DE JESUS, CENTRO, FLORINIA, SP, BRASIL",,,,
SP,FLORINIA,PENITENCIARIA DE FLORINEA,RODOVIA SP 333 KM 438 754M,S/N,ZONA RURAL,"RODOVIA SP 333 KM 438 754M, ZONA RURAL, FLORINIA, SP, BRASIL",,,,
SP,FRANCA,CENTRO DE DETENCAO PROVISORIA DE FRANCA,DOUTOR SIDNEY ROMEU,S/N,CITY PETROPOLIS,"DOUTOR SIDNEY ROMEU, CITY PETROPOLIS, FRANCA, SP, BRASIL",,,,
SP,FRANCA,UBS SANTA TERESINHA FRANCA SP,RUA FREI AGOSTINHO DA PIEDADE,500,JARDIM REDENTOR,"RUA FREI AGOSTINHO DA PIEDADE, JARDIM REDENTOR, FRANCA, SP, BRASIL",,,,
SP,FRANCA,AMBULATORIO DO CAIC,RUA JOSE GIANESELLA,581,CITY PETROPOLIS,"RUA JOSE GIANESELLA, CITY PETROPOLIS, FRANCA, SP, BRASIL",,,,
SP,FRANCA,UBS SANTA CLARA,RUA ELECIO ODILON DE PAULA,1025,SANTA CLARA,"RUA ELECIO ODILON DE PAULA, SANTA CLARA, FRANCA, SP, BRASIL",,,,
SP,FRANCA,NUCLEO DE SAUDE DA FAMILIA PALMA,AV LEILA SCARABUCCI GUIMARAES,2842,JD PALMA,"AV LEILA SCARABUCCI GUIMARAES, JD PALMA, FRANCA, SP, BRASIL",,,,
SP,FRANCA,UBS PAULISTA,RUA LUIZ GAMA,1880,JAD PAULISTA,"RUA LUIZ GAMA, JAD PAULISTA, FRANCA, SP, BRASIL",,,,
SP,FRANCA,UBS PLANALTO FRANCA SP,RUA OFELIA SOARES RUSSO,1140,JAD PLANALTO,"RUA OFELIA SOARES RUSSO, JAD PLANALTO, FRANCA, SP, BRASIL",,,,
SP,FRANCA,UBS ESF JD LUIZA,AV NELSON JAPAULO,1731,JD LUIZA,"AV NELSON JAPAULO, JD LUIZA, FRANCA, SP, BRASIL",,,,
SP,FRANCA,UBS AEROPORTO I,CYRO EDUARDO ROSA FALEIROS,601,AEROPORTO I,"CYRO EDUARDO ROSA FALEIROS, AEROPORTO I, FRANCA, SP, BRASIL",,,,
SP,FRANCA,UBS DISTRITAL HORTO MIRAMONTES FRANCA SP,RUA LUIZ BELCHIOR,1040,HORTO,"RUA LUIZ BELCHIOR, HORTO, FRANCA, SP, BRASIL",,,,
SP,FRANCA,UBS LEPORACE,RUA NORBERTO BASSALO,820,VICENTE LEPORACE,"RUA NORBERTO BASSALO, VICENTE LEPORACE, FRANCA, SP, BRASIL",,,,
SP,FRANCA,UBS BRASILANDIA FRANCA SP,RUA PORTO VELHO,1871,BRASILANDIA,"RUA PORTO VELHO, BRASILANDIA, FRANCA, SP, BRASIL",,,,
SP,FRANCA,UBS SAO SEBASTIAO,RUA AMELIO BORGES CAMPOS,603,VIL SAO SEBASTIAO,"RUA AMELIO BORGES CAMPOS, VIL SAO SEBASTIAO, FRANCA, SP, BRASIL",,,,
SP,FRANCA,UBS PROGRESSO FRANCA SP,RUA HERCILIO BATISTA DE AVELAR,1211,PRQ PROGRESSO,"RUA HERCILIO BATISTA DE AVELAR, PRQ PROGRESSO, FRANCA, SP, BRASIL",,,,
SP,FRANCA,UBS AEROPORTO III,RUA DENIZAR TREVIZANI,1971,JAD AEROPORTO III,"RUA DENIZAR TREVIZANI, JAD AEROPORTO III, FRANCA, SP, BRASIL",,,,
SP,FRANCA,NUCLEO DE SAUDE DA FAMILIA PAINEIRAS,MARCOS GRANZOTTI,4725,JD PAINEIRAS,"MARCOS GRANZOTTI, JD PAINEIRAS, FRANCA, SP, BRASIL",,,,
SP,FRANCA,NUCLEO SAUDE FAMILIA C PETROPOLIS,RUA ALBERT SABIN,1471,CITY PETROPOLIS,"RUA ALBERT SABIN, CITY PETROPOLIS, FRANCA, SP, BRASIL",,,,
SP,FRANCA,UBS PAULISTANO FRANCA SP,RUA GILBERTO DE AGUILAR,790,PAULISTANO,"RUA GILBERTO DE AGUILAR, PAULISTANO, FRANCA, SP, BRASIL",,,,
SP,FRANCA,CENTRO DE SAUDE I FRANCA,RUA OUVIDOR FREIRE,2109,CENTRO,"RUA OUVIDOR FREIRE, CENTRO, FRANCA, SP, BRASIL",,,,
SP,FRANCA,UBS GUANABARA,RUA JAMIL ABDALLA,351,JAD GUANABARA,"RUA JAMIL ABDALLA, JAD GUANABARA, FRANCA, SP, BRASIL",,,,
SP,FRANCA,NUCLEO SAUDE FAMILIA ESMERALDA,RUA ANTONIO ALBINO SILVA,160,JARDIM ESMERALDA,"RUA ANTONIO ALBINO SILVA, JARDIM ESMERALDA, FRANCA, SP, BRASIL",,,,
SP,FRANCA,UBS ESTACAO,AVENIDA SANTOS DUMONT,288,ESTACAO,"AVENIDA SANTOS DUMONT, ESTACAO, FRANCA, SP, BRASIL",,,,
SP,FRANCA,UBS ANGELA ROSA FRANCA SP,RUA ANGELA ROSA SCARABUCCI,2691,JD ANGELA ROSA,"RUA ANGELA ROSA SCARABUCCI, JD ANGELA ROSA, FRANCA, SP, BRASIL",,,,
SP,FRANCISCO MORATO,USF DO ARPOADOR,RUA 10,361,JARDIM ARPOADOR,"RUA 10, JARDIM ARPOADOR, FRANCISCO MORATO, SP, BRASIL",,,,
SP,FRANCISCO MORATO,USF CASA GRANDE,RUA AMERICANA,289,JD MARIA LUIZA,"RUA AMERICANA, JD MARIA LUIZA, FRANCISCO MORATO, SP, BRASIL",,,,
SP,FRANCISCO MORATO,USF DO PARQUE PAULISTA,RUA AVARE,152,PARQUE PAULISTA,"RUA AVARE, PARQUE PAULISTA, FRANCISCO MORATO, SP, BRASIL",,,,
SP,FRANCISCO MORATO,USF JARDIM SILVIA,RUA VEREADOR ASSIS GOMES DA SILVA,215,JD SILVIA,"RUA VEREADOR ASSIS GOMES DA SILVA, JD SILVIA, FRANCISCO MORATO, SP, BRASIL",,,,
SP,FRANCISCO MORATO,USF DO JARDIM NOVA ESPERANCA,RUA HAWAY,152,JD VASSOURAS I,"RUA HAWAY, JD VASSOURAS I, FRANCISCO MORATO, SP, BRASIL",,,,
SP,FRANCISCO MORATO,USF DO PARQUE 120,R GUANABARA,229,PQUE 120,"R GUANABARA, PQUE 120, FRANCISCO MORATO, SP, BRASIL",,,,
SP,FRANCISCO MORATO,UBS VILA ESPANHOLA,RUA ANTONIO SORIANO DIAS,72,VILA ESPANHOLA,"RUA ANTONIO SORIANO DIAS, VILA ESPANHOLA, FRANCISCO MORATO, SP, BRASIL",,,,
SP,FRANCISCO MORATO,USF DO AGUA VERMELHA,RUA DONALD SAVAZONI,407,PARQUE AGUA VERMELHA,"RUA DONALD SAVAZONI, PARQUE AGUA VERMELHA, FRANCISCO MORATO, SP, BRASIL",,,,
SP,FRANCISCO MORATO,USF DR WALFRIDO TIBURCIO,AV OURO PRETO,1536,JARDIM ALEGRIA,"AV OURO PRETO, JARDIM ALEGRIA, FRANCISCO MORATO, SP, BRASIL",,,,
SP,FRANCISCO MORATO,UBS DO JARDIM SANTO ANTONIO,RUA OLEGARIO MARIANO,34,JD SANTO ANTONIO,"RUA OLEGARIO MARIANO, JD SANTO ANTONIO, FRANCISCO MORATO, SP, BRASIL",,,,
SP,FRANCISCO MORATO,USF VILA GUILHERME,ESTRADA ULISSES GUIMARAES,1707,V GUILHERME,"ESTRADA ULISSES GUIMARAES, V GUILHERME, FRANCISCO MORATO, SP, BRASIL",,,,
SP,FRANCISCO MORATO,USF DO JARDIM ROSAS,RUA VITOR EUGENIO LIPPO,76,JD ROSAS,"RUA VITOR EUGENIO LIPPO, JD ROSAS, FRANCISCO MORATO, SP, BRASIL",,,,
SP,FRANCO DA ROCHA,PENITENCIARIA NILTON SILVA DE FRANCO DA ROCHA II,ESTRADA EDGAR MAXIMO ZAMBOTE,445,SERRA DOS CRISTAIS,"ESTRADA EDGAR MAXIMO ZAMBOTE, SERRA DOS CRISTAIS, FRANCO DA ROCHA, SP, BRASIL",,,,
SP,FRANCO DA ROCHA,UBS DR FRANCO DA ROCHA,RUA NELSON RODRIGUES,S/N,CENTRO,"RUA NELSON RODRIGUES, CENTRO, FRANCO DA ROCHA, SP, BRASIL",,,,
SP,FRANCO DA ROCHA,UNIDADE DE SAUDE MENTAL E REABILITACAO,RUA BARAO DE MAUA,S/N,JARDIM CRUZEIRO,"RUA BARAO DE MAUA, JARDIM CRUZEIRO, FRANCO DA ROCHA, SP, BRASIL",,,,
SP,FRANCO DA ROCHA,PENITENCIARIA DE FRANCO DA ROCHA III,RUA MARCOS VINICIUS DE GOES,S/N,PARQUE INDUSTRIAL,"RUA MARCOS VINICIUS DE GOES, PARQUE INDUSTRIAL, FRANCO DA ROCHA, SP, BRASIL",,,,
SP,FRANCO DA ROCHA,CENTRO DE PROGRESSAO PENITENCIARIA DE FRANCO DA ROCHA,ESTRADA DO GOVERNO,41,POUSO ALEGRE,"ESTRADA DO GOVERNO, POUSO ALEGRE, FRANCO DA ROCHA, SP, BRASIL",,,,
SP,FRANCO DA ROCHA,UNIDADE BASICA DE SAUDE AFONSO NOBRE BAIA,AVENIDA TONICO LENCI,2847,LAGO AZUL,"AVENIDA TONICO LENCI, LAGO AZUL, FRANCO DA ROCHA, SP, BRASIL",,,,
SP,FRANCO DA ROCHA,UNIDADE BASICA DE SAUDE JOSE GRACIANO CORDEIRO FERREIRA,AVENIDA PACAEMBU,1610,JARDIM LUCIANA,"AVENIDA PACAEMBU, JARDIM LUCIANA, FRANCO DA ROCHA, SP, BRASIL",,,,
SP,FRANCO DA ROCHA,UNIDADE BASICA DE SAUDE VER RODRIGO DA CRUZ FRANCA,RUA JOBI,221,JARDIM BANDEIRANTES,"RUA JOBI, JARDIM BANDEIRANTES, FRANCO DA ROCHA, SP, BRASIL",,,,
SP,FRANCO DA ROCHA,UBS MARCELO GOES DE SOUZA,AV CECI,S/N,JARDIM UNIAO,"AV CECI, JARDIM UNIAO, FRANCO DA ROCHA, SP, BRASIL",,,,
SP,FRANCO DA ROCHA,UNIDADE BASICA DE SAUDE ADILSON GOMES DE SA,AVENIDA SETE DE SETEMBRO,1890,PARQUE LANEL,"AVENIDA SETE DE SETEMBRO, PARQUE LANEL, FRANCO DA ROCHA, SP, BRASIL",,,,
SP,FRANCO DA ROCHA,PENIT MARIO DE M ALBUQUERQUE DE FCO DA ROCHA IALA DE PR,ESTRADA EDGARD MAXIMO ZAMBOTO,445,SERRA DOS CRISTAIS,"ESTRADA EDGARD MAXIMO ZAMBOTO, SERRA DOS CRISTAIS, FRANCO DA ROCHA, SP, BRASIL",,,,
SP,FRANCO DA ROCHA,UBS ENF ROSA GENOVEVA DOS REIS,ESTRADA MANOEL DE JESUS,131,VILA PALMARES,"ESTRADA MANOEL DE JESUS, VILA PALMARES, FRANCO DA ROCHA, SP, BRASIL",,,,
SP,FRANCO DA ROCHA,HOSPITAL DE CUSTODIA ANDRE TEIXEIRA LIMA,RODOVIA LUIS CHAMA,43,VILA RAMOS,"RODOVIA LUIS CHAMA, VILA RAMOS, FRANCO DA ROCHA, SP, BRASIL",,,,
SP,FRANCO DA ROCHA,UBS DR OSORIO CESAR,RUA JOSE NICODEMO,191,VL ROSALINA,"RUA JOSE NICODEMO, VL ROSALINA, FRANCO DA ROCHA, SP, BRASIL",,,,
SP,FRANCO DA ROCHA,CDP FRANCO DA ROCHA,RUA MARCUS VINICIUS DONADEL GOES,S/N,PARQUE INDUSTRIAL,"RUA MARCUS VINICIUS DONADEL GOES, PARQUE INDUSTRIAL, FRANCO DA ROCHA, SP, BRASIL",,,,
SP,FRANCO DA ROCHA,UBS VILA BELA,RUA GRECIA,S/N,VILA BELA,"RUA GRECIA, VILA BELA, FRANCO DA ROCHA, SP, BRASIL",,,,
SP,FRANCO DA ROCHA,UBS DR LEOPOLDINO JOSE DOS PASSOS,RUA LUIZ COUTINHO DE ABREU,551,PQ VITORIA,"RUA LUIZ COUTINHO DE ABREU, PQ VITORIA, FRANCO DA ROCHA, SP, BRASIL",,,,
SP,FRANCO DA ROCHA,UNIDADE BASICA DE SAUDE PASTOR ELIAS PEREIRA,ESTRADA MANOEL DE JESUS,12,MATO DENTRO,"ESTRADA MANOEL DE JESUS, MATO DENTRO, FRANCO DA ROCHA, SP, BRASIL",,,,
SP,FRANCO DA ROCHA,UAISAS CASAS JACARANDA RIO NEGRO TAPAJOS E NOVO TEMPO,ESTRADA DO GOVERNO,S/N,POUSO ALEGRE,"ESTRADA DO GOVERNO, POUSO ALEGRE, FRANCO DA ROCHA, SP, BRASIL",,,,
SP,FRANCO DA ROCHA,UBS VEREADOR GILSON GABRIEL ROSA,RUA DOUTOR ARMANDO PINTO,706,COMPANHIA FAZENDA BE,"RUA DOUTOR ARMANDO PINTO, COMPANHIA FAZENDA BE, FRANCO DA ROCHA, SP, BRASIL",,,,
SP,GABRIEL MONTEIRO,UBS III DE GABRIEL MONTEIRO,RUA FUNDADORES,173,CENTRO,"RUA FUNDADORES, CENTRO, GABRIEL MONTEIRO, SP, BRASIL",,,,
SP,GALIA,UNIDADE DE SAUDE DA FAMILIA III DE GALIA,RUA JOAO OTTONICAR,1038,CENTRO,"RUA JOAO OTTONICAR, CENTRO, GALIA, SP, BRASIL",,,,
SP,GALIA,CENTRO DE SAUDE DR PLINIO ALBERS DE GALIA,RUA DONA AYDA BAGANHA FERREIRA,610,CENTRO,"RUA DONA AYDA BAGANHA FERREIRA, CENTRO, GALIA, SP, BRASIL",,,,
SP,GARCA,USF DR ERNESTO GAION,RUA SAO PAULO,16,DISTRITO DE JAFA,"RUA SAO PAULO, DISTRITO DE JAFA, GARCA, SP, BRASIL",,,,
SP,GARCA,USF GLENDA RODELLA DUMAS,RUA SAO JOAO,165,LABIENOPOLIS,"RUA SAO JOAO, LABIENOPOLIS, GARCA, SP, BRASIL",,,,
SP,GARCA,USF DR JOSE BARBOSA,RUA ANTONIO LEAL DE OLIVEIRA,125,SOL NASCENTE,"RUA ANTONIO LEAL DE OLIVEIRA, SOL NASCENTE, GARCA, SP, BRASIL",,,,
SP,GARCA,USF MARIA LUCIA FERREIRA CAVALLINI,RUA GUARANTA,105,JD EUCALIPTOS,"RUA GUARANTA, JD EUCALIPTOS, GARCA, SP, BRASIL",,,,
SP,GARCA,USF DR ACACIO ALVES DE SOUZA,RUA PREFEITO SALVIANO PEREIRA DE ANDRADE,1733,JARDIM SAO LUCAS,"RUA PREFEITO SALVIANO PEREIRA DE ANDRADE, JARDIM SAO LUCAS, GARCA, SP, BRASIL",,,,
SP,GARCA,USF HELENA GARCIA MULLER,RUA GABRIELA,130,LABIENOPOLIS,"RUA GABRIELA, LABIENOPOLIS, GARCA, SP, BRASIL",,,,
SP,GARCA,USF DR ACACIO ALVES DE SOUZA II,RUA ALCIDES CASSAO,84,JARDIM MONDRIAN,"RUA ALCIDES CASSAO, JARDIM MONDRIAN, GARCA, SP, BRASIL",,,,
SP,GARCA,USF DR DECIO NOBRE MOREIRA,RUA SAO FRANCISCO DE ASSIS,120,ARACELI,"RUA SAO FRANCISCO DE ASSIS, ARACELI, GARCA, SP, BRASIL",,,,
SP,GARCA,USF DR ASDRUBAL BORGES DE BARROS,RUA BRIGADEIRO MACHADO,224,WILLIANS,"RUA BRIGADEIRO MACHADO, WILLIANS, GARCA, SP, BRASIL",,,,
SP,GARCA,USF DR ADAUTO GONCALVES COLLETES,RUA CARLOS FERRARI,1415,REBELO,"RUA CARLOS FERRARI, REBELO, GARCA, SP, BRASIL",,,,
SP,GARCA,USF DR JURANDIR UBIRAJARA GUIMARAES,RUA DA ESTACAO,1117,LABIENOPOLIS,"RUA DA ESTACAO, LABIENOPOLIS, GARCA, SP, BRASIL",,,,
SP,GARCA,USF DR JOSE MARTINHO PALERMO II,RUA MINAS GERAIS,850,VILA REBELO,"RUA MINAS GERAIS, VILA REBELO, GARCA, SP, BRASIL",,,,
SP,GARCA,USF DR JOSE MARTINHO PALERMO,RUA MINAS GERAIS,850,VL REBELO,"RUA MINAS GERAIS, VL REBELO, GARCA, SP, BRASIL",,,,
SP,GASTAO VIDIGAL,UNIDADE BASICA DE SAUDE,RUA 21 DE ABRIL,617,CENTRO,"RUA 21 DE ABRIL, CENTRO, GASTAO VIDIGAL, SP, BRASIL",,,,
SP,GAVIAO PEIXOTO,PSF UNIDADE II GAVIAO PEIXOTO,ALAMEDA GULLA,725,CENTRO,"ALAMEDA GULLA, CENTRO, GAVIAO PEIXOTO, SP, BRASIL",,,,
SP,GAVIAO PEIXOTO,CENTRO MUNICIPAL DE SAUDE RUI DE CAMARGO,ALAMEDA GULLA,725,CENTRO,"ALAMEDA GULLA, CENTRO, GAVIAO PEIXOTO, SP, BRASIL",,,,
SP,GAVIAO PEIXOTO,PSF UNIDADE I GAVIAO PEIXOTO,ALAMEDA GULLA,725,CENTRO,"ALAMEDA GULLA, CENTRO, GAVIAO PEIXOTO, SP, BRASIL",,,,
SP,GENERAL SALGADO,JOSE RODRIGUES DE MENDONCA,AVENIDA PAULO CONSTANTINO,410,MILTON RENDA,"AVENIDA PAULO CONSTANTINO, MILTON RENDA, GENERAL SALGADO, SP, BRASIL",,,,
SP,GENERAL SALGADO,UBS DR JOAO RODRIGUES MOREIRA,AVN PLINIO RIBEIRO DO VAL,1395,CENTRO,"AVN PLINIO RIBEIRO DO VAL, CENTRO, GENERAL SALGADO, SP, BRASIL",,,,
SP,GENERAL SALGADO,ESF OSMAR ANTONIO DO CARMO,RUA IZAEL AUGUSTO RIBEIRO,S/N,PADRE VITORINO,"RUA IZAEL AUGUSTO RIBEIRO, PADRE VITORINO, GENERAL SALGADO, SP, BRASIL",,,,
SP,GETULINA,PENITENCIARIA OSIRIS SOUZA E SILVA DE GETULINA,ESTRADA VICINAL AURELIO DE A JUNQUEIRA,95,EST GETULINAMACUCOS,"ESTRADA VICINAL AURELIO DE A JUNQUEIRA, EST GETULINAMACUCOS, GETULINA, SP, BRASIL",,,,
SP,GETULINA,ESF MACUCOS GETULINA,RUA ETELVINA MARIA DA CONCEICAO,S/N,NATALINO PELLOSO,"RUA ETELVINA MARIA DA CONCEICAO, NATALINO PELLOSO, GETULINA, SP, BRASIL",,,,
SP,GETULINA,CS III DE GETULINA,RUA DR JULIO PRESTES,444,CENTRO,"RUA DR JULIO PRESTES, CENTRO, GETULINA, SP, BRASIL",,,,
SP,GLICERIO,CENTRO DE SAUDE III GLICERIO GIMAIEL ELIAS GIMAIEL,RUA PREFEITO FUAD EID,355,CENTRO,"RUA PREFEITO FUAD EID, CENTRO, GLICERIO, SP, BRASIL",,,,
SP,GLICERIO,CENTRO DE SAUDE III GLICERIO JULIO FUJIHARA,RUA TIRADENTES,161,JURITIS,"RUA TIRADENTES, JURITIS, GLICERIO, SP, BRASIL",,,,
SP,GUAICARA,CS III MARTINIANO CRUZ DE GUAICARA,RUA OSVALDO CRUZ,269,CENTRO,"RUA OSVALDO CRUZ, CENTRO, GUAICARA, SP, BRASIL",,,,
SP,GUAICARA,UNIDADE BASICA DE SAUDE NELSON THOMAZ,RUA ELISEO NUNES,680,COHAB CRIS,"RUA ELISEO NUNES, COHAB CRIS, GUAICARA, SP, BRASIL",,,,
SP,GUAICARA,POSTO DE SAUDE DO CANJARANA GUAICARA,BAIRRO CANJARANA,S/N,CANJARANA,"BAIRRO CANJARANA, CANJARANA, GUAICARA, SP, BRASIL",,,,
SP,GUAICARA,PROGRAMA DE SAUDE DA FAMILIA DOM BOSCO GUAICARA,AVENIDA JOSE SOUTO PEREIRA,485,JARDIM DOM BOSCO,"AVENIDA JOSE SOUTO PEREIRA, JARDIM DOM BOSCO, GUAICARA, SP, BRASIL",,,,
SP,GUAICARA,POSTO DE SAUDE DE TARAMA GUAICARA,BAIRRO TARAMA,S/N,TARAMA,"BAIRRO TARAMA, TARAMA, GUAICARA, SP, BRASIL",,,,
SP,GUAIMBE,USF I DE GUAIMBE,RUA RUI BARBOSA,215,CENTRO,"RUA RUI BARBOSA, CENTRO, GUAIMBE, SP, BRASIL",,,,
SP,GUAIMBE,USF II DE GUAIMBE,RUA EXPEDITO PEREIRA,391,NOSSA SENHORA APAREC,"RUA EXPEDITO PEREIRA, NOSSA SENHORA APAREC, GUAIMBE, SP, BRASIL",,,,
SP,GUAIRA,UNIDADE DE SAUDE DA FAMILIA TARCISIO BARINI,RUA 4,50,VIVENDAS DO BOM JARD,"RUA 4, VIVENDAS DO BOM JARD, GUAIRA, SP, BRASIL",,,,
SP,GUAIRA,UNIDADE DE SAUDE DA FAMILIA ANTONIO MANOEL DA SILVA,RUA 44,660,JARDIM ELISA,"RUA 44, JARDIM ELISA, GUAIRA, SP, BRASIL",,,,
SP,GUAIRA,UNIDADE DE SAUDE DA FAMILIA DR JOSE VILELA JUNQUEIRA,AVENIDA 29,1191,V NOSSA SR APARECI,"AVENIDA 29, V NOSSA SR APARECI, GUAIRA, SP, BRASIL",,,,
SP,GUAIRA,UNIDADE DE SAUDE DA FAMILIA JOAO BOSCO LELLIS,RUA 02 A,1344,RESIDENCIAL NADIA I,"RUA 02 A, RESIDENCIAL NADIA I, GUAIRA, SP, BRASIL",,,,
SP,GUAIRA,UNIDADE DE SAUDE DA FAMILIA CABO AGNALDO SOARES BARBOSA,RUA 46 B,166,JOAO VACARO,"RUA 46 B, JOAO VACARO, GUAIRA, SP, BRASIL",,,,
SP,GUAIRA,UNIDADE DE SAUDE DA FAMILIA JOSE ADALBERTO LELLIS GARCIA,RUA 10 B,455,ANTONIO GARCIA,"RUA 10 B, ANTONIO GARCIA, GUAIRA, SP, BRASIL",,,,
SP,GUAPIACU,CENTRO DE REABILITACAO GUAPIACU,XV DE NOVEMBRO,46,CENTRO,"XV DE NOVEMBRO, CENTRO, GUAPIACU, SP, BRASIL",,,,
SP,GUAPIACU,ESFSB MI CAIC DE GUAPIACU,RUA FRANCISCO HENRIQUE,478,ALVORADA,"RUA FRANCISCO HENRIQUE, ALVORADA, GUAPIACU, SP, BRASIL",,,,
SP,GUAPIACU,ESFSB MI SAO MARCOS,ANTONIO DOMINGOS RODRIGUES AGUILERA,412,SAO MARCOS,"ANTONIO DOMINGOS RODRIGUES AGUILERA, SAO MARCOS, GUAPIACU, SP, BRASIL",,,,
SP,GUAPIACU,CENTRO DE SAUDE DR RUBENS DE OLIVEIRA BOTTAS,RUA ABRAAO JOSE DE LIMA,659,CENTRO,"RUA ABRAAO JOSE DE LIMA, CENTRO, GUAPIACU, SP, BRASIL",,,,
SP,GUAPIACU,ESFSB MI SAO JOSE DE GUAPIACU,RUA JOAO ROMERO PEREZ,17,CDHU,"RUA JOAO ROMERO PEREZ, CDHU, GUAPIACU, SP, BRASIL",,,,
SP,GUAPIACU,CENTRO ODONTOLOGICO DE GUAPIACU,RUA XV DE NOVEMBRO,359,CENTRO,"RUA XV DE NOVEMBRO, CENTRO, GUAPIACU, SP, BRASIL",,,,
SP,GUAPIACU,ESFSBMI ANTONIETA,RUA JOAO ROMERO PERES,17,SAO JOSE,"RUA JOAO ROMERO PERES, SAO JOSE, GUAPIACU, SP, BRASIL",,,,
SP,GUAPIACU,CENTRO DE ESPECIALIDADES GUAPIACU,RUA XV DE NOVEMBRO,292,CENTRO,"RUA XV DE NOVEMBRO, CENTRO, GUAPIACU, SP, BRASIL",,,,
