UF,MUNICIPIO,ESTABELECIMENTO,LOGRADOURO,NUMERO,BAIRRO,ENDERECO_COMPLETO,latitude,longitude,address,point
AP,MAZAGAO,PM MZG POSTO DE SAUDE PIQUIAZAL,COMUNIDADE PIQUIAZAL,S/N,COMUNIDADE PIQUIAZAL,"COMUNIDADE PIQUIAZAL, COMUNIDADE PIQUIAZAL, MAZAGAO, AP, BRASIL",-0.04957,-51.11967,"Travessa São José Comunidade do Coração, 68903, Macapá","0 2m 58.452s S, 51 7m 10.812s W"
AP,MAZAGAO,PM MZG POSTO DE SAUDE DONA ANTONIA,COMUNIDADE RIO PRETO,S/N,COMUN RIO PRETO,"COMUNIDADE RIO PRETO, COMUN RIO PRETO, MAZAGAO, AP, BRASIL",-20.81087,-49.37913,São José do Rio Preto,"20 48m 39.132s S, 49 22m 44.868s W"
AP,MAZAGAO,PM MZG UBS DO MAZAGAO VELHO,DISTRITO DE MAZAGAO VELHO,S/N,MAZAGAO VELHO,"DISTRITO DE MAZAGAO VELHO, MAZAGAO VELHO, MAZAGAO, AP, BRASIL",-0.12107,-51.28872,Mazagão,"0 7m 15.852s S, 51 17m 19.392s W"
AP,MAZAGAO,PM MZG POSTO DE SAUDE CONCEICAO DO MARACA,COMUNIDADE DO MARACA,S/N,COMUNIDADE MARACA,"COMUNIDADE DO MARACA, COMUNIDADE MARACA, MAZAGAO, AP, BRASIL",-0.04957,-51.11967,"Travessa São José Comunidade do Coração, 68903, Macapá","0 2m 58.452s S, 51 7m 10.812s W"
AP,MAZAGAO,PM MZG POSTO DE SAUDE MARANATA,COMUNIDADE MARANATA,1,COMUNIDADE MARANATA,"COMUNIDADE MARANATA, COMUNIDADE MARANATA, MAZAGAO, AP, BRASIL",-0.04957,-51.11967,"Travessa São José Comunidade do Coração, 68903, Macapá","0 2m 58.452s S, 51 7m 10.812s W"
AP,MAZAGAO,PM MZG POSTO DE SAUDE DO ARIRAMBA,COMUNIDADE DO ARIRAMBA,1,COMUNIDADE ARIRAMBA,"COMUNIDADE DO ARIRAMBA, COMUNIDADE ARIRAMBA, MAZAGAO, AP, BRASIL",-0.04957,-51.11967,"Travessa São José Comunidade do Coração, 68903, Macapá","0 2m 58.452s S, 51 7m 10.812s W"
AP,MAZAGAO,PM MZG POSTO DE SAUDE VILA NOVA DO BISPO,COMUNIDADE VILA NOVA,S/N,COMUN VILA NOVA,"COMUNIDADE VILA NOVA, COMUN VILA NOVA, MAZAGAO, AP, BRASIL",-0.12448,-51.2846,"Avenida Vila Nova, 68940-000, Mazagão","0 7m 28.128s S, 51 17m 4.56s W"
AP,MAZAGAO,PM MZG UBS DR CID SANTANA,RUA PRESIDENTE VARGAS,1,OLARIA,"RUA PRESIDENTE VARGAS, OLARIA, MAZAGAO, AP, BRASIL",-0.1155,-51.28381,"Rua Presidente Vargas, 68940-000, Mazagão","0 6m 55.8s S, 51 17m 1.716s W"
AP,MAZAGAO,PM MZG POSTO DE SAUDE RECREIO DO RIO PRETO,COMUNIDADE DO RIO PRETO,S/N,COMUN RIO PRETO,"COMUNIDADE DO RIO PRETO, COMUN RIO PRETO, MAZAGAO, AP, BRASIL",-20.81087,-49.37913,São José do Rio Preto,"20 48m 39.132s S, 49 22m 44.868s W"
AP,MAZAGAO,PM MZG POSTO DE SAUDE CENTRAL DO MARACA,VILA DO MARACA,1,VILA DO MARACA,"VILA DO MARACA, VILA DO MARACA, MAZAGAO, AP, BRASIL",-23.6929,-46.46135,"Avenida do Manacá, 09361-110, Mauá","23 41m 34.44s S, 46 27m 40.86s W"
AP,MAZAGAO,SES AP UNID MISTA DE SAUDE DE MAZAGAO,RUA PRESIDENTE VARGAS,440,CENTRO,"RUA PRESIDENTE VARGAS, CENTRO, MAZAGAO, AP, BRASIL",-0.1155,-51.28381,"Rua Presidente Vargas, 68940-000, Mazagão","0 6m 55.8s S, 51 17m 1.716s W"
AP,MAZAGAO,PM MZG POSTO DE SAUDE SAO JOSE DO AJURUXI,COMUNIDADE SAO JOSE DO AJURUXI,1,C S JOSE DO AJURUX,"COMUNIDADE SAO JOSE DO AJURUXI, C S JOSE DO AJURUX, MAZAGAO, AP, BRASIL",-0.04957,-51.11967,"Travessa São José Comunidade do Coração, 68903, Macapá","0 2m 58.452s S, 51 7m 10.812s W"
AP,MAZAGAO,PM MZG POSTO DE SAUDE DE CURUCA,COMUNIDADE DE CURUC,1,C CURUC,"COMUNIDADE DE CURUC, C CURUC, MAZAGAO, AP, BRASIL",-0.11592,-51.29088,"Avenida Prefeito Antônio Carpina de Oliveira, 68940-000, Mazagão","0 6m 57.312s S, 51 17m 27.168s W"
AP,MAZAGAO,PM MZG UBS ADAUTO BASILIO,RUA VEIGA CABRAL,S/N,SAO TIAGO,"RUA VEIGA CABRAL, SAO TIAGO, MAZAGAO, AP, BRASIL",-0.11717,-51.28651,"Rua Veiga Cabral, 68940, Mazagão","0 7m 1.812s S, 51 17m 11.436s W"
AP,MAZAGAO,PM MZG UBS TIAGO DA FONSECA E SILVA,RUA INTENDENTE ALFREDO PINTO,S/N,UNIAO,"RUA INTENDENTE ALFREDO PINTO, UNIAO, MAZAGAO, AP, BRASIL",-0.11478,-51.29152,"Avenida Intendente Alfredo Valente Pinto, 68940-000, Mazagão","0 6m 53.208s S, 51 17m 29.472s W"
AP,OIAPOQUE,PMOPQ PS PRIMEIRO DO CASSIPORE,BR 156 KM 100,S/N,CASSIPORE,"BR 156 KM 100, CASSIPORE, OIAPOQUE, AP, BRASIL",3.36185,-51.6745,"BR-156, 68980-000, Oiapoque","3 21m 42.66s N, 51 40m 28.2s W"
AP,OIAPOQUE,PMOPQ PS DE CLEVELANDIA,LIRA CASTRO,S/N,CLEVELANDIA,"LIRA CASTRO, CLEVELANDIA, OIAPOQUE, AP, BRASIL",3.8156,-51.86228,"Avenida Lira Castro, 68980-000, Oiapoque","3 48m 56.16s N, 51 51m 44.208s W"
AP,OIAPOQUE,PMOPQ PS VILA VELHA DO CASSIPORE,BR 156 KM 130,S/N,RURAL,"BR 156 KM 130, RURAL, OIAPOQUE, AP, BRASIL",3.36185,-51.6745,"BR-156, 68980-000, Oiapoque","3 21m 42.66s N, 51 40m 28.2s W"
AP,OIAPOQUE,PMOPQ PS DO PIQUIA KM 30,BR 156 KM 30,S/N,PIQUIA,"BR 156 KM 30, PIQUIA, OIAPOQUE, AP, BRASIL",3.5320249,-51.766517,"BR-156, Piquia, Oiapoque, Região Geográfica Imediata de Oiapoque, Região Geográfica Intermediária de Oiapoque-Porto Grande, Amapá, Região Norte, Brasil","3 31m 55.2896s N, 51 45m 59.4612s W"
AP,OIAPOQUE,PMOPQ UBS DO PLANALTO,RUA ULISSES GUIMARAES,S/N,PLANALTO,"RUA ULISSES GUIMARAES, PLANALTO, OIAPOQUE, AP, BRASIL",3.84072,-51.83186,"Rua Ulisses Guimarães, 68980-000, Oiapoque","3 50m 26.592s N, 51 49m 54.696s W"
AP,OIAPOQUE,PMOPQ UBS VILA VITORIA,RUA GERVASIO BARBOSA,522,VILA VITORIA,"RUA GERVASIO BARBOSA, VILA VITORIA, OIAPOQUE, AP, BRASIL",-23.53071,-46.20366,"Rua Manoel Joaquim Barbosa, 08730-050, Mogi das Cruzes","23 31m 50.556s S, 46 12m 13.176s W"
AP,OIAPOQUE,PMOPQ UBS JULIETA PALMERIM,RUA SANTOS DRUMONT,S/N,CENTRO,"RUA SANTOS DRUMONT, CENTRO, OIAPOQUE, AP, BRASIL",3.84675,-51.83601,"Rua Santos Dumont, 68980-000, Oiapoque","3 50m 48.3s N, 51 50m 9.636s W"
AP,OIAPOQUE,PMOPQ UBS NOVA ESPERANCA,RUA LELIO SILVA,S/N,NOVA ESPERANCA,"RUA LELIO SILVA, NOVA ESPERANCA, OIAPOQUE, AP, BRASIL",3.844430000000001,-51.83343,"Rua Lélio Silva, Oiapoque","3 50m 39.948s N, 51 50m 0.348s W"
AP,OIAPOQUE,PMOPQ UBS DO INFRAERO,AV SANTA HELENA,1304,INFRAERO,"AV SANTA HELENA, INFRAERO, OIAPOQUE, AP, BRASIL",-0.83683,-52.52541,"Avenida Santa Helena, 68924-000, Laranjal do Jari","0 50m 12.588s S, 52 31m 31.476s W"
AP,PEDRA BRANCA DO AMAPARI,SES AP UNID MISTA DE SAUDE DE PEDRA BRANCA DO AMAPARI,RUA FRANCISCO DUTRA,517,CENTRO,"RUA FRANCISCO DUTRA, CENTRO, PEDRA BRANCA DO AMAPARI, AP, BRASIL",0.77767,-51.9532,"Rua Francisco Brás, 68945, Pedra Branca do Amapari","0 46m 39.612s N, 51 57m 11.52s W"
AP,PEDRA BRANCA DO AMAPARI,PMPBA UBS PEDRA BRANCA DO AMAPARI,RUA FRANCISCO BRAZ,35,CENTRO,"RUA FRANCISCO BRAZ, CENTRO, PEDRA BRANCA DO AMAPARI, AP, BRASIL",0.77767,-51.9532,"Rua Francisco Brás, 68945, Pedra Branca do Amapari","0 46m 39.612s N, 51 57m 11.52s W"
AP,PEDRA BRANCA DO AMAPARI,PMPBA POSTO DE SAUDE SAO SEBASTIAO DO CACHACO,COMUNIDADE DE SAO SEBASTIAO DO CACHACO,1,COMUNIDADE SAO SEBAS,"COMUNIDADE DE SAO SEBASTIAO DO CACHACO, COMUNIDADE SAO SEBAS, PEDRA BRANCA DO AMAPARI, AP, BRASIL",0.77477,-51.95855,"Rua São Francisco, 68945-000, Pedra Branca do Amapari","0 46m 29.172s N, 51 57m 30.78s W"
AP,PEDRA BRANCA DO AMAPARI,PMPBA POSTO DE SAUDE DO CACHORRINHO,COMUNIDADE DO CACHORRINHO,1,COMUNIDADE CACHORRIN,"COMUNIDADE DO CACHORRINHO, COMUNIDADE CACHORRIN, PEDRA BRANCA DO AMAPARI, AP, BRASIL",0.77753,-51.95317,Pedra Branca do Amapari,"0 46m 39.108s N, 51 57m 11.412s W"
AP,PEDRA BRANCA DO AMAPARI,PMPBA POSTO DE SAUDE SAO JOSE DO CACHORRINHO,COLONIA DO CACHORRINHO,S/N,COLONIA DO CACHORRIN,"COLONIA DO CACHORRINHO, COLONIA DO CACHORRIN, PEDRA BRANCA DO AMAPARI, AP, BRASIL",0.77753,-51.95317,Pedra Branca do Amapari,"0 46m 39.108s N, 51 57m 11.412s W"
AP,PEDRA BRANCA DO AMAPARI,PMPBA UBS AGUA FRIA,COMUNIDADE AGUA FRIA,1,AGUA FRIA,"COMUNIDADE AGUA FRIA, AGUA FRIA, PEDRA BRANCA DO AMAPARI, AP, BRASIL",0.77753,-51.95317,Pedra Branca do Amapari,"0 46m 39.108s N, 51 57m 11.412s W"
AP,PEDRA BRANCA DO AMAPARI,PMPBA UBS SETE ILHAS,COMUNIDADE SETE ILHAS,1,SETE ILHAS,"COMUNIDADE SETE ILHAS, SETE ILHAS, PEDRA BRANCA DO AMAPARI, AP, BRASIL",0.77753,-51.95317,Pedra Branca do Amapari,"0 46m 39.108s N, 51 57m 11.412s W"
AP,PEDRA BRANCA DO AMAPARI,PMPBA POSTO DE SAUDE DO RIOZINHO,COMUNIDADE DO RIOZINHO,1,COMUNIDADE DO RIOZIN,"COMUNIDADE DO RIOZINHO, COMUNIDADE DO RIOZIN, PEDRA BRANCA DO AMAPARI, AP, BRASIL",0.77753,-51.95317,Pedra Branca do Amapari,"0 46m 39.108s N, 51 57m 11.412s W"
AP,PEDRA BRANCA DO AMAPARI,PMPBA POSTO DE SAUDE DO CENTRO NOVO,COMUNIDADE DO CENTRO NOVO,S/N,COMUNIDADE DE CENTRO,"COMUNIDADE DO CENTRO NOVO, COMUNIDADE DE CENTRO, PEDRA BRANCA DO AMAPARI, AP, BRASIL",0.77753,-51.95317,Pedra Branca do Amapari,"0 46m 39.108s N, 51 57m 11.412s W"
AP,PEDRA BRANCA DO AMAPARI,PMPBA POSTO DE SAUDE TUCANO II,COMUNIDADE DO TUCANO II,S/N,COMUNIDADE DO TUCANO,"COMUNIDADE DO TUCANO II, COMUNIDADE DO TUCANO, PEDRA BRANCA DO AMAPARI, AP, BRASIL",0.77753,-51.95317,Pedra Branca do Amapari,"0 46m 39.108s N, 51 57m 11.412s W"
AP,PORTO GRANDE,PMPG UBS MANOEL CORTEZ,JOSE AIRTON NASCIMENTO,S/N,MANOEL CORTEZ,"JOSE AIRTON NASCIMENTO, MANOEL CORTEZ, PORTO GRANDE, AP, BRASIL",0.70177,-51.39874,"Rua José de Araújo, 68997-000, Porto Grande","0 42m 6.372s N, 51 23m 55.464s W"
AP,PORTO GRANDE,PMPG PS DO VILA NOVA,GARIMPO DO VILA NOVA,S/N,ZONA RURAL,"GARIMPO DO VILA NOVA, ZONA RURAL, PORTO GRANDE, AP, BRASIL",-30.11485,-51.18073,"Vila Nova, Porto Alegre","30 6m 53.46s S, 51 10m 50.628s W"
AP,PORTO GRANDE,PMPG PS MANOEL CAMELO DE OLIVEIRA,ASSENTAMENTO NOVA COLINA,S/N,NOVA COLINA ZONA RUR,"ASSENTAMENTO NOVA COLINA, NOVA COLINA ZONA RUR, PORTO GRANDE, AP, BRASIL",-1.33673,-48.37648,"Rua Nova Colina & Avenida Porto Grande, 67030, Ananindeua","1 20m 12.228s S, 48 22m 35.328s W"
AP,PORTO GRANDE,PMPG UBS MANOEL DE SOUSA PEREIRA,COLONIA AGRICOLA DO MATAPI,S/N,ZONA RURAL,"COLONIA AGRICOLA DO MATAPI, ZONA RURAL, PORTO GRANDE, AP, BRASIL",-32.04053,-52.096,"Rua Apelles Porto Alegre, 96200-060, Rio Grande","32 2m 25.908s S, 52 5m 45.6s W"
AP,PORTO GRANDE,PMPG PS M BRASILINA GONCALVES,RODOVIA PERIMETRAL NORTE KM 142,S/N,ZONA RURAL,"RODOVIA PERIMETRAL NORTE KM 142, ZONA RURAL, PORTO GRANDE, AP, BRASIL",-32.04105,-52.09573,"Rua Apelles Porto Alegre, 142, 96200-060, Rio Grande","32 2m 27.78s S, 52 5m 44.628s W"
AP,PORTO GRANDE,PMPG UBS JOSE LUIZ GOMES BARRETO,RODOVIA PERIMETRAL NORTE KM 150,S/N,ZONA RURAL,"RODOVIA PERIMETRAL NORTE KM 150, ZONA RURAL, PORTO GRANDE, AP, BRASIL",-32.041090000000004,-52.09571,"Rua Apelles Porto Alegre, 150, 96200-060, Rio Grande","32 2m 27.924s S, 52 5m 44.556s W"
AP,PORTO GRANDE,PMPG UBS CENTRO I E II,AV OITO DE AGOSTO,S/N,CENTRO,"AV OITO DE AGOSTO, CENTRO, PORTO GRANDE, AP, BRASIL",-30.24322,-54.93173,"Rua Oito de Agosto, 97590-000, Rosário do Sul","30 14m 35.592s S, 54 55m 54.228s W"
AP,PORTO GRANDE,PMPG UBS WENDER RODRIGUES DE SOUSA,AV PRINCESA DAYANE,S/N,AEROPORTO,"AV PRINCESA DAYANE, AEROPORTO, PORTO GRANDE, AP, BRASIL",0.7015,-51.39942,"Rua Princesa Dayana, 68997-000, Porto Grande","0 42m 5.4s N, 51 23m 57.912s W"
AP,PORTO GRANDE,PMPG PS DO MUNGUBA,RODOVIA PERIMETRAL NORTE KM 162,S/N,ZONA RURAL,"RODOVIA PERIMETRAL NORTE KM 162, ZONA RURAL, PORTO GRANDE, AP, BRASIL",-32.04114000000001,-52.09569000000001,"Rua Apelles Porto Alegre, 162, 96200-060, Rio Grande","32 2m 28.104s S, 52 5m 44.484s W"
AP,PORTO GRANDE,PMPG UBS NOVA ESPERANCA,RUA SOLDADO CLAUDINEI PEREIRA DOS SANTOS,S/N,NOVA ESPERANCA,"RUA SOLDADO CLAUDINEI PEREIRA DOS SANTOS, NOVA ESPERANCA, PORTO GRANDE, AP, BRASIL",-30.12319,-51.21908,"Rua Jandira Pereira Santos, 91750-560, Porto Alegre","30 7m 23.484s S, 51 13m 8.688s W"
AP,PORTO GRANDE,PMPG PS VILA DO MUNGUBA,RODOVIA PERIMETRAL NORTE KM 160,S/N,VILA DO MUNGUBA ZONA,"RODOVIA PERIMETRAL NORTE KM 160, VILA DO MUNGUBA ZONA, PORTO GRANDE, AP, BRASIL",-30.121440000000003,-51.25745,"Rua Apolinário Porto Alegre, 160, 91920-610, Porto Alegre","30 7m 17.184s S, 51 15m 26.82s W"
AP,PRACUUBA,PMP POSTO DE SAUDE DO BREU,RODOVIA BR 156,S/N,BREU,"RODOVIA BR 156, BREU, PRACUUBA, AP, BRASIL",-7.9558399999999985,-36.20436,"Rua Antônio Pereira de Abreu, 156, 55192-345, Santa Cruz do Capibaribe","7 57m 21.024s S, 36 12m 15.696s W"
AP,PRACUUBA,PMP UNIDADE BASICA DE SAUDE DE PRACUUBA,RUA ELOGIO FERREIRA,72,CENTRO,"RUA ELOGIO FERREIRA, CENTRO, PRACUUBA, AP, BRASIL",1.7431,-50.78454,"Rua Elogio Ferreira, 68918-000, Pracuúba","1 44m 35.16s N, 50 47m 4.344s W"
AP,PRACUUBA,PMP POSTO DE SAUDE DO PERNAMBUCO,VILA DO PERNAMBUCO,S/N,CENTRO,"VILA DO PERNAMBUCO, CENTRO, PRACUUBA, AP, BRASIL",-15.79276,-47.84874,"Via Acampamento Pacheco Fernandes, 70802, 70803, 70804, 73340, Brasília","15 47m 33.936s S, 47 50m 55.464s W"
AP,PRACUUBA,PMP UNIDADE BASICA DE SAUDE DO CUJUBIM,RODOVIA BR 156,S/N,CUJUBIM,"RODOVIA BR 156, CUJUBIM, PRACUUBA, AP, BRASIL",0.03954,-51.13672,"Rodovia AP-20, 68906-720, Macapá","0 2m 22.344s N, 51 8m 12.192s W"
AP,PRACUUBA,PMP POSTO DE SAUDE DO FLEXAL,RODOVIA BR 156,S/N,FLEXAL,"RODOVIA BR 156, FLEXAL, PRACUUBA, AP, BRASIL",0.02383,-51.08054,"Rua Tiago Flexa da Costa, 156, 68904-260, Macapá","0 1m 25.788s N, 51 4m 49.944s W"
AP,SANTANA,PM STN PS IGARAPE DO LAGO,BR 156,S/N,IGARAPE DO LAGO,"BR 156, IGARAPE DO LAGO, SANTANA, AP, BRASIL",0.1509512999999999,-51.5775872,"BR-156, Jeferson, Igarapé do Lago, Santana, Região Geográfica Imediata de Macapá, Região Geográfica Intermediária de Macapá, Amapá, Região Norte, Brasil","0 9m 3.42468s N, 51 34m 39.3139s W"
AP,SANTANA,PM STN UBS ILHA DE SANTANA,RAMAL DA PICARREIRA,1,ILHA DE SANTANA,"RAMAL DA PICARREIRA, ILHA DE SANTANA, SANTANA, AP, BRASIL",-0.0736932,-51.1762536,"Ramal da Piçarreira, Ilha de Santana, Santana, Região Geográfica Imediata de Macapá, Região Geográfica Intermediária de Macapá, Amapá, Região Norte, 68925-000, Brasil","0 4m 25.2955s S, 51 10m 34.513s W"
AP,SANTANA,PM STN UBS DR IACY ALCANTARA,RUA JOAO LEITE COUTINHO,S/N,FONTE NOVA,"RUA JOAO LEITE COUTINHO, FONTE NOVA, SANTANA, AP, BRASIL",-0.020584,-51.17148270000001,"Rua João Leite Coutinho, Fonte Nova, Santana, Região Geográfica Imediata de Macapá, Região Geográfica Intermediária de Macapá, Amapá, Região Norte, 68925-105, Brasil","0 1m 14.1024s S, 51 10m 17.3377s W"
AP,SANTANA,PM STN UBS ANTONIO SERIEIRO,AVENIDA MARIA COLARES,1850,NOVA BRASILIA,"AVENIDA MARIA COLARES, NOVA BRASILIA, SANTANA, AP, BRASIL",-0.0485926,-51.166938,"Avenida Maria Colares, Vila Remédios, Nova Brasilia, Santana, Região Geográfica Imediata de Macapá, Região Geográfica Intermediária de Macapá, Amapá, Região Norte, 68926-102, Brasil","0 2m 54.9334s S, 51 10m 0.9768s W"
AP,SANTANA,PM STN UBS FOZ RIO VILA NOVA,BR 156,S/N,RIO VILA NOVA,"BR 156, RIO VILA NOVA, SANTANA, AP, BRASIL",-0.04743,-51.14421,"Travessa Rio Vila Nova, 156, 68926-375, Santana","0 2m 50.748s S, 51 8m 39.156s W"
AP,SANTANA,PM STN PS ANAUERAPUCU,RODOVIA AP010,S/N,VILA ANAUERAPUCU,"RODOVIA AP010, VILA ANAUERAPUCU, SANTANA, AP, BRASIL",-0.047060000000000005,-51.15316,"Rodovia Salvador Diniz, 68927, Santana","0 2m 49.416s S, 51 9m 11.376s W"
AP,SANTANA,PM STN UBS SANTO ANTONIO,BR 156,S/N,SANTO ANTONIO,"BR 156, SANTO ANTONIO, SANTANA, AP, BRASIL",-9.36832,-37.24589,"Rua Santo Antônio, 156, 57500-000, Santana do Ipanema","9 22m 5.952s S, 37 14m 45.204s W"
AP,SANTANA,PM STN UBS PICARREIRA,RAMAL DO DELTA,S/N,PICARREIRA,"RAMAL DO DELTA, PICARREIRA, SANTANA, AP, BRASIL",-0.0407079,-51.192082,"Ramal Delta do Matapi, Picarreira, Santana, Região Geográfica Imediata de Macapá, Região Geográfica Intermediária de Macapá, Amapá, Região Norte, 68925-105, Brasil","0 2m 26.5484s S, 51 11m 31.4952s W"
AP,SANTANA,PM STN PS MATAO DO PIACACA,ASSENTAMENTO MATAO DO PIACACA,1,MATAO DO PIACACA,"ASSENTAMENTO MATAO DO PIACACA, MATAO DO PIACACA, SANTANA, AP, BRASIL",-23.21294,-46.90511,"Estrada do Matão, Jundiaí","23 12m 46.584s S, 46 54m 18.396s W"
AP,SANTANA,PM STN UBS TRES IRMAOS,CANAL DO RIO VILA NOVA,1,VILA NOVA,"CANAL DO RIO VILA NOVA, VILA NOVA, SANTANA, AP, BRASIL",-0.04727,-51.14399,"Travessa Rio Vila Nova, 68926-375, Santana","0 2m 50.172s S, 51 8m 38.364s W"
AP,SANTANA,PM STN UBS ALTO PIRATIVA,COMUNIDADE DO ALTO PIRATIVA,1,COMUN ALTO PIRATIVA,"COMUNIDADE DO ALTO PIRATIVA, COMUN ALTO PIRATIVA, SANTANA, AP, BRASIL",-22.39432,-47.57273,"Alto do Santana, Rio Claro","22 23m 39.552s S, 47 34m 21.828s W"
AP,SANTANA,PM STN POLICLINICA DR ALBERTO LIMA,TRAVESSA MOURA DE CARVALHO,30,DANIEL,"TRAVESSA MOURA DE CARVALHO, DANIEL, SANTANA, AP, BRASIL",-0.0546393,-51.16070379999999,"Travessa Manoel Carvalho, Daniel, Santana, Região Geográfica Imediata de Macapá, Região Geográfica Intermediária de Macapá, Amapá, Região Norte, 68926-102, Brasil","0 3m 16.7015s S, 51 9m 38.5337s W"
AP,SANTANA,PM STN POLICLINICA MARIA TADEU AGUIAR,PRESIDENTE JUSCELINO KUBITSCHEK DE OLIVEIRA,529,PARAISO,"PRESIDENTE JUSCELINO KUBITSCHEK DE OLIVEIRA, PARAISO, SANTANA, AP, BRASIL",-0.02867,-51.17861,"Rua Presidente Juscelino Kubitschek de Oliveira, 68928-069, Santana","0 1m 43.212s S, 51 10m 42.996s W"
AP,SANTANA,PM STN UBS DA FAMILIA ELESBAO,VILA DO ELESBAO,1,RAMAL DA OLARIA,"VILA DO ELESBAO, RAMAL DA OLARIA, SANTANA, AP, BRASIL",-0.03648,-51.18233,"Ramal da Olaria, 68927, Santana","0 2m 11.328s S, 51 10m 56.388s W"
AP,SANTANA,PM STN UBS IGARAPE DA FORTALEZA,RODOVIA SALVADOR DINIZ,2477,IGARAPE DA FORTALEZA,"RODOVIA SALVADOR DINIZ, IGARAPE DA FORTALEZA, SANTANA, AP, BRASIL",-0.0491562,-51.1389837,"Rodovia Salvador Diniz, Igarape da Fortaleza, Santana, Região Geográfica Imediata de Macapá, Região Geográfica Intermediária de Macapá, Amapá, Região Norte, 68926-102, Brasil","0 2m 56.9623s S, 51 8m 20.3413s W"
AP,SANTANA,PM STN UBS PARQUE DAS LARANJEIRAS,RUA DAS ORQUIDEAS,S/N,PARQUE DAS LARANJEIR,"RUA DAS ORQUIDEAS, PARQUE DAS LARANJEIR, SANTANA, AP, BRASIL",-30.87005,-55.54949000000001,"Rua Adão Paulino Vieira, 97571-634, Santana do Livramento","30 52m 12.18s S, 55 32m 58.164s W"
AP,SANTANA,PM STN UBS FLORIANO REGO,RUA CLAUDIO LUCIO MONTEIRO,2,COMERCIAL,"RUA CLAUDIO LUCIO MONTEIRO, COMERCIAL, SANTANA, AP, BRASIL",-0.05341,-51.1772,"Rua Cláudio Lúcio Monteiro, 68927-003, Santana","0 3m 12.276s S, 51 10m 37.92s W"
AP,SERRA DO NAVIO,PMSN UBS SEBASTIAO MOURA DE ARAUJO,COMUNIDADE DO CACHACO,S/N,C CACHACO,"COMUNIDADE DO CACHACO, C CACHACO, SERRA DO NAVIO, AP, BRASIL",0.86687,-52.02577,Serra do Navio,"0 52m 0.732s N, 52 1m 32.772s W"
AP,SERRA DO NAVIO,PMSN UBS MUNICIPAL DA CIDADE DE SERRA DO NAVIO,RUA A1,S/N,VILA INTERMEDIARIA,"RUA A1, VILA INTERMEDIARIA, SERRA DO NAVIO, AP, BRASIL",0.8949,-52.0064,"Rua 3 Primária, 68948-000, Serra do Navio","0 53m 41.64s N, 52 0m 23.04s W"
AP,SERRA DO NAVIO,PMSN UBS JACIRA RIBEIRO DA LUZ,ASSENTAMENTO DE SERRA DO NAVIO,S/N,ASSENTAMENTO DE SERR,"ASSENTAMENTO DE SERRA DO NAVIO, ASSENTAMENTO DE SERR, SERRA DO NAVIO, AP, BRASIL",0.86687,-52.02577,Serra do Navio,"0 52m 0.732s N, 52 1m 32.772s W"
AP,SERRA DO NAVIO,PMSN UBS ALCIMAR DE ALMEIDA SILVA,COMUNIDADE RIBEIRINHA DO CAPIVARA,S/N,COMUNIDADE DO CAPIVA,"COMUNIDADE RIBEIRINHA DO CAPIVARA, COMUNIDADE DO CAPIVA, SERRA DO NAVIO, AP, BRASIL",0.86687,-52.02577,Serra do Navio,"0 52m 0.732s N, 52 1m 32.772s W"
AP,SERRA DO NAVIO,SES AP UNID M S DE SERRA D0 NAVIO,RUA 2,529,VILA INTERMEDIARIA,"RUA 2, VILA INTERMEDIARIA, SERRA DO NAVIO, AP, BRASIL",0.90363,-52.00165,"Rua 2, 68948-000, Serra do Navio","0 54m 13.068s N, 52 0m 5.94s W"
AP,SERRA DO NAVIO,PMSN UBS LUCILIANA BASTOS DA SILVA,DIDIMO FERREIRA BARBOSA,755,COLONIA AGUA BRANCA,"DIDIMO FERREIRA BARBOSA, COLONIA AGUA BRANCA, SERRA DO NAVIO, AP, BRASIL",0.93812,-51.99427,"Rua Didimo Ferreira Barbosa, 68948-000, Serra do Navio","0 56m 17.232s N, 51 59m 39.372s W"
AP,SERRA DO NAVIO,PMSN UBS GIMINIANO LIBERATO MARTINS JUNIOR,COMUNIDADE RIBEIRINHA DO PEDRA PRETA,S/N,PEDRA PRETA,"COMUNIDADE RIBEIRINHA DO PEDRA PRETA, PEDRA PRETA, SERRA DO NAVIO, AP, BRASIL",0.90254,-52.00868,"Ramal Pedra Preta, 68948-000, Serra do Navio","0 54m 9.144s N, 52 0m 31.248s W"
AP,TARTARUGALZINHO,PM TARTA POSTO DE SAUDE GUANABARA,COMUNIDADE GUANABARA,S/N,GUANABARA,"COMUNIDADE GUANABARA, GUANABARA, TARTARUGALZINHO, AP, BRASIL",0.05777,-51.05491,"Rua Guanabara, Macapá","0 3m 27.972s N, 51 3m 17.676s W"
AP,TARTARUGALZINHO,PM TARTA POSTO DE SAUDE ENTRE RIOS,VILA DO TREVO,S/N,ENTRE RIOS,"VILA DO TREVO, ENTRE RIOS, TARTARUGALZINHO, AP, BRASIL",-28.25408,-52.38413,"Vila Entre Rios, Passo Fundo","28 15m 14.688s S, 52 23m 2.868s W"
AP,TARTARUGALZINHO,PM TARTA POSTO DE SAUDE JANARY I,GOVERNADOR JANARY I,S/N,JANARY I,"GOVERNADOR JANARY I, JANARY I, TARTARUGALZINHO, AP, BRASIL",0.07318,-51.06449,"Rua Janary Nunes 9 Lot Infraero I, Macapá","0 4m 23.448s N, 51 3m 52.164s W"
AP,TARTARUGALZINHO,PM TARTA POSTO DE SAUDE NOVA VIDA,COMUNIDADE NOVO VIDA,S/N,NOVA VIDA,"COMUNIDADE NOVO VIDA, NOVA VIDA, TARTARUGALZINHO, AP, BRASIL",-23.83279,-50.50566,"Vida Nova, Sapopema","23 49m 58.044s S, 50 30m 20.376s W"
AP,TARTARUGALZINHO,PM TARTA POSTO DE SAUDE ASSENTAMENTO SAO BENEDITO,ASSENTAMENTO SAO BENEDITO,S/N,ASSENTAMENTO SAO BEN,"ASSENTAMENTO SAO BENEDITO, ASSENTAMENTO SAO BEN, TARTARUGALZINHO, AP, BRASIL",0.60211,-50.70178,"Rua São Benedito, 68976-000, Itaubal","0 36m 7.596s N, 50 42m 6.408s W"
AP,TARTARUGALZINHO,PM TARTA POSTO DE SAUDE FAZENDA MODELO,COMUNIDADE FAZENDA MODELO,S/N,FAZENDA MODELO,"COMUNIDADE FAZENDA MODELO, FAZENDA MODELO, TARTARUGALZINHO, AP, BRASIL",-8.0953,-34.95523,"Estrada Fazenda Modelo, 51350, Recife","8 5m 43.08s S, 34 57m 18.828s W"
AP,TARTARUGALZINHO,PM TARTA POSTO DE SAUDE TERRA FIRME,COMUNIDADE DO TERRA FIRME,S/N,TERRA FIRME,"COMUNIDADE DO TERRA FIRME, TERRA FIRME, TARTARUGALZINHO, AP, BRASIL",-1.44834,-48.45073,"Montese-Terra Firme, Belém","1 26m 54.024s S, 48 27m 2.628s W"
AP,TARTARUGALZINHO,PM TARTA UBS IPUJUCAN DA LUZ NASCIMENTO,RUA DAS PALMEIRAS,S/N,ADELINO GURJAO,"RUA DAS PALMEIRAS, ADELINO GURJAO, TARTARUGALZINHO, AP, BRASIL",1.50922,-50.90854,"Rua das Palmeiras, 68990-000, Tartarugalzinho","1 30m 33.192s N, 50 54m 30.744s W"
AP,TARTARUGALZINHO,PM TARTA UBS JOSE ALVES MEIRELES,ALAMEDA EUCALIPTO,657,CENTRO,"ALAMEDA EUCALIPTO, CENTRO, TARTARUGALZINHO, AP, BRASIL",1.50247,-50.91069,"Alameda Eucalipto, 68990-000, Tartarugalzinho","1 30m 8.892s N, 50 54m 38.484s W"
AP,TARTARUGALZINHO,PM TARTA POSTO DE SAUDE BOM JESUS,BOM JESUS,S/N,BOM JESUS,"BOM JESUS, BOM JESUS, TARTARUGALZINHO, AP, BRASIL",1.3744708,-50.9881255,"Estrada de Acesso à Comunidade Bom Jesus, Tartarugalzinho, Região Geográfica Imediata de Oiapoque, Região Geográfica Intermediária de Oiapoque-Porto Grande, Amapá, Região Norte, Brasil","1 22m 28.0949s N, 50 59m 17.2518s W"
AP,TARTARUGALZINHO,PM TARTA UBS COLONIA DO CEDRO,COLONIA DO CEDRO,S/N,COLONIA DO CEDRO,"COLONIA DO CEDRO, COLONIA DO CEDRO, TARTARUGALZINHO, AP, BRASIL",-23.85602,-46.72236,"Estrada do Pedro Rocha À Colônia, 04131-050, São Paulo","23 51m 21.672s S, 46 43m 20.496s W"
AP,TARTARUGALZINHO,PM TARTA POSTO DE SAUDE SANTA ROSA,COMUNIDADE SANTA ROSA,S/N,SANTA ROSA,"COMUNIDADE SANTA ROSA, SANTA ROSA, TARTARUGALZINHO, AP, BRASIL",-27.87088,-54.48172,Santa Rosa,"27 52m 15.168s S, 54 28m 54.192s W"
AP,TARTARUGALZINHO,PM TARTA POSTO DE SAUDE LAGO NOVO,LAGO NOVO,S/N,LAGO NOVO,"LAGO NOVO, LAGO NOVO, TARTARUGALZINHO, AP, BRASIL",-8.75757,-67.37507,"Lago Novo, Boca do Acre","8 45m 27.252s S, 67 22m 30.252s W"
AP,TARTARUGALZINHO,PM TARTA UBS LIVRAMENTO,LIVRAMENTO,S/N,LIVRAMENTO,"LIVRAMENTO, LIVRAMENTO, TARTARUGALZINHO, AP, BRASIL",-30.8779,-55.54892,"Rua Amélia Porto Pereira, 97573-060, Santana do Livramento","30 52m 40.44s S, 55 32m 56.112s W"
AP,TARTARUGALZINHO,PM TARTA POSTO DE SAUDE SAO BENEDITO,COMUNIDADE SAO BENEDITO,S/N,SAO BENEDITO,"COMUNIDADE SAO BENEDITO, SAO BENEDITO, TARTARUGALZINHO, AP, BRASIL",0.60211,-50.70178,"Rua São Benedito, 68976-000, Itaubal","0 36m 7.596s N, 50 42m 6.408s W"
AP,TARTARUGALZINHO,PM TARTA POSTO DE SAUDE ITAUBAL,COMUNIDADE ITAUBAL,S/N,ITAUBAL,"COMUNIDADE ITAUBAL, ITAUBAL, TARTARUGALZINHO, AP, BRASIL",0.60392,-50.69989,Itaubal,"0 36m 14.112s N, 50 41m 59.604s W"
AP,TARTARUGALZINHO,SES AP UNID MISTA DE SAUDE DE TARTARUGALZINHO,RUA MAE VERONICA,482,CENTRO,"RUA MAE VERONICA, CENTRO, TARTARUGALZINHO, AP, BRASIL",1.50556,-50.91282,"Avenida Mãe Verônica, 68990, Tartarugalzinho","1 30m 20.016s N, 50 54m 46.152s W"
AP,VITORIA DO JARI,PMVJ UBS SANTA CLARA,PASSARELA JOSE SIMEAO DE SOUZA,S/N,SANTA CLARA,"PASSARELA JOSE SIMEAO DE SOUZA, SANTA CLARA, VITORIA DO JARI, AP, BRASIL",-0.9184,-52.41556,"Passagem José Simeão de Souza, 68924-000, Vitória do Jari","0 55m 6.24s S, 52 24m 56.016s W"
AP,VITORIA DO JARI,SES AP UNID MISTA DE SAUDE DE VITORIA DO JARI,AVN AYRTON SENA,1180,COMERCIAL,"AVN AYRTON SENA, COMERCIAL, VITORIA DO JARI, AP, BRASIL",-0.93329,-52.41434,"Avenida Ayrton Senna, 68924, Vitória do Jari","0 55m 59.844s S, 52 24m 51.624s W"
AP,VITORIA DO JARI,PMVJ UBS JARILANDIA,LOCALIDADE DE JARILANDIA,1,V DE JARILANDIA,"LOCALIDADE DE JARILANDIA, V DE JARILANDIA, VITORIA DO JARI, AP, BRASIL",-0.83405,-52.51973,"Rua Vinícius de Moares, 68924-000, Laranjal do Jari","0 50m 2.58s S, 52 31m 11.028s W"
AP,VITORIA DO JARI,PMVJ POSTO DE SAUDE PAGA DIVIDAS,LOCALIDADE PAGA DIVIDAS,1,L P DIVIDAS,"LOCALIDADE PAGA DIVIDAS, L P DIVIDAS, VITORIA DO JARI, AP, BRASIL",-0.91976,-52.41657,"Rua Pedro Ladislau da Silveira, Vitória do Jari","0 55m 11.136s S, 52 24m 59.652s W"
AP,VITORIA DO JARI,PMVJ UBS BEIRA RIO,AV AIRTON SENA,303,COMERCIAL,"AV AIRTON SENA, COMERCIAL, VITORIA DO JARI, AP, BRASIL",-0.93329,-52.41434,"Avenida Ayrton Senna, 68924, Vitória do Jari","0 55m 59.844s S, 52 24m 51.624s W"
AP,VITORIA DO JARI,PMVJ UBS CIDADE LIVRE,RUA PEDRO LADISLAU DA SILVEIRA,1,CIDADE LIVRE,"RUA PEDRO LADISLAU DA SILVEIRA, CIDADE LIVRE, VITORIA DO JARI, AP, BRASIL",-0.91976,-52.41657,"Rua Pedro Ladislau da Silveira, Vitória do Jari","0 55m 11.136s S, 52 24m 59.652s W"
AP,VITORIA DO JARI,UBS CAULIM,AVENIDA 08 DE SETEMBRO,0,VILA CAULIM,"AVENIDA 08 DE SETEMBRO, VILA CAULIM, VITORIA DO JARI, AP, BRASIL",-0.92401,-52.40305,"Rua 8 de Setembro, Vitória do Jari","0 55m 26.436s S, 52 24m 10.98s W"
AP,VITORIA DO JARI,PMVJ POSTO DE SAUDE SAO JOAO DO CAJARI,LOCALIDADE DE SAO JOAO DO CAJARI,1,RIO CAJARI,"LOCALIDADE DE SAO JOAO DO CAJARI, RIO CAJARI, VITORIA DO JARI, AP, BRASIL",-6.71656,-37.20372,"Rua Ana Paulina de Medeiros, 59310-000, São João do Sabugi","6 42m 59.616s S, 37 12m 13.392s W"
