UF,MUNICIPIO,ESTABELECIMENTO,LOGRADOURO,NUMERO,BAIRRO,ENDERECO_COMPLETO,latitude,longitude,address,point
SP,MENDONCA,UBS DE MENDONCA,RUA LAZARO SOARES DIAS,570,CENTRO,"RUA LAZARO SOARES DIAS, CENTRO, MENDONCA, SP, BRASIL",,,,
SP,MENDONCA,UBS BENEDICTA DO CARMO OLIVEIRA DONA DITA,RUA ANGELO PETROLINI,136,CENTRO,"RUA ANGELO PETROLINI, CENTRO, MENDONCA, SP, BRASIL",,,,
SP,MERIDIANO,PAS STO ANTONIO DO VIRADOURO MERIDIANO,RUA A,S/N,CENTRO,"RUA A, CENTRO, MERIDIANO, SP, BRASIL",,,,
SP,MERIDIANO,UBS DE MERIDIANO,RUA SETE DE SETEMBRO,2070,CENTRO,"RUA SETE DE SETEMBRO, CENTRO, MERIDIANO, SP, BRASIL",,,,
SP,MESOPOLIS,UBS DE MESOPOLIS,RUA DIREITOS HUMANOS,2164,BOA ESPERANCA,"RUA DIREITOS HUMANOS, BOA ESPERANCA, MESOPOLIS, SP, BRASIL",,,,
SP,MIGUELOPOLIS,P A S II JOSE ANTONIO DA SILVA MIGUELOPOLIS,RUA ABILIO DUARTE,S/N,TETUO INON,"RUA ABILIO DUARTE, TETUO INON, MIGUELOPOLIS, SP, BRASIL",,,,
SP,MIGUELOPOLIS,ESTRATEGIA SAUDE DA FAMILIA II DE MIGUELOPOLIS,AV JOAQUIM SEBASTIAO DE CARVALHO,S/N,SUMARE,"AV JOAQUIM SEBASTIAO DE CARVALHO, SUMARE, MIGUELOPOLIS, SP, BRASIL",,,,
SP,MIGUELOPOLIS,CS II DE MIGUELOPOLIS,AV FRANCISCO A DE FREITAS,1500,CENTRO,"AV FRANCISCO A DE FREITAS, CENTRO, MIGUELOPOLIS, SP, BRASIL",,,,
SP,MIGUELOPOLIS,ESTRATEGIA SAUDE DA FAMILIA I DE MIGUELOPOLIS,AV FERNANDO JORGE MOREIRA,S/N,SUMARE,"AV FERNANDO JORGE MOREIRA, SUMARE, MIGUELOPOLIS, SP, BRASIL",,,,
SP,MINEIROS DO TIETE,ESF CARLOS ALVES MAMEDE,RUA ORIDES SANTILI,400,VILA SONIA,"RUA ORIDES SANTILI, VILA SONIA, MINEIROS DO TIETE, SP, BRASIL",,,,
SP,MINEIROS DO TIETE,ESF SONIA MARIA DALMAZO SANCHEZ,RUA AMALIA SANTESSO RAMPAZZO,110,JARDIM EUROPA,"RUA AMALIA SANTESSO RAMPAZZO, JARDIM EUROPA, MINEIROS DO TIETE, SP, BRASIL",,,,
SP,MINEIROS DO TIETE,CENTRO DE SAUDE III E ESF LUIZ MERCADANTE,RUA MARIA ELIDIA FERRAZ DE ARRUDA,498,CENTRO,"RUA MARIA ELIDIA FERRAZ DE ARRUDA, CENTRO, MINEIROS DO TIETE, SP, BRASIL",,,,
SP,MIRACATU,ESF I OLIVEIRA BARROS MIRACATU,PRACA MARINA WOLPERT,S/N,OLIVEIRA BARROS,"PRACA MARINA WOLPERT, OLIVEIRA BARROS, MIRACATU, SP, BRASIL",,,,
SP,MIRACATU,ESF VI VILA SAO JOSE BARRA FUNDA MIRACATU,ESTRADA DA BARRA FUNDA,0,VILA SAO JOSE,"ESTRADA DA BARRA FUNDA, VILA SAO JOSE, MIRACATU, SP, BRASIL",,,,
SP,MIRACATU,ESF III RIBEIRAO BONITO MIRACATU,ZONA RURAL,S/N,RIBEIRAO BONITO,"ZONA RURAL, RIBEIRAO BONITO, MIRACATU, SP, BRASIL",,,,
SP,MIRACATU,ESF V MUSACEA PEDRO BARROS MIRACATU,RUA MARIA JOSE NOGUEIRA BRUNETTO,S/N,MUSACEA,"RUA MARIA JOSE NOGUEIRA BRUNETTO, MUSACEA, MIRACATU, SP, BRASIL",,,,
SP,MIRACATU,ESF IV JD YOLANDA MIRACATU,RUA NOEL ROSA,S/N,JD YOLANDA,"RUA NOEL ROSA, JD YOLANDA, MIRACATU, SP, BRASIL",,,,
SP,MIRACATU,UBS DR MANOEL PEREZ BAZAN MIRACATU,AV GETULIO VARGAS ESQ R JUSCELINO KUBITSCHECK,S/N,CENTRO,"AV GETULIO VARGAS ESQ R JUSCELINO KUBITSCHECK, CENTRO, MIRACATU, SP, BRASIL",,,,
SP,MIRACATU,ESF VII FAU MIRACATU,ESTRADA MUNICIPAL DO FAU,S/N,FAU,"ESTRADA MUNICIPAL DO FAU, FAU, MIRACATU, SP, BRASIL",,,,
SP,MIRACATU,ESF II SANTA RITA MIRACATU,AVENIDA SAO PAULO,S/N,SANTA RITA,"AVENIDA SAO PAULO, SANTA RITA, MIRACATU, SP, BRASIL",,,,
SP,MIRACATU,UBS SERRA DO CAFEZAL MIRACATU,BR 116 KM 340,S/N,SERRA DO CAFEZAL,"BR 116 KM 340, SERRA DO CAFEZAL, MIRACATU, SP, BRASIL",,,,
SP,MIRA ESTRELA,UBS DE MIRA ESTRELA,PRC BENEDITO CASTREQUINE,472,CENTRO,"PRC BENEDITO CASTREQUINE, CENTRO, MIRA ESTRELA, SP, BRASIL",,,,
SP,MIRANDOPOLIS,UBS DR RUBENS FIGUEIREDO CONRADO MIRANDOPOLIS,RUA TORNADO,147,JD AEROPORTO,"RUA TORNADO, JD AEROPORTO, MIRANDOPOLIS, SP, BRASIL",,,,
SP,MIRANDOPOLIS,CENTRO DE SAUDE DR YOSHITO KANZAWA,AV DR RAUL DA CUNHA BUENO,628,CENTRO,"AV DR RAUL DA CUNHA BUENO, CENTRO, MIRANDOPOLIS, SP, BRASIL",,,,
SP,MIRANDOPOLIS,PENITENCIARIA I MIRANDOPOLIS NESTOR CANOA,AV DR OSVALDO BRANDI FARIA,4450,RIBEIRAO CLARO,"AV DR OSVALDO BRANDI FARIA, RIBEIRAO CLARO, MIRANDOPOLIS, SP, BRASIL",,,,
SP,MIRANDOPOLIS,UBS MARIO COVAS MIRANDOPOLIS,RUA JOAO FRANCISCO,526,1 ALIANCA,"RUA JOAO FRANCISCO, 1 ALIANCA, MIRANDOPOLIS, SP, BRASIL",,,,
SP,MIRANDOPOLIS,UBS NELSON YURASSECK MIRANDOPOLIS,RUA BRASIL,131,AMANDABA,"RUA BRASIL, AMANDABA, MIRANDOPOLIS, SP, BRASIL",,,,
SP,MIRANDOPOLIS,UBS KOZO TAKEUCHI MIRANDOPOLIS,RUA SAO JOAQUIM,S/N,3 ALIANCA,"RUA SAO JOAQUIM, 3 ALIANCA, MIRANDOPOLIS, SP, BRASIL",,,,
SP,MIRANDOPOLIS,UBS DR FRANCISCO TEOTHONIO PARDO MIRANDOPOLIS,RUA OLIMPIO DE MACEDO,1720,JD NSA SRA DE FATIMA,"RUA OLIMPIO DE MACEDO, JD NSA SRA DE FATIMA, MIRANDOPOLIS, SP, BRASIL",,,,
SP,MIRANDOPOLIS,UBS JORGE MALULY NETO MIRANDOPOLIS,RUA ANTONIO SANVITO,30,VALE DO SOL,"RUA ANTONIO SANVITO, VALE DO SOL, MIRANDOPOLIS, SP, BRASIL",,,,
SP,MIRANDOPOLIS,PENITENCIARIA II DE MIRANDOPOLIS,AV DR OSVALDO BRANDI FARIA,4450,RIBEIRAO CLARO,"AV DR OSVALDO BRANDI FARIA, RIBEIRAO CLARO, MIRANDOPOLIS, SP, BRASIL",,,,
SP,MIRANTE DO PARANAPANEMA,ESF DOUTOR TERCIO PESSOA DE VASCONCELOS,AVENIDA ZIL BRASIL,1321,CENTRO,"AVENIDA ZIL BRASIL, CENTRO, MIRANTE DO PARANAPANEMA, SP, BRASIL",,,,
SP,MIRANTE DO PARANAPANEMA,ESF PE DE GALINHA,ASSENTAMENTO FAZENDA HAROLDINA,S/N,ENG VERAS,"ASSENTAMENTO FAZENDA HAROLDINA, ENG VERAS, MIRANTE DO PARANAPANEMA, SP, BRASIL",,,,
SP,MIRANTE DO PARANAPANEMA,ESF CUIABA PAULISTA,RUA SETE,S/N,CUIABA PAULISTA,"RUA SETE, CUIABA PAULISTA, MIRANTE DO PARANAPANEMA, SP, BRASIL",,,,
SP,MIRANTE DO PARANAPANEMA,ESF ANTONIO QUIRINO CAVALCANTE,RUA VALDOMIRO ESTEVAO GOMES,731,CENTRO,"RUA VALDOMIRO ESTEVAO GOMES, CENTRO, MIRANTE DO PARANAPANEMA, SP, BRASIL",,,,
SP,MIRANTE DO PARANAPANEMA,UBS II DR EXPEDITO SHIZUO KUROCE,RUA DR NOBORU KASAE,854,CENTRO,"RUA DR NOBORU KASAE, CENTRO, MIRANTE DO PARANAPANEMA, SP, BRASIL",,,,
SP,MIRANTE DO PARANAPANEMA,ESF SANTA TEREZINHA,RUA PAPA JOAO XXIII,1900,CENTRO,"RUA PAPA JOAO XXIII, CENTRO, MIRANTE DO PARANAPANEMA, SP, BRASIL",,,,
SP,MIRANTE DO PARANAPANEMA,ESF NILO MIGUEL DOS ANJOS,ASSENTAMENTO ESTADUAL CHE GUEVARA,S/N,RURAL,"ASSENTAMENTO ESTADUAL CHE GUEVARA, RURAL, MIRANTE DO PARANAPANEMA, SP, BRASIL",,,,
SP,MIRANTE DO PARANAPANEMA,ESF COSTA MACHADO,RUA CARLOS HELBIG,S/N,DISTRITO DE COSTA MA,"RUA CARLOS HELBIG, DISTRITO DE COSTA MA, MIRANTE DO PARANAPANEMA, SP, BRASIL",,,,
SP,MIRASSOL,UBS AEROPORTO DE MIRASSOL JOSE SICARD,RUA MANOEL ANTONIO CESAR MINE,2689,AEROPORTO,"RUA MANOEL ANTONIO CESAR MINE, AEROPORTO, MIRASSOL, SP, BRASIL",,,,
SP,MIRASSOL,ESF REGISSOL DEMIRASSOL,NELSON APARECIDO GARETTI,2971,REGISSOL,"NELSON APARECIDO GARETTI, REGISSOL, MIRASSOL, SP, BRASIL",,,,
SP,MIRASSOL,CS DE MIRASSOL,RUA PRUDENTE DE MORAES,2386,CENTRO,"RUA PRUDENTE DE MORAES, CENTRO, MIRASSOL, SP, BRASIL",,,,
SP,MIRASSOL,UBS COHAB I DE MIRASSOL ERNANI CORREA,AVENIDA MARTINS TORRES,2811,COHAB I,"AVENIDA MARTINS TORRES, COHAB I, MIRASSOL, SP, BRASIL",,,,
SP,MIRASSOL,CASA DO ADOLESCENTE PROSAD MIRASSOL,RUA DOS TOZZO,1110,COHAB II,"RUA DOS TOZZO, COHAB II, MIRASSOL, SP, BRASIL",,,,
SP,MIRASSOL,PAS DE RUILANDIA MIRASSOL,RUA PARAIBA,2051,DISTRITO RUILANDIA,"RUA PARAIBA, DISTRITO RUILANDIA, MIRASSOL, SP, BRASIL",,,,
SP,MIRASSOL,UNIDADE BASICA DE SAUDE DA FAMILIA ROBERTO NARDI,AVENIDA JOAO BATISTA POSSEBOM,3727,COHAB II,"AVENIDA JOAO BATISTA POSSEBOM, COHAB II, MIRASSOL, SP, BRASIL",,,,
SP,MIRASSOLANDIA,CS DE MIRASSOLANDIA,RUA EUGENIO PONCHIO,477,CENTRO,"RUA EUGENIO PONCHIO, CENTRO, MIRASSOLANDIA, SP, BRASIL",,,,
SP,MOCOCA,PSF MARIA MAGDALENA TALIBERTI CUNALI MOCOCA,RUA DA FE,300,NENE PEREIRA LIMA,"RUA DA FE, NENE PEREIRA LIMA, MOCOCA, SP, BRASIL",,,,
SP,MOCOCA,CENTRO DE SAUDE II DR JOSE PAIONE MOCOCA TRAILER,PRACA MARECHAL DEODORO,93,CENTRO,"PRACA MARECHAL DEODORO, CENTRO, MOCOCA, SP, BRASIL",,,,
SP,MOCOCA,NUCLEO DE AT INTEG A SAUD DR GASTAO DE P LEITAO MOCOCA,RUA CRISPIM BASTOS SOBRINHO,308,COHAB II,"RUA CRISPIM BASTOS SOBRINHO, COHAB II, MOCOCA, SP, BRASIL",,,,
SP,MOCOCA,PSF DR JACINTHO TALIBERTI MOCOCA,RUA ROVAIL RODRIGUES SILVA,50,MOCOQUINHA,"RUA ROVAIL RODRIGUES SILVA, MOCOQUINHA, MOCOCA, SP, BRASIL",,,,
SP,MOCOCA,PSF DR HUMBERTO CUNALI MOCOCA,RUA ERASMO SOUZA RIBEIRO,290,SANTA CLARA,"RUA ERASMO SOUZA RIBEIRO, SANTA CLARA, MOCOCA, SP, BRASIL",,,,
SP,MOCOCA,PSF SR ANTONIO CARLOS MASSARO MOCOCA,RUA JOSE RIBEIRO,86,FRANCISCO GAROFALO,"RUA JOSE RIBEIRO, FRANCISCO GAROFALO, MOCOCA, SP, BRASIL",,,,
SP,MOCOCA,UBS CIRENE FRANCISCA DE SISTO,AVENIDA SAO PAULO,425,VILA LAMBARI,"AVENIDA SAO PAULO, VILA LAMBARI, MOCOCA, SP, BRASIL",,,,
SP,MOCOCA,ESF DR VITAL DIAS PORTO DE MOCOCA MOCOCA,RUA MAJOR QUINTINO,20,IGARAI,"RUA MAJOR QUINTINO, IGARAI, MOCOCA, SP, BRASIL",,,,
SP,MOCOCA,PROGRAMA MUNICIPAL DE SAUDE PPA MOCOCA,PRACA PRINCESA ISABEL,75,JARDIM RIGOBELLO,"PRACA PRINCESA ISABEL, JARDIM RIGOBELLO, MOCOCA, SP, BRASIL",,,,
SP,MOCOCA,CASA DO ADOLESCENTE DR VINICIUS GHIRLINZONI MONSORES,RUA CRISPIM BASTOS SOBRINHO,308,COHAB II,"RUA CRISPIM BASTOS SOBRINHO, COHAB II, MOCOCA, SP, BRASIL",,,,
SP,MOCOCA,NUCLEO DE ASSIST INT SR AUGUSTO TREVIZANE MOCOCA,RUA ROSA MARTINS,S/N,S BENEDITO DAS AREIA,"RUA ROSA MARTINS, S BENEDITO DAS AREIA, MOCOCA, SP, BRASIL",,,,
SP,MOCOCA,PSF CARMO PRICOLI CENTRO DE SAUDE MOCOCA,RUA PARANA,225,VILA SANTA ROSA,"RUA PARANA, VILA SANTA ROSA, MOCOCA, SP, BRASIL",,,,
SP,MOGI DAS CRUZES,UBS NOVA JUNDIAPEBA,RUA DOLORES DE AQUINO,601,NOVA JUNDIAPEBA,"RUA DOLORES DE AQUINO, NOVA JUNDIAPEBA, MOGI DAS CRUZES, SP, BRASIL",,,,
SP,MOGI DAS CRUZES,UBS VILA DA PRATA,RUA JOAQUIM CARDOSO,200,VILA DA PRATA,"RUA JOAQUIM CARDOSO, VILA DA PRATA, MOGI DAS CRUZES, SP, BRASIL",,,,
SP,MOGI DAS CRUZES,UBS SANTO ANGELO,RUA SAO SIMAO,59,STO ANGELO,"RUA SAO SIMAO, STO ANGELO, MOGI DAS CRUZES, SP, BRASIL",,,,
SP,MOGI DAS CRUZES,UBS PONTE GRANDE,RUA LOTHAR WALDEMAR HOENNE,80,PONTE GRANDE,"RUA LOTHAR WALDEMAR HOENNE, PONTE GRANDE, MOGI DAS CRUZES, SP, BRASIL",,,,
SP,MOGI DAS CRUZES,UBS VILA NOVA APARECIDA,RUA ALOISIO DE AZEVEDO,53,JARDIM DAS BANDEIRAS,"RUA ALOISIO DE AZEVEDO, JARDIM DAS BANDEIRAS, MOGI DAS CRUZES, SP, BRASIL",,,,
SP,MOGI DAS CRUZES,UBS JUNDIAPEBA,RUA VEREADOR NITO SONA,1745,JUNDIAPEBA,"RUA VEREADOR NITO SONA, JUNDIAPEBA, MOGI DAS CRUZES, SP, BRASIL",,,,
SP,MOGI DAS CRUZES,UBS SANTA TEREZA,RUA KAZUMO SUMIZONO,1181,JARDIM SANTA TEREZA,"RUA KAZUMO SUMIZONO, JARDIM SANTA TEREZA, MOGI DAS CRUZES, SP, BRASIL",,,,
SP,MOGI DAS CRUZES,UBS JARDIM MARICA,AV EZELINO DA CUNHA GLORIA,245,JARDIM MARICA,"AV EZELINO DA CUNHA GLORIA, JARDIM MARICA, MOGI DAS CRUZES, SP, BRASIL",,,,
SP,MOGI DAS CRUZES,UBS BRAZ CUBAS,RUA PADRE ALVARO QUIRNONES ZUNIGA,340,BRAS CUBAS,"RUA PADRE ALVARO QUIRNONES ZUNIGA, BRAS CUBAS, MOGI DAS CRUZES, SP, BRASIL",,,,
SP,MOGI DAS CRUZES,USF TABOAO LAMBARI,ESTRADA TABOAO LAMBARI,1110,LAMBARI,"ESTRADA TABOAO LAMBARI, LAMBARI, MOGI DAS CRUZES, SP, BRASIL",,,,
SP,MOGI DAS CRUZES,USF JARDIM AEROPORTO 3,RUA SALGADO FILHO,336,JARDIM AEROPORTO III,"RUA SALGADO FILHO, JARDIM AEROPORTO III, MOGI DAS CRUZES, SP, BRASIL",,,,
SP,MOGI DAS CRUZES,USF JARDIM MARGARIDA,AV CELESTE,621,JARDIM MARGARIDA,"AV CELESTE, JARDIM MARGARIDA, MOGI DAS CRUZES, SP, BRASIL",,,,
SP,MOGI DAS CRUZES,USF JARDIM PLANALTO,RUA BABACU,50,JARDIM PLANALTO,"RUA BABACU, JARDIM PLANALTO, MOGI DAS CRUZES, SP, BRASIL",,,,
SP,MOGI DAS CRUZES,UBS BOTUJURU,RUA FREI BONIFACIO HARINK,313,BOTUJURU,"RUA FREI BONIFACIO HARINK, BOTUJURU, MOGI DAS CRUZES, SP, BRASIL",,,,
SP,MOGI DAS CRUZES,EMESP PROFESSORA JOVITA FRANCO AROUCHE,RUA JOSE D CARLO,85,VIL LAVINIA,"RUA JOSE D CARLO, VIL LAVINIA, MOGI DAS CRUZES, SP, BRASIL",,,,
SP,MOGI DAS CRUZES,USF COCUERA,ESTRADA MOGI SALESOPOLIS,S/N,COCUERA,"ESTRADA MOGI SALESOPOLIS, COCUERA, MOGI DAS CRUZES, SP, BRASIL",,,,
SP,MOGI DAS CRUZES,PRO HIPER,RUA PREF CARLOS FERREIRA LOPES,540,MOGILAR,"RUA PREF CARLOS FERREIRA LOPES, MOGILAR, MOGI DAS CRUZES, SP, BRASIL",,,,
SP,MOGI DAS CRUZES,USF PIATA,RUA ARAPIRANGA,600,JARDIM PIATA,"RUA ARAPIRANGA, JARDIM PIATA, MOGI DAS CRUZES, SP, BRASIL",,,,
SP,MOGI DAS CRUZES,UBS JARDIM IVETE,AVENIDA PEDRO MACHADO,1411,MOGI MODERNO,"AVENIDA PEDRO MACHADO, MOGI MODERNO, MOGI DAS CRUZES, SP, BRASIL",,,,
SP,MOGI DAS CRUZES,USF NOVO HORIZONTE,RUA MAURICIO JOSE DE OLIVEIRA,250,NOVO HORIZONTE,"RUA MAURICIO JOSE DE OLIVEIRA, NOVO HORIZONTE, MOGI DAS CRUZES, SP, BRASIL",,,,
SP,MOGI DAS CRUZES,USF CONJUNTO TOYAMA,AVENIDA ENGENHEIRO MIGUEL GEMMA,S/N,CONJUNTO TOYAMA,"AVENIDA ENGENHEIRO MIGUEL GEMMA, CONJUNTO TOYAMA, MOGI DAS CRUZES, SP, BRASIL",,,,
SP,MOGI DAS CRUZES,USF NOVE DE JULHO,RUA GEORGINA SOARES DE SOUZA,S/N,NOVE DE JULHO,"RUA GEORGINA SOARES DE SOUZA, NOVE DE JULHO, MOGI DAS CRUZES, SP, BRASIL",,,,
SP,MOGI DAS CRUZES,UBS VILA MORAES,ESTRADA MOGIBERTIOGA,540,VILA MORAES,"ESTRADA MOGIBERTIOGA, VILA MORAES, MOGI DAS CRUZES, SP, BRASIL",,,,
SP,MOGI DAS CRUZES,USF JARDIM LAYR,RUA ARATIMBO,168,JARDIM LAYR,"RUA ARATIMBO, JARDIM LAYR, MOGI DAS CRUZES, SP, BRASIL",,,,
SP,MOGI DAS CRUZES,UBS BIRITIBA USSU,RUA THIAGO SILVESTRE FURTADO,90,BIRITIBA USSU,"RUA THIAGO SILVESTRE FURTADO, BIRITIBA USSU, MOGI DAS CRUZES, SP, BRASIL",,,,
SP,MOGI DAS CRUZES,USF JARDIM AEROPORTO 2 SANTOS DUMONT,RUA TONGA,420,JARDIM AEROPORTO II,"RUA TONGA, JARDIM AEROPORTO II, MOGI DAS CRUZES, SP, BRASIL",,,,
SP,MOGI DAS CRUZES,UBS JARDIM CAMILA,AV PRESIDENTE GETULIO VARGAS,999,JARDIM CAMILA,"AV PRESIDENTE GETULIO VARGAS, JARDIM CAMILA, MOGI DAS CRUZES, SP, BRASIL",,,,
SP,MOGI DAS CRUZES,UBS JARDIM UNIVERSO,RUA DOM LUIZ DE SOUZA,136,JARDIM UNIVERSO,"RUA DOM LUIZ DE SOUZA, JARDIM UNIVERSO, MOGI DAS CRUZES, SP, BRASIL",,,,
SP,MOGI DAS CRUZES,UBS MINERACAO,RUA APRIGIO DE OLIVEIRA,262,VILA INDUSTRIAL,"RUA APRIGIO DE OLIVEIRA, VILA INDUSTRIAL, MOGI DAS CRUZES, SP, BRASIL",,,,
SP,MOGI DAS CRUZES,UBS QUATINGA,RUA ANTONIO ROSENDO DE LIMA,353,QUATINGA,"RUA ANTONIO ROSENDO DE LIMA, QUATINGA, MOGI DAS CRUZES, SP, BRASIL",,,,
SP,MOGI DAS CRUZES,UBS SABAUNA,RUA FRANCISCO RODRIGUES MATHIAS,90,SABAUNA,"RUA FRANCISCO RODRIGUES MATHIAS, SABAUNA, MOGI DAS CRUZES, SP, BRASIL",,,,
SP,MOGI DAS CRUZES,UBS TAIACUPEBA,RUA AVELINO NUNES DE SOUZA,135,TAIACUPEBA,"RUA AVELINO NUNES DE SOUZA, TAIACUPEBA, MOGI DAS CRUZES, SP, BRASIL",,,,
SP,MOGI DAS CRUZES,USF CHACARA GUANABARA,RUA SAO PAULO,S/N,CHACARA GUANABARA,"RUA SAO PAULO, CHACARA GUANABARA, MOGI DAS CRUZES, SP, BRASIL",,,,
SP,MOGI DAS CRUZES,UBS VILA SUISSA,AV RICIERI JOSE MARCATTO,310,CEZAR DE SOUZA,"AV RICIERI JOSE MARCATTO, CEZAR DE SOUZA, MOGI DAS CRUZES, SP, BRASIL",,,,
SP,MOGI DAS CRUZES,UBS VILA JUNDIAI,RUA JOSE GALDINO DE CASTRO,S/N,VILA JUNDIAI,"RUA JOSE GALDINO DE CASTRO, VILA JUNDIAI, MOGI DAS CRUZES, SP, BRASIL",,,,
SP,MOGI DAS CRUZES,UBS VILA NATAL,RUA CORONEL CARDOSO DE SIQUEIRA,2650,VILA OLIVEIRA,"RUA CORONEL CARDOSO DE SIQUEIRA, VILA OLIVEIRA, MOGI DAS CRUZES, SP, BRASIL",,,,
SP,MOGI DAS CRUZES,UBS ALTO IPIRANGA,RUA CAPITAO JOAQUIM DE MELO FREIRE,700,ALTO DO IPIRANGA,"RUA CAPITAO JOAQUIM DE MELO FREIRE, ALTO DO IPIRANGA, MOGI DAS CRUZES, SP, BRASIL",,,,
SP,MOGI GUACU,USF SANTA TEREZINHA,RUA BENEDITO MAIA FIGUEIREDO,520,JARDIM SAO PEDRO,"RUA BENEDITO MAIA FIGUEIREDO, JARDIM SAO PEDRO, MOGI GUACU, SP, BRASIL",,,,
SP,MOGI GUACU,UBS ZONA NORTE,AVENIDA JOSE FERREIRA DE CAMPOS,4,JARDIM NOVO I,"AVENIDA JOSE FERREIRA DE CAMPOS, JARDIM NOVO I, MOGI GUACU, SP, BRASIL",,,,
SP,MOGI GUACU,USF ALTO DOS IPES,RUA JATIR DOMINGUES,S/N,JARDIM ALTO DOS YPES,"RUA JATIR DOMINGUES, JARDIM ALTO DOS YPES, MOGI GUACU, SP, BRASIL",,,,
SP,MOGI GUACU,USF SUECIA,RUA MARINO GISLOTTI,138,JARDIM SUECIA,"RUA MARINO GISLOTTI, JARDIM SUECIA, MOGI GUACU, SP, BRASIL",,,,
SP,MOGI GUACU,UBS IPE II,RUA JANDAIA DO SUL,215,JARDIM IPE II,"RUA JANDAIA DO SUL, JARDIM IPE II, MOGI GUACU, SP, BRASIL",,,,
SP,MOGI GUACU,UBS ZANIBONI,RUA EDUARDO FIGUEIREDO,950,JARDIM NOVO II,"RUA EDUARDO FIGUEIREDO, JARDIM NOVO II, MOGI GUACU, SP, BRASIL",,,,
SP,MOGI GUACU,USF CHACARA ALVORADA,RUA JOSE COELHO DE CAMPOS,36,CHACARA ALVORADA,"RUA JOSE COELHO DE CAMPOS, CHACARA ALVORADA, MOGI GUACU, SP, BRASIL",,,,
SP,MOGI GUACU,USF ZANIBONI II,RUA HONORIO DO CARMO SILVA,45,JARDIM BOA VISTA,"RUA HONORIO DO CARMO SILVA, JARDIM BOA VISTA, MOGI GUACU, SP, BRASIL",,,,
SP,MOGI GUACU,UBS IPE PINHEIRO,AVENIDA DOS FLAMBOYANTS,7241,JARDIM YPE PINHEIROS,"AVENIDA DOS FLAMBOYANTS, JARDIM YPE PINHEIROS, MOGI GUACU, SP, BRASIL",,,,
SP,MOGI GUACU,USF SANTA CECILIA,RUA ALMIR NELSON FALSETTI,460,CANAA II,"RUA ALMIR NELSON FALSETTI, CANAA II, MOGI GUACU, SP, BRASIL",,,,
SP,MOGI GUACU,USF ROSA CRUZ,RUA WALDOMIRO CAVEANHA,390,JD ROSA CRUZ,"RUA WALDOMIRO CAVEANHA, JD ROSA CRUZ, MOGI GUACU, SP, BRASIL",,,,
SP,MOGI GUACU,CENTRO DE SAUDE,RUA ISALINO LEALDINI,16,CENTRO,"RUA ISALINO LEALDINI, CENTRO, MOGI GUACU, SP, BRASIL",,,,
SP,MOGI GUACU,UBS ZONA SUL,RUA SEBASTIAO BUENO,415,JARDIM ITAMARATY,"RUA SEBASTIAO BUENO, JARDIM ITAMARATY, MOGI GUACU, SP, BRASIL",,,,
SP,MOGI GUACU,UBS CENTRO OESTE,RUA VEREADOR ACACIO DE OLIVEIRA,341,JARDIM NOSSA SENHORA,"RUA VEREADOR ACACIO DE OLIVEIRA, JARDIM NOSSA SENHORA, MOGI GUACU, SP, BRASIL",,,,
SP,MOGI GUACU,USF FANTINATO,RUA ARISTIDES PAPA,400,JARDIM FANTINATO,"RUA ARISTIDES PAPA, JARDIM FANTINATO, MOGI GUACU, SP, BRASIL",,,,
SP,MOGI GUACU,USF EUCALIPTOS,RUA OZORIO TEIXEIRA FILHO,S/N,PARQUE DOS EUCALIPTO,"RUA OZORIO TEIXEIRA FILHO, PARQUE DOS EUCALIPTO, MOGI GUACU, SP, BRASIL",,,,
SP,MOGI GUACU,USF CENTENARIO,RUA VEREADOR ACACIO DE OLIVEIRA,341,JD NOSSA SENHORA DAS,"RUA VEREADOR ACACIO DE OLIVEIRA, JD NOSSA SENHORA DAS, MOGI GUACU, SP, BRASIL",,,,
SP,MOGI GUACU,USF HERMINIO BUENO,RUA HONORIO ORLANDO MARTINI,45,HERMINIO BUENO,"RUA HONORIO ORLANDO MARTINI, HERMINIO BUENO, MOGI GUACU, SP, BRASIL",,,,
SP,MOGI GUACU,USF CHAPARRAL,AVENIDA CUSTODIO SILVA NETO,401,CHAPARRAL,"AVENIDA CUSTODIO SILVA NETO, CHAPARRAL, MOGI GUACU, SP, BRASIL",,,,
SP,MOGI GUACU,USF GUACUANO,RUA ANTONIO ALVES DE AZEVEDO,25,JARDIM GUACUANO,"RUA ANTONIO ALVES DE AZEVEDO, JARDIM GUACUANO, MOGI GUACU, SP, BRASIL",,,,
SP,MOGI GUACU,UBS GUACU MIRIM,RUA ALCIDES TOLEDO,195,JARDIM GUACU MIRIM,"RUA ALCIDES TOLEDO, JARDIM GUACU MIRIM, MOGI GUACU, SP, BRASIL",,,,
SP,MOGI GUACU,USF MARTINHO PRADO,RUA BENEDITO DE LIMA,460,MARTINHO PRADO,"RUA BENEDITO DE LIMA, MARTINHO PRADO, MOGI GUACU, SP, BRASIL",,,,
SP,MOJI MIRIM,ESF JOSE ANTONIO S PEREIRA MOGI MIRIM,RUA PERU,20,SEHAC,"RUA PERU, SEHAC, MOJI MIRIM, SP, BRASIL",,,,
SP,MOJI MIRIM,ESF RURAL NOROESTE MOGI MIRIM,RODOVIA ENGENHEIRO JOAO TOSELLO,S/N,PEDERNEIRAS,"RODOVIA ENGENHEIRO JOAO TOSELLO, PEDERNEIRAS, MOJI MIRIM, SP, BRASIL",,,,
SP,MOJI MIRIM,CASA LARANJEIRAS MOGI MIRIM,RODOVIA WILSON FINARDI,191,VATINGA,"RODOVIA WILSON FINARDI, VATINGA, MOJI MIRIM, SP, BRASIL",,,,
SP,MOJI MIRIM,UBS ATERRADO MOGI MIRIM,RUA DOMINGOS DOS SANTOS,105,ATERRADO,"RUA DOMINGOS DOS SANTOS, ATERRADO, MOJI MIRIM, SP, BRASIL",,,,
SP,MOJI MIRIM,UBS MARIA BEATRIZ MOGI MIRIM,RUA JUVENAL TOLEDO,120,MARIA BEATRIZ,"RUA JUVENAL TOLEDO, MARIA BEATRIZ, MOJI MIRIM, SP, BRASIL",,,,
SP,MOJI MIRIM,UBS JARDIM PLANALTO MOGI MIRIM,RUA SEBASTIAO MILANO SOBRINHO,1455,JD PLANALTO,"RUA SEBASTIAO MILANO SOBRINHO, JD PLANALTO, MOJI MIRIM, SP, BRASIL",,,,
SP,MOJI MIRIM,CENTRO RESSOC PREF JOAO MISSAGLIA MOGI MIRIM MOGI MIRIM,RODOVIA,1,VATINGA,"RODOVIA, VATINGA, MOJI MIRIM, SP, BRASIL",,,,
SP,MOJI MIRIM,ESF PARQUE DO ESTADO II MOGI MIRIM,ANA ZULIANI,S/N,PARQUE DO ESTADO II,"ANA ZULIANI, PARQUE DO ESTADO II, MOJI MIRIM, SP, BRASIL",,,,
SP,MOJI MIRIM,UBS MARTIM FRANCISCO MOGI MIRIM,AV LUIS PILLA,1350,MARTIM FRANCISCO,"AV LUIS PILLA, MARTIM FRANCISCO, MOJI MIRIM, SP, BRASIL",,,,
SP,MOJI MIRIM,UBS DR ANTONIO ALBEJANTE MOGI MIRIM,RUA TIMBIRA,51,MOGI MIRIM II,"RUA TIMBIRA, MOGI MIRIM II, MOJI MIRIM, SP, BRASIL",,,,
SP,MOJI MIRIM,UBS DR VANDERLEI SILVA BUENO MOGI MIRIM,RUA CUBA,20,VILA UNIVERSITARIA,"RUA CUBA, VILA UNIVERSITARIA, MOJI MIRIM, SP, BRASIL",,,,
SP,MOJI MIRIM,UBS JARDIM PAULISTA MOGI MIRIM,RUA DR DECIO PEREIRA QUEIROS TELES,447,JD PAULISTA,"RUA DR DECIO PEREIRA QUEIROS TELES, JD PAULISTA, MOJI MIRIM, SP, BRASIL",,,,
SP,MOJI MIRIM,UBS SANTA CRUZ MOGI MIRIM,RUA RIO DE JANEIRO,823,SANTA CRUZ,"RUA RIO DE JANEIRO, SANTA CRUZ, MOJI MIRIM, SP, BRASIL",,,,
SP,MOJI MIRIM,CASA MOGI MIRIM MOGI MIRIM,RODOVIA WILSON FINARDI,7,VATINGA,"RODOVIA WILSON FINARDI, VATINGA, MOJI MIRIM, SP, BRASIL",,,,
SP,MOJI MIRIM,ESF RURAL SUDESTE MOGI MIRIM,ASSENTAMENTO 12 DE OUTUBRO 1 HORTO DE VERGEL,S/N,VERGEL,"ASSENTAMENTO 12 DE OUTUBRO 1 HORTO DE VERGEL, VERGEL, MOJI MIRIM, SP, BRASIL",,,,
SP,MOJI MIRIM,UBS SANTA CLARA MOGI MIRIM,RUA ESTANISLAU KROLL,45,JARDIM BI CENTENARIO,"RUA ESTANISLAU KROLL, JARDIM BI CENTENARIO, MOJI MIRIM, SP, BRASIL",,,,
SP,MOMBUCA,UNIDADE MISTA DE SAUDE MOMBUCA,RUA GERSON MASCHIO,60,JARDIM DAS OLIVEIRAS,"RUA GERSON MASCHIO, JARDIM DAS OLIVEIRAS, MOMBUCA, SP, BRASIL",,,,
SP,MOMBUCA,ESTRATEGIA DE SAUDE DA FAMILIA DE MOMBUCA,RUA GERALDO PEDRO ARCANJO,240,VILA NOVA,"RUA GERALDO PEDRO ARCANJO, VILA NOVA, MOMBUCA, SP, BRASIL",,,,
SP,MONCOES,CS DE MONCOES,RUA RIO DE JANEIRO,552,CENTRO,"RUA RIO DE JANEIRO, CENTRO, MONCOES, SP, BRASIL",,,,
SP,MONGAGUA,UNIDADE DE SAUDE DA FAMILIA FLORIDA MIRIM MONGAGUA,AVENIDA MONTEIRO LOBATO,11130,FLORIDA MIRIM,"AVENIDA MONTEIRO LOBATO, FLORIDA MIRIM, MONGAGUA, SP, BRASIL",,,,
SP,MONGAGUA,AMBULATORIO JARDIM PRAIA GRANDE MONGAGUA,AVENIDA MONTEIRO LOBATO,6092,JARDIM PRAIA GRANDE,"AVENIDA MONTEIRO LOBATO, JARDIM PRAIA GRANDE, MONGAGUA, SP, BRASIL",,,,
SP,MONGAGUA,SAE SERVICO DE ASSISTENCIA ESPECIALIZADA,RUA IOLANDA FERRIGNO,20,CENTRO,"RUA IOLANDA FERRIGNO, CENTRO, MONGAGUA, SP, BRASIL",,,,
SP,MONGAGUA,CPP DE MONGAGUA DR RUBENS ALEIXO SENDIN MONGAGUA,AVENIDA DOS MARISCOS,500,BALNEARIO ARARA VERM,"AVENIDA DOS MARISCOS, BALNEARIO ARARA VERM, MONGAGUA, SP, BRASIL",,,,
SP,MONGAGUA,UNIDADE DE SAUDE DA FAMILIA ITAGUAI,AVENIDA JOSE MUNHOZ BONILHA,429,PLATAFORMA II ITAGUA,"AVENIDA JOSE MUNHOZ BONILHA, PLATAFORMA II ITAGUA, MONGAGUA, SP, BRASIL",,,,
SP,MONGAGUA,UNIDADE DE SAUDE DA FAMILIA VILA ATLANTICA,AVENIDA PRESIDENTE COSTA E SILVA,266,VILA ATLANTICA,"AVENIDA PRESIDENTE COSTA E SILVA, VILA ATLANTICA, MONGAGUA, SP, BRASIL",,,,
SP,MONGAGUA,UNIDADE DE SAUDE DA FAMILIA VILA OPERARIA MONGAGUA,AVENIDA WASHINGTON LUIZ,815,VILA ATLANTICA,"AVENIDA WASHINGTON LUIZ, VILA ATLANTICA, MONGAGUA, SP, BRASIL",,,,
SP,MONGAGUA,UNIDADE DE SAUDE DA FAMILIA JUSSARA MONGAGUA,AVENIDA JUSSARA,62,JUSSARA,"AVENIDA JUSSARA, JUSSARA, MONGAGUA, SP, BRASIL",,,,
SP,MONGAGUA,UNIDADE DE SAUDE DA FAMILIA JARDIM PRIMAVERA MONGAGUA,AVENIDA NOSSA SENHORA DE FATIMA,1801,AGENOR DE CAMPOS,"AVENIDA NOSSA SENHORA DE FATIMA, AGENOR DE CAMPOS, MONGAGUA, SP, BRASIL",,,,
SP,MONGAGUA,CENTRO DE SAUDE III MONGAGUA MONGAGUA,RUA ANTONIO CORDEIRO MENDES,204,VILA ARENS,"RUA ANTONIO CORDEIRO MENDES, VILA ARENS, MONGAGUA, SP, BRASIL",,,,
SP,MONGAGUA,UNIDADE DE SAUDE DA FAMILIA AGENOR DE CAMPOS,RUA SANTA TEREZINHA,1645,AGENOR DE CAMPOS,"RUA SANTA TEREZINHA, AGENOR DE CAMPOS, MONGAGUA, SP, BRASIL",,,,
SP,MONTE ALEGRE DO SUL,UNIDADE SAUDE DA FAMILIA MOSTARDAS,AVA MARTILIANO TORRICELLI,S/N,MOSTARDA,"AVA MARTILIANO TORRICELLI, MOSTARDA, MONTE ALEGRE DO SUL, SP, BRASIL",,,,
SP,MONTE ALEGRE DO SUL,CENTRO DE SAUDE III MONTE ALEGRE DO SUL,RUA PREFEITO JOSE AMARAL,S/N,CENTRO,"RUA PREFEITO JOSE AMARAL, CENTRO, MONTE ALEGRE DO SUL, SP, BRASIL",,,,
SP,MONTE ALEGRE DO SUL,UNIDADE DE SAUDE DA FAMILIA DOS LIMAS,EST VICINAL MONTE ALEGRE DO SUL TUIUTI,S/N,LIMAS,"EST VICINAL MONTE ALEGRE DO SUL TUIUTI, LIMAS, MONTE ALEGRE DO SUL, SP, BRASIL",,,,
SP,MONTE ALTO,UBS DR ROBERTO DA ROCHA LEAO MONTE ALTO,AV ANTONIO INFORCATI,100,CENTENARIO,"AV ANTONIO INFORCATI, CENTENARIO, MONTE ALTO, SP, BRASIL",,,,
SP,MONTE ALTO,UBS DR ROBERTO DA ROCHA LEAO 2 MONTE ALTO,AV ANTONIO INFORCATTI,100,CENTENARIO,"AV ANTONIO INFORCATTI, CENTENARIO, MONTE ALTO, SP, BRASIL",,,,
SP,MONTE ALTO,PAMM ANA MARIA NACARATTO POPIM APARECIDA DE MONTE ALTO,RUA JOAO LUIZ GONZAGA FILHO,334,CENTRO,"RUA JOAO LUIZ GONZAGA FILHO, CENTRO, MONTE ALTO, SP, BRASIL",,,,
SP,MONTE ALTO,USF JOAO THIAGO DE CAMARGO MONTE ALTO,RUA WADY ELIAS,13,JD ALVORADA,"RUA WADY ELIAS, JD ALVORADA, MONTE ALTO, SP, BRASIL",,,,
SP,MONTE ALTO,PSF ACCACIO DE OLIVEIRA NUNES MONTE ALTO,RUA JACIR GERMANO GARBIM,41,JARDIM BELA VISTA,"RUA JACIR GERMANO GARBIM, JARDIM BELA VISTA, MONTE ALTO, SP, BRASIL",,,,
SP,MONTE ALTO,UBS EZIDIO PELLOSO 2 MONTE ALTO,RUA DAS ESMERALDAS,420,VILA MUNICIPAL,"RUA DAS ESMERALDAS, VILA MUNICIPAL, MONTE ALTO, SP, BRASIL",,,,
SP,MONTE ALTO,UBS EZIDIO PELLOSO MONTE ALTO,RUA DAS ESMERALDAS,420,VILA MUNICIPAL,"RUA DAS ESMERALDAS, VILA MUNICIPAL, MONTE ALTO, SP, BRASIL",,,,
SP,MONTE ALTO,USF DR JOSE JESUS VICTORIO RODRIGUES MONTE ALTO,RUA APRIGIO RIBEIRO GUIMARAES,161,JARDIM CANAA,"RUA APRIGIO RIBEIRO GUIMARAES, JARDIM CANAA, MONTE ALTO, SP, BRASIL",,,,
SP,MONTE ALTO,UBS SILVIO GOVONI MONTE ALTO,AV JOSE LUIZ FRANCO DA ROCHA,112,CENTRO,"AV JOSE LUIZ FRANCO DA ROCHA, CENTRO, MONTE ALTO, SP, BRASIL",,,,
SP,MONTE ALTO,USF DR JOSE IGNACIO GRELLET MONTE ALTO,RUA DOS JASMINS,1000,JARDIM CALIFORNIA,"RUA DOS JASMINS, JARDIM CALIFORNIA, MONTE ALTO, SP, BRASIL",,,,
SP,MONTE APRAZIVEL,UBS GABRIEL JORGE VALERIO,RUA OLIVIO DE CARVALHO,235,ITAIUBA,"RUA OLIVIO DE CARVALHO, ITAIUBA, MONTE APRAZIVEL, SP, BRASIL",,,,
SP,MONTE APRAZIVEL,CS DE MONTE APRAZIVEL,RUA OSVALDO CRUZ,745,CENTRO,"RUA OSVALDO CRUZ, CENTRO, MONTE APRAZIVEL, SP, BRASIL",,,,
SP,MONTE APRAZIVEL,ESF EVERALDO ALVES NAZARETH COM SAUDE BUCAL MONTE APRAZIVEL,RUA DA SAUDADE,72,JARDIM DO LAGO,"RUA DA SAUDADE, JARDIM DO LAGO, MONTE APRAZIVEL, SP, BRASIL",,,,
SP,MONTE APRAZIVEL,UBS DE JUNQUEIRA MONTE APRAZIVEL,RUA BALIEIRO,S/N,CENTRO,"RUA BALIEIRO, CENTRO, MONTE APRAZIVEL, SP, BRASIL",,,,
SP,MONTE APRAZIVEL,ESF ORLANDO POLOTTO MONTE APRAZIVEL,RUA CAMILO SOUBHIA,91,JORGE CARNEIRO DE CA,"RUA CAMILO SOUBHIA, JORGE CARNEIRO DE CA, MONTE APRAZIVEL, SP, BRASIL",,,,
SP,MONTE APRAZIVEL,UBS PACS JOAO DUARTE MONTEIRO MONTE APRAZIVEL,AVENIDA SAO PAULO,407,VILA APARECIDA,"AVENIDA SAO PAULO, VILA APARECIDA, MONTE APRAZIVEL, SP, BRASIL",,,,
SP,MONTE AZUL PAULISTA,ESTRATEGIA SAUDE DA FAMILIA SAO FRANCISCO,AVENIDA ANTONIO CORREIA,1150,SAO FRANCISCO,"AVENIDA ANTONIO CORREIA, SAO FRANCISCO, MONTE AZUL PAULISTA, SP, BRASIL",,,,
SP,MONTE AZUL PAULISTA,ESF DR BELIZARIO SEVILHANO,AVN MATHEUS BARTOL,S/N,CENTRO,"AVN MATHEUS BARTOL, CENTRO, MONTE AZUL PAULISTA, SP, BRASIL",,,,
SP,MONTE AZUL PAULISTA,CENTRO DE SAUDE II DR ALCIDES FACUNDO ARROYO,PRACA NEWTON PRADO,S/N,CENTRO,"PRACA NEWTON PRADO, CENTRO, MONTE AZUL PAULISTA, SP, BRASIL",,,,
