UF,MUNICIPIO,ESTABELECIMENTO,LOGRADOURO,NUMERO,BAIRRO,ENDERECO_COMPLETO,latitude,longitude,address,point
GO,ABADIA DE GOIAS,UBS CAMPOS ELISIOS,RUA DR SERAFIM DE CARVALHO APM,S/N,SETOR CAMPOS ELISIOS,"RUA DR SERAFIM DE CARVALHO APM, SETOR CAMPOS ELISIOS, ABADIA DE GOIAS, GO, BRASIL",,,,
GO,ABADIA DE GOIAS,UBS GORGONIO ALVES FORTES,RUA DR RUI ALVES NEIVA C AV DOM FELLIPE AMP 01,S/N,SETOR DOM FELLIPE,"RUA DR RUI ALVES NEIVA C AV DOM FELLIPE AMP 01, SETOR DOM FELLIPE, ABADIA DE GOIAS, GO, BRASIL",,,,
GO,ABADIA DE GOIAS,UBS DR MARLOS CUSTODIO PEREIRA,RUA OMAR JOSE ALVES,S/N,VILA SOCORRO,"RUA OMAR JOSE ALVES, VILA SOCORRO, ABADIA DE GOIAS, GO, BRASIL",,,,
GO,ABADIA DE GOIAS,UBS RECANTO DOS DOURADOS,RUA CABO FRIO,S/N,SETOR RECANTO DOS DO,"RUA CABO FRIO, SETOR RECANTO DOS DO, ABADIA DE GOIAS, GO, BRASIL",,,,
GO,ABADIANIA,POSTO DE SAUDE POSSE DA ABADIA ABADIANIA,PRC DA MATRIZ,S/N,CENTRO,"PRC DA MATRIZ, CENTRO, ABADIANIA, GO, BRASIL",,,,
GO,ABADIANIA,UBS LINDO HORIZONTE,RUA SETE,S/N,LINDO HORIZONTE,"RUA SETE, LINDO HORIZONTE, ABADIANIA, GO, BRASIL",,,,
GO,ABADIANIA,UBS PLANALMIRA,RUA 49,S/N,DIST PLANALMIRA,"RUA 49, DIST PLANALMIRA, ABADIANIA, GO, BRASIL",,,,
GO,ABADIANIA,UBS EDUARDO ALMEIDA BALBINO,RUA JOAO SERGINO DE SOUZA,S/N,PROLONGAMENTO I,"RUA JOAO SERGINO DE SOUZA, PROLONGAMENTO I, ABADIANIA, GO, BRASIL",,,,
GO,ABADIANIA,UNIDADE MISTA,AVENIDA OTACILIO FERNANDES LIMA,S/N,CENTRO,"AVENIDA OTACILIO FERNANDES LIMA, CENTRO, ABADIANIA, GO, BRASIL",,,,
GO,ABADIANIA,UBS CENTRAL,AVENIDA GERALDO RODRIGUES DOS SANTOS,712,CENTRO,"AVENIDA GERALDO RODRIGUES DOS SANTOS, CENTRO, ABADIANIA, GO, BRASIL",,,,
GO,ACREUNA,UNIDADE MISTA MARIA PIRES MAIA,AVENIDA TANCREDO NEVES,S/N,SETOR VILA RICA,"AVENIDA TANCREDO NEVES, SETOR VILA RICA, ACREUNA, GO, BRASIL",,,,
GO,ACREUNA,U S F ANA CARLA,RUA 8 ESQ COM RUA ORISMAR ALVES DE AVELAR,S/N,ANA CARLA,"RUA 8 ESQ COM RUA ORISMAR ALVES DE AVELAR, ANA CARLA, ACREUNA, GO, BRASIL",,,,
GO,ACREUNA,U S F SOL NASCENTE,AVENIDA ITALIA,S/N,SOL NASCENTE,"AVENIDA ITALIA, SOL NASCENTE, ACREUNA, GO, BRASIL",,,,
GO,ACREUNA,UNIDADE DE SAUDE DA FAMILIA JOAQUIM DE O ATAIDE NETO,AV MINAS GERAIS C RUA CEARA,64,NOVA ACREUNA,"AV MINAS GERAIS C RUA CEARA, NOVA ACREUNA, ACREUNA, GO, BRASIL",,,,
GO,ACREUNA,U S F ARANTINA,AVENIDA CENTRAL,S/N,CENTRO,"AVENIDA CENTRAL, CENTRO, ACREUNA, GO, BRASIL",,,,
GO,ADELANDIA,UBS LOURIVON DINIZ LINHARES,AV ABEL LUIZ PEREIRA,S/N,JD PROGRESSO,"AV ABEL LUIZ PEREIRA, JD PROGRESSO, ADELANDIA, GO, BRASIL",,,,
GO,AGUA FRIA DE GOIAS,CENTRO DE SAUDE DE AGUA FRIA DE GOIAS,RUA ZAIDA PINTO BOAVENTURA,S/N,CENTRO,"RUA ZAIDA PINTO BOAVENTURA, CENTRO, AGUA FRIA DE GOIAS, GO, BRASIL",,,,
GO,AGUA FRIA DE GOIAS,UNIDADE BASICA DE SAUDE DA FAMILIA II AGUA FRIA,QUADRA 26,S/N,LOTEAMENTO AGUA FRIA,"QUADRA 26, LOTEAMENTO AGUA FRIA, AGUA FRIA DE GOIAS, GO, BRASIL",,,,
GO,AGUA FRIA DE GOIAS,UNIDADE BASICA DE SAUDE DA FAMILIA I MATO SECO,RUA DO POSTO DE SAUDE MATO SECO,S/N,ZONA RURAL,"RUA DO POSTO DE SAUDE MATO SECO, ZONA RURAL, AGUA FRIA DE GOIAS, GO, BRASIL",,,,
GO,AGUA LIMPA,CENTRO DE SAUDE AGUA LIMPA,RUA ADOLFO ROSA,1,CENTRO,"RUA ADOLFO ROSA, CENTRO, AGUA LIMPA, GO, BRASIL",,,,
GO,AGUA LIMPA,ESF AGUA LIMPA,RUA PEDRO AVELINO DIAS,1,CENTRO,"RUA PEDRO AVELINO DIAS, CENTRO, AGUA LIMPA, GO, BRASIL",,,,
GO,AGUAS LINDAS DE GOIAS,POSTO PSF AGUAS LINDAS II,QUADRA 00 LT 01,S/N,AGUAS LINDAS II,"QUADRA 00 LT 01, AGUAS LINDAS II, AGUAS LINDAS DE GOIAS, GO, BRASIL",,,,
GO,AGUAS LINDAS DE GOIAS,POSTO PSF LARANJEIRAS,AREA PUBLICA MUNICIPAL QUADRA B 3 LOTE,21,JARDIM LARANJEIRAS,"AREA PUBLICA MUNICIPAL QUADRA B 3 LOTE, JARDIM LARANJEIRAS, AGUAS LINDAS DE GOIAS, GO, BRASIL",,,,
GO,AGUAS LINDAS DE GOIAS,POSTO PSF SETOR II,QD 33 CONJ B CASA,3,SETOR II,"QD 33 CONJ B CASA, SETOR II, AGUAS LINDAS DE GOIAS, GO, BRASIL",,,,
GO,AGUAS LINDAS DE GOIAS,POSTO PSF BARRAGEM V,QD 06 LOTE,4,BARRAGEM V,"QD 06 LOTE, BARRAGEM V, AGUAS LINDAS DE GOIAS, GO, BRASIL",,,,
GO,AGUAS LINDAS DE GOIAS,POSTO PSF PADRE LUCIO,RUA SEM NOME AE POLICIAL,0,PADRE LUCIO,"RUA SEM NOME AE POLICIAL, PADRE LUCIO, AGUAS LINDAS DE GOIAS, GO, BRASIL",,,,
GO,AGUAS LINDAS DE GOIAS,POSTO PSF SETOR X,QD 108 CONJ A LOTE,31,SETOR 09,"QD 108 CONJ A LOTE, SETOR 09, AGUAS LINDAS DE GOIAS, GO, BRASIL",,,,
GO,AGUAS LINDAS DE GOIAS,POSTO PSF CAMPING CLUB,R 20 QUADRA 09 AREA ESPECIAL CAMPING CLUBE,1,CAMPING CLUBE,"R 20 QUADRA 09 AREA ESPECIAL CAMPING CLUBE, CAMPING CLUBE, AGUAS LINDAS DE GOIAS, GO, BRASIL",,,,
GO,AGUAS LINDAS DE GOIAS,POSTO PSF BARRAGEM II,QD 58 LOTE,S/N,JARDIM BARRAGEM IV,"QD 58 LOTE, JARDIM BARRAGEM IV, AGUAS LINDAS DE GOIAS, GO, BRASIL",,,,
GO,AGUAS LINDAS DE GOIAS,POSTO PSF GUAIRA I,QUADRA 05 ARAE ESPECIAL,18,JARDIM GUAIRA I,"QUADRA 05 ARAE ESPECIAL, JARDIM GUAIRA I, AGUAS LINDAS DE GOIAS, GO, BRASIL",,,,
GO,AGUAS LINDAS DE GOIAS,POSTO PSF JARDIM PINHEIROS,QUADRA 07 LOTE,13,JARDIM DOS PINHEIROS,"QUADRA 07 LOTE, JARDIM DOS PINHEIROS, AGUAS LINDAS DE GOIAS, GO, BRASIL",,,,
GO,AGUAS LINDAS DE GOIAS,POSTO PSF AGUAS BONITAS I,R 08 QUADRA 33 LOTE,27,AGUAS BONITAS I,"R 08 QUADRA 33 LOTE, AGUAS BONITAS I, AGUAS LINDAS DE GOIAS, GO, BRASIL",,,,
GO,AGUAS LINDAS DE GOIAS,POSTO PSF SANTA LUCIA,QUADRA 56 LOTE,7,JARDIM SANTA LUCIA,"QUADRA 56 LOTE, JARDIM SANTA LUCIA, AGUAS LINDAS DE GOIAS, GO, BRASIL",,,,
GO,AGUAS LINDAS DE GOIAS,POSTO PSF DANIEL MARQUES,QD D AREA ESPECIAL LT,1,JARDIM AMERICA IV,"QD D AREA ESPECIAL LT, JARDIM AMERICA IV, AGUAS LINDAS DE GOIAS, GO, BRASIL",,,,
GO,AGUAS LINDAS DE GOIAS,POSTO PSF CIDADE DO ENTORNO,QUADRA 50 LOT,48,CIDADE DO ENTORNO,"QUADRA 50 LOT, CIDADE DO ENTORNO, AGUAS LINDAS DE GOIAS, GO, BRASIL",,,,
GO,AGUAS LINDAS DE GOIAS,POSTO PSF JARDIM PARAISO,AREA ESPECIAL,S/N,JARDIM PARAISO,"AREA ESPECIAL, JARDIM PARAISO, AGUAS LINDAS DE GOIAS, GO, BRASIL",,,,
GO,AGUAS LINDAS DE GOIAS,POSTO PSF PEROLA II,QUADRA 66 LOTE,1,JARDIM PEROLA II,"QUADRA 66 LOTE, JARDIM PEROLA II, AGUAS LINDAS DE GOIAS, GO, BRASIL",,,,
GO,AGUAS LINDAS DE GOIAS,POSTO PSF COIMBRA,QD P CHACARA 10 CASAS,3,ST COIMBRA,"QD P CHACARA 10 CASAS, ST COIMBRA, AGUAS LINDAS DE GOIAS, GO, BRASIL",,,,
GO,AGUAS LINDAS DE GOIAS,POSTO PSF BARRAGEM IV,QD 58 LOTE,S/N,JD DA BARRAGEM IV,"QD 58 LOTE, JD DA BARRAGEM IV, AGUAS LINDAS DE GOIAS, GO, BRASIL",,,,
GO,AGUAS LINDAS DE GOIAS,PRESIDIO MUNICIPAL DE AGUAS LINDAS DE GOIAS,QUADRA 18 LOTE 01,1,SETOR III,"QUADRA 18 LOTE 01, SETOR III, AGUAS LINDAS DE GOIAS, GO, BRASIL",,,,
GO,ALEXANIA,CENTRO DE SAUDE JK ALEXANIA GO,R 15 DE NOVEMBRO QD 100 LTS 1 2 3 4 5 E 23,S/N,SETOR 13 DE MAIO,"R 15 DE NOVEMBRO QD 100 LTS 1 2 3 4 5 E 23, SETOR 13 DE MAIO, ALEXANIA, GO, BRASIL",,,,
GO,ALEXANIA,PSF 3 VILA ESPERANCA,AV JK AREA ESPECIAL,S/N,VILA ESPERANCA,"AV JK AREA ESPECIAL, VILA ESPERANCA, ALEXANIA, GO, BRASIL",,,,
GO,ALEXANIA,PSF 1 VILA MUTIRAO,RUA 16,S/N,SETOR CENTRAL,"RUA 16, SETOR CENTRAL, ALEXANIA, GO, BRASIL",,,,
GO,ALEXANIA,PSF 6 VILA BENE,RUA 182,S/N,VILA BENE,"RUA 182, VILA BENE, ALEXANIA, GO, BRASIL",,,,
GO,ALEXANIA,PSF 2 OLHOS DAGUA,RUA CAMARA FILHO QUADRA 15,S/N,OLHOS DAGUA,"RUA CAMARA FILHO QUADRA 15, OLHOS DAGUA, ALEXANIA, GO, BRASIL",,,,
GO,ALEXANIA,PSF 5 SERRA DO OURO,AV C1 AREA ESPECIAL SETOR PARQUE ALVORADA IV,S/N,SERRA DO OURO,"AV C1 AREA ESPECIAL SETOR PARQUE ALVORADA IV, SERRA DO OURO, ALEXANIA, GO, BRASIL",,,,
GO,ALEXANIA,PSF 7,AVENIDA NELSON SANTOS AREA ESPECIAL,S/N,CENTRO,"AVENIDA NELSON SANTOS AREA ESPECIAL, CENTRO, ALEXANIA, GO, BRASIL",,,,
GO,ALEXANIA,PSF 4,AV BRASILIA,338,SETOR SUDESTE,"AV BRASILIA, SETOR SUDESTE, ALEXANIA, GO, BRASIL",,,,
GO,ALOANDIA,UNIDADE BASICA DE SAUDE DE ALOANDIA,RUA 04,11,CENTRAL,"RUA 04, CENTRAL, ALOANDIA, GO, BRASIL",,,,
GO,ALTO HORIZONTE,CENTRO DE SAUDE DE ALTO HORIZONTE,RUA BELEM,S/N,CENTRO,"RUA BELEM, CENTRO, ALTO HORIZONTE, GO, BRASIL",,,,
GO,ALTO HORIZONTE,ESTRATEGIA SAUDE DA FAMILIA II,RUA DAS BANDEIRAS,S/N,NOSSA SENHORA APAREC,"RUA DAS BANDEIRAS, NOSSA SENHORA APAREC, ALTO HORIZONTE, GO, BRASIL",,,,
GO,ALTO PARAISO DE GOIAS,UNIDADE BASICA DE SAUDE DA FAMILIA II,AV ABILIO SZERVINSK,S/N,NOVO HORIZONTE,"AV ABILIO SZERVINSK, NOVO HORIZONTE, ALTO PARAISO DE GOIAS, GO, BRASIL",,,,
GO,ALTO PARAISO DE GOIAS,UNIDADE BASICA DE SAUDE DA FAMILIA IV,POVOADO DE SAO JORGE,S/N,SAO JORGE,"POVOADO DE SAO JORGE, SAO JORGE, ALTO PARAISO DE GOIAS, GO, BRASIL",,,,
GO,ALTO PARAISO DE GOIAS,UNIDADE BASICA DE SAUDE DA FAMILIA I,RUA DO MOINHO,S/N,PARAISO VELHO,"RUA DO MOINHO, PARAISO VELHO, ALTO PARAISO DE GOIAS, GO, BRASIL",,,,
GO,ALTO PARAISO DE GOIAS,UNIDADE BASICA DE SAUDE DA FAMILIA III,RUA 03,S/N,CIDADE ALTA,"RUA 03, CIDADE ALTA, ALTO PARAISO DE GOIAS, GO, BRASIL",,,,
GO,ALVORADA DO NORTE,UNIDADE SAUDE DA FAMILIA IV ALVORADA DO NORTE,RUA FRANCISCO MOTA LIMA,S/N,CENTRO,"RUA FRANCISCO MOTA LIMA, CENTRO, ALVORADA DO NORTE, GO, BRASIL",,,,
GO,ALVORADA DO NORTE,UNIDADE DE SAUDE DA FAMILIA III ALVORADA DO NORTE,AV MAJOR MOURA BASTOS,S/N,CENTRO,"AV MAJOR MOURA BASTOS, CENTRO, ALVORADA DO NORTE, GO, BRASIL",,,,
GO,ALVORADA DO NORTE,UNIDADE DE SAUDE DA FAMILIA I ALVORADA DO NORTE,RUA 06 ESQUINA COM A RUA 05,S/N,SETOR NOVA VILA,"RUA 06 ESQUINA COM A RUA 05, SETOR NOVA VILA, ALVORADA DO NORTE, GO, BRASIL",,,,
GO,ALVORADA DO NORTE,UNIDADE DE SAUDE DA FAMILIA IIALVORADA DO NORTE,RUA JOSE ANTONIO DE SERVILHA,S/N,NOVO IPIRANGA,"RUA JOSE ANTONIO DE SERVILHA, NOVO IPIRANGA, ALVORADA DO NORTE, GO, BRASIL",,,,
GO,AMARALINA,CENTRO DE SAUDE DE FIICOLANDIA,RUA CRIXAS,S/N,DISTRITO DE FIICOLAN,"RUA CRIXAS, DISTRITO DE FIICOLAN, AMARALINA, GO, BRASIL",,,,
GO,AMARALINA,CENTRO DE SAUDE DE AMARALINA,AV ANTONIO ALIPIO DIAS,3,CENTRO,"AV ANTONIO ALIPIO DIAS, CENTRO, AMARALINA, GO, BRASIL",,,,
GO,AMERICANO DO BRASIL,UBS ANTONIO DA SILVA ROSA,RUA AURELIANO PEIXOTO,10,CENTRO,"RUA AURELIANO PEIXOTO, CENTRO, AMERICANO DO BRASIL, GO, BRASIL",,,,
GO,AMERICANO DO BRASIL,UBS ADONIL BORGES DE SOUZA,AV GOIAS,666,CENTRO,"AV GOIAS, CENTRO, AMERICANO DO BRASIL, GO, BRASIL",,,,
GO,AMORINOPOLIS,POSTO DE SAUDE GOIAPORA,DISTRITO GOIAPORA,S/N,CENTRO,"DISTRITO GOIAPORA, CENTRO, AMORINOPOLIS, GO, BRASIL",,,,
GO,AMORINOPOLIS,CENTRO DE SAUDE DE AMORINOPOLIS ESF,RUA JOSE BONIFACIO,S/N,CENTRO,"RUA JOSE BONIFACIO, CENTRO, AMORINOPOLIS, GO, BRASIL",,,,
GO,ANAPOLIS,UBS MARACANANZINHO,RUA JOAO DE SOUZA RAMOS,618,MARACANANZINHO,"RUA JOAO DE SOUZA RAMOS, MARACANANZINHO, ANAPOLIS, GO, BRASIL",,,,
GO,ANAPOLIS,UBS JARDIM ALVORADA,PCA NOVA CAPITAL QD L,S/N,JARDIM ALVORADA,"PCA NOVA CAPITAL QD L, JARDIM ALVORADA, ANAPOLIS, GO, BRASIL",,,,
GO,ANAPOLIS,CENTRO DE INSERCAO SOCIAL MONSENHOR LUIZ ILC PRESIDIO,AV RAIMUNDO CARLOS COSTA E SILVA,S/N,JD AMERICA 3 ETAPA,"AV RAIMUNDO CARLOS COSTA E SILVA, JD AMERICA 3 ETAPA, ANAPOLIS, GO, BRASIL",,,,
GO,ANAPOLIS,UBS VILA FORMOSA,RUA 25 A,388,VILA FORMOSA,"RUA 25 A, VILA FORMOSA, ANAPOLIS, GO, BRASIL",,,,
GO,ANAPOLIS,UBS BANDEIRAS,AVENID MARECHAL GOUVEIA ESQUINA COM MARECHAL RORIZ,S/N,BANDEIRAS,"AVENID MARECHAL GOUVEIA ESQUINA COM MARECHAL RORIZ, BANDEIRAS, ANAPOLIS, GO, BRASIL",,,,
GO,ANAPOLIS,UBS DOM MANOEL,RUA ROQUE BRAGA,S/N,VICTOR BRAGA,"RUA ROQUE BRAGA, VICTOR BRAGA, ANAPOLIS, GO, BRASIL",,,,
GO,ANAPOLIS,UBS SANTA ISABEL,RUA COLOMBIA,1220,BOA VISTA,"RUA COLOMBIA, BOA VISTA, ANAPOLIS, GO, BRASIL",,,,
GO,ANAPOLIS,UBS BAIRRO LOURDES,AV COMERCIAL,S/N,BAIRRO LOURDES,"AV COMERCIAL, BAIRRO LOURDES, ANAPOLIS, GO, BRASIL",,,,
GO,ANAPOLIS,UBS SAO JOSE,RUA DONA AMELHA LOPES DE MORAIS,S/N,SAO JOSE,"RUA DONA AMELHA LOPES DE MORAIS, SAO JOSE, ANAPOLIS, GO, BRASIL",,,,
GO,ANAPOLIS,UBS GOIALANDIA,R PRINCIPAL,S/N,DIST GOIALANDIA,"R PRINCIPAL, DIST GOIALANDIA, ANAPOLIS, GO, BRASIL",,,,
GO,ANAPOLIS,UBS JOANAPOLIS,R JOAO GOMES,S/N,DIST JOANAPOLIS,"R JOAO GOMES, DIST JOANAPOLIS, ANAPOLIS, GO, BRASIL",,,,
GO,ANAPOLIS,UBS SANTA MARIA DE NAZARE,RUA MARTINHO FONTES,S/N,STA MARIA DE NAZARE,"RUA MARTINHO FONTES, STA MARIA DE NAZARE, ANAPOLIS, GO, BRASIL",,,,
GO,ANAPOLIS,UBS CALIXTOLANDIA,AVENIDA SOCRATES DINIZ ESQ COM RUA CALIFORNIA,S/N,CALIXTOLANDIA,"AVENIDA SOCRATES DINIZ ESQ COM RUA CALIFORNIA, CALIXTOLANDIA, ANAPOLIS, GO, BRASIL",,,,
GO,ANAPOLIS,UBS JARDIM SUICO,RUA GUAPORE,S/N,JARDIM SUICO,"RUA GUAPORE, JARDIM SUICO, ANAPOLIS, GO, BRASIL",,,,
GO,ANAPOLIS,UBS SANTO ANTONIO,AV SANTO ANTONIO,S/N,STO ANTONIO,"AV SANTO ANTONIO, STO ANTONIO, ANAPOLIS, GO, BRASIL",,,,
GO,ANAPOLIS,UBS VILA FABRIL,AV FABRIL,S/N,VILA FABRIL,"AV FABRIL, VILA FABRIL, ANAPOLIS, GO, BRASIL",,,,
GO,ANAPOLIS,UBS FILOSTRO CAIC,RUA MN 10,S/N,MORADA NOVA,"RUA MN 10, MORADA NOVA, ANAPOLIS, GO, BRASIL",,,,
GO,ANAPOLIS,UBS JARDIM GUANABARA,AVENIDA FEDERAL,S/N,JARDIM GUANABARA,"AVENIDA FEDERAL, JARDIM GUANABARA, ANAPOLIS, GO, BRASIL",,,,
GO,ANAPOLIS,UBS SAO LOURENCO,RUA 1 ESQUINA COM TRAVESSA 20,S/N,SAO LOURENCO,"RUA 1 ESQUINA COM TRAVESSA 20, SAO LOURENCO, ANAPOLIS, GO, BRASIL",,,,
GO,ANAPOLIS,UBS ARCO VERDE,RUA 21,S/N,JARDIM ARCO VERDE,"RUA 21, JARDIM ARCO VERDE, ANAPOLIS, GO, BRASIL",,,,
GO,ANAPOLIS,UBS JARDIM DAS AMERICAS,AVENIDA JOAO FLORENTINO,S/N,RESIDENCIAL ARAGUAIA,"AVENIDA JOAO FLORENTINO, RESIDENCIAL ARAGUAIA, ANAPOLIS, GO, BRASIL",,,,
GO,ANAPOLIS,UBS BRANAPOLIS,RUA B,102,BRANAPOLIS,"RUA B, BRANAPOLIS, ANAPOLIS, GO, BRASIL",,,,
GO,ANAPOLIS,UBS ALEXANDRINA,RUA ALAMEDA DOS PALMARES,S/N,JARDIM ALEXANDRINA,"RUA ALAMEDA DOS PALMARES, JARDIM ALEXANDRINA, ANAPOLIS, GO, BRASIL",,,,
GO,ANAPOLIS,UBS SOUZANIA,RUA CORIOLANDO SANTANA RAMOS,S/N,DISTRITO DE SOUZANIA,"RUA CORIOLANDO SANTANA RAMOS, DISTRITO DE SOUZANIA, ANAPOLIS, GO, BRASIL",,,,
GO,ANAPOLIS,UBS RECANTO DO SOL,AVENIDA DO ESTADO,S/N,RECANTO DO SOL,"AVENIDA DO ESTADO, RECANTO DO SOL, ANAPOLIS, GO, BRASIL",,,,
GO,ANAPOLIS,UBS ANEXO ITAMARATY,RUA PARANAGUA,S/N,ANEXO ITAMARATY,"RUA PARANAGUA, ANEXO ITAMARATY, ANAPOLIS, GO, BRASIL",,,,
GO,ANAPOLIS,UBS PARQUE DOS PIRINEUS,AVENIDA DOS PIRENEUS,S/N,PARQUE DOS PIRENEUS,"AVENIDA DOS PIRENEUS, PARQUE DOS PIRENEUS, ANAPOLIS, GO, BRASIL",,,,
GO,ANAPOLIS,UBS VILA ESPERANCA,AV INDEPENDENCIA,S/N,VILA ESPERANCA,"AV INDEPENDENCIA, VILA ESPERANCA, ANAPOLIS, GO, BRASIL",,,,
GO,ANAPOLIS,UBS JOAO LUIZ DE OLIVEIRA,RUA ROSARIO P BARROS,430,VILA JOAO LUIZ DE OL,"RUA ROSARIO P BARROS, VILA JOAO LUIZ DE OL, ANAPOLIS, GO, BRASIL",,,,
GO,ANAPOLIS,PRESIDIO ESTADUAL DE ANAPOLIS,BR 414,S/N,JARDIM PROMISSAO,"BR 414, JARDIM PROMISSAO, ANAPOLIS, GO, BRASIL",,,,
GO,ANAPOLIS,CIAA CENTRO DE INTERNACAO PARA ADOLESCENTES APS,AVENIDA BRASIL SUL,S/N,JARDIM GONCALVES,"AVENIDA BRASIL SUL, JARDIM GONCALVES, ANAPOLIS, GO, BRASIL",,,,
GO,ANAPOLIS,UBS JK,RUA 03,S/N,JK,"RUA 03, JK, ANAPOLIS, GO, BRASIL",,,,
GO,ANAPOLIS,ODONTOLOGIA INTEGRADA ANAPOLIS,RUA ROBERTO MANGE,153,VILA SANTANA,"RUA ROBERTO MANGE, VILA SANTANA, ANAPOLIS, GO, BRASIL",,,,
GO,ANAPOLIS,UBS JARDIM DAS OLIVEIRAS,RUA SOBRADINHO QD 07 LT 08,S/N,JARDIM DAS OLIVEIRAS,"RUA SOBRADINHO QD 07 LT 08, JARDIM DAS OLIVEIRAS, ANAPOLIS, GO, BRASIL",,,,
GO,ANAPOLIS,UBS CALIXTOPOLIS,RUA SAO FRANCISCO ESQUINA COM RUA SILVANIA,S/N,PARQUE CALIXTOPOLIS,"RUA SAO FRANCISCO ESQUINA COM RUA SILVANIA, PARQUE CALIXTOPOLIS, ANAPOLIS, GO, BRASIL",,,,
GO,ANAPOLIS,UBS PARAISO,PRACA SEBASTIAO SILVA,12,PARAISO,"PRACA SEBASTIAO SILVA, PARAISO, ANAPOLIS, GO, BRASIL",,,,
GO,ANAPOLIS,UBS PARQUE IRACEMA,PRACA DOM PEDRO,S/N,PARQUE IRACEMA,"PRACA DOM PEDRO, PARQUE IRACEMA, ANAPOLIS, GO, BRASIL",,,,
GO,ANAPOLIS,UBS ABADIA LOPES DA FONSECA,RUA LARGA,S/N,JARDIM CALIXTO,"RUA LARGA, JARDIM CALIXTO, ANAPOLIS, GO, BRASIL",,,,
GO,ANAPOLIS,UBS ARCO IRIS,AV CONTORNO ESQ COM RUA MOEMA L DE MELO,S/N,RES ARCO IRIS,"AV CONTORNO ESQ COM RUA MOEMA L DE MELO, RES ARCO IRIS, ANAPOLIS, GO, BRASIL",,,,
GO,ANAPOLIS,UBS VILA UNIAO,TRAVESSA 7 C AVENIDA LYDIA FERNANDES,S/N,VILA UNIAO,"TRAVESSA 7 C AVENIDA LYDIA FERNANDES, VILA UNIAO, ANAPOLIS, GO, BRASIL",,,,
GO,ANAPOLIS,UBS VIVIAN PARQUE,RUA ILMA P BRAGA ESQUINA COM ODILIA F BORGES,S/N,VIVIAN PARQUE,"RUA ILMA P BRAGA ESQUINA COM ODILIA F BORGES, VIVIAN PARQUE, ANAPOLIS, GO, BRASIL",,,,
GO,ANAPOLIS,UBS MARACANA,RUA ADA CENTINE,S/N,MARACANA,"RUA ADA CENTINE, MARACANA, ANAPOLIS, GO, BRASIL",,,,
GO,ANAPOLIS,UBS MUNIR CALIXTO,RUA 03 ESQUINA COM AVENIDA CENTRAL,S/N,SETOR IND MUNIR CAL,"RUA 03 ESQUINA COM AVENIDA CENTRAL, SETOR IND MUNIR CAL, ANAPOLIS, GO, BRASIL",,,,
GO,ANAPOLIS,UBS SAO CARLOS,RUA 05,S/N,BAIRRO BOA VISTA,"RUA 05, BAIRRO BOA VISTA, ANAPOLIS, GO, BRASIL",,,,
GO,ANAPOLIS,UBS ADRIANA PARQUE,RUA LILIAN ESQ COM RUA G,S/N,JANDAIA,"RUA LILIAN ESQ COM RUA G, JANDAIA, ANAPOLIS, GO, BRASIL",,,,
GO,ANAPOLIS,UBS INTERLANDIA,RUA ANAPOLIS PCA SAO SEBASTIAO,S/N,DIST INTERLANDIA,"RUA ANAPOLIS PCA SAO SEBASTIAO, DIST INTERLANDIA, ANAPOLIS, GO, BRASIL",,,,
GO,ANAPOLIS,UBS SAO VICENTE,RUA FRANCISCO DE MELO MOURA,32,VILA SAO VICENTE,"RUA FRANCISCO DE MELO MOURA, VILA SAO VICENTE, ANAPOLIS, GO, BRASIL",,,,
GO,ANHANGUERA,CENTRO DE SAUDE DE ANHANGUERA,AVENIDA BELCHIOR DE GODOY,152,CENTRO,"AVENIDA BELCHIOR DE GODOY, CENTRO, ANHANGUERA, GO, BRASIL",,,,
GO,ANICUNS,UBS JOSE SEVERIANO CENTRO DE SAUDE,PRACA DO ROSARIO,374,CENTRO,"PRACA DO ROSARIO, CENTRO, ANICUNS, GO, BRASIL",,,,
GO,ANICUNS,POSTO DE SAUDE CHOUPANA ANICUNS,DISTRITO DE CHOUPANA,S/N,CHOUPANA,"DISTRITO DE CHOUPANA, CHOUPANA, ANICUNS, GO, BRASIL",,,,
GO,ANICUNS,UBS HELIODORA MARIA DINIZ DONA LICA,RUA FRANCISCO MORANGA,S/N,SETOR SAO MIGUEL,"RUA FRANCISCO MORANGA, SETOR SAO MIGUEL, ANICUNS, GO, BRASIL",,,,
GO,ANICUNS,UBS ANTONIO GONCALVES COSTA RIO DOS BOIS,RUA ARLINDO B XAVIER,S/N,CONJUNTO RIO DOS BOI,"RUA ARLINDO B XAVIER, CONJUNTO RIO DOS BOI, ANICUNS, GO, BRASIL",,,,
GO,ANICUNS,UBS JOAQUIM ANTONIO DIAS SAO VICENTE,AVENIDA PAULO ALVES,S/N,SETOR OESTE,"AVENIDA PAULO ALVES, SETOR OESTE, ANICUNS, GO, BRASIL",,,,
GO,ANICUNS,UBS CAPELA ANICUNS,RUA 4,S/N,DISTRITO DE CAPELA,"RUA 4, DISTRITO DE CAPELA, ANICUNS, GO, BRASIL",,,,
GO,ANICUNS,UBS JULIO GOMES DE ARAUJO ARCO VERDE,RUA VITORIA,S/N,JARDIM ARCO VERDE,"RUA VITORIA, JARDIM ARCO VERDE, ANICUNS, GO, BRASIL",,,,
GO,ANICUNS,UBS MARIA DE LOURDES RODRIGUES SAO DOMINGOS,RUA ANA RIBEIRO DOS SANTOS,S/N,VILA SAO DOMINGOS,"RUA ANA RIBEIRO DOS SANTOS, VILA SAO DOMINGOS, ANICUNS, GO, BRASIL",,,,
GO,ANICUNS,UBS SANTA LUCIA,RUA FLAMBOYANT,S/N,VILA SANTA LUCIA,"RUA FLAMBOYANT, VILA SANTA LUCIA, ANICUNS, GO, BRASIL",,,,
GO,APARECIDA DE GOIANIA,UNIDADE BASICA DE SAUDE CRUZEIRO DO SUL,RUA CANAVIAL,S/N,CONJUNTO CRUZEIRO DO,"RUA CANAVIAL, CONJUNTO CRUZEIRO DO, APARECIDA DE GOIANIA, GO, BRASIL",,,,
GO,APARECIDA DE GOIANIA,UNIDADE BASICA DE SAUDE JARDIM FLORENCA,RUA VERONA ESQ C RUA SAO PAULO,S/N,JARDIM FLORENCA,"RUA VERONA ESQ C RUA SAO PAULO, JARDIM FLORENCA, APARECIDA DE GOIANIA, GO, BRASIL",,,,
GO,APARECIDA DE GOIANIA,UNIDADE BASICA DE SAUDE CAMPOS ELISIOS,RUA LA ROCHELLE,S/N,CAMPOS ELISIOS,"RUA LA ROCHELLE, CAMPOS ELISIOS, APARECIDA DE GOIANIA, GO, BRASIL",,,,
GO,APARECIDA DE GOIANIA,UNIDADE BASICA DE SAUDE PARQUE TRINDADE,ALAMEDA WILTON PINHEIRO,S/N,PQ TRINDADE,"ALAMEDA WILTON PINHEIRO, PQ TRINDADE, APARECIDA DE GOIANIA, GO, BRASIL",,,,
GO,APARECIDA DE GOIANIA,UNIDADE BASICA DE SAUDE RESIDENCIAL ANHAMBI,RUA A 2,S/N,RESIDENCIAL ANHAMBI,"RUA A 2, RESIDENCIAL ANHAMBI, APARECIDA DE GOIANIA, GO, BRASIL",,,,
GO,APARECIDA DE GOIANIA,CENTRO DE SAUDE VILA BRASILIA,RUA HAVAI,S/N,VILA BRASILIA,"RUA HAVAI, VILA BRASILIA, APARECIDA DE GOIANIA, GO, BRASIL",,,,
GO,APARECIDA DE GOIANIA,UNIDADE BASICA DE SAUDE BAIRRO ILDA,RUA JOSE BERNARDES DE SOUSA,S/N,BAIRRRO ILDA,"RUA JOSE BERNARDES DE SOUSA, BAIRRRO ILDA, APARECIDA DE GOIANIA, GO, BRASIL",,,,
GO,APARECIDA DE GOIANIA,UNIDADE BASICA DE SAUDE BAIRRO CARDOSO,AV EMBAIXADOR,S/N,CARDOSO,"AV EMBAIXADOR, CARDOSO, APARECIDA DE GOIANIA, GO, BRASIL",,,,
GO,APARECIDA DE GOIANIA,UNIDADE BASICA DE SAUDE PONTAL SUL,AVENIDA ANCHIETA C RUA HEMATITA,S/N,PONTAL SUL,"AVENIDA ANCHIETA C RUA HEMATITA, PONTAL SUL, APARECIDA DE GOIANIA, GO, BRASIL",,,,
GO,APARECIDA DE GOIANIA,CENTRO DE SAUDE DA CASA DE PRISAO PROVISORIA,BR153 KM1292,S/N,ZONA RURAL,"BR153 KM1292, ZONA RURAL, APARECIDA DE GOIANIA, GO, BRASIL",,,,
GO,APARECIDA DE GOIANIA,UNIDADE BASICA DE SAUDE JARDIM BOA ESPERANCA,RUA C 48 APM 01,S/N,JARDIM BOA ESPERANCA,"RUA C 48 APM 01, JARDIM BOA ESPERANCA, APARECIDA DE GOIANIA, GO, BRASIL",,,,
GO,APARECIDA DE GOIANIA,UNIDADE BASICA DE SAUDE CARAIBAS,AVENIDA DOMITILIA LOBO,S/N,RES CARAIBAS,"AVENIDA DOMITILIA LOBO, RES CARAIBAS, APARECIDA DE GOIANIA, GO, BRASIL",,,,
GO,APARECIDA DE GOIANIA,UNIDADE BASICA DE SAUDE PONTAL SUL II,RUA DO RODEIO,S/N,PONTAL SUL,"RUA DO RODEIO, PONTAL SUL, APARECIDA DE GOIANIA, GO, BRASIL",,,,
GO,APARECIDA DE GOIANIA,UNIDADE BASICA DE SAUDE JARDIM TIRADENTES I,AVENIDA 8 ESQ RUA 11,S/N,JARDIM TIRADENTES,"AVENIDA 8 ESQ RUA 11, JARDIM TIRADENTES, APARECIDA DE GOIANIA, GO, BRASIL",,,,
GO,APARECIDA DE GOIANIA,UNIDADE BASICA DE SAUDE JARDIM PARAISO,RUA PARAISO,S/N,JARDIM PARAISO,"RUA PARAISO, JARDIM PARAISO, APARECIDA DE GOIANIA, GO, BRASIL",,,,
GO,APARECIDA DE GOIANIA,UNIDADE BASICA DE SAUDE GARAVELO PARK,RUA 36 E QD 106 APM 1C,S/N,GARAVELO RESIDENCIAL,"RUA 36 E QD 106 APM 1C, GARAVELO RESIDENCIAL, APARECIDA DE GOIANIA, GO, BRASIL",,,,
GO,APARECIDA DE GOIANIA,UNIDADE BASICA DE SAUDE BURITI SERENO,RUA PEDRO AMERICO C PRACA MARECHAL HERMES,S/N,BURITI SERENO,"RUA PEDRO AMERICO C PRACA MARECHAL HERMES, BURITI SERENO, APARECIDA DE GOIANIA, GO, BRASIL",,,,
GO,APARECIDA DE GOIANIA,UNIDADE BASICA DE SAUDE JARDIM NOVA OLINDA,AV INDEPENDENCIA,S/N,JD NOVA OLINDA,"AV INDEPENDENCIA, JD NOVA OLINDA, APARECIDA DE GOIANIA, GO, BRASIL",,,,
GO,APARECIDA DE GOIANIA,UNIDADE BASICA DE SAUDE ANDRADE REIS,AVENIDA DOS GIRASSOIS,S/N,ANDRADE REIS,"AVENIDA DOS GIRASSOIS, ANDRADE REIS, APARECIDA DE GOIANIA, GO, BRASIL",,,,
GO,APARECIDA DE GOIANIA,UNIDADE BASICA DE SAUDE JARDIM OLIMPICO,AVENIDA MONTE CARLO,S/N,JARDIM OLIMPICO,"AVENIDA MONTE CARLO, JARDIM OLIMPICO, APARECIDA DE GOIANIA, GO, BRASIL",,,,
GO,APARECIDA DE GOIANIA,UNIDADE BASICA DE SAUDE DO PSF JARDIM DOS BURITIS,AV DAS PALMEIRAS,S/N,JD DOS BURITIS,"AV DAS PALMEIRAS, JD DOS BURITIS, APARECIDA DE GOIANIA, GO, BRASIL",,,,
GO,APARECIDA DE GOIANIA,UNIDADE BASICA DE SAUDE JARDIM RIVIERA,RUA ALBERTO PASQUALINI C DR PEDRO LUD TEIXEIRA,S/N,JARDIM RIVIERA,"RUA ALBERTO PASQUALINI C DR PEDRO LUD TEIXEIRA, JARDIM RIVIERA, APARECIDA DE GOIANIA, GO, BRASIL",,,,
GO,APARECIDA DE GOIANIA,UNIDADE BASICA DE SAUDE INDEPENDENCIA MANSOES,RUA 56,S/N,INDEPENDENCIA MANSOE,"RUA 56, INDEPENDENCIA MANSOE, APARECIDA DE GOIANIA, GO, BRASIL",,,,
GO,APARECIDA DE GOIANIA,UNIDADE BASICA DE SAUDE ALTO PARAISO,RUA CABO FRIO C RUA SAO FELIX C RUA SANTA ANA,S/N,JARDIM ALTO PARAISO,"RUA CABO FRIO C RUA SAO FELIX C RUA SANTA ANA, JARDIM ALTO PARAISO, APARECIDA DE GOIANIA, GO, BRASIL",,,,
GO,APARECIDA DE GOIANIA,CENTRO DE SAUDE PENITENCIARIA CORONEL ODENIR GUIMARAES,BR153 KM1292,S/N,ZONA RURAL,"BR153 KM1292, ZONA RURAL, APARECIDA DE GOIANIA, GO, BRASIL",,,,
GO,APARECIDA DE GOIANIA,CENTRO DE SAUDE MADRE GERMANA I,RUA MG 17 AREA VERDE,S/N,MADRE GERMANA I,"RUA MG 17 AREA VERDE, MADRE GERMANA I, APARECIDA DE GOIANIA, GO, BRASIL",,,,
GO,APARECIDA DE GOIANIA,UNIDADE BASICA DE SAUDE JARDIM BELA VISTA,RUA DAS PAINEIRAS,S/N,ST BELA VISTA,"RUA DAS PAINEIRAS, ST BELA VISTA, APARECIDA DE GOIANIA, GO, BRASIL",,,,
GO,APARECIDA DE GOIANIA,UNIDADE BASICA DE SAUDE JARDIM DOS IPES,RUA JI 51,S/N,RESIDENCIAL JARDIM D,"RUA JI 51, RESIDENCIAL JARDIM D, APARECIDA DE GOIANIA, GO, BRASIL",,,,
GO,APARECIDA DE GOIANIA,UNIDADE BASICA DE SAUDE CHACARA SAO PEDRO,RUA 5,314,CHACARAS SAO PEDRO,"RUA 5, CHACARAS SAO PEDRO, APARECIDA DE GOIANIA, GO, BRASIL",,,,
GO,APARECIDA DE GOIANIA,UNIDADE BASICA DE SAUDE COLINA AZUL,RUA DAS GARCAS,S/N,COLINA AZUL,"RUA DAS GARCAS, COLINA AZUL, APARECIDA DE GOIANIA, GO, BRASIL",,,,
GO,APARECIDA DE GOIANIA,UNIDADE BASICA DE SAUDE ROSA DOS VENTOS,RUA DIMITRY NOVGORODCEV,0,ROSA DOS VENTOS,"RUA DIMITRY NOVGORODCEV, ROSA DOS VENTOS, APARECIDA DE GOIANIA, GO, BRASIL",,,,
GO,APARECIDA DE GOIANIA,UNIDADE BASICA DE SAUDE MANSOES PARAISO,RUA J 50 E AVENIDA W 1,S/N,MANSOES PARAISO,"RUA J 50 E AVENIDA W 1, MANSOES PARAISO, APARECIDA DE GOIANIA, GO, BRASIL",,,,
GO,APARECIDA DE GOIANIA,UNIDADE BASICA DE SAUDE PARQUE DAS NACOES II,AVENIDA ARGELIA,S/N,INDEPENDENCIA,"AVENIDA ARGELIA, INDEPENDENCIA, APARECIDA DE GOIANIA, GO, BRASIL",,,,
GO,APARECIDA DE GOIANIA,UNIDADE BASICA DE SAUDE RESIDENCIAL CANDIDO DE QUEIROZ,RUA 20,S/N,RESIDENCIAL CANDIDO,"RUA 20, RESIDENCIAL CANDIDO, APARECIDA DE GOIANIA, GO, BRASIL",,,,
GO,APARECIDA DE GOIANIA,UNIDADE BASICA DE SAUDE BAIRRO INDEPENDENCIA,RUA 60,S/N,INDEPENDENCIA,"RUA 60, INDEPENDENCIA, APARECIDA DE GOIANIA, GO, BRASIL",,,,
GO,APARECIDA DE GOIANIA,UNIDADE BASICA DE SAUDE PORTO DAS PEDRAS,RUA R 1,S/N,PORTO DAS PEDRAS,"RUA R 1, PORTO DAS PEDRAS, APARECIDA DE GOIANIA, GO, BRASIL",,,,
GO,APARECIDA DE GOIANIA,UNIDADE BASICA DE SAUDE SANTA LUZIA,AV W 5,S/N,JARDIM OLIMPICO,"AV W 5, JARDIM OLIMPICO, APARECIDA DE GOIANIA, GO, BRASIL",,,,
GO,APARECIDA DE GOIANIA,CENTRO DE SAUDE PAPILON PARK,RUA L11,S/N,PAPILON PARK,"RUA L11, PAPILON PARK, APARECIDA DE GOIANIA, GO, BRASIL",,,,
GO,APARECIDA DE GOIANIA,UNIDADE BASICA DE SAUDE DELFIORI,RUA PERICLES RAMOS,S/N,VILLA DELFIORE,"RUA PERICLES RAMOS, VILLA DELFIORE, APARECIDA DE GOIANIA, GO, BRASIL",,,,
GO,APARECIDA DE GOIANIA,UNIDADE BASICA DE SAUDE VEIGA JARDIM,AVENIDA MAJOR MANOEL AUGUSTO SILVA BRANDAO,S/N,VEIGA JARDIM,"AVENIDA MAJOR MANOEL AUGUSTO SILVA BRANDAO, VEIGA JARDIM, APARECIDA DE GOIANIA, GO, BRASIL",,,,
GO,APARECIDA DE GOIANIA,UNIDADE BASICA DE SAUDE EXPANSUL,AVENIDA CORONEL EDUARDO AUGUSTO DE BARROS,S/N,EXPANSUL,"AVENIDA CORONEL EDUARDO AUGUSTO DE BARROS, EXPANSUL, APARECIDA DE GOIANIA, GO, BRASIL",,,,
GO,APARECIDA DE GOIANIA,UNIDADE BASICA DE SAUDE BANDEIRANTES,RUA AMADOR BUENO C PASCOAL MOREIRA CABRAL C 2 AV,S/N,SETOR DOS BANDEIRANT,"RUA AMADOR BUENO C PASCOAL MOREIRA CABRAL C 2 AV, SETOR DOS BANDEIRANT, APARECIDA DE GOIANIA, GO, BRASIL",,,,
GO,APARECIDA DE GOIANIA,UNIDADE BASICA DE SAUDE RETIRO DO BOSQUE,RUA DAS PAINEIRAS C RUA JACARANDAS,S/N,RETIRO DO BOSQUE,"RUA DAS PAINEIRAS C RUA JACARANDAS, RETIRO DO BOSQUE, APARECIDA DE GOIANIA, GO, BRASIL",,,,
GO,APARECIDA DE GOIANIA,UNIDADE BASICA DE SAUDE SANTO ANDRE,RUA 24 DE OUTUBRO,S/N,SANTO ANDRE,"RUA 24 DE OUTUBRO, SANTO ANDRE, APARECIDA DE GOIANIA, GO, BRASIL",,,,
