UF,MUNICIPIO,ESTABELECIMENTO,LOGRADOURO,NUMERO,BAIRRO,ENDERECO_COMPLETO,latitude,longitude,address,point
BA,JAGUAQUARA,USF NILTON FREIRE DE ASSIS,RUA BELA VISTA,S/N,BELA VISTA,"RUA BELA VISTA, BELA VISTA, JAGUAQUARA, BA, BRASIL",,,,
BA,JAGUAQUARA,USF PEDRO BERNARDINO SANTOS,RUA MENANDRO MENAHIM,53,PALMEIRA,"RUA MENANDRO MENAHIM, PALMEIRA, JAGUAQUARA, BA, BRASIL",,,,
BA,JAGUAQUARA,USF MIRO TABAREU,RUA DA LAGOA,S/N,LAGOA,"RUA DA LAGOA, LAGOA, JAGUAQUARA, BA, BRASIL",,,,
BA,JAGUAQUARA,USF JOSE MARIA FONTENELLE,LOTEAMENTO NOVA JAGUAQUARA,S/N,NOVA JAGUAQUARA,"LOTEAMENTO NOVA JAGUAQUARA, NOVA JAGUAQUARA, JAGUAQUARA, BA, BRASIL",,,,
BA,JAGUARARI,POSTO DE SAUDE DO FLAMENGO,POVOADO DO FLAMENGO,S/N,ZONA RURAL,"POVOADO DO FLAMENGO, ZONA RURAL, JAGUARARI, BA, BRASIL",,,,
BA,JAGUARARI,USF MARIA ORAIDA DA SILVA E SILVA,POVOADO DE JUACEMA,5,ZONA RURAL,"POVOADO DE JUACEMA, ZONA RURAL, JAGUARARI, BA, BRASIL",,,,
BA,JAGUARARI,USF RAUL LOPEZ ESCUDERO,RUA DO BEMTIVI,1038,CENTRO,"RUA DO BEMTIVI, CENTRO, JAGUARARI, BA, BRASIL",,,,
BA,JAGUARARI,USF ODILON GONCALVES,RUA DA LAM,20,CENTRO,"RUA DA LAM, CENTRO, JAGUARARI, BA, BRASIL",,,,
BA,JAGUARARI,UNIDADE DE SAUDE FAMILIA SALOMAO CARVALHO,RUA ANTONIO SANTOS,2,CENTRO,"RUA ANTONIO SANTOS, CENTRO, JAGUARARI, BA, BRASIL",,,,
BA,JAGUARARI,USF FERNANDO DANTAS DA SILVA,RUA PRINCIPAL,1,CENTRO,"RUA PRINCIPAL, CENTRO, JAGUARARI, BA, BRASIL",,,,
BA,JAGUARARI,USF JOSEFA MARIA DE MENEZES,POVOADO DE GAMELEIRA,S/N,CENTRO,"POVOADO DE GAMELEIRA, CENTRO, JAGUARARI, BA, BRASIL",,,,
BA,JAGUARARI,CENTRO DE SAUDE TIPO II,RUA DA QUADRA,2,POPULARES,"RUA DA QUADRA, POPULARES, JAGUARARI, BA, BRASIL",,,,
BA,JAGUARARI,PSF JOSELINA PIO DE FARIAS,POVOADO DE CATUNI,S/N,ZONA RURAL,"POVOADO DE CATUNI, ZONA RURAL, JAGUARARI, BA, BRASIL",,,,
BA,JAGUARARI,USF MARINALVA DE SOUZA FERNANDES,POVOADO DE SANTA ROSA DE LIMA,S/N,ZONA RURAL,"POVOADO DE SANTA ROSA DE LIMA, ZONA RURAL, JAGUARARI, BA, BRASIL",,,,
BA,JAGUARIPE,UNIDADE BASICA DE SAUDE DO CACHACO,RUA DIRETO DO CACHACO,S/N,CACHACO,"RUA DIRETO DO CACHACO, CACHACO, JAGUARIPE, BA, BRASIL",,,,
BA,JAGUARIPE,UNIDADE DE SAUDE DA FAMILIA DO PALMA,RUA MARIA BISPO DAS NEVES,20,PALMA,"RUA MARIA BISPO DAS NEVES, PALMA, JAGUARIPE, BA, BRASIL",,,,
BA,JAGUARIPE,UNIDADE DE SAUDE DA FAMILIA DO CAPAO,RUA MARIA BISPO DAS NEVES,S/N,PALMA,"RUA MARIA BISPO DAS NEVES, PALMA, JAGUARIPE, BA, BRASIL",,,,
BA,JAGUARIPE,UNIDADE DE SAUDE DA FAMILIA DE CACOES,RUA SAGRADO CORACAO DE JESUS,S/N,CACOES,"RUA SAGRADO CORACAO DE JESUS, CACOES, JAGUARIPE, BA, BRASIL",,,,
BA,JAGUARIPE,UNIDADE DE SAUDE DA FAMILIA DE JAGUARIPE,PRACA DA BANDEIRA,1,CENTRO,"PRACA DA BANDEIRA, CENTRO, JAGUARIPE, BA, BRASIL",,,,
BA,JAGUARIPE,UNIDADE DE SAUDE DA FAMILIA DE MUTA,RUA DA ESTRADA,1,MUTA,"RUA DA ESTRADA, MUTA, JAGUARIPE, BA, BRASIL",,,,
BA,JAGUARIPE,USF JOSE RAIMUNDO RIBEIRO PEDREIRA,RUA DA LINHA,S/N,CAMASSANDI,"RUA DA LINHA, CAMASSANDI, JAGUARIPE, BA, BRASIL",,,,
BA,JAGUARIPE,UNIDADE DE SAUDE DA FAMILIA DE BARREIRAS,ENTROCAMENTO DE BARREIRAS,31,BARREIRAS,"ENTROCAMENTO DE BARREIRAS, BARREIRAS, JAGUARIPE, BA, BRASIL",,,,
BA,JAGUARIPE,UNIDADE BASICA DE SAUDE DE SAO BERNARDO,RUA CHILE,12,SAO BERNARDO,"RUA CHILE, SAO BERNARDO, JAGUARIPE, BA, BRASIL",,,,
BA,JAGUARIPE,UNIDADE BASICA DE SAUDE DE ILHA DAJUDA,RUA PRINCIPAL,19,ILHA DAJUDA,"RUA PRINCIPAL, ILHA DAJUDA, JAGUARIPE, BA, BRASIL",,,,
BA,JANDAIRA,POSTO DE SAUDE DE CACHOEIRA,RUA DO RIO,S/N,POVOADO,"RUA DO RIO, POVOADO, JANDAIRA, BA, BRASIL",,,,
BA,JANDAIRA,POSTO DE SAUDE DE COQUEIRO,RUA DA MARE,S/N,POVOADO,"RUA DA MARE, POVOADO, JANDAIRA, BA, BRASIL",,,,
BA,JANDAIRA,USF ALCIDES DE AGUIAR LEITE,POV ABADIA,S/N,POVOADO,"POV ABADIA, POVOADO, JANDAIRA, BA, BRASIL",,,,
BA,JANDAIRA,POSTO DE SAUDE DE MANGUE SECO,PRACA DA ESCOLA,S/N,POVOADO,"PRACA DA ESCOLA, POVOADO, JANDAIRA, BA, BRASIL",,,,
BA,JANDAIRA,POSTO DE SAUDE WELLNGTON LEITE DE AVILA,POV MONTE BELO,56,POVOADO,"POV MONTE BELO, POVOADO, JANDAIRA, BA, BRASIL",,,,
BA,JANDAIRA,USF AGNALDO FRANCA,POVOADO PONTE DE ITABATINGA,S/N,POVOADO,"POVOADO PONTE DE ITABATINGA, POVOADO, JANDAIRA, BA, BRASIL",,,,
BA,JANDAIRA,POSTO DE SAUDE SAMUEL NUNES,POVOADO MALHADINHA,52,POVOADO,"POVOADO MALHADINHA, POVOADO, JANDAIRA, BA, BRASIL",,,,
BA,JANDAIRA,USF MAE BENZINHA,LARGO DA MURTA,1,CENTRO,"LARGO DA MURTA, CENTRO, JANDAIRA, BA, BRASIL",,,,
BA,JEQUIE,USF DRA ISA CLERIA BORGES,AV OTAVIO MAGABEIRA,S/N,KM 03,"AV OTAVIO MAGABEIRA, KM 03, JEQUIE, BA, BRASIL",,,,
BA,JEQUIE,UBS SEBASTIAO AZEVEDO,PCA OTAVIO MANGABEIRA,S/N,MANDACARU,"PCA OTAVIO MANGABEIRA, MANDACARU, JEQUIE, BA, BRASIL",,,,
BA,JEQUIE,UBS ALMERINDA LOMANTO,PRACA PAPA JOAO XXIII,S/N,JOAQUIM ROMAO,"PRACA PAPA JOAO XXIII, JOAQUIM ROMAO, JEQUIE, BA, BRASIL",,,,
BA,JEQUIE,USF DR JOSE MAXIMILIANO HENRIQUEZ SANDOVAL,RUA M,1,JEQUIEZINHO,"RUA M, JEQUIEZINHO, JEQUIE, BA, BRASIL",,,,
BA,JEQUIE,USF DR AMANDO RIBEIRO BORGES,LOTM AGUA BRANCA,100,JEQUIEZINHO,"LOTM AGUA BRANCA, JEQUIEZINHO, JEQUIE, BA, BRASIL",,,,
BA,JEQUIE,USF DR MILTON RABELO,RUA ADEMAR DE BARROS,1,KM 04,"RUA ADEMAR DE BARROS, KM 04, JEQUIE, BA, BRASIL",-13.8707658,-40.1193741,"Rua Ademar de Barros, Jequié, Região Geográfica Imediata de Jequié, Região Geográfica Intermediária de Vitória da Conquista, Bahia, Região Nordeste, 45206-191, Brasil","13 52m 14.7569s S, 40 7m 9.74676s W"
BA,JEQUIE,USF WALDOMIRO BORGES,RUA DO CACAU,S/N,ITAJURU,"RUA DO CACAU, ITAJURU, JEQUIE, BA, BRASIL",,,,
BA,JEQUIE,USF DR AURELIO SCIARRETTA,RUA MANOELITO REBOUCAS,S/N,ITAIGARA,"RUA MANOELITO REBOUCAS, ITAIGARA, JEQUIE, BA, BRASIL",,,,
BA,JEQUIE,USF ODORICO MOTTA,AVENIDA VICENTE LEONE,S/N,CAIXA D AGUA,"AVENIDA VICENTE LEONE, CAIXA D AGUA, JEQUIE, BA, BRASIL",,,,
BA,JEQUIE,UNIDADE DE SAUDE DO CONJUNTO PENAL DE JEQUIE,AVENIDA BAIXA DO BONFIM,100,JEQUIEZINHO,"AVENIDA BAIXA DO BONFIM, JEQUIEZINHO, JEQUIE, BA, BRASIL",,,,
BA,JEQUIE,USF GISERLANDO BIONDI,AV SENHOR DO BOMFIM,S/N,JEQUIEZINHO,"AV SENHOR DO BOMFIM, JEQUIEZINHO, JEQUIE, BA, BRASIL",,,,
BA,JEQUIE,USF ISABEL ANDRADE,FLORESTAL,S/N,FLORESTAL,"FLORESTAL, FLORESTAL, JEQUIE, BA, BRASIL",-13.7996547,-39.8476736,"Rua Jequié, Florestal, Jequié, Região Geográfica Imediata de Jequié, Região Geográfica Intermediária de Vitória da Conquista, Bahia, Região Nordeste, Brasil","13 47m 58.7569s S, 39 50m 51.625s W"
BA,JEQUIE,USF ANTONIO CARLOS MARTINS,RUA CARLOS AGUIAR RIBEIRO,S/N,SAO JUDAS TADEU,"RUA CARLOS AGUIAR RIBEIRO, SAO JUDAS TADEU, JEQUIE, BA, BRASIL",,,,
BA,JEQUIE,USF PADRE HILARIO TERROSI,RUA WALDIR LEITE,S/N,AGUA BRANCA,"RUA WALDIR LEITE, AGUA BRANCA, JEQUIE, BA, BRASIL",,,,
BA,JEQUIE,USF SENHORINHA FERREIRA DE ARAUJO I,PCA CAPITAO SILVINO DE RAUJO,S/N,CURRAL NOVO,"PCA CAPITAO SILVINO DE RAUJO, CURRAL NOVO, JEQUIE, BA, BRASIL",,,,
BA,JEQUIE,USF DORALIZE VIDAL,CAIXA DAGUA,S/N,CAIXA DAGUA,"CAIXA DAGUA, CAIXA DAGUA, JEQUIE, BA, BRASIL",,,,
BA,JEQUIE,USF SEBASTIAO GUEDES,RUA PRINCIPAL,S/N,CACHOEIRINHA,"RUA PRINCIPAL, CACHOEIRINHA, JEQUIE, BA, BRASIL",,,,
BA,JEQUIE,USF ILDEFONSO GUEDES,RUA ANTONIO ALVES MARTINS,S/N,JOAQUIM ROMAO,"RUA ANTONIO ALVES MARTINS, JOAQUIM ROMAO, JEQUIE, BA, BRASIL",,,,
BA,JEQUIE,USF DR GILSON PINHEIRO,RUA DOUTOR ANTONIO ASTOLFO,S/N,POMPILIO SAMPAIO,"RUA DOUTOR ANTONIO ASTOLFO, POMPILIO SAMPAIO, JEQUIE, BA, BRASIL",,,,
BA,JEQUIE,USF DR JOAO CARICCHIO FILHO,RUA 8,S/N,AMARALINA,"RUA 8, AMARALINA, JEQUIE, BA, BRASIL",-13.8373769,-40.0662841,"Rua Oito, Amaralina, Jequié, Região Geográfica Imediata de Jequié, Região Geográfica Intermediária de Vitória da Conquista, Bahia, Região Nordeste, 45208-209, Brasil","13 50m 14.5568s S, 40 3m 58.6228s W"
BA,JEQUIE,USF OLIMPIO JOSE DOS ANJOS,RUA MANOEL PEREIRA DA SILVA,S/N,CANSANCAO,"RUA MANOEL PEREIRA DA SILVA, CANSANCAO, JEQUIE, BA, BRASIL",,,,
BA,JEQUIE,USF DR RUBENS XAVIER,RUA AMERICANO DA COSTA,S/N,JOAQUIM ROMAO,"RUA AMERICANO DA COSTA, JOAQUIM ROMAO, JEQUIE, BA, BRASIL",,,,
BA,JEQUIE,UBS DE JEQUIE,RUA MANOEL VITORINO,S/N,CAMPO DO AMERICA,"RUA MANOEL VITORINO, CAMPO DO AMERICA, JEQUIE, BA, BRASIL",,,,
BA,JEQUIE,USF HOSANNAH MICHELLI TOLOMEI,RUA EDVALDO CARDOSO,S/N,LOTEAMENTO ITAIGARA,"RUA EDVALDO CARDOSO, LOTEAMENTO ITAIGARA, JEQUIE, BA, BRASIL",,,,
BA,JEQUIE,USF VIRGILIO DE PAULA TOURINHO NETO,RUA PARAISO,S/N,CIDADE NOVA,"RUA PARAISO, CIDADE NOVA, JEQUIE, BA, BRASIL",,,,
BA,JEQUIE,UBS JULIA MAGALHAES,RUA DR JOAO BRAGA,S/N,JEQUIEZINHO,"RUA DR JOAO BRAGA, JEQUIEZINHO, JEQUIE, BA, BRASIL",,,,
BA,JEREMOABO,POSTO DE SAUDE DA BAIXA DA PEDRA,POVOADO BAIXA DA PEDRA,1,ZONA RURAL,"POVOADO BAIXA DA PEDRA, ZONA RURAL, JEREMOABO, BA, BRASIL",,,,
BA,JEREMOABO,UNIDADE DE SAUDE DE FAMILIA MATRIZ,PRACA CORONEL ANTONIO LOURENCO,11,CENTRO,"PRACA CORONEL ANTONIO LOURENCO, CENTRO, JEREMOABO, BA, BRASIL",,,,
BA,JEREMOABO,POSTO DE SAUDE DA CIRICA,POVOADO CIRICA,1,ZONA RURAL,"POVOADO CIRICA, ZONA RURAL, JEREMOABO, BA, BRASIL",,,,
BA,JEREMOABO,UNIDADE DE SAUDE DA FAMILIA ROMAO,AVENIDA SR DO BONFIM,S/N,SR DO BOMFIM,"AVENIDA SR DO BONFIM, SR DO BOMFIM, JEREMOABO, BA, BRASIL",,,,
BA,JEREMOABO,POSTO DE SAUDE DOS BRANCOS,POVOADO BRANCOS,1,ZONA RURAL,"POVOADO BRANCOS, ZONA RURAL, JEREMOABO, BA, BRASIL",,,,
BA,JEREMOABO,POSTO DE SAUDE DA ALVORADA,POVOADO ALVORADA,1,ZONA RURAL,"POVOADO ALVORADA, ZONA RURAL, JEREMOABO, BA, BRASIL",,,,
BA,JEREMOABO,CENTRO MEDICO DE JEREMOABO,RUA DA ALEGRIA,S/N,CENTRO,"RUA DA ALEGRIA, CENTRO, JEREMOABO, BA, BRASIL",,,,
BA,JEREMOABO,UNIDADE DE SAUDE DA FAMILIA RIACHO SAO JOSE,POVOADO RIACHO SAO JOSE,S/N,ZONA RURAL,"POVOADO RIACHO SAO JOSE, ZONA RURAL, JEREMOABO, BA, BRASIL",,,,
BA,JEREMOABO,POSTO DE SAUDE DO JEQUIA,POVOADO JEQUIA,1,ZONA RURAL,"POVOADO JEQUIA, ZONA RURAL, JEREMOABO, BA, BRASIL",,,,
BA,JEREMOABO,POSTO DE SAUDE DA VIRACAO,POVOADO VIRACAO,1,ZONA RURAL,"POVOADO VIRACAO, ZONA RURAL, JEREMOABO, BA, BRASIL",,,,
BA,JEREMOABO,CENTRO DE SAUDE DR FAUSTO AGUIAR CARDOSO,PRACA DR JONAS DE CARVALHO,S/N,CENTRO,"PRACA DR JONAS DE CARVALHO, CENTRO, JEREMOABO, BA, BRASIL",,,,
BA,JEREMOABO,UNIDADE DE SAUDE DA FAMILIA LAGOA DO INACIO,POVOADO LAGOA DO INACIO,1,ZONA RURAL,"POVOADO LAGOA DO INACIO, ZONA RURAL, JEREMOABO, BA, BRASIL",,,,
BA,JEREMOABO,UNIDADE DE SAUDE DA FAMILIA ESPADUADAS,RUA SANTO ANTONIO,S/N,SANTO ANTONIO,"RUA SANTO ANTONIO, SANTO ANTONIO, JEREMOABO, BA, BRASIL",,,,
BA,JEREMOABO,UNIDADE DE SAUDE DA FAMILIA 2 JOAO PAULO II,AV MONSENHOR JOSE MAGALHAES,10,JOAO PAULO II,"AV MONSENHOR JOSE MAGALHAES, JOAO PAULO II, JEREMOABO, BA, BRASIL",,,,
BA,JEREMOABO,UNIDADE DE SAUDE DA FAMILIA MALHADA VERMELHA,POVOADO MALHADA VERMELHA,10,ZONA RURAL,"POVOADO MALHADA VERMELHA, ZONA RURAL, JEREMOABO, BA, BRASIL",,,,
BA,JEREMOABO,UNIDADE DE SAUDE DA FAMILIA MONTE ALEGRE,POVOADO DO MONTE ALGRE,S/N,ZONA RURAL,"POVOADO DO MONTE ALGRE, ZONA RURAL, JEREMOABO, BA, BRASIL",,,,
BA,JEREMOABO,UNIDADE DE SAUDE DA FAMILIA MANOEL DANTAS SOBRINHO,RUA L,S/N,LOTEAMENTO MANOEL DA,"RUA L, LOTEAMENTO MANOEL DA, JEREMOABO, BA, BRASIL",,,,
BA,JEREMOABO,POSTO DE SAUDE DE CANABRAVINHA DOS CANDIS,CANABRAVINHA DOS CANDIS,1,ZONA RURAL,"CANABRAVINHA DOS CANDIS, ZONA RURAL, JEREMOABO, BA, BRASIL",,,,
BA,JEREMOABO,UNIDADE DE SAUDE DA FAMILIA JOAO PAULO II,AV MONSENHOR JOSE MAGALHAES,10,CONJ JOAO PAULO II,"AV MONSENHOR JOSE MAGALHAES, CONJ JOAO PAULO II, JEREMOABO, BA, BRASIL",,,,
BA,JEREMOABO,UNIDADE DE SAUDE DA FAMILIA LAGOA DO MATO,POVOADO LAGOA DO MATO,S/N,ZONA RURAL,"POVOADO LAGOA DO MATO, ZONA RURAL, JEREMOABO, BA, BRASIL",,,,
BA,JEREMOABO,UNIDADE DE SAUDE DA FAMILIA SERTAO,POVOADO AGUA BRANCA,S/N,ZONA RURAL,"POVOADO AGUA BRANCA, ZONA RURAL, JEREMOABO, BA, BRASIL",,,,
BA,JEREMOABO,UNIDADE DE SAUDE DA FAMILIA SERTAO II,POVOADO BREJO GRANDE,S/N,ZONA RURAL,"POVOADO BREJO GRANDE, ZONA RURAL, JEREMOABO, BA, BRASIL",,,,
BA,JEREMOABO,POSTO DE SAUDE DA BAIXA DA VOLTA,POVOADO BAIXA DA VOLTA,1,ZONA RURAL,"POVOADO BAIXA DA VOLTA, ZONA RURAL, JEREMOABO, BA, BRASIL",,,,
BA,JEREMOABO,POSTO DE SAUDE DO ITAPICURU,POVOADO ITAPICURU,1,ZONA RURAL,"POVOADO ITAPICURU, ZONA RURAL, JEREMOABO, BA, BRASIL",,,,
BA,JEREMOABO,UNIDADE DE SAUDE DA FAMILIA JOSE NOLASCO,BAIRRO JOSE NOLASCO,S/N,JOSE NOLASCO,"BAIRRO JOSE NOLASCO, JOSE NOLASCO, JEREMOABO, BA, BRASIL",,,,
BA,JEREMOABO,POSTO DE SAUDE DO CANCHE,POVOADO CANCHE,1,ZONA RURAL,"POVOADO CANCHE, ZONA RURAL, JEREMOABO, BA, BRASIL",,,,
BA,JIQUIRICA,USF JOAO DE ALMEIDA SAMPAIO TREZE DE MAIO,RUA DAS MALVINAS,S/N,CENTRO,"RUA DAS MALVINAS, CENTRO, JIQUIRICA, BA, BRASIL",,,,
BA,JIQUIRICA,USF ANTONIO SALES DE SANTANA PINDOBA,LOTEAMENTO PINDOBA,S/N,PINDOBA,"LOTEAMENTO PINDOBA, PINDOBA, JIQUIRICA, BA, BRASIL",,,,
BA,JIQUIRICA,USF BERNARDO MUNIZ FERREIRA,FAZENDA SERRARIA 2,S/N,ZONA RURAL,"FAZENDA SERRARIA 2, ZONA RURAL, JIQUIRICA, BA, BRASIL",,,,
BA,JIQUIRICA,USF DR ROBERTO ELISIARIO DE SOUZA,R CORONEL VICENTE,120,CENTRO,"R CORONEL VICENTE, CENTRO, JIQUIRICA, BA, BRASIL",,,,
BA,JIQUIRICA,USF JOSE VIANA DIAS,FAZENDA ANDARAI,S/N,ZONA RURAL,"FAZENDA ANDARAI, ZONA RURAL, JIQUIRICA, BA, BRASIL",,,,
BA,JIQUIRICA,USF 02 DE JULHO,RUA CORONEL VICENTE,S/N,CENTRO,"RUA CORONEL VICENTE, CENTRO, JIQUIRICA, BA, BRASIL",,,,
BA,JIQUIRICA,USF GEVASIO FRANCISCO DE JESUS,FAZENDA LAGOA VERDE,S/N,ZONA RURAL,"FAZENDA LAGOA VERDE, ZONA RURAL, JIQUIRICA, BA, BRASIL",,,,
BA,JITAUNA,USF DR VALTENOR LOPES PEREIRA,RUA PRIMAVERA,S/N,CENTRO,"RUA PRIMAVERA, CENTRO, JITAUNA, BA, BRASIL",,,,
BA,JITAUNA,CENTRO SAUDE LUIS VIANA FILHO,RUA MANOEL ALVES MEIRA,S/N,CENTRO,"RUA MANOEL ALVES MEIRA, CENTRO, JITAUNA, BA, BRASIL",,,,
BA,JITAUNA,USF CINARA GOMES DE ALMEIDA,RUA SAO CRISTOVAO,S/N,MILTON BARBOSA DE AL,"RUA SAO CRISTOVAO, MILTON BARBOSA DE AL, JITAUNA, BA, BRASIL",,,,
BA,JITAUNA,USF GILDA RAMOS DOS SANTOS,AV LOMANTO JUNIOR,S/N,CENTRO,"AV LOMANTO JUNIOR, CENTRO, JITAUNA, BA, BRASIL",,,,
BA,JITAUNA,USF EVANILTON PEREIRA DE JESUS,RUA 15 DE NOVEMBRO,S/N,CENTRO,"RUA 15 DE NOVEMBRO, CENTRO, JITAUNA, BA, BRASIL",,,,
BA,JITAUNA,USF ANTONIA DIAS DOS SANTOS,RUA DA INDEPENDENCIA,S/N,DISTR DE ST TEREZ,"RUA DA INDEPENDENCIA, DISTR DE ST TEREZ, JITAUNA, BA, BRASIL",,,,
BA,JITAUNA,USF OBERDAN PECORELLI,AV ALFREDO PEREIRA BATISTA,S/N,DIST VILA TEMAO,"AV ALFREDO PEREIRA BATISTA, DIST VILA TEMAO, JITAUNA, BA, BRASIL",,,,
BA,JOAO DOURADO,UNIDADE SATELITE DE RIACHO,POV DE RIACHO,S/N,ZONA RURAL,"POV DE RIACHO, ZONA RURAL, JOAO DOURADO, BA, BRASIL",,,,
BA,JOAO DOURADO,UNIDADE SATELITE DE CALDEIRAO DE JACO,POV DE CALDEIRAO DE JACO,S/N,ZONA RURAL,"POV DE CALDEIRAO DE JACO, ZONA RURAL, JOAO DOURADO, BA, BRASIL",,,,
BA,JOAO DOURADO,UBSF IDALINA ALVES DOURADO,LOTEMANTO EDILSON CARDOSO,S/N,CENTRO,"LOTEMANTO EDILSON CARDOSO, CENTRO, JOAO DOURADO, BA, BRASIL",,,,
BA,JOAO DOURADO,UBSF ARNOBIO FIALHO LOULA,AVENIDA JOSE ALVES DE ANDRADE,S/N,NOVO CANAL,"AVENIDA JOSE ALVES DE ANDRADE, NOVO CANAL, JOAO DOURADO, BA, BRASIL",,,,
BA,JOAO DOURADO,UNIDADE SATELITE DE FLORESTA,POV DE FLORESTA,S/N,ZONA RURAL,"POV DE FLORESTA, ZONA RURAL, JOAO DOURADO, BA, BRASIL",,,,
BA,JOAO DOURADO,UBSF AUGUSTO PEREIRA DA CRUZ,POV DE MATA DO MILHO,S/N,POV M MILHO,"POV DE MATA DO MILHO, POV M MILHO, JOAO DOURADO, BA, BRASIL",,,,
BA,JOAO DOURADO,UNIDADE SATELITE DE CONQUISTA,POV DE CONQUISTA,S/N,ZONA RURAL,"POV DE CONQUISTA, ZONA RURAL, JOAO DOURADO, BA, BRASIL",,,,
BA,JOAO DOURADO,UBSF GERALDO PARAVENTE,TRAVESSA VEREADOR EDVALDO OLIVEIRA,S/N,CENTRO,"TRAVESSA VEREADOR EDVALDO OLIVEIRA, CENTRO, JOAO DOURADO, BA, BRASIL",,,,
BA,JOAO DOURADO,UBSF DR BENEDITO NEY,POVOADO DE GAMELEIRA DOS CRENTES,S/N,POV G CRENTES,"POVOADO DE GAMELEIRA DOS CRENTES, POV G CRENTES, JOAO DOURADO, BA, BRASIL",,,,
BA,JOAO DOURADO,UBSF BELARMINA NUNES DOURADO,RUA CASTELO BRANCO,S/N,CENTRO,"RUA CASTELO BRANCO, CENTRO, JOAO DOURADO, BA, BRASIL",,,,
BA,JUAZEIRO,USF ANTONIO GUILHERMINO,AVENIDA DOS EVANGELICOS,S/N,ANTONIO GUILHERMINO,"AVENIDA DOS EVANGELICOS, ANTONIO GUILHERMINO, JUAZEIRO, BA, BRASIL",,,,
BA,JUAZEIRO,USF CENTRO I,RUA DR JOSE GONCALVES,S/N,CENTRO,"RUA DR JOSE GONCALVES, CENTRO, JUAZEIRO, BA, BRASIL",,,,
BA,JUAZEIRO,USF QUIDE,RUA DAS ALGAROBAS,S/N,QUIDE,"RUA DAS ALGAROBAS, QUIDE, JUAZEIRO, BA, BRASIL",-9.4302548,-40.5235407,"Rua das Algarobas, Quide, Bairro Quide, Juazeiro, Região Geográfica Imediata de Juazeiro, BR, Região Geográfica Intermediária de Juazeiro, Bahia, Região Nordeste, 48902-270, Brasil","9 25m 48.9173s S, 40 31m 24.7465s W"
BA,JUAZEIRO,USF CONCHAS,POVOADO DE CONCHAS,31,CONCHAS,"POVOADO DE CONCHAS, CONCHAS, JUAZEIRO, BA, BRASIL",,,,
BA,JUAZEIRO,USF MARINGA,RUA BRAULIO SAMPAIO,S/N,MARINGA,"RUA BRAULIO SAMPAIO, MARINGA, JUAZEIRO, BA, BRASIL",-9.4160801,-40.5132008,"Rua Braulio Sampaio, Bairro Maringa, Juazeiro, Região Geográfica Imediata de Juazeiro, BR, Região Geográfica Intermediária de Juazeiro, Bahia, Região Nordeste, 48903-120, Brasil","9 24m 57.8884s S, 40 30m 47.5229s W"
BA,JUAZEIRO,USF ALTO DO CRUZEIRO,AV JOAO DURVAL CARNEIRO,S/N,ALTO DO CRUZEIRO,"AV JOAO DURVAL CARNEIRO, ALTO DO CRUZEIRO, JUAZEIRO, BA, BRASIL",-9.4329545,-40.4972973,"Avenida João Durval Carneiro, Bairro Alto do Cruzeiro, Juazeiro, Região Geográfica Imediata de Juazeiro, BR, Região Geográfica Intermediária de Juazeiro, Bahia, Região Nordeste, 48900-160, Brasil","9 25m 58.6362s S, 40 29m 50.2703s W"
BA,JUAZEIRO,USF JARDIM PRIMAVERA,AVENIDA MANDACARU,S/N,JARDIM PRIMAVERA,"AVENIDA MANDACARU, JARDIM PRIMAVERA, JUAZEIRO, BA, BRASIL",,,,
BA,JUAZEIRO,USF MANICOBA II JATOBA,PROJETO DE IRRIGACAO MANICOBA II,S/N,MANICOBA II,"PROJETO DE IRRIGACAO MANICOBA II, MANICOBA II, JUAZEIRO, BA, BRASIL",,,,
BA,JUAZEIRO,USF PALMARES PEDRA DO LORD,RUA LEOPOLDO CELSO DA CUNHA,518,PEDRA DO LORD,"RUA LEOPOLDO CELSO DA CUNHA, PEDRA DO LORD, JUAZEIRO, BA, BRASIL",,,,
BA,JUAZEIRO,USF NH4 BONITA,PROJETO CURACA NH4,S/N,CURACA NH4,"PROJETO CURACA NH4, CURACA NH4, JUAZEIRO, BA, BRASIL",,,,
BA,JUAZEIRO,USF CSU I,RUA PIO XI,S/N,ALTO DO ALENCAR,"RUA PIO XI, ALTO DO ALENCAR, JUAZEIRO, BA, BRASIL",-9.4350611,-40.4951241,"Rua Pio XI, Alto do Alencar, Bairro Alto do Alencar, Juazeiro, Região Geográfica Imediata de Juazeiro, BR, Região Geográfica Intermediária de Juazeiro, Bahia, Região Nordeste, 48907-218, Brasil","9 26m 6.21996s S, 40 29m 42.4468s W"
BA,JUAZEIRO,USF ITABERABA,RUA DEP ULYSSES GUIMARAES,S/N,ITABERABA,"RUA DEP ULYSSES GUIMARAES, ITABERABA, JUAZEIRO, BA, BRASIL",,,,
BA,JUAZEIRO,USF ABOBORAS,RUA MANOEL BARBOSA DO NASCIMENTO RUA DO POSTO,S/N,POCOES,"RUA MANOEL BARBOSA DO NASCIMENTO RUA DO POSTO, POCOES, JUAZEIRO, BA, BRASIL",,,,
BA,JUAZEIRO,USF PENHA JARDIM VITORIA,RUA AUGUSTO FERNANDES DE SOUZA,S/N,JARDIM VITORIA,"RUA AUGUSTO FERNANDES DE SOUZA, JARDIM VITORIA, JUAZEIRO, BA, BRASIL",-9.4213269,-40.5102956,"Rua Augusto Fernandes de Souza, Bairro Jardim Vitoria, Juazeiro, Região Geográfica Imediata de Juazeiro, BR, Região Geográfica Intermediária de Juazeiro, Bahia, Região Nordeste, 48902-270, Brasil","9 25m 16.7768s S, 40 30m 37.0642s W"
BA,JUAZEIRO,USF PINHOES LAGOA DO BOI,RUA DA RODOVIA,S/N,PINHOES,"RUA DA RODOVIA, PINHOES, JUAZEIRO, BA, BRASIL",,,,
BA,JUAZEIRO,USF PARQUE RESIDENCIAL JOAO PAULO II,AVENIDA DAS ARVORES,S/N,PARQUE RESIDENCIAL,"AVENIDA DAS ARVORES, PARQUE RESIDENCIAL, JUAZEIRO, BA, BRASIL",,,,
BA,JUAZEIRO,USF CENTRO II,RUA DR JOSE GONCALVES,S/N,CENTRO,"RUA DR JOSE GONCALVES, CENTRO, JUAZEIRO, BA, BRASIL",,,,
BA,JUAZEIRO,USF TABULEIRO,AV NOSSA SENHORA DAS GROTAS,S/N,TABULEIRO,"AV NOSSA SENHORA DAS GROTAS, TABULEIRO, JUAZEIRO, BA, BRASIL",-9.4325249,-40.4763776,"Avenida Nossa Senhora das Grotas, Bairro Tabuleiro, Juazeiro, Região Geográfica Imediata de Juazeiro, BR, Região Geográfica Intermediária de Juazeiro, Bahia, Região Nordeste, 48907-218, Brasil","9 25m 57.0896s S, 40 28m 34.9594s W"
BA,JUAZEIRO,USF CURACA NH1 NH2,RUA DO MEIO,S/N,PROJETO CURACA NH1 E,"RUA DO MEIO, PROJETO CURACA NH1 E, JUAZEIRO, BA, BRASIL",,,,
BA,JUAZEIRO,USF NOVO ENCONTRO,AV ELIZEU MARTINS DO NASCIMENTO,S/N,NOVO ENCONTRO,"AV ELIZEU MARTINS DO NASCIMENTO, NOVO ENCONTRO, JUAZEIRO, BA, BRASIL",,,,
BA,JUAZEIRO,USF CAPIM DE RAIZ,POVOADO DE CAPIM DE RAIZ,S/N,CAPIM DE RAIZ,"POVOADO DE CAPIM DE RAIZ, CAPIM DE RAIZ, JUAZEIRO, BA, BRASIL",,,,
BA,JUAZEIRO,USF MANICOBA I,AVENIDA DOS COLONOS,S/N,MANICOBA I,"AVENIDA DOS COLONOS, MANICOBA I, JUAZEIRO, BA, BRASIL",-9.3230497,-40.2923685,"Avenida dos Colonos, Maniçoba, Distrito de Maniçoba, Juazeiro, Região Geográfica Imediata de Juazeiro, Região Administrativa Integrada de Desenvolvimento do Polo Petrolina e Juazeiro, Região Geográfica Intermediária de Juazeiro, Bahia, Região Nordeste, Brasil","9 19m 22.9789s S, 40 17m 32.5266s W"
BA,JUAZEIRO,USF MANDACARU II,PROJETO DE IRRIGACAO MANDACARU II,S/N,MANDACARU II,"PROJETO DE IRRIGACAO MANDACARU II, MANDACARU II, JUAZEIRO, BA, BRASIL",,,,
BA,JUAZEIRO,USF ALTO DA ALIANCA,AVENIDA IRMA DULCE,S/N,ALTO DA ALIANCA,"AVENIDA IRMA DULCE, ALTO DA ALIANCA, JUAZEIRO, BA, BRASIL",-9.445808,-40.4993704,"Avenida Irmã Dulce, Alto da Aliança, Bairro Alto da Aliança, Juazeiro, Região Geográfica Imediata de Juazeiro, BR, Região Geográfica Intermediária de Juazeiro, Bahia, Região Nordeste, 48924-999, Brasil","9 26m 44.9088s S, 40 29m 57.7334s W"
BA,JUAZEIRO,USF JOAO ARAUJO MOREIRA MUSSAMBE,TRAVESSA SAO MIGUEL,S/N,SANTO ANTONIO,"TRAVESSA SAO MIGUEL, SANTO ANTONIO, JUAZEIRO, BA, BRASIL",-9.4160725,-40.5077207,"Travessa São Miguel, Bairro Mussambe, Juazeiro, Região Geográfica Imediata de Juazeiro, BR, Região Geográfica Intermediária de Juazeiro, Bahia, Região Nordeste, 48903-240, Brasil","9 24m 57.861s S, 40 30m 27.7945s W"
BA,JUAZEIRO,USF JOAO XXIII,AV JOAO DURVAL CARNEIRO,S/N,JOAO XXIII,"AV JOAO DURVAL CARNEIRO, JOAO XXIII, JUAZEIRO, BA, BRASIL",-9.4347895,-40.4965774,"Avenida João Durval Carneiro, Bairro João XXIII, Juazeiro, Região Geográfica Imediata de Juazeiro, BR, Região Geográfica Intermediária de Juazeiro, Bahia, Região Nordeste, 48907-218, Brasil","9 26m 5.2422s S, 40 29m 47.6786s W"
BA,JUAZEIRO,USF CAIC,RUA ARMANDO DE JESUS,S/N,ANTONIO CONSELHEIRO,"RUA ARMANDO DE JESUS, ANTONIO CONSELHEIRO, JUAZEIRO, BA, BRASIL",,,,
BA,JUAZEIRO,USF LAGOA DO SALITRE,RUA SANTA LUZIA,S/N,LAGOA DO SALITRE,"RUA SANTA LUZIA, LAGOA DO SALITRE, JUAZEIRO, BA, BRASIL",,,,
BA,JUAZEIRO,USF ITAMOTINGA,RUA MANOEL DANTAS,S/N,ITAMOTINGA,"RUA MANOEL DANTAS, ITAMOTINGA, JUAZEIRO, BA, BRASIL",-9.0948452,-40.099061,"Rua Manoel Dantas, Itamotinga, Juazeiro, Região Geográfica Imediata de Juazeiro, Região Administrativa Integrada de Desenvolvimento do Polo Petrolina e Juazeiro, Região Geográfica Intermediária de Juazeiro, Bahia, Região Nordeste, Brasil","9 5m 41.4427s S, 40 5m 56.6196s W"
BA,JUAZEIRO,USF MANDACARU I,PROJETO DE IRRIGACAO DE MANDACARU I,S/N,MANDACARU I,"PROJETO DE IRRIGACAO DE MANDACARU I, MANDACARU I, JUAZEIRO, BA, BRASIL",,,,
BA,JUAZEIRO,USF JUREMAL MASSAROCA,RUA GETULIO VARGAS,S/N,JUREMAL,"RUA GETULIO VARGAS, JUREMAL, JUAZEIRO, BA, BRASIL",,,,
BA,JUAZEIRO,USF SAO GERALDO,RUA 1 LOT H FLORESTAL,S/N,SAO GERALDO,"RUA 1 LOT H FLORESTAL, SAO GERALDO, JUAZEIRO, BA, BRASIL",,,,
BA,JUAZEIRO,USF ERASMO MENEZES SERAFIM ARGEMIRO,AVENIDA CRISTALINA,S/N,PADRE CICERO,"AVENIDA CRISTALINA, PADRE CICERO, JUAZEIRO, BA, BRASIL",,,,
BA,JUAZEIRO,USF ALTO DA MARAVILHA,TRAVESSA DA LAVANDERIA,S/N,ALTO DA MARAVILHA,"TRAVESSA DA LAVANDERIA, ALTO DA MARAVILHA, JUAZEIRO, BA, BRASIL",-9.4226225,-40.5052064,"Travessa da Lavanderia, Alto da Maravilha, Bairro Alto Maravilha, Juazeiro, Região Geográfica Imediata de Juazeiro, BR, Região Geográfica Intermediária de Juazeiro, Bahia, Região Nordeste, 48900-441, Brasil","9 25m 21.441s S, 40 30m 18.743s W"
BA,JUAZEIRO,USF CURACA NH3,PROJETO CURACA NH3,1,CURACA NH3,"PROJETO CURACA NH3, CURACA NH3, JUAZEIRO, BA, BRASIL",,,,
BA,JUAZEIRO,USF JARDIM FLORIDA,RUA AYRTON SENNA,S/N,JARDIM FLORIDA,"RUA AYRTON SENNA, JARDIM FLORIDA, JUAZEIRO, BA, BRASIL",,,,
BA,JUAZEIRO,USF DOM THOMAZ,RODOVIA BA 210,S/N,DOM THOMAZ,"RODOVIA BA 210, DOM THOMAZ, JUAZEIRO, BA, BRASIL",,,,
BA,JUAZEIRO,USF CAJ,PROJETO CAJ,S/N,PROJETO CAJ,"PROJETO CAJ, PROJETO CAJ, JUAZEIRO, BA, BRASIL",,,,
BA,JUAZEIRO,USF GOIABEIRA JUNCO,POVOADO DE GOIABEIRA II,S/N,JUNCO,"POVOADO DE GOIABEIRA II, JUNCO, JUAZEIRO, BA, BRASIL",,,,
BA,JUAZEIRO,USF PIRANGA,RUA IMACULADA CONCEICAO,S/N,PIRANGA,"RUA IMACULADA CONCEICAO, PIRANGA, JUAZEIRO, BA, BRASIL",-9.4294188,-40.5047293,"Rua Imaculada Conceição, Bairro Piranga, Juazeiro, Região Geográfica Imediata de Juazeiro, BR, Região Geográfica Intermediária de Juazeiro, Bahia, Região Nordeste, 48900-160, Brasil","9 25m 45.9077s S, 40 30m 17.0255s W"
BA,JUAZEIRO,USF VILA JACARE,RUA 1,S/N,COREIA,"RUA 1, COREIA, JUAZEIRO, BA, BRASIL",,,,
BA,JUAZEIRO,USF DOM JOSE RODRIGUES,AVENIDA ALFA,2,DOM JOSE RODRIGUES,"AVENIDA ALFA, DOM JOSE RODRIGUES, JUAZEIRO, BA, BRASIL",-9.4534798,-40.5141185,"Avenida Alfa, Dom José Rodrigues, Bairro Dom José Rodrigues, Juazeiro, Região Geográfica Imediata de Juazeiro, BR, Região Geográfica Intermediária de Juazeiro, Bahia, Região Nordeste, 48924-999, Brasil","9 27m 12.5273s S, 40 30m 50.8266s W"
BA,JUAZEIRO,USF ALAGADICO,RUA JOAO OLIVEIRA SOUZA,S/N,ALAGADICO,"RUA JOAO OLIVEIRA SOUZA, ALAGADICO, JUAZEIRO, BA, BRASIL",,,,
BA,JUAZEIRO,USF JOAO PAULO II JOSE CARLOS TANURY,QUADRA 12 A,41,JOAO PAULO II,"QUADRA 12 A, JOAO PAULO II, JUAZEIRO, BA, BRASIL",,,,
BA,JUAZEIRO,CONJUNTO PENAL DE JUAZEIRO,RODOVIA BR 407 KM 10,S/N,DISTRITO DO SAO FRAN,"RODOVIA BR 407 KM 10, DISTRITO DO SAO FRAN, JUAZEIRO, BA, BRASIL",,,,
BA,JUAZEIRO,USF CENTRO DE SAUDE III,AV CARMELA DUTRA,S/N,CENTRO,"AV CARMELA DUTRA, CENTRO, JUAZEIRO, BA, BRASIL",,,,
BA,JUAZEIRO,USF CARNAIBA DO SERTAO,RUA DO COMERCIO,S/N,CARNAIBA,"RUA DO COMERCIO, CARNAIBA, JUAZEIRO, BA, BRASIL",,,,
BA,JUAZEIRO,USF JOSE ARAUJO DE SOUZA,QUADRA 12 A,41,JOAO PAULO II,"QUADRA 12 A, JOAO PAULO II, JUAZEIRO, BA, BRASIL",,,,
BA,JUAZEIRO,USF CAMPOS,SITIO SAO JOSE FAZENDA CAMPOS,S/N,COMUNIDADE DE CAMPOS,"SITIO SAO JOSE FAZENDA CAMPOS, COMUNIDADE DE CAMPOS, JUAZEIRO, BA, BRASIL",,,,
BA,JUCURUCU,ESFSB JUCURUCU 01,AVENIDA ITAMARAJU,S/N,CENTRO,"AVENIDA ITAMARAJU, CENTRO, JUCURUCU, BA, BRASIL",,,,
BA,JUCURUCU,ESFSB COQUEIRO 02,RUA CENTRAL,122,CENTRO,"RUA CENTRAL, CENTRO, JUCURUCU, BA, BRASIL",,,,
BA,JUCURUCU,ESFSB DE MONTE AZUL 03,PRACA PRINCIPAL,S/N,CENTRO,"PRACA PRINCIPAL, CENTRO, JUCURUCU, BA, BRASIL",,,,
